{"iter": 221, "ts": "2026-10-10T14:30:00Z", "decision": "keep", "verdict": "KEEP", "run_label": "t471 pfwc 32 B blend records (GSPLAT_TT_PFWC_REC32) default on, p150 b2b A/B", "iter_dir": "ttw-221", "buildid": "afc99e56", "idea": "Task #467/#471: the fused split pfwc writes its blend records as 32 B (only the words the one-launch TOWN emit reads: a, b, c, mx, my, u01, u23, dep), two per 64 B page, instead of one 64 B page each. Bytes written per survivor 76 -> 44, emit blendrec read 64 -> 32 B. Default on; GSPLAT_TT_PFWC_REC32=0 or any kill switch of the chain turns it off.", "reason": "bh-30 (Blackhole p150, ETH dispatch 12x10, viewer reservation; viewer stopped for the bench only, the only p150 held), tree afc99e56 (opt c7232e14 + #467), one build, 3 alternating rounds (O/R, R/O, O/R) of render/run.py --back-to-back, 30 bicycle views, 1 check + 5 measured passes each. B2B ms/view (run median): REC32 9.356/9.353/9.517 vs off 9.449/9.495/9.679; median 9.356 vs 9.495 (-0.139, -1.5%); every round faster (-0.093/-0.142/-0.162). Median over the 15 measured passes 9.229 vs 9.434 (-0.205). Per-pass B2B_STAGES medians: project (pfwc gather wait) 2.445 vs 2.619, sort 1.367 vs 1.390 (bin emit 0.353 vs 0.430), blend 5.262 vs 5.228. Latency (no dumps, secondary) 8.969/8.967/8.990 vs 9.156/9.146/9.155 ms/view. md5 39d84b28 = 12x10 golden on 30/30 views in all 6 b2b runs; hero identical across arms, bit-exact vs hero_golden_8bit_12x10, PSNR vs reference_v2 42.51 dB. bh-30 load average was 9-14 during the bench (noisy host); the gain held in every round. Default flipped after the A/B: the default path is the measured REC32=1 path (same static flag). Not yet run on the p100. Published GPU reference 10.75 ms/view (published, not measured).", "metrics": {"board": "bh-30 (Blackhole p150, ETH dispatch 12x10, viewer reservation; viewer stopped for the bench only)", "commit": "afc99e56", "build": "opt c7232e14 + #467 REC32 (env =1 vs =0)", "ms_view_b2b": 9.229, "ms_view_b2b_rounds": [9.356, 9.353, 9.517], "ms_view_b2b_passes": [9.771, 9.756, 9.087, 9.087, 9.08, 9.993, 9.229, 9.123, 9.286, 9.133, 9.953, 9.746, 9.494, 9.172, 9.218], "ms_view_b2b_off": 9.434, "ms_view_b2b_off_rounds": [9.449, 9.495, 9.679], "ms_view_b2b_off_passes": [9.458, 9.874, 9.255, 9.391, 9.27, 10.09, 9.506, 9.284, 9.3, 9.296, 10.097, 9.558, 9.434, 9.342, 9.966], "b2b_delta_vs_off_ms": -0.205, "ms_view_latency": 8.969, "ms_view_latency_runs": [8.969, 8.967, 8.99], "ms_view_latency_off": 9.155, "ms_view_latency_off_runs": [9.156, 9.146, 9.155], "b2b_stage_project_ms": 2.445, "b2b_stage_project_off_ms": 2.619, "b2b_stage_sort_ms": 1.367, "b2b_stage_sort_off_ms": 1.39, "b2b_stage_sort_bin_emit_ms": 0.353, "b2b_stage_sort_bin_emit_off_ms": 0.43, "b2b_stage_blend_ms": 5.262, "b2b_stage_blend_off_ms": 5.228, "md5": "39d84b28", "fps": 108.35, "hero_psnr_vs_ref": 42.51, "golden_match": true, "gpu_published_ms_view": 10.75, "b2b_headline_note": "t469: headline set to the median of all 15 measured passes (checklist rule, validator); was the median of round medians 9.356 vs 9.495 (-0.139), kept in ms_view_b2b_rounds/_off_rounds."}, "timings": {"ms_view_b2b": 9.229, "ms_view_latency": 8.969}, "device_screenshot": {"hero": "opt/metal-screenshots/ttw-221/hero.png", "diff": "opt/metal-screenshots/ttw-221/hero_diff10.png", "ref": "benchmarks/reference_v2/hero.png", "psnr_vs_ref": 42.51, "diff_ref": "benchmarks/reference_v2/hero.png", "golden": "tests/fixtures/hero/hero_golden_8bit_12x10.png", "golden_match": true, "md5": "39d84b28", "commit": "afc99e56", "config": "GSPLAT_TT_PFWC_REC32=1 (the new default)", "device": "bh-30 p150", "visual_check": "t471 worker looked at the hero and the diff x10: no tile seams, blocky or empty tiles, no color shifts; diff only on thin edges (spokes, frame, bench slats, foliage). Hero is bit-exact vs the board golden and identical across both arms."}, "tracy": "opt/profiler/ttw-221/render.tracy"}
{"iter": 222, "ts": "2026-10-10T14:23:00Z", "decision": "keep", "verdict": "KEEP", "run_label": "t469 K2 on idle TRISCs (#274, GSPLAT_TT_K2_TRISC) default on, p100 b2b A/B", "iter_dir": "ttw-222", "buildid": "ed3d3baf", "idea": "Task #274/#469: K2 (the pfwc tile-key/count pass) runs on the pfwc cores' idle TRISCs instead of on the data-mover cores only, so it overlaps the mover work inside pfwc. Shelved in #274 for missing the old 0.3 ms latency gate; #468 triage queued a b2b re-measure. Default on; GSPLAT_TT_K2_TRISC=0 restores the mover-only K2.", "reason": "yyzo-bh-04 (Blackhole p100a, measurement reservation, worker dispatch 11x10), tree ed3d3baf (opt 48d942a0 incl. iter 221 REC32 + no-ff merge of t274 a9dd06e + default flip), one build, discarded warm-up then 3 alternating rounds (off/on, on/off, off/on) of render/run.py --back-to-back (1 check + 3 measured passes), 30 bicycle views 1024x1024 (docs/k2-b2b-t469). B2B ms/view (run median): on 9.418/9.409/9.408 vs off 9.707/9.706/9.710; paired deltas -0.289/-0.297/-0.302, median -0.297 (-3.1%), 103.0 -> 106.3 FPS. Median of the 9 measured passes 9.409 vs 9.707. Per-pass B2B_STAGES medians: project (pfwc gather wait) 2.417 vs 2.716, sort 0.596 vs 0.607, blend 6.305 vs 6.290. Latency (no dumps, secondary) 9.376/9.373/9.353 vs 9.669/9.605/9.647. --dump-views md5 906e0435 = 11x10 golden on 30/30 views in both arms; raw b2b md5 5a438f5a identical across passes and arms. Hero (default arm) bit-exact vs hero_golden_8bit, PSNR vs reference_v2 42.51 dB. An earlier A/B on the pre-221 tip gave -0.305 (docs/k2-b2b-t469/README.md). Measured on p100a only, not yet on p150 (12x10 ETH dispatch). Published GPU reference 10.75 ms/view (published, not measured).", "metrics": {"board": "yyzo-bh-04 (Blackhole p100a, measurement box, 11x10)", "commit": "ed3d3baf", "build": "opt 48d942a0 + #274 K2_TRISC default on (env unset vs =0)", "ms_view_b2b": 9.409, "ms_view_b2b_rounds": [9.418, 9.409, 9.408], "ms_view_b2b_passes": [9.418, 9.415, 9.426, 9.417, 9.409, 9.406, 9.409, 9.408, 9.403], "ms_view_b2b_off": 9.707, "ms_view_b2b_off_rounds": [9.707, 9.706, 9.71], "ms_view_b2b_off_passes": [9.735, 9.707, 9.704, 9.708, 9.706, 9.704, 9.71, 9.714, 9.702], "b2b_delta_vs_off_ms": -0.297, "ms_view_latency": 9.373, "ms_view_latency_runs": [9.376, 9.373, 9.353], "ms_view_latency_off": 9.647, "ms_view_latency_off_runs": [9.669, 9.605, 9.647], "b2b_stage_project_ms": 2.417, "b2b_stage_project_off_ms": 2.716, "b2b_stage_sort_ms": 0.596, "b2b_stage_sort_off_ms": 0.607, "b2b_stage_blend_ms": 6.305, "b2b_stage_blend_off_ms": 6.29, "md5": "906e0435", "fps": 106.28, "hero_psnr_vs_ref": 42.51, "golden_match": true, "gpu_published_ms_view": 10.75}, "timings": {"ms_view_b2b": 9.409, "ms_view_latency": 9.373}, "device_screenshot": {"hero": "opt/metal-screenshots/ttw-222/hero.png", "diff": "opt/metal-screenshots/ttw-222/hero_diff10.png", "ref": "benchmarks/reference_v2/hero.png", "psnr_vs_ref": 42.51, "diff_ref": "benchmarks/reference_v2/hero.png", "golden": "tests/fixtures/hero/hero_golden_8bit.png", "golden_match": true, "md5": "906e0435", "commit": "ed3d3baf", "config": "defaults (GSPLAT_TT_K2_TRISC unset = on, the new default)", "device": "yyzo-bh-04 p100a", "visual_check": "t469 worker looked at the hero and the diff x10: no tile seams, blocky or empty tiles, no color shifts; diff only on thin edges (spokes, frame, bench slats, foliage). Hero bit-exact vs the 11x10 golden."}, "tracy": "opt/profiler/ttw-222/render.tracy"}
{"iter": 223, "ts": "2026-10-10T16:50:00Z", "decision": "keep", "verdict": "KEEP", "run_label": "t489/t490 pfwc ACQ_FUSE=3 + SKIP_RGB default on, p100 b2b A/B", "iter_dir": "ttw-223", "buildid": "4b110d78", "idea": "Task #481/#489: pfwc fuses the projection and the conic/cov pass into fewer SFPU passes (GSPLAT_TT_PFWC_ACQ_FUSE=3) and stops reading the RGB colour planes the REC32 blend path never uses (GSPLAT_TT_PFWC_SKIP_RGB=1). Both default on; GSPLAT_TT_PFWC_ACQ_FUSE=0 GSPLAT_TT_PFWC_SKIP_RGB=0 restores the old pfwc.", "reason": "Independent review #490. yyzo-bh-04 (Blackhole p100a, measurement reservation, 11x10), tree 4b110d78 (no-ff merge of opt f8c27c97 into t489 feaa5c3e + A/B drivers), one build, warm-up round then 5 alternating rounds (off/def, def/off, ...) of render/run.py --back-to-back (defaults: 1 check + 1 warm-up + 20 measured passes), 30 bicycle views 1024x1024 (docs/land-t490). B2B ms/view (run medians, rounds 1-5): default 9.237/9.235/9.233/9.235/9.240 vs off 9.407/9.407/9.406/9.406/9.406; median 9.235 vs 9.406, -0.171 ms (-1.8%), 106.3 -> 108.3 FPS. Warm-up round 9.235 vs 9.406. B2B_STAGES medians: project (pfwc gather wait) 2.249 vs 2.420, sort 0.478 vs 0.472, blend 6.418 vs 6.425. Latency (no dumps, secondary) median 9.197 vs 9.375. --dump-views md5 906e0435 = 11x10 golden on 30/30 views in both arms. Hero (default arm) bit-exact vs hero_golden_8bit, PSNR vs reference_v2 42.51 dB. #489 claimed 9.347 -> 9.241; the off arm here includes #485 and lands at iter 222's 9.409 level. Measured on p100a only, not on p150. Published GPU reference 10.75 ms/view (published, not measured).", "metrics": {"board": "yyzo-bh-04 (Blackhole p100a, measurement box, 11x10)", "commit": "4b110d78", "build": "opt f8c27c97 + #489 PFWC_ACQ_FUSE=3 + PFWC_SKIP_RGB=1 default on (env unset vs ACQ_FUSE=0 SKIP_RGB=0)", "ms_view_b2b": 9.235, "ms_view_b2b_rounds": [9.237, 9.235, 9.233, 9.235, 9.24], "ms_view_b2b_passes": [9.237, 9.235, 9.233, 9.235, 9.24], "ms_view_b2b_off": 9.406, "ms_view_b2b_off_rounds": [9.407, 9.407, 9.406, 9.406, 9.406], "ms_view_b2b_off_passes": [9.407, 9.407, 9.406, 9.406, 9.406], "b2b_delta_vs_off_ms": -0.171, "ms_view_latency": 9.197, "ms_view_latency_runs": [9.202, 9.196, 9.197, 9.199, 9.195], "ms_view_latency_off": 9.375, "ms_view_latency_off_runs": [9.376, 9.374, 9.375, 9.378, 9.368], "b2b_stage_project_ms": 2.249, "b2b_stage_project_off_ms": 2.42, "b2b_stage_sort_ms": 0.478, "b2b_stage_sort_off_ms": 0.472, "b2b_stage_blend_ms": 6.418, "b2b_stage_blend_off_ms": 6.425, "md5": "906e0435", "fps": 108.28, "hero_psnr_vs_ref": 42.51, "golden_match": true, "gpu_published_ms_view": 10.75}, "timings": {"ms_view_b2b": 9.235, "ms_view_latency": 9.197}, "device_screenshot": {"hero": "opt/metal-screenshots/ttw-223/hero.png", "diff": "opt/metal-screenshots/ttw-223/hero_diff10.png", "ref": "benchmarks/reference_v2/hero.png", "psnr_vs_ref": 42.51, "diff_ref": "benchmarks/reference_v2/hero.png", "golden": "tests/fixtures/hero/hero_golden_8bit.png", "golden_match": true, "md5": "906e0435", "commit": "4b110d78", "config": "defaults (GSPLAT_TT_PFWC_ACQ_FUSE and GSPLAT_TT_PFWC_SKIP_RGB unset = 3 and 1, the new defaults)", "device": "yyzo-bh-04 p100a", "visual_check": "#490 reviewer looked at the hero and the diff x10: no tile seams, blocky or empty tiles, stripes or color shifts; diff only on thin edges (spokes, frame, bench slats, foliage, rooftops). Mean diff on 32 px tile-edge rows/columns 0.85-0.87 vs 0.875 overall. Hero bit-exact vs the 11x10 golden."}, "tracy_waiver": "bit-identical pfwc-internal change (fewer SFPU passes, fewer colour reads); stage evidence is the per-pass B2B_STAGES split (project 2.420 -> 2.249 ms, sort/blend unchanged) in docs/land-t490/out/run-r*-b2b-*.log."}
