{"iter": 183, "idea": "Task #161: device A/B of the pixel-centre pre-cull (GSPLAT_TT_PRECULL=2, task #157: r' = max(sqrt(t cov) - 3/8, 1/8) instead of lever C's integer sqrt(t cov) + 2, so the tile rect only keeps tiles whose pixel centres the band cull can reach) vs PRECULL=1 (default) vs 0. Opt-in; a separate review decides the default.", "decision": "keep-optin", "reason": "Interleaved A/B on yyzo-bh-07 (Blackhole p100a, not a p150), bicycle 30 views 1024x1024, 3 rounds, untraced: off 19.674+-0.022, base (PRECULL=1) 19.142+-0.031, pc (PRECULL=2) 18.384+-0.035 ms/view; paired pc-base -0.799/-0.724/-0.749, mean -0.757 ms (-4.0%). Below the 1.2-2.3 ms host estimate: Tracy (10 views) shows sort_ol_emit -0.27, mat_cull_mask -0.27, sort_ol_count -0.10, blend flat (dead records were already dropped before blend). Hero dead records: 3.237M records 16.5% dead -> 2.896M 6.6% dead (-10.5% records vs mode 1, -14.05% vs off; model -13.96%), live records 2,704,260 in all arms. pc vs default <= 1 LSB, PSNR 74.24-77.81 dB over 90 comparisons, deterministic; byte-identical to modes 0 and 1 at BLEND_T_PERIOD=0 (5 views). Fits the 70656 B kernel config buffer (trisc1 +4 B vs mode 1). Recommend flipping the default after review.", "metrics": {"board": "yyzo-bh-07 (Blackhole p100a)", "bit_identical": false, "bit_identical_t_period_0": true, "max_lsb_diff": 1, "psnr_min_db": 74.24, "psnr_max_db": 77.81, "deterministic_3_rounds": true, "frame_ms_view": 18.384, "frame_ms_view_stdev": 0.035, "frame_ms_view_baseline": 19.142, "frame_ms_view_baseline_stdev": 0.031, "frame_ms_view_off": 19.674, "frame_delta_ms": -0.757, "frame_delta_pct": -4.0, "fps": 54.4, "hero_records_pc": 2895701, "hero_records_base": 3236947, "hero_dead_share_pc": 0.0661, "hero_dead_share_base": 0.1646}, "timings": {"ms_view": 18.384, "project": 4.595, "tile_assign": 0.004, "sort": 4.653, "blend": 8.89}, "iter_dir": "ttw-183", "run_label": "t161r1..r3-{off,base,pc}", "verdict": "KEEP-OPTIN (PRECULL=2 pixel-centre pre-cull: 19.14 -> 18.38 ms/view (-0.76, -4.0%), <=1 LSB, live records unchanged; recommend default after review; board yyzo-bh-07 p100a)", "ts": "2026-10-04T13:55:00-0700", "buildid": {"cpp": "gsplat_tt ttp/t161 6a00513 on iter-182", "data": ""}, "tracy": "docs/precull-pc-t161/out/t161-m{0,1,2}-zones.txt"}
{"iter": 184, "idea": "Task #160: sort_ol_emit pack-loop instruction diet (bit-identical). Fast path for ring+PUBOC+pow2 tiles_x in sort_bin_onelaunch.cpp: register locals in a hand-inlined loop instead of by-reference lambda captures, per-tile cursors in a 4 KB RISC local-memory array instead of L1 read-after-write, sub_int32 always-inline 32-bit path (sub_int_cold fallback, exhaustive fp32 test 0 mismatches), plain plane loads after a compiler barrier, P bound hoisted per batch. GSPLAT_TT_OL_EMIT_FAST=0 is the kill switch.", "decision": "keep", "reason": "Swapped A/B on yyzo-bh-07 (Blackhole p100a, not a p150), bicycle 30 views 1024x1024, 2 rounds, untraced, code e74a2dc on b54c54e (PRECULL=1 default): FAST=0 19.29/19.11, fast 18.56/18.62 ms/view, paired delta -0.72/-0.49, mean -0.61 ms (-3.2%). Stages: sort 5.02 -> 4.40 (bin_emit 4.61 -> 3.99), project and blend unchanged. All 4 runs md5-identical to md5-r82new.txt over 30 views. Tracy (EMIT_PROF=1): emit zone 2.61 ms/view mean mover (busiest 2.76), issue_brec 0.51, process_batch 1.97 (pack/key build 1.82, write issue 0.13), drain 0.09; 263 cycles/record whole emit. issue_brec scan fold not done (next lever).", "metrics": {"board": "yyzo-bh-07 (Blackhole p100a)", "bit_identical": true, "all_30_views_identical": true, "hero_vs_ref": 100.0, "frame_ms_view": 18.59, "frame_ms_view_baseline": 19.2, "frame_delta_ms": -0.61, "frame_delta_pct": -3.2, "fps": 53.8, "emit_zone_ms": 2.61, "emit_issue_brec_ms": 0.51, "emit_pack_ms": 1.82, "emit_cycles_per_record": 263.3}, "timings": {"ms_view": 18.59, "project": 4.66, "tile_assign": 0.005, "sort": 4.4, "blend": 9.29}, "iter_dir": "ttw-184", "run_label": "t160-r1..r2-{base,off}, t160-ep", "verdict": "KEEP (emit pack-loop diet: 19.20 -> 18.59 ms/view (-0.61, -3.2%), md5-identical; board yyzo-bh-07 p100a)", "ts": "2026-10-04T20:40:00-0700", "buildid": {"cpp": "gsplat_tt ttp/t160 e74a2dc on b54c54e", "data": ""}, "tracy": "yyzo-bh-07:/localdev/smarton/gstt2-t160/opt/profiler/t160-ep/render.tracy"}
{"iter": 185, "idea": "Task #174: make t160 fast emit pay off under PRECULL=2 and flip the default to 2. Per-mover Tracy (t166-p2f) showed the PRECULL=2 emit window is set by NoC hot spots (BRISC/NOC0 rows y=2,3 stalling on blendrec read issue, NCRISC/NOC1 columns x=14,15), not by the fast loop. Fix: host gives each one-launch emit mover a page range in proportion to a measured per-core speed table (render/host/sort_mover_speed.h, GSPLAT_TT_OL_MOVER_SPEED, default on with PRECULL=2); output-neutral. GSPLAT_TT_PRECULL default 1 -> 2.", "decision": "keep", "reason": "Interleaved gate on yyzo-bh-07 (Blackhole p100a, not a p150), bicycle 30 views 1024x1024, 3 rounds untraced: tip (PRECULL=1) 18.595/18.428/18.453, new default 18.202/18.174/18.157 ms/view, paired -0.393/-0.254/-0.296, mean -0.314 (-1.7%); t166 row split arm 18.326 mean. Stages: sort 4.35 -> 4.50, blend 9.28 -> 8.88, project 4.66 -> 4.59. md5: PRECULL=1 identical to md5-r82new.txt; new default identical across rounds (46a725ab set), <=1 LSB vs tip, PSNR 74.24-77.81 dB (hero 75.64). Tracy emit window 3.576 -> 3.011 ms; re-balance predicts 2.49.", "metrics": {"board": "yyzo-bh-07 (Blackhole p100a)", "bit_identical": false, "max_lsb": 1, "hero_vs_ref": 75.64, "frame_ms_view": 18.18, "frame_ms_view_baseline": 18.49, "frame_delta_ms": -0.31, "frame_delta_pct": -1.7, "fps": 55.0, "emit_window_ms": 3.011, "emit_window_ms_prev": 3.576}, "timings": {"ms_view": 18.18, "project": 4.59, "tile_assign": 0.004, "sort": 4.5, "blend": 8.88}, "iter_dir": "ttw-185", "run_label": "t162-t162r1..r3-{tip,base,rows}, t174-p2w", "verdict": "KEEP (PRECULL=2 + speed-proportional emit ranges: 18.49 -> 18.18 ms/view (-0.31), <=1 LSB; board yyzo-bh-07 p100a)", "ts": "2026-10-04T23:00:00-0700", "buildid": {"cpp": "gsplat_tt ttp/t174 8295e08", "data": ""}, "tracy": "yyzo-bh-07:/localdev/smarton/gstt2-t166/opt/profiler/t174-p2w/render.tracy"}
{"iter": 186, "idea": "Task #170: pair stage diet. K2 (tile_assign_scatter_seg) reads lofs/box pages ahead through a ring, writes pair pages in batches with no per-page flush and drops the per-pair divide (GSPLAT_TT_K2_DIET). The K2 also counts pairs per tile in RISC local memory and writes the one-launch sort's count rows on the sort's own speed-proportional ranges, so the sort skips its count pass and first barrier and reads no keep pages (GSPLAT_TT_K2_FOLD; the sort checks cores/row_pages/tiles/P/ranges and logs why=<code> when it cannot fold).", "decision": "keep", "reason": "Paired A/B on yyzo-bh-07 (Blackhole p100a, not a p150), bicycle 30 views 1024x1024, untraced. view_total off/diet/diet+fold: r6 18.238/17.519/17.326, r7 18.303/17.614/17.438 ms/view; diet+fold vs off -0.912/-0.865, mean -0.889 (-4.9%); diet alone -0.704, fold -0.184. Uniform-range arms (r7): fold 18.023 vs no fold 18.211. Stages off -> diet+fold: project 4.61 -> 4.11, sort 4.52 -> 4.07, blend 8.88 unchanged. Tracy K2+count+barrier 2.590 -> 1.335 ms/view (k2_pairs 0.922, k2_rows 0.006, no sort_ol_count, barrier 0.407); sort_ol_prefix 0.037 -> 0.373. All r5-r7 arms md5-identical to md5-r82new.txt (46a725ab). Left: per-pair counting costs the K2 ~0.16 ms; prefix growth to explain (docs/k2-diet-t170).", "metrics": {"board": "yyzo-bh-07 (Blackhole p100a)", "bit_identical": true, "max_lsb": 0, "hero_vs_ref": 75.64, "frame_ms_view": 17.38, "frame_ms_view_baseline": 18.27, "frame_delta_ms": -0.89, "frame_delta_pct": -4.9, "fps": 57.5, "k2_count_barrier_ms": 1.335, "k2_count_barrier_ms_prev": 2.59}, "timings": {"ms_view": 17.38, "project": 4.11, "tile_assign": 0.004, "sort": 4.07, "blend": 8.88}, "iter_dir": "ttw-186", "run_label": "t170-r6,r7-{base,nf,off}, t170-r7-{u,unf}, t170-{on,nf,off} (Tracy)", "verdict": "KEEP (K2 diet + count fold: 18.27 -> 17.38 ms/view (-0.89), md5-identical; board yyzo-bh-07 p100a)", "ts": "2026-10-04T16:16:00-0700", "buildid": {"cpp": "gsplat_tt ttp/t170 96c9910", "data": ""}, "tracy": "yyzo-bh-07:/localdev/smarton/gstt2-t170/opt/profiler/t170-on/render.tracy"}
{"iter": 187, "idea": "Task #172: probe the blend per-tile fixed cost (the 85-90 us/tile intercept of the t147 fit) with a per-tile MATH cycle split (GSPLAT_TT_MB_TILECYC: records loop / T read-back / stage / tail / init / emit) and Tracy sub-zones (GSPLAT_TT_BLEND_PROF=2), then cut the largest part behind a kill switch if it can reach the 0.3 ms/view gate.", "decision": "diagnostic", "reason": "Not cut: the gate cannot be met. yyzo-bh-07 (Blackhole p100a, not a p150), bicycle 1024x1024 views 0:2, code d3bae7d on 04f86dc. MATH per core per view: wall 5.784 ms, records loop 5.683 (98.3%), T read-back 0.097 (1.1 us x ~47), init 0.004, stage+tail+emit <0.001. Real fixed cost ~10 us/tile, ~0.1 ms/view, not 85-90 us/tile. Adding the dispatch count to the fit drops the intercept to 1-3 us/tile (rms 70 -> 14.7 us): cyc ~ 0.016*rec + 0.080*live + 0.061*disp, i.e. dispatches 3.66 ms (64%), live-record staging 1.71 ms (30%), record scan 0.30 ms. UNPACK/PACK 80-103 us zones are waits on MATH. Blend levers must make each dispatch (~82 cycles) or each staging (~108 cycles) cheaper.", "metrics": {"board": "yyzo-bh-07 (Blackhole p100a)", "math_wall_ms_core": 5.784, "math_loop_ms_core": 5.683, "t_readback_ms_core": 0.097, "init_ms_core": 0.004, "fixed_us_tile": 10, "fit_intercept_us_tile_old": 91.2, "fit_intercept_us_tile_with_disp": 1.0, "disp_cycles": 82, "live_stage_cycles": 108, "dispatch_share_pct": 64}, "timings": {}, "iter_dir": "ttw-187", "run_label": "t172-prof (Tracy), t172-tc (TILECYC DPRINT)", "verdict": "DIAGNOSTIC (blend per-tile fixed cost ~0.1 ms/view, below the 0.3 gate; the t147 intercept was the missing dispatch-count term; no cut)", "ts": "2026-10-04T18:10:00-0700", "buildid": {"cpp": "gsplat_tt ttp/t172 d3bae7d on 04f86dc", "data": ""}, "tracy": "yyzo-bh-07:/localdev/smarton/gstt2-t172/opt/profiler/t172-prof/chunks/0-2/render.tracy"}
{"iter": 188, "idea": "Task #188: blend late claim + record-count-descending claim order. The blend reader reserves a bulk ring slot before it claims the next tile from the shared counter (GSPLAT_TT_BLEND_LATE_CLAIM), so each core has at most 2 tiles committed instead of 3. The host deals tiles round-robin in record-count-descending order instead of LPT lists (GSPLAT_TT_BLEND_CLAIM_DESC).", "decision": "keep", "reason": "Paired A/B on yyzo-bh-07 (Blackhole p100a, not a p150), bicycle 30 views 1024x1024, untraced, 3 rounds, arm order rotated. view_total off/late/late+desc: r1 17.449/17.047/16.864, r2 17.312/17.068/16.991, r3 17.277/17.048/17.039 ms/view; late+desc vs off -0.585/-0.321/-0.238, mean -0.381 (-2.2%); late alone -0.292. Blend stage 8.884 -> 8.544 (-0.34, steady across rounds). All 9 runs md5-identical to md5-r82new.txt (46a725ab). Tracy: blend core end max-mean 0.439 -> 0.106 ms/view (docs/blend-claim-t188).", "metrics": {"board": "yyzo-bh-07 (Blackhole p100a)", "bit_identical": true, "max_lsb": 0, "hero_vs_ref": 100.0, "frame_ms_view": 16.97, "frame_ms_view_baseline": 17.35, "frame_delta_ms": -0.38, "frame_delta_pct": -2.2, "fps": 58.9, "blend_tail_ms": 0.106, "blend_tail_ms_prev": 0.439}, "timings": {"ms_view": 16.97, "project": 4.13, "tile_assign": 0.005, "sort": 4.02, "blend": 8.54}, "iter_dir": "ttw-188", "run_label": "t188-r1..r3-{off,late,base}, t188-on (Tracy)", "verdict": "KEEP (blend late claim + desc claim order: 17.35 -> 16.97 ms/view (-0.38), md5-identical; board yyzo-bh-07 p100a)", "ts": "2026-10-04T18:20:00-0700", "buildid": {"cpp": "gsplat_tt ttp/t188 cff6c59", "data": ""}, "tracy": "yyzo-bh-07:/localdev/smarton/gstt2-t188/opt/profiler/t188-on/render.tracy"}
{"iter": 189, "idea": "Task #181: K2-fold window fill in sort_bin_onelaunch reads one run per DRAM bank and plane (interleaved page p+nb follows page p in the same bank) instead of one 64 B NoC read per page, then copies pages to their window slots (GSPLAT_TT_OL_FILL_BULK, kill switch =0). Tracy zones sort_ol_fill (NCRISC) and sort_ol_fillb (BRISC) measure the fill.", "decision": "keep", "reason": "Paired A/B on yyzo-bh-07 (Blackhole p100a, not a p150), bicycle 30 views 1024x1024, untraced, 3 rounds, arm order rotated. view_total off/bulk: r1 16.983/16.587, r2 16.994/16.640, r3 17.025/16.749 ms/view; mean -0.342 (-2.0%). Sort stage 3.819 -> 3.449. All 6 runs md5-identical to md5-r82new.txt (46a725ab). Tracy views 0:10: fill makespan 764 -> 147 us, 27.1 -> 140.6 GB/s (page reads were request-bound); prefix makespan 377 -> 84 us. Base affaad2 = 04f86dc + #187 stack fix, before #188; the gain is in sort, combined tip not measured (docs/sort-fill-t181).", "metrics": {"board": "yyzo-bh-07 (Blackhole p100a)", "bit_identical": true, "max_lsb": 0, "hero_vs_ref": 100.0, "frame_ms_view": 16.659, "frame_ms_view_baseline": 17.001, "frame_delta_ms": -0.342, "frame_delta_pct": -2.0, "fill_us_off": 764.1, "fill_us_bulk": 147.0, "fill_gbps_off": 27.1, "fill_gbps_bulk": 140.6, "prefix_makespan_us_off": 377.0, "prefix_makespan_us_bulk": 83.9}, "timings": {"ms_view": 16.659, "project": 4.09, "tile_assign": 0.005, "sort": 3.449, "blend": 8.9}, "iter_dir": "ttw-189", "run_label": "t181-r1..r3-{base,off}, t181-on/off (Tracy)", "verdict": "KEEP (sort window bulk fill: 17.00 -> 16.66 ms/view (-0.34) on the pre-#188 base, md5-identical; board yyzo-bh-07 p100a)", "ts": "2026-10-04T18:45:00-0700", "buildid": {"cpp": "gsplat_tt ttp/t181 affaad2", "data": ""}, "tracy": "yyzo-bh-07:/localdev/smarton/gstt2-t181/opt/profiler/t181-on/render.tracy"}
{"iter": 190, "idea": "Re-baseline (task #194): measure the combined tip 4d591f7 (#181 sort window bulk fill + #188 blend late claim) untraced, then a fresh 30-view default-chain Tracy capture for the per-program split.", "decision": "rebaseline", "reason": "yyzo-bh-07 (Blackhole p100a, not a p150), bicycle 30 views 1024x1024, default env, 3 untraced rounds: view_total 16.236/16.271/16.227 ms/view (mean 16.245, 61.6 FPS); avg_frame_ms mean 16.276. All 3 rounds md5-identical to md5-r82new.txt (46a725ab). Better than the expected ~16.6: #181 (-0.342) was measured on a pre-#188 base, and 17.001-0.342-0.381 = 16.28. Tracy 30 views, program busy ms/view: pfwc 2.981, K2 0.985, gap 0.419, sort_ol 2.975 (was 3.547 at t170), gap 0.260, mat 3.008, blend 5.540 (was 5.868), all-core idle 0.691, traced end 16.179. Top levers: blend 5.54 (MATH-bound records loop), mat 3.01, pfwc 2.98, sort_ol emit mover imbalance (median 2.53 vs max 3.62 ms), host bridges 0.69 ms traced (docs/tip-t194).", "metrics": {"board": "yyzo-bh-07 (Blackhole p100a)", "bit_identical": true, "all_30_views_identical": true, "hero_vs_ref": 100.0, "frame_ms_view": 16.245, "frame_ms_view_stdev": 0.023, "fps": 61.56, "avg_frame_ms": 16.276, "combined_tip_measured": true, "tracy_pfwc_ms": 2.981, "tracy_k2_ms": 0.985, "tracy_gap_k2_sort_ms": 0.419, "tracy_sort_ol_ms": 2.975, "tracy_gap_sort_mat_ms": 0.26, "tracy_mat_ms": 3.008, "tracy_blend_ms": 5.54, "tracy_idle_ms": 0.691, "tracy_end_ms": 16.179, "sort_ol_prefix_us": 84.5, "sort_ol_barrier_us": 148.6, "sort_ol_fill_union_us": 148.3, "sort_ol_emit_us": 2861.8}, "timings": {"ms_view": 16.245, "project": 4.092, "tile_assign": 0.004, "sort": 3.392, "blend": 8.547}, "iter_dir": "ttw-190", "run_label": "t194-r1..r3-base, t194-tip (Tracy)", "verdict": "REBASELINE 4d591f7 = 16.245 ms/view (61.6 FPS) on yyzo-bh-07 p100a, md5-identical", "ts": "2026-10-04T18:55:00-0700", "buildid": {"cpp": "gsplat_tt 4d591f7 (run as 24556e8, drivers only)", "data": ""}, "tracy": "opt/profiler/ttw-190/render.tracy"}
{"iter": 191, "idea": "Task #196: sort_ol emit mover imbalance. The fast K2-fold emit reads each batch's blendrec pages as one NoC read per DRAM bank (interleaved page p+nb follows page p in the same bank) instead of one 64 B read per distinct gaussian; ring halves grow to 256 pages (+16 KB L1 per mover). Kill switch GSPLAT_TT_OL_BREC_BULK=0. The per-g 64 B reads were request-bound and stalled most on the NoC hot spots (BRISC rows y=2,3, NCRISC columns x=14,15), which set the emit makespan.", "decision": "keep", "reason": "Paired A/B on yyzo-bh-07 (Blackhole p100a, not a p150), bicycle 30 views 1024x1024, untraced, 3 rounds, arm order rotated. view_total off/bulk: r1 16.357/15.765, r2 16.116/15.699, r3 16.293/15.755 ms/view; mean -0.516 (-3.2%). Sort stage 3.324 -> 2.834. All 6 runs md5-identical to md5-r82new.txt (46a725ab). Tracy views 0:10 (EMIT_PROF=1): sort_ol busy 2.913 -> 2.491 ms/view, emit makespan 2776 -> 2362 us, mover median 2542 -> 2186 us, blendrec read issue 0.477 -> 0.037 ms per mover, emit cycles/record 286 -> 246; per-mover rate spread 0.67-1.09 -> 0.96-1.06 of the mean (docs/emit-imbalance-t196).", "metrics": {"board": "yyzo-bh-07 (Blackhole p100a)", "bit_identical": true, "all_30_views_identical": true, "max_lsb": 0, "hero_vs_ref": 100.0, "frame_ms_view": 15.74, "frame_ms_view_baseline": 16.255, "frame_delta_ms": -0.516, "frame_delta_pct": -3.2, "fps": 63.53, "emit_makespan_us_off": 2775.8, "emit_makespan_us_bulk": 2362.1, "emit_median_us_off": 2542.3, "emit_median_us_bulk": 2185.7, "ep_brec_ms_off": 0.477, "ep_brec_ms_bulk": 0.037, "emit_cyc_per_rec_off": 286.4, "emit_cyc_per_rec_bulk": 245.6, "tracy_sort_ol_ms_off": 2.913, "tracy_sort_ol_ms_bulk": 2.491}, "timings": {"ms_view": 15.74, "project": 4.102, "tile_assign": 0.005, "sort": 2.834, "blend": 8.547}, "iter_dir": "ttw-191", "run_label": "t196-r1..r3-{base,off}, t196-on/off (Tracy)", "verdict": "KEEP (sort_ol emit bulk blendrec reads: 16.26 -> 15.74 ms/view (-0.52), 63.5 FPS, md5-identical; board yyzo-bh-07 p100a)", "ts": "2026-10-04T19:31:08-0700", "buildid": {"cpp": "gsplat_tt ttp/t196 3d975ca", "data": ""}, "tracy": "opt/profiler/ttw-191/render.tracy", "tracy_note": "views 0:10 of the bulk-on arm with GSPLAT_TT_OL_EMIT_PROF=1 (ep_* emit markers); copy of yyzo-bh-07:/localdev/smarton/gstt2-t196/opt/profiler/t196-on/chunks/0-10/render.tracy"}
{"iter": 192, "idea": "Task #198: 2-CQ bridge hiding. (1) GSPLAT_TT_SORT_OL_EARLY: the one-launch sort is enqueued on CQ0 right behind the fused K2; the kernel reads P from the ta_pairs_P page and uses K2's speed-split mover ranges, so the host P read and the M-float depths vector go away. (2) GSPLAT_TT_MAT_CQ1: a second command queue waits on a K2 event, reads projM and the K2 count rows, the host sums the per-tile totals and runs bin_layout/publish/mat uploads on CQ1 while the device sorts; mat and blend are enqueued on CQ0 behind the sort. Kill switches GSPLAT_TT_SORT_OL_EARLY=0 (both off) and GSPLAT_TT_MAT_CQ1=0.", "decision": "keep", "reason": "Paired A/B on yyzo-bh-07 (Blackhole p100a, not a p150), bicycle 30 views 1024x1024, untraced. Defaults on vs GSPLAT_TT_SORT_OL_EARLY=0, 3 rounds, order swapped: view_total 15.639 -> 15.221 ms/view, paired -0.420/-0.431/-0.404, mean -0.418. Env arms on the same tip, 4 rounds rotated: off/early/both 15.680/15.477/15.216, both-off mean -0.464. All 35 runs (incl. smoke with GSPLAT_TT_SORT_ONELAUNCH_CHECK=1) md5-identical to md5-r82new.txt (46a725ab). Tracy 30 views, same build off/on: K2->sort_ol gap 0.450 -> 0.010, sort_ol->mat 0.260 -> 0.007, pfwc->K2 and mat->blend stay 0.006; all-core idle 0.723 -> 0.029 ms/view; device busy per program unchanged (sort_ol 2.396/2.397); traced view span 15.627 -> 14.943. On the pre-#196 base the gain was only -0.266 because an early-started sort_ol ran slower on the request-bound row y=2 BRISC movers; #196's bulk blendrec reads removed that (emit makespan 2287.4 vs 2287.5 us) (docs/two-cq-t198).", "metrics": {"board": "yyzo-bh-07 (Blackhole p100a)", "bit_identical": true, "all_30_views_identical": true, "max_lsb": 0, "hero_vs_ref": 100.0, "frame_ms_view": 15.221, "frame_ms_view_baseline": 15.639, "frame_delta_ms": -0.418, "frame_delta_pct": -2.7, "fps": 65.7, "env_arms_off_ms": 15.68, "env_arms_early_ms": 15.477, "env_arms_both_ms": 15.216, "env_arms_both_delta_ms": -0.464, "gap_k2_sort_ms_off": 0.45, "gap_k2_sort_ms_on": 0.01, "gap_sort_mat_ms_off": 0.26, "gap_sort_mat_ms_on": 0.007, "gap_pfwc_k2_ms_on": 0.006, "gap_mat_blend_ms_on": 0.006, "idle_between_programs_ms_off": 0.723, "idle_between_programs_ms_on": 0.029, "tracy_view_span_ms_off": 15.627, "tracy_view_span_ms_on": 14.943}, "timings": {"ms_view": 15.221, "project": 3.994, "tile_assign": 0.004, "sort": 0.866, "blend": 10.094}, "iter_dir": "ttw-192", "run_label": "t198-rt1..rt3-{base,both}, t198-r1..r4-{base,early,both}, t198-tip/t198-toff (Tracy)", "verdict": "KEEP (2-CQ bridge hiding, early sort_ol + CQ1 mat bridge: 15.64 -> 15.22 ms/view (-0.42), 65.7 FPS, md5-identical; board yyzo-bh-07 p100a)", "ts": "2026-10-04T20:21:04-0700", "buildid": {"cpp": "gsplat_tt ttp/t198 64d951e", "data": ""}, "tracy": "opt/profiler/ttw-192/render.tracy", "tracy_note": "30 views of the defaults-on arm (64d951e); copy of yyzo-bh-07:/localdev/smarton/gstt2-t198/opt/profiler/t198-tip/render.tracy. Note: the sort host stage now ends at enqueue; blend's host wait absorbs the device sort time, so stage splits are not comparable with earlier iters."}
