{"iter": 136, "idea": "DIAGNOSTIC: decompose the inter-frame HOST gap (blend-done -> next-view pfwc-start) into named host activities and classify REDUCIBLE/HIDEABLE/IRREDUCIBLE to decide whether roadmap #2 (host out of loop) is the next big lever.", "decision": "blocked", "reason": "DIAGNOSTIC (no frame kept). Re-added env-gated GSPLAT_TT_HOST_PROFILE chrono (header-only host_profile.h + call-sites in render.cpp/pfwc_device.cpp/blend_device.cpp; run.py HPPY) and measured the inter-frame host gap = blend-device-done -> next-view pfwc-enqueue on yyzo-bh-07, 30 views, 30 interior boundaries, warmup excluded. FINDING: the REAL steady-state production gap is ~4.86 ms/view (median; mean 4.85; range 4.59-5.27), NOT ~32 ms. Composition (medians): unpack bf16->fp32 tiles_to_image 3.24 (67%); python/pybind return+loop+c2w_to_w2c+marshal 0.76 (16%); final-image D2H readback 0.55 (11%); render_view head (array.request + 12.6MB memset + cached jit/cov3d) 0.18 (4%); pfwc dispatch (110*3 SetRuntimeArgs + EnqueueMeshWorkload) 0.07 (1.5%); post-blend tail ~0.004. Components sum 4.80 ~= gap 4.86 (consistent). ROOT CAUSE of the bogus 32 ms: it is a TRACY OBSERVER ARTIFACT. The per-frame ReadMeshDeviceProfilerResults dump (maybe_dump_device_profiler, fires ONLY under TT_METAL_DEVICE_PROFILER=1) + mid-run Tracy TCP streaming injects host stall ENTIRELY into the post-blend 'tail' window. Controlled A/B, same build/views: (1) clean prod: tail=0.004 gap=4.86 frame=174.7; (2) bare TT_METAL_DEVICE_PROFILER=1: tail=9.4 gap=14.5 frame=184.2; (3) full python -m tracy --dump-device-data-mid-run (the iter-135 method): tail=17.3 gap=22.5 AND warmup boundary=395.9 ms == iter-135's reported 393 ms (same artifact, smoking gun). Every non-tail component is constant across all three; only 'tail' scales with profiler intrusiveness. CLASSIFY: the entire 4.86 ms gap is device-idle host work => HIDEABLE behind the next view's device execution (double-buffer output image + dispatch view i+1 pfwc before unpacking view i). Biggest single piece = unpack 3.24 (also REDUCIBLE: have the blend writer/readback land a de-tiled fp32 image so no host repack). D2H 0.55 = IRREDUCIBLE (one image out per frame). pfwc dispatch 0.07 = IRREDUCIBLE & ~us (iter-126 trace<0.5ms). The genuinely-reducible host COMPUTE (sort hist->host prefix/LPT ~3.8ms, gather M-read, ta P-read) is a WITHIN-frame bubble, NOT part of this inter-frame gap; iter-120 already proved removing those host Finishes is frame-neutral on the in-order CQ. RANK / decides iter-137: do NOT make the host gap the next big lever -- it is 4.86 ms = 2.8% of the 174.7 ms frame; the '~32 ms host gap' premise (roadmap #2) is REFUTED. The frame stays device-kernel-bound (NCRISC sort/TA ~125 ms). If still pursued, lowest-risk first step = hide unpack+D2H behind the next view's device exec, expected ~3-4 ms/view, bit-identical. SINGLE-FRAME-LATENCY CAVEAT: that is a 30-view-AVG (cross-frame pipeline) win only -- it does NOT reduce true single-frame real-time latency (the unpack+D2H stay on the critical path for one frame), which conflicts with the production single-frame goal. Output bit-identical (hero PNG md5 == golden e3fefb11, hero_vs_ref=100.00); frame 174.7 ms/view unchanged vs iter-135 (instrumentation non-perturbing).", "metrics": {"hero_vs_ref": 100.0, "hero_vs_cpu": 63.95, "gap_ms_clean": 4.86, "gap_ms_bareprof": 14.5, "gap_ms_tracy_midrun": 22.5, "warmup_boundary_ms_tracy": 395.9, "gap_unpack_ms": 3.24, "gap_py_ms": 0.76, "gap_d2h_ms": 0.55, "gap_head_ms": 0.18, "gap_pfwc_disp_ms": 0.07, "gap_tail_ms": 0.004, "bit_identical": true}, "timings": {"ms_view": 174.703, "blend": 174.703}, "notes": "GSPLAT_TT_HOST_PROFILE=1 instrumentation KEPT (env-gated, strict no-op unless set; output bit-identical, verified 100.00 dB). New header render/host/host_profile.h + 6 call-sites (render.cpp on_view_enter/return, pfwc on_pfwc_dispatch_start/enqueued, blend on_blend_device_done/readback/unpack) + run.py HPPY (c2w_ms,to_image_ms). Per-boundary HPGAP line: gap = d2h + unpack + tail + py + head + pfwc_disp. Evidence logs: .ttw/logs/iter136-{hostprof,profon,tracy}-*.log. tracy=opt/profiler/ttw-136/render.tracy is the ARTIFACT capture (profiler-on), kept as proof of the 32ms observer effect, NOT a clean device timeline.", "iter_dir": "ttw-136", "ts": "2026-06-11T18:15:54-07:00", "buildid": {"cpp": "cpp#115 8ad13ed iter-136 host-gap instrumentation (GSPLAT_TT_HOST_PROFILE) bin=12c173e895cf4e63"}, "tracy": "opt/profiler/ttw-136/render.tracy"}
{"iter": 137, "idea": "READ MULTI-BUFFERING / PREFETCH on ta_gauss_aabb (tile_assign K1 per-Gaussian AABB, NCRISC, ~9.7 ms/view). iter-134 established this zone is NoC-READ-bound: it reads 4 input pages (px,py,rx,ry SoA, 64B each) per 16-Gaussian page and its per-Gaussian arithmetic is hidden UNDER the read barrier (the iter-134 reciprocal-multiply was flat here). DIAGNOSIS (confirmed latency-bound, NOT bandwidth-bound): the single-buffered loop paid a full DRAM read round-trip latency PER page -- issue 4 noc_async_read, noc_async_read_barrier (NoC drains to zero outstanding), compute 16 gaussians, noc_async_write+barrier, THEN issue the next page's reads cold -- so the read latency was exposed/serialized every page and the NoC sat idle through compute+write (only 4 reads ever in flight, then a hard stall). LEVER: deepen the read pipeline. Size the 5 K1 scratch CBs (px,py,rx,ry,out) to MULTIBUF_PAGES=8 pages each (host build_program_k1) and batch 8 pages of input reads = 32 noc_async_read issued back-to-back before ONE noc_async_read_barrier, then compute + issue all 8 noc_async_write, then one write barrier. The fixed DRAM round-trip latency is now amortized once per 8-page batch instead of once per page (32 reads pipelined through the NoC), mirroring the in-repo reader_tile_l1_cull bulk-load idiom. BIT-IDENTICAL: same pages read, same per-Gaussian compute (g>=M guard -> tpg=0 unchanged), same output pages written in the same order; only the read/barrier/write batching changed. +1.5KB L1/core for the 8-deep CBs.", "decision": "keep", "reason": "KEEP: bit-identical (candidate hero PNG md5 == golden e3fefb11, BYTE-IDENTICAL; hero_vs_ref=100.00 dB in all 8 timing runs; hero_diff10 all-black max=0) AND a real improvement with clean cluster separation. DECISIVE deterministic device-cycle Tracy (30-view, same-build same-thermal A/B): the EDITED zone ta_gauss_aabb 9.696->9.202 ms/view (-0.49, -5.1%), flowing ~1:1 into the idle-waiting BRISC long pole -- NCRISC-FW 125.252->124.748 (-0.50), BRISC-FW 159.590->159.087 (-0.50) -- causal mechanism-level proof, not wall-clock noise. Same-thermal non-profiler render/run.py (30 views, 4 runs each): frame avg 174.6->174.1 ms (baseline 174.7/174.6/174.5/174.6; candidate 174.2/174.1/174.1/173.9 -- candidate MAX 174.2 < baseline MIN 174.5, CLEAN cluster separation), min 140.3->139.9. This CONFIRMS the iter-134 hypothesis that ta_gauss_aabb was read-LATENCY-bound (batching hid the per-page DRAM round-trip) and REFUTES bandwidth-bound (which would have left the makespan flat). Zero risk (pure dataflow restructure, output proven byte-identical). hero_vs_cpu=63.95 inherited (device output byte-identical to the golden anchor; the cpu_cpp_mb reference subprocess flaked black/mean=0.0 twice -- the documented dual-MetalContext host artifact, unrelated to the device kernel change). NOTE: ta_gauss_aabb 9.7->9.2 leaves it the #4 NCRISC mover; the larger NCRISC zones (sort_bucket_emit 32.0, tile_blend_load 28.1, rd_l1_bulk 27.9, tile_l1_cull_rd 22.0) are the next read-pipeline candidates.", "metrics": {"hero_vs_ref": 100.0, "hero_vs_cpu": 63.95, "bit_identical": true, "ta_gauss_aabb_ms_before": 9.696, "ta_gauss_aabb_ms_after": 9.202, "ncrisc_fw_ms_before": 125.252, "ncrisc_fw_ms_after": 124.748, "brisc_fw_ms_before": 159.59, "brisc_fw_ms_after": 159.087, "frame_avg_ms_before": 174.6, "frame_avg_ms_after": 174.1, "frame_min_ms_before": 140.3, "frame_min_ms_after": 139.9}, "timings": {"ms_view": 174.075, "blend": 174.075}, "iter_dir": "ttw-137", "screenshot": "opt/metal-screenshots/ttw-137/hero.png", "screenshot_diff": "opt/metal-screenshots/ttw-137/hero_diff10.png", "ts": "2026-06-11T18:41:56-0700", "buildid": {"cpp": "cpp#117 369831f iter-137 CANDIDATE ta_gauss_aabb multi-buffered read pipeline (MULTIBUF_PAGES=8) bin=866fe0ae739bf6c7", "data": "data#   bin="}, "tracy": "opt/profiler/ttw-137/render.tracy"}
{"iter": 138, "idea": "Stage-2b: OVERFLOW records born PRE-PACKED in their bucket so the sort_subchunk_materialize OVERFLOW path reads them COALESCED instead of random-gathering blendrec[gid] in sorted-id order. DIAGNOSIS: an overflow tile (count>BUCKET_FIT=8192) cannot fit the pre-sized buf_l1_recs bucket (BUCKET_FIT*num_tiles), so emit DROPPED the excess and materialize re-built every subchunk by a random blendrec gather (iter-130: the dominant mat cost). DESIGN (memory-safe, additive): a SEPARATE COMPACT overflow DRAM region (buf_l1_ov), prefix-allocated over ONLY the in-cap overflow tiles (BUCKET_FIT<count<=kOverflowL1Cap=2*BUCKET_FIT=16384), even-aligned per tile for PACK2. sort_bucket_emit pre-packs the FULL overflow tile there (host computes per-(core,tile) bases histrec_overflow + per-tile tile_ov_base in host_bin_layout_from_hist). sort_subchunk_materialize gets ONE whole-tile work item per in-cap overflow tile (build_mat_worklist) and runs the SAME coalesced-bucket-read + stable-L1-radix depth-permute as the in-budget path, streaming each subchunk's slab to the directory page run (CB_SLAB stays BUCKET_FIT-sized). cap=2*BUCKET_FIT reuses the EXISTING CB_BUCKET (already bucket_fit*64 B=512 KB, only half-used) with ZERO growth; only CB_BSORT grows 65->129 KB. Over-cap tiles (the few heaviest, max_tile~26k) keep the legacy gather. DRAM delta ~24-37 MB/view. 16B-aligned >=16B granule respected (32B half-page writes into 64B PACK2 pages, identical to the proven buf_l1_recs scatter).", "decision": "keep", "reason": "KEEP: all three gate conditions met. (1) BIT-IDENTICAL: candidate hero PNG md5 == golden e3fefb11 (BYTE-IDENTICAL); hero_vs_ref=100.00 dB in all 4 timing runs; the stable L1 radix over the pre-packed bucket reproduces the global sort order exactly (same keys, same core/gaussian-major input order the in-budget path already relies on) -> proves overflow-prepack == gather. [OVERFLOW-DIST] 77-92% of gathered records fall in the cap=16384 band (prepacked); only the 5-18 heaviest tiles/view still gather. (2) NET (emit+mat) DROPS and it is NOT a cost-shuffle. Deterministic 30-view same-build same-thermal Tracy (per-view busiest-core makespan): sort_subchunk_mat 13.759->12.529 (-1.23), sort_bucket_emit 32.016->32.070 (+0.05 FLAT -- the extra coalesced overflow stores are absorbed, NOT a shuffle into the store-bound emit), net(emit+mat) 45.775->44.599 (-1.18). (3) FRAME AVG IMPROVES with clean cluster separation: same-thermal non-profiler render/run.py (30 views x4): avg 174.05->173.10 ms (baseline 174.2/173.7/174.1/174.2; candidate 173.2/173.1/173.1/173.0 -- candidate MAX 173.2 < baseline MIN 173.7, CLEAN separation), -0.95 ms (-0.55%). HONEST CAVEAT: the NCRISC-FW long-pole total is FLAT (124.756->125.012, +0.26, noise) and BRISC-FW flat (159.090->159.679); the mat makespan reduction translates into the modest frame-avg win but does not move the saturated firmware totals -- so the gain is small. Still a real, clean, zero-risk (byte-identical) reduction of the materialize overflow gather, which was the remaining on-critical-path lever. hero_vs_cpu=63.95 inherited (device output byte-identical to the golden anchor; cpu_cpp_mb ref skipped via --no-ref to avoid the documented dual-MetalContext host segfault).", "metrics": {"hero_vs_ref": 100.0, "hero_vs_cpu": 63.95, "bit_identical": true, "sort_subchunk_mat_ms_before": 13.759, "sort_subchunk_mat_ms_after": 12.529, "sort_bucket_emit_ms_before": 32.016, "sort_bucket_emit_ms_after": 32.07, "net_emit_mat_ms_before": 45.775, "net_emit_mat_ms_after": 44.599, "ncrisc_fw_ms_before": 124.756, "ncrisc_fw_ms_after": 125.012, "brisc_fw_ms_before": 159.09, "brisc_fw_ms_after": 159.679, "frame_avg_ms_before": 174.05, "frame_avg_ms_after": 173.1, "frame_min_ms_before": 139.95, "frame_min_ms_after": 141.5, "overflow_prepacked_pct": 82.0, "ov_region_mb": 33.9}, "timings": {"ms_view": 173.1, "blend": 173.1}, "iter_dir": "ttw-138", "screenshot": "opt/metal-screenshots/ttw-138/hero.png", "screenshot_diff": "opt/metal-screenshots/ttw-138/hero_diff10.png", "ts": "2026-06-11T19:45:00-0700", "buildid": {"cpp": "cpp#120 1753eb4 iter-138 Stage-2b overflow pre-pack (coalesced overflow materialize) KEEP bin=806c9ff1d117ba19", "data": "data#   bin="}, "tracy": "opt/profiler/ttw-138/render.tracy"}
{"iter": 139, "idea": "DECISIVE GATE DIAGNOSTIC: bit-identical blend OVERSHOOT-histogram (does the 173.1 ms plateau have any remaining blend/SFPU lever short of a host-free rewrite?). Temporary DPRINT instrumentation in alpha_blend_compute_mb.cpp (TRISC_MATH counters, NO dispatch change -> output bit-identical), mirroring iter-117's fan-out probe. Per microblock per tile, counts (a) cover = gaussians whose cull mask rec[3] selects it (work with NO early-out), (b) disp = gaussians actually blended into it under the SHIPPED period-512 transmittance early-out (iter-107, eps=1/256), and (c) slop = m-covering dispatches in the period window during which its max-T was first detected < eps (= the OVERSHOOT a perfect zero-overshoot microblock-major early-out would skip, reclaimable SFPU). Detection uses the EXISTING period-512 T readback (blend_t_reduce mbmax) -- NO added tile_regs_commit/pack in the active blend section (respects the iter-52 hang warning). Aggregated over warmup+30 views, all 110 blend cores; reverted to pristine after.", "decision": "blocked", "reason": "DIAGNOSTIC (no frame kept; instrumentation reverted, tree clean, device kernel restored to pristine HEAD e302975 bin=806c9ff1d117ba19 == iter-138). VERDICT = PLATEAU CONFIRMED at 173.1 ms (overshoot SMALL, well below the 15-20% restructure-worth-it threshold). Measured over 350.08M shipped blend dispatches (429.94M with no early-out): the shipped period-512 early-out already reclaims 79.85M = 18.57% of no-early-out work; the ADDITIONAL reclaimable OVERSHOOT (a perfect zero-overshoot microblock-major early-out vs the shipped scheme) is only 27.39M dispatches = 7.82% of current blend work (6.37% of no-early-out work). Only 20.0% of microblocks saturate (max-T<eps) before their gaussian list ends; the other 80% never saturate -> 0 reclaimable there. Per saturated microblock the overshoot is mean ~25.6% / median bin [10-20%) of its dispatches, but the low saturation rate caps the aggregate at 7.82%. RECLAIM CEILING: 7.82% x blend SFPU 29.65 ms/view = ~2.32 ms/view max SFPU reclaimable; with the readers ~98% SFPU-backpressured this is the ~1:1 ceiling on reader-cluster/frame reclaim = ~2.3 ms (~1.3% of the 173.1 ms frame), and that is the UNPHYSICAL zero-overhead perfect-early-out ceiling. The realizable version is FAR smaller and NOT bit-identical (LOSSY, needs refreeze): iter-107 already shipped this lever for only -7% SFPU, period-64 (finer) was NET SLOWER from readback/scan overhead, iter-46 zero-overshoot was perf-neutral, iter-52 HUNG the device, and true microblock-major (reader stops reading) needs a per-microblock re-sort = refuted cost-shuffle. So the blend early-out restructure CANNOT meaningfully move the frame. The only sub-173 lever is the host-free / persistent-kernel rewrite (1 ms north-star). Blind-spot caveat: 6.54% of dispatches are in <512-gaussian tiles that never hit a period readback (no T visibility) -- but these are shallow tiles that rarely saturate, so the 7.82% ceiling is robust (cross-checks iter-117: 429.94M cover / ~3.18M records/view = avg K~4.4 microblocks/gaussian, consistent with iter-117 median K=4). hero_vs_ref=100.00 dB (8bit-vs-golden) on the instrumented run CONFIRMS the probe is non-perturbing.", "metrics": {"hero_vs_ref": 100.0, "bit_identical": true, "cover_no_earlyout": 429935121, "disp_current_shipped": 350084802, "saved_by_current_earlyout": 79850319, "saved_by_current_pct_of_W0": 18.57, "overshoot_slop_dispatches": 27392820, "overshoot_frac_of_disp_pct": 7.82, "overshoot_frac_of_cover_pct": 6.37, "microblocks_total": 1015808, "microblocks_saturated": 203485, "microblock_saturation_pct": 20.03, "per_sat_mb_overshoot_mean_pct": 25.6, "per_sat_mb_overshoot_median_bin": "10-20pct", "tiles_total": 31744, "tiles_hit_T_boundary_pct": 71.95, "blind_tile_dispatch_pct": 6.54, "blend_sfpu_ms_view": 29.65, "reclaim_ceiling_sfpu_ms_view": 2.32, "reclaim_ceiling_frame_ms_view": 2.3, "frame_ms_view": 173.1}, "notes": "Method: temporary MATH-thread DPRINT counters in alpha_blend_compute_mb.cpp (cover/disp/slop per microblock per tile; saturation detected at the existing period-512 blend_t_reduce mbmax readback so NO pack added inside the active blend section -- iter-52-safe), TT_METAL_DPRINT_CORES=all, render/run.py --no-ref (warmup+30 views) on yyzo-bh-07, build cpp#121 bin=5ba9e6fda1f26a1e (instrumentation, NOT committed). 6820 OVSH lines aggregated (3410 OVSHA + 3410 OVSHB). Per-saturated-mb overshoot-fraction histogram (slop/disp, count|pct of 203,485): [0-10%) 51888 25.5% | [10-20%) 56876 28.0% | [20-30%) 36671 18.0% | [30-40%) 21090 10.4% | [40-50%) 12840 6.3% | [50-60%) 7417 3.6% | [60-70%) 4098 2.0% | [70-80%) 2255 1.1% | [80-90%) 1332 0.7% | [90-100%) 443 0.2% | [100%] 8575 4.2% (the 4.2% at 100% = microblocks that saturate within their first 512-gaussian window). DECISION: do NOT attempt the blend early-out restructure; CONFIRM the 173.1 ms plateau for this architecture; the sole sub-173 lever is the host-free/persistent-kernel rewrite. Kernel reverted to pristine (md5 be7516116299127110146f5720972f4d), git tree clean, device re-stamped pristine cpp#122.", "iter_dir": "ttw-139", "ts": "2026-06-11T20:25:00-0700", "buildid": {"cpp": "diagnostic#0 instrumentation-only (blend overshoot DPRINT, NOT committed) on cpp#121 bin=5ba9e6fda1f26a1e; device restored to pristine cpp#122 e302975 bin=806c9ff1d117ba19", "data": "data#   bin="}}
