{"iter": 193, "idea": "Re-baseline (task #199): measure 7a23beb (#196 bulk blendrec reads on the t194 tip) untraced, then a fresh 30-view default-chain Tracy capture for the per-program split. Measured before #198 (iter 192, 2-CQ bridge hiding) landed; this is the 7a23beb reference, not the current tip.", "decision": "rebaseline", "reason": "yyzo-bh-07 (Blackhole p100a, not a p150), bicycle 30 views 1024x1024, default env, run as 3855aa2 (7a23beb + default-off #197 pfwc counters + drivers), 3 untraced rounds: view_total 15.766/15.743/15.728 ms/view (mean 15.746, stdev 0.019, 63.5 FPS); avg_frame_ms mean 15.786. Matches #196's 15.740 and #198's off arm (15.639-15.680). All 3 rounds md5-identical to md5-r82new.txt (46a725ab). Tracy 30 views, program busy ms/view: pfwc 2.981, K2 0.986, gap 0.452, sort_ol 2.395 (t194 2.975), gap 0.259, mat 3.009, blend 5.538, all-core idle 0.723, traced end 15.632. sort_ol emit makespan 2286 us, per-mover median 2.13 vs max 2.74 ms (t194 2.53/3.62). Device-busy share: blend 37%, mat 20%, pfwc 20%, sort_ol 16%, K2 7%. The two host bridges (0.71 ms traced) are what #198 hides (docs/tip-t199).", "metrics": {"board": "yyzo-bh-07 (Blackhole p100a)", "bit_identical": true, "all_30_views_identical": true, "hero_vs_ref": 100.0, "frame_ms_view": 15.746, "frame_ms_view_stdev": 0.019, "fps": 63.51, "avg_frame_ms": 15.786, "tracy_pfwc_ms": 2.981, "tracy_k2_ms": 0.986, "tracy_gap_k2_sort_ms": 0.452, "tracy_sort_ol_ms": 2.395, "tracy_gap_sort_mat_ms": 0.259, "tracy_mat_ms": 3.009, "tracy_blend_ms": 5.538, "tracy_idle_ms": 0.723, "tracy_end_ms": 15.632, "sort_ol_prefix_us": 84.5, "sort_ol_barrier_us": 148.8, "sort_ol_fill_union_us": 148.6, "sort_ol_emit_us": 2286.2, "emit_mover_median_ms": 2.133, "emit_mover_max_ms": 2.74}, "timings": {"ms_view": 15.746, "project": 4.113, "tile_assign": 0.005, "sort": 2.8, "blend": 8.542}, "iter_dir": "ttw-193", "run_label": "t199-r1..r3-base, t199-tip (Tracy)", "verdict": "REBASELINE 7a23beb = 15.746 ms/view (63.5 FPS) on yyzo-bh-07 p100a, md5-identical (superseded as tip by iter 192, 15.221)", "ts": "2026-10-04T20:03:41-0700", "buildid": {"cpp": "gsplat_tt 7a23beb (run as 3855aa2, default-off counters + drivers)", "data": ""}, "tracy": "opt/profiler/ttw-193/render.tracy"}
{"iter": 194, "idea": "Task #202: tile-owned TRISC emit pack (docs/emit-trisc-own-t200, model task #200). The one-launch sort's per-record emit loop moves from the 2 mover RISCs to the 3 idle TRISCs: TRISC i owns the tiles with t % 3 == i in both mover streams and does their cursor read-modify-write and the 32 B record pack into the mover's ring. The movers build per-TRISC lists per batch (32-bit entries), issue the pair/blendrec reads into 4 slots (was 2), write the full runs the TRISCs queue, and publish a per-tile flushed word so a TRISC starts a run only after its previous write landed. Same records in the same slots, so the output is bit-identical. Kill switch GSPLAT_TT_OL_EMIT_TOWN=0.", "decision": "keep", "reason": "yyzo-bh-07 (Blackhole p100a, not a p150), bicycle 30 views 1024x1024. Gate (Tracy views 0:10, EMIT_PROF=1): TRISC 178.8 cycles per owned record (kill > 270), emit zone makespan 2.312 -> 1.328 ms/view (kill < 0.3 drop), sort_ol program busy 2.497 -> 1.478, traced view span 15.037 -> 14.027; other programs unchanged. Untraced A/B, 3 rounds, order swapped in round 2: view_total base/town r1 15.177/14.235, r2 15.165/14.224, r3 15.241/14.247; mean 15.194 -> 14.235 ms/view, paired mean -0.959 (-6.3%), 70.2 FPS. Default flip checked on the tip (a37ad1e): default 14.226 (OL_EMIT_TOWN=1), =0 15.207. All 9 runs incl. the 2-view smoke md5-identical to md5-r82new.txt (46a725ab). Beats the t200 model (-0.63) since the TRISC loop runs at 179 cycles/record vs the mover's 216. +46.4 KB L1 per mover (docs/emit-trisc-own-t200).", "metrics": {"board": "yyzo-bh-07 (Blackhole p100a)", "bit_identical": true, "all_30_views_identical": true, "max_lsb": 0, "hero_vs_ref": 100.0, "frame_ms_view": 14.235, "frame_ms_view_baseline": 15.194, "frame_delta_ms": -0.959, "frame_delta_pct": -6.3, "fps": 70.25, "default_check_ms_on": 14.226, "default_check_ms_off": 15.207, "trisc_cyc_per_owned_rec": 178.8, "trisc_cyc_per_rec_with_waits": 189.7, "emit_makespan_ms_base": 2.312, "emit_makespan_ms_town": 1.328, "town_trisc_makespan_ms": 1.228, "tracy_sort_ol_ms_base": 2.497, "tracy_sort_ol_ms_town": 1.478, "tracy_view_span_ms_base": 15.037, "tracy_view_span_ms_town": 14.027, "ep_wfl_ms_town": 0.55, "ep_wiss_ms_town": 0.291, "ep_brec_ms_town": 0.468, "cb_bytes_per_mover_base": 521280, "cb_bytes_per_mover_town": 567680}, "timings": {"ms_view": 14.235, "project": 4.016, "tile_assign": 0.004, "sort": 0.857, "blend": 9.145}, "iter_dir": "ttw-194", "run_label": "t202-r1..r3-{base,town}, t202-rd-{base,off}, t202-town/t202-base (Tracy)", "verdict": "KEEP (tile-owned TRISC emit pack: 15.19 -> 14.24 ms/view (-0.96), 70.2 FPS, md5-identical; board yyzo-bh-07 p100a)", "ts": "2026-10-05T08:13:31-0400", "buildid": {"cpp": "gsplat_tt ttp/t202 626de7b (A/B), a37ad1e (default on)", "data": ""}, "tracy": "opt/profiler/ttw-194/render.tracy", "tracy_note": "views 0:10 of the town arm with GSPLAT_TT_OL_EMIT_PROF=1 (TRISC town_pc counters, mover ep_* markers); copy of yyzo-bh-07:/localdev/smarton/gstt2-t202/opt/profiler/t202-town/chunks/0-10/render.tracy"}
{"iter": 195, "idea": "Task #221 (t207 design, docs/pfwc-writer-split-t207): pfwc writer split over BRISC/NCRISC (GSPLAT_TT_PFWC_WRITER_SPLIT) plus t206 single-pass SFPU cov_cam (GSPLAT_TT_PFWC_COVCAM_SFPU), both on by default (=0 off). Super-additive: the split makes pfwc TRISC-bound, so the cov_cam compute cut pays.", "decision": "keep", "reason": "yyzo-bh-07 (Blackhole p100a, not a p150), bicycle 30 views 1024x1024. Default verify on f031ba0, 3 rotated untraced rounds: default 13.578/13.590/13.643 mean 13.604 ms/view (73.5 FPS); both off 14.268; cov only 14.023. Default vs both-off -0.664 ms/view, vs cov-only -0.419. project stage 4.017 -> 3.354 ms/view. All 9 arms 30/30 views md5-identical (46a725ab). Device auto-opens +24 KB kcfg; Tracy of default needs GSPLAT_TT_KCFG_EXTRA_KB=32. pfwc now TRISC-bound (wall ~2.22 ms).", "metrics": {"board": "yyzo-bh-07 (Blackhole p100a)", "bit_identical": true, "all_30_views_identical": true, "max_lsb": 0, "hero_vs_ref": 100.0, "frame_ms_view": 13.604, "frame_ms_view_baseline": 14.268, "frame_delta_ms": -0.664, "frame_delta_pct": -4.7, "fps": 73.51, "cov_only_ms_view": 14.023, "project_ms_default": 3.354, "project_ms_both_off": 4.017, "project_ms_cov_only": 3.79, "tracy_pfwc_wall_ms_base": 2.737, "tracy_pfwc_wall_ms_cov_split": 2.223}, "timings": {"ms_view": 13.604, "project": 3.354}, "iter_dir": "ttw-195", "run_label": "t221-verify rv1..rv3 {default,both-off,cov-only}", "verdict": "KEEP (pfwc writer split + SFPU cov_cam on by default: 14.268 -> 13.604 ms/view (-0.664), 73.5 FPS, md5-identical; board yyzo-bh-07 p100a)", "ts": "2026-10-05T12:00:00-0400", "buildid": {"cpp": "gsplat_tt f031ba0 (default on)", "data": ""}}
{"iter": 196, "idea": "Task #229 (t219 design, docs/blend-sched-t219, model docs/blend-loop-model-t205): GSPLAT_TT_BLEND_SCHED hand-scheduled raw-TTI blend jump-walk bodies, bit-identical to the compiled ones. 1 = F (stall-free MAD->use order), 2 = A2 (F with the common front/tail recorded once per tile into the replay buffer, so TRISC1 pushes about half the instructions per body). Default now 2 (=0 compiled, =1 F).", "decision": "keep", "reason": "yyzo-bh-07 (Blackhole p100a, not a p150), bicycle 30 views 1024x1024, one build of 7f0850d. Gate, 3 rotated untraced rounds: level 0 13.609/13.665/13.620 mean 13.631 ms/view; level 1 13.648/13.635/13.676 mean 13.653 (+0.022, so the MAD->use stall is not the limit; TRISC1 instruction push is); level 2 12.602/12.609/12.638 mean 12.616 (paired -1.015 vs 0, -1.037 vs 1). STAGES blend 9.148/9.199/8.168. Tracy (KCFG_EXTRA_KB=32) blend segment busy 8.539/8.610/7.565 ms/view, tile_blend_sfpu makespan 5.381/5.444/4.413. Default verify on 29c288b, 2 swapped rounds: default 12.699/12.630 mean 12.665 (79.0 FPS), =0 13.691/13.603 mean 13.647, paired -0.982. All 15 arms 30/30 views md5-identical (46a725ab).", "metrics": {"board": "yyzo-bh-07 (Blackhole p100a)", "bit_identical": true, "all_30_views_identical": true, "max_lsb": 0, "hero_vs_ref": 100.0, "frame_ms_view": 12.665, "frame_ms_view_baseline": 13.647, "frame_delta_ms": -0.982, "frame_delta_pct": -7.2, "fps": 78.96, "gate_ms_view_l0": 13.631, "gate_ms_view_l1": 13.653, "gate_ms_view_l2": 12.616, "blend_stage_ms_l0": 9.148, "blend_stage_ms_l1": 9.199, "blend_stage_ms_l2": 8.168, "tracy_blend_busy_ms_l0": 8.539, "tracy_blend_busy_ms_l1": 8.61, "tracy_blend_busy_ms_l2": 7.565, "tracy_blend_sfpu_makespan_l0": 5.381, "tracy_blend_sfpu_makespan_l2": 4.413}, "timings": {"ms_view": 12.665, "blend": 8.168}, "iter_dir": "ttw-196", "run_label": "t229 gate r1..r3 {L0,L1,L2} + verify rv1..rv2 {default,L0}", "verdict": "KEEP (BLEND_SCHED=2 A2 replay bodies on by default: 13.647 -> 12.665 ms/view (-0.982), 79.0 FPS, md5-identical; board yyzo-bh-07 p100a)", "tracy": "opt/profiler/ttw-196/render.tracy", "ts": "2026-10-05T11:00:00-0400", "buildid": {"cpp": "gsplat_tt 29c288b (default 2)", "data": ""}, "device_screenshot": {"hero": "opt/metal-screenshots/ttw-196/hero.png", "diff": "opt/metal-screenshots/ttw-196/hero_diff10.png", "ref": "benchmarks/reference_v2/hero.png", "psnr_vs_ref": 41.16, "diff_ref": "benchmarks/reference_v2/hero.png", "golden": "tests/fixtures/hero/archive/hero_golden_8bit_pre-t290-newton.png", "golden_match": true, "md5": "46a725ab", "commit": "06d4fa7", "config": "defaults (GSPLAT_TT_BLEND_SCHED=2, no knobs set); backfill by task #236 with opt/ttw/screenshot.sh 196 06d4fa7", "device": "yyzo-bh-07 p100a", "visual_check": "Looked at hero.png full size, a 512 px crop of the bike, and the 10x diff. No seams on 16/32 px tile edges (mean gradient across 32 px column/row boundaries 6.95/7.54 vs 6.78/7.73 elsewhere), no blocky, empty or black tiles (darkest 32x32 tile mean 14.5/255), no stripes, banding or color shifts. Byte-identical to tests/fixtures/hero/hero_golden_8bit.png (max diff 0, PSNR inf). The 10x diff vs benchmarks/reference_v2/hero.png (41.16 dB, same as the golden) shows only edge detail (spokes, frame, bench slats, foliage) plus faint large soft blobs at upper left from culled low-contribution Gaussians; no tile grid or tile-aligned structure."}}
{"iter": 197, "idea": "Task #228 (P2 from docs/pfwc-trisc-model-t226, write-up docs/pfwc-cov2d-sfpu-t228): pfwc steps 7-11 (cov2d a/b/c, conic fold, radii) as two DEST sections with looped raw-TTI SFPU passes (pfwc_cov2d_sfpu.h, GSPLAT_TT_PFWC_COV2D_SFPU=1) instead of six tile-op acquires; same rounding order, bit-identical. Per chunk: copy_tile 38 -> 17, SFPU tile ops 87 -> 8 plus the two passes.", "decision": "reject", "reason": "yyzo-bh-07 (Blackhole p100a, not a p150), bicycle 30 views 1024x1024, 543869b (on 3b96ba6, measured before BLEND_SCHED=2 landed), 4 swapped untraced rounds: base (knob 0) 13.662/13.574/13.578/13.597 mean 13.603 ms/view; cov2d 13.883/13.883/13.824/13.844 mean 13.858 (+0.256; the gate needs -0.3). project 3.356 -> 3.605. md5 46a725ab on every arm (30/30). Tracy STEPCYC=1 views 0-4: TRISC_1 steps 6-11 24.7k -> 11.5k cycles/chunk (16k gate passes), TRISC mean wall 2.20 -> 1.86 ms, median core 2.247 -> 1.812 ms, but the slowest core 2.316 -> 2.552 ms. On grid columns x=13-15 the NCRISC writer (NoC1: odd chunks and the input reader) spends 1.24-1.40 ms in its record loop against 0.83 at x=1 and BRISC's flat ~0.75, so BRISC waits on its OPEN hand-off and compute waits on output CB space. Shelved with default 0; the code stays for a re-gate once the right-hand columns' NoC1 load is balanced (follow-up).", "metrics": {"board": "yyzo-bh-07 (Blackhole p100a)", "bit_identical": true, "all_30_views_identical": true, "max_lsb": 0, "hero_vs_ref": 100.0, "frame_ms_view": 13.858, "frame_ms_view_baseline": 13.603, "frame_delta_ms": 0.256, "frame_delta_pct": 1.9, "fps": 72.16, "project_ms_base": 3.356, "project_ms_cov2d": 3.605, "t1_steps6_11_kcyc_per_chunk_base": 24.7, "t1_steps6_11_kcyc_per_chunk_cov2d": 11.5, "tracy_pfwc_core_wall_p50_ms_base": 2.247, "tracy_pfwc_core_wall_p50_ms_cov2d": 1.812, "tracy_pfwc_core_wall_max_ms_base": 2.316, "tracy_pfwc_core_wall_max_ms_cov2d": 2.552}, "timings": {"ms_view": 13.858, "project": 3.605}, "iter_dir": "ttw-197", "run_label": "t228 smoke + r1..r4 {base,cov2d} + Tracy STEPCYC k0/k1", "verdict": "SHELVED (P2 cov2d SFPU sections: md5-identical, TRISC_1 steps 6-11 24.7k -> 11.5k cycles/chunk, but +0.256 ms/view (13.603 -> 13.858) because pfwc becomes NCRISC-writer bound on grid columns 13-15; default 0; board yyzo-bh-07 p100a)", "tracy": "yyzo-bh-07:/localdev/smarton/gstt2-t228/opt/profiler/t228-{k0,k1}/chunks/0-4/render.tracy (STEPCYC=1, views 0-4; CSVs docs/pfwc-cov2d-sfpu-t228/dev/out/prof-k{0,1}-dev.csv.gz)", "ts": "2026-10-05T11:14:33-04:00", "buildid": {"cpp": "gsplat_tt 543869b (knob default 0)", "data": ""}, "device_screenshot": {"hero": "opt/metal-screenshots/ttw-197/hero.png", "diff": "opt/metal-screenshots/ttw-197/hero_diff10.png", "ref": "benchmarks/reference_v2/hero.png", "psnr_vs_ref": 41.16, "diff_ref": "benchmarks/reference_v2/hero.png", "golden": "tests/fixtures/hero/archive/hero_golden_8bit_pre-t290-newton.png", "golden_match": true, "md5": "46a725ab", "commit": "768d91b", "config": "default-config render; knob md5-identical (GSPLAT_TT_PFWC_COV2D_SFPU default 0). Knob-on render GSPLAT_TT_PFWC_COV2D_SFPU=1 at the same commit: hero_cov2d_sfpu1.png, byte-identical, sweep md5 46a725ab. Backfill by task #236 with opt/ttw/screenshot.sh 197 768d91b [GSPLAT_TT_PFWC_COV2D_SFPU=1]", "device": "yyzo-bh-07 p100a", "visual_check": "Looked at hero.png full size, a 512 px crop of the bike, and the 10x diff. No seams on 16/32 px tile edges (mean gradient across 32 px column/row boundaries 6.95/7.54 vs 6.78/7.73 elsewhere), no blocky, empty or black tiles (darkest 32x32 tile mean 14.5/255), no stripes, banding or color shifts. Byte-identical to tests/fixtures/hero/hero_golden_8bit.png (max diff 0, PSNR inf). The 10x diff vs benchmarks/reference_v2/hero.png (41.16 dB, same as the golden) shows only edge detail (spokes, frame, bench slats, foliage) plus faint large soft blobs at upper left from culled low-contribution Gaussians; no tile grid or tile-aligned structure. The knob-on render (hero_cov2d_sfpu1.png) is byte-identical to hero.png.", "knob_on": {"hero": "opt/metal-screenshots/ttw-197/hero_cov2d_sfpu1.png", "diff": "opt/metal-screenshots/ttw-197/hero_cov2d_sfpu1_diff10.png", "config": "GSPLAT_TT_PFWC_COV2D_SFPU=1", "md5": "46a725ab", "ref": "benchmarks/reference_v2/hero.png", "psnr_vs_ref": 41.16, "diff_ref": "benchmarks/reference_v2/hero.png", "golden": "tests/fixtures/hero/archive/hero_golden_8bit_pre-t290-newton.png", "golden_match": true}}}
{"iter": 198, "idea": "Task #231 (t230 design S2a/S2, docs/blend-trisc1-t230; write-up docs/blend-decode-ahead-t231): GSPLAT_TT_BLEND_DECODE_AHEAD TRISC0 decode-ahead staging for blend. TRISC0 (idle during blend) walks the records and writes each live record's 14 pre-encoded SFPLOADI words plus its microblock mask to an L1 ring (CB 10, 64 slots); TRISC1 loads and pushes them with the same SFPU ops in the same order as RAW_STAGE, so the output is bit-identical. 1 = S2a (TRISC1 still scans and reduces T), 2 = S2 (ring holds only live records plus readback and end markers, so TRISC1 skips the scan and the T reduce). Default now 2 (=1 S2a, =0 off).", "decision": "keep", "reason": "yyzo-bh-07 (Blackhole p100a, not a p150), bicycle 30 views 1024x1024, one build of 2f926c6. Gate, 3 rotated untraced rounds: default (knob 0) 12.698/12.617/12.660 mean 12.658 ms/view; S2a 12.382/12.257/12.266 mean 12.302 (paired -0.357, kill gate 0.15 passed); S2 11.965/11.949/11.939 mean 11.951 (paired -0.707); RAW_STAGE=1 calibration 12.452 (-0.206, model +0.27). Model overestimated S2a (+0.66 to +0.90) and S2 (+0.91 to +1.20): the ring loads and handshake cost TRISC1 more than modeled. STAGES blend 8.145 / 7.771 / 7.486 / 7.947. Default verify on 096d892, 2 swapped rounds: default 11.931/11.946 mean 11.939 ms/view (83.8 FPS), knob 0 12.612/12.639 mean 12.626, paired -0.687. Tracy (KCFG_EXTRA_KB=32): device span 11.663 ms/view, mat+blend window 7.562 -> 6.898, tile_blend_sfpu makespan 4.417 -> 3.760; pfwc, K2 and sort_ol unchanged. All 18 arms 30/30 views md5-identical (46a725ab).", "metrics": {"board": "yyzo-bh-07 (Blackhole p100a)", "bit_identical": true, "all_30_views_identical": true, "max_lsb": 0, "hero_vs_ref": 100.0, "frame_ms_view": 11.939, "frame_ms_view_baseline": 12.626, "frame_delta_ms": -0.687, "frame_delta_pct": -5.4, "fps": 83.76, "gate_ms_view_def": 12.658, "gate_ms_view_s2a": 12.302, "gate_ms_view_s2": 11.951, "gate_ms_view_raw_stage": 12.452, "gate_delta_s2a": -0.357, "gate_delta_s2": -0.707, "gate_delta_raw_stage": -0.206, "blend_stage_ms_def": 8.145, "blend_stage_ms_s2a": 7.771, "blend_stage_ms_s2": 7.486, "tracy_device_span_ms": 11.663, "tracy_mat_blend_window_ms": 6.898, "tracy_tile_blend_sfpu_makespan_ms": 3.76, "tracy_tile_blend_load_makespan_ms": 3.684}, "timings": {"ms_view": 11.939, "blend": 7.473}, "iter_dir": "ttw-198", "run_label": "t231 gate rs {DA1,DA2} + r1..r3 {def,DA1,DA2,RAW} + verify rv1..rv2 {default,D0} + Tracy t231-def", "verdict": "KEEP (BLEND_DECODE_AHEAD=2 TRISC0 decode-ahead staging on by default: 12.626 -> 11.939 ms/view (-0.687), 83.8 FPS, md5-identical; board yyzo-bh-07 p100a)", "tracy": "opt/profiler/ttw-198/render.tracy", "ts": "2026-10-05T11:55:00-0400", "buildid": {"cpp": "gsplat_tt 096d892 (default 2)", "data": ""}, "device_screenshot": {"hero": "opt/metal-screenshots/ttw-198/hero.png", "diff": "opt/metal-screenshots/ttw-198/hero_diff10.png", "ref": "benchmarks/reference_v2/hero.png", "psnr_vs_ref": 41.16, "diff_ref": "benchmarks/reference_v2/hero.png", "golden": "tests/fixtures/hero/archive/hero_golden_8bit_pre-t290-newton.png", "golden_match": true, "md5": "46a725ab", "commit": "096d892", "config": "defaults (GSPLAT_TT_BLEND_DECODE_AHEAD=2, GSPLAT_TT_BLEND_SCHED=2, ...), verify round rv1", "device": "yyzo-bh-07 p100a", "visual_check": "Looked at hero.png full size and a 512 px crop, and the 10x diff: no tile seams on 16/32 px edges, no blocky or empty tiles, no stripes or color shifts. Bit-identical to tests/fixtures/hero/hero_golden_8bit.png (max diff 0, PSNR inf). hero_diff10.png is against benchmarks/reference_v2/hero.png (41.16 dB, the same as the golden itself) and shows only edge detail (spokes, frame, foliage), no tile grid."}}
