{"iter": 207, "idea": "Task #306/#315: GSPLAT_TT_MATCULL_TRISC_FILL on by default (unset=on, =0 off). The mat cull coefficient fill/patch runs on the TRISCs instead of the data movers.", "decision": "keep", "reason": "yyzo-bh-04 (Blackhole p100a, not a p150), bicycle 30 views 1024x1024, commit 4bdf0888 (iter-206 defaults + fill on). 3 alternating untraced rounds in one session (on/off, off/on, on/off): on 10.923/10.861/10.937 mean 10.907 vs MATCULL_TRISC_FILL=0 11.077/11.099/11.092 mean 11.089 ms/view (-0.182; per round -0.154/-0.238/-0.155). Blend stage (fused mat+blend) 6.711/6.715/6.762 vs 6.940/6.894/6.889. Off arm matches the iter-208 bh-04 re-baseline (11.093). md5 906e0435 on 30/30 views in all 6 runs; hero golden match, PSNR vs reference_v2 42.51 dB.", "metrics": {"board": "yyzo-bh-04 (Blackhole p100a)", "frame_ms_view": 10.907, "frame_ms_view_rounds": [10.923, 10.861, 10.937], "frame_ms_view_off": 11.089, "frame_ms_view_off_rounds": [11.077, 11.099, 11.092], "frame_delta_vs_off_ms": -0.182, "fps": 91.68, "hero_psnr_vs_ref": 42.51, "md5": "906e0435", "golden_match": true}, "timings": {"ms_view": 10.907}, "iter_dir": "ttw-207", "run_label": "t315 rounds r1..r3 (docs/iter207-t315/drive.sh), screenshot opt/ttw/screenshot.sh", "verdict": "KEEP (MATCULL_TRISC_FILL on: 10.907 ms/view, -0.182 vs off on yyzo-bh-04, same image)", "ts": "2026-10-07T03:10:00-0400", "buildid": {"cpp": "gsplat_tt ttp/t315-iter-207-matcull-trisc-fill-on-by-defaul 4bdf0888 (cpp#124)", "data": ""}, "device_screenshot": {"hero": "opt/metal-screenshots/ttw-207/hero.png", "diff": "opt/metal-screenshots/ttw-207/hero_diff10.png", "ref": "benchmarks/reference_v2/hero.png", "psnr_vs_ref": 42.51, "diff_ref": "benchmarks/reference_v2/hero.png", "golden": "tests/fixtures/hero/hero_golden_8bit.png", "golden_match": true, "md5": "906e0435", "commit": "4bdf0888", "config": "defaults (GSPLAT_TT_MATCULL_TRISC_FILL=1 now default; fused mat+blend and PFWC_RECIP_NEWTON on)", "device": "yyzo-bh-04 p100a", "visual_check": "looked at hero and diff: no tile or microblock seams, no blocky or empty tiles, no stripes or color shifts; diff only on thin high-gradient edges (spokes, frame, foliage), same as iter 206/208"}, "tracy": "opt/profiler/ttw-207/render.tracy", "tracy_note": "captured at defaults (fill on, no env overrides) on yyzo-bh-04 at 4bdf0888; zones in opt/profiler/ttw-207/zones.txt (mat_cull_mask 2.679 ms, tile_blend_sfpu 3.865 ms per-view makespan)"}
{"iter": 208, "idea": "Task #212: re-baseline of the smarton/tt-project-opt tip on the new measurement box yyzo-bh-04 (IRD job 244892). Absolute ms/view are box-specific, so later A/Bs on this box compare against this row, not the yyzo-bh-07 rows.", "decision": "diagnostic", "reason": "yyzo-bh-04 (Blackhole p100a, not a p150: no p150 other than the viewer box bh-30 was free), bicycle 30 views 1024x1024, commit b9ea1cb6 (iter-206 defaults: fused mat+blend on, PFWC_RECIP_NEWTON on, MATCULL_TRISC_FILL still off). 3 untraced rounds: 11.091/11.097/11.092, mean 11.093 ms/view (90.1 FPS); iter 206 on yyzo-bh-07 was 11.129. Sweep md5 906e0435 on 30/30 views in all 3 rounds; hero golden match, PSNR vs reference_v2 42.51 dB. No code change.", "metrics": {"board": "yyzo-bh-04 (Blackhole p100a)", "frame_ms_view": 11.093, "frame_ms_view_rounds": [11.091, 11.097, 11.092], "fps": 90.15, "hero_psnr_vs_ref": 42.51, "md5": "906e0435", "golden_match": true}, "timings": {"ms_view": 11.093}, "iter_dir": "ttw-208", "run_label": "t212 rounds r1..r3 (docs/rebaseline-t212/drive.sh), screenshot opt/ttw/screenshot.sh", "verdict": "DIAGNOSTIC (re-baseline on yyzo-bh-04 p100a: 11.093 ms/view at iter-206 defaults, md5 906e0435)", "ts": "2026-10-06T20:31:00-0400", "buildid": {"cpp": "gsplat_tt smarton/tt-project-opt b9ea1cb6", "data": ""}, "device_screenshot": {"hero": "opt/metal-screenshots/ttw-208/hero.png", "diff": "opt/metal-screenshots/ttw-208/hero_diff10.png", "ref": "benchmarks/reference_v2/hero.png", "psnr_vs_ref": 42.51, "diff_ref": "benchmarks/reference_v2/hero.png", "golden": "tests/fixtures/hero/hero_golden_8bit.png", "golden_match": true, "md5": "906e0435", "commit": "b9ea1cb6", "config": "defaults (iter-206 defaults)", "device": "yyzo-bh-04 p100a", "visual_check": "looked at hero and diff: no tile or microblock seams, no blocky tiles; diff only on thin high-gradient edges (spokes, frame, foliage), same as iter 206"}}
{"iter": 209, "idea": "Task #355: read the early-path K2 count rows (buf_k2_rows) on CQ1 through a 4 KB-page view of the same DRAM address (220 page reads instead of 14,080 of 64 B), then unshuffle the interleaved bank layout on the host (GSPLAT_TT_K2_ROWS_VIEW, default on, =0 restores the 64 B-page read).", "decision": "keep", "reason": "bh-30 (Blackhole p150, the user's viewer box, measured under the viewer reservation with the viewer stopped for the bench only), bicycle 30 views 1024x1024, build 010939d2 (code = 8588f1ac). 3 alternating untraced rounds: view on 12.443/12.658/12.724 mean 12.608 vs GSPLAT_TT_K2_ROWS_VIEW=0 12.876/13.002/13.070 mean 12.983 ms/view (-0.375, -2.9%; per round -0.43/-0.34/-0.35). bin_emit 0.415 vs 2.519 ms; most of the saved host time reappears as blend wait (7.969 vs 6.235), so the device is now the critical path. p100a yyzo-bh-04 same A/B: 10.888 vs 10.902 (noise; bin_emit 0.203 vs 0.588). md5 906e0435 on 30/30 views in all 6 p150 runs and all 6 p100a runs; PSNR vs reference_v2 42.51 dB. Reviewed in #361.", "metrics": {"board": "bh-30 (Blackhole p150, fw 19.13.2)", "frame_ms_view": 12.608, "frame_ms_view_rounds": [12.443, 12.658, 12.724], "frame_ms_view_off": 12.983, "frame_ms_view_off_rounds": [12.876, 13.002, 13.07], "frame_delta_vs_off_ms": -0.375, "fps": 79.31, "bin_emit_ms": 0.415, "bin_emit_ms_off": 2.519, "p100a_frame_ms_view": 10.888, "p100a_frame_ms_view_off": 10.902, "hero_psnr_vs_ref": 42.51, "md5": "906e0435", "golden_match": true}, "timings": {"ms_view": 12.608, "sort": 1.077, "bin_emit": 0.415, "blend": 7.969}, "iter_dir": "ttw-209", "run_label": "t355 p150 rounds r1..r3 (docs/k2-rows-view-t355/p150_drive.sh), p100a rounds (docs/k2-rows-view-t355/drive.sh)", "verdict": "KEEP (K2 rows 4 KB-page view: 12.608 vs 12.983 ms/view on the p150 bh-30, same image)", "ts": "2026-10-07T18:40:00-0400", "buildid": {"cpp": "gsplat_tt ttp/t355-fix-shrink-the-early-path-k2-rows-read-6 010939d2", "data": ""}, "device_screenshot": {"hero": "docs/k2-rows-view-t355/out/p150/hero-r1-base.png", "diff": "docs/k2-rows-view-t355/out/p150/hero-r1-base_diff10.png", "ref": "benchmarks/reference_v2/hero.png", "psnr_vs_ref": 42.51, "diff_ref": "benchmarks/reference_v2/hero.png", "golden": "tests/fixtures/hero/hero_golden_8bit.png", "golden_match": true, "md5": "906e0435", "commit": "010939d2", "config": "defaults (GSPLAT_TT_K2_ROWS_VIEW=1 now default; iter-207 defaults otherwise)", "device": "bh-30 p150", "visual_check": "author and reviewer (#361) looked at hero and diff: no tile or microblock seams, no blocky or empty tiles, no stripes or color shifts; diff only on thin edges (spokes, frame, bench slats). Hero byte-identical to the p100a hero (md5 86524912)."}, "tracy_waiver": "host-side read change; the effect is in the untraced TTW_TIMING bin_emit stage (2.519 -> 0.415 ms on the p150, run logs in docs/k2-rows-view-t355/out/p150/); scoped review did no device run, so no Tracy capture at this commit."}
{"iter": 210, "idea": "Task #365: pad the sort one-launch bucket's per-tile stride to a page count coprime with the DRAM bank count (513 x 2 KB pages on the p150's 8 banks; 512 unchanged on the p100a's 7). At 512 pages page k of every tile sat in the same bank at the same offset, so the emit's bucket writes camped on a few banks. GSPLAT_TT_OL_TILE_PAD=0 restores the old stride, n forces n extra pages.", "decision": "keep", "reason": "bh-30 (Blackhole p150, the user's viewer box, measured under the viewer reservation with the viewer stopped for the bench only), bicycle 30 views 1024x1024, code 4f4e812b (iter 209 + #365). Same binary, 3 alternating rounds: auto 11.066/11.003/11.144 mean 11.071 vs GSPLAT_TT_OL_TILE_PAD=0 12.757/12.615/12.649 mean 12.674 ms/view (-1.603, -12.6%); stage_blend 8.03 -> 6.58 ms (the device emit no longer stalls the blend), d2h 0.64 -> 0.44. p100a yyzo-bh-04 same A/B: 10.935 vs 10.894 (same 512-page layout in both arms, noise). md5 906e0435 on 30/30 views in all 6 p150 and 4 p100a runs; hero PSNR vs reference_v2 42.51 dB. Author's runs (#365, without iter 209): 11.094 vs 12.896. Reviewed in #369.", "metrics": {"board": "bh-30 (Blackhole p150, 8 DRAM banks)", "frame_ms_view": 11.071, "frame_ms_view_rounds": [11.066, 11.003, 11.144], "frame_ms_view_off": 12.674, "frame_ms_view_off_rounds": [12.757, 12.615, 12.649], "frame_delta_vs_off_ms": -1.603, "fps": 90.33, "blend_stage_ms": 6.575, "blend_stage_ms_off": 8.026, "p100a_frame_ms_view": 10.935, "p100a_frame_ms_view_off": 10.894, "hero_psnr_vs_ref": 42.51, "md5": "906e0435", "golden_match": true}, "timings": {"ms_view": 11.071, "sort": 0.98, "bin_emit": 0.35, "blend": 6.575}, "iter_dir": "ttw-210", "run_label": "review #369 rounds r1..r3 on bh-30 (docs/p150-emit-throughput/drive_bh30.sh, OUT=review-t369-p150), p100a r1..r2 (drive_p100a.sh, OUT=review-t369-p100a)", "verdict": "KEEP (bucket tile stride coprime with the DRAM bank count: 11.071 vs 12.674 ms/view on the p150 bh-30, same image)", "ts": "2026-10-07T19:35:00-0400", "buildid": {"cpp": "gsplat_tt ttp/t369-land-iter210 4f4e812b", "data": ""}, "device_screenshot": {"hero": "docs/p150-emit-throughput/review-t369-p150/hero-r1-P1.png", "diff": "docs/p150-emit-throughput/review-t369-p150/hero-r1-P1_diff10.png", "ref": "benchmarks/reference_v2/hero.png", "psnr_vs_ref": 42.51, "diff_ref": "benchmarks/reference_v2/hero.png", "golden": "tests/fixtures/hero/hero_golden_8bit.png", "golden_match": true, "md5": "906e0435", "commit": "4f4e812b", "config": "defaults (auto tile stride: 513 pages on 8 banks; iter-209 defaults otherwise)", "device": "bh-30 p150", "visual_check": "reviewer (#369) looked at hero and diff x10: no tile or microblock seams, no grid lines, no blocky or empty tiles, no color shifts; diff only on thin edges (spokes, frame, bench slats, foliage). Hero md5 86524912, identical to the author's bh-30 hero (docs/p150-emit-throughput/out-p150/hero-r1-P1.png) and the p100a hero."}, "tracy_waiver": "DRAM layout change; the effect is in the untraced TTW_TIMING blend stage (8.03 -> 6.58 ms) and, without iter 209, bin_emit 2.43 -> 0.62 ms (docs/p150-emit-throughput/out-p150); scoped review took no Tracy capture at this commit."}
{"iter": 211, "idea": "Task #374/#395: zero-copy pinned output (GSPLAT_TT_OUT_ZEROCOPY=1). The blend writer writes the u8 image over the NoC into a ring of pinned host buffers and render_view returns a numpy view of the slot (holding its lease) instead of reading the image back. Review #391 found the zero-copy arm had lost the fused mat+blend program (gate on image_out != nullptr); #395 fixed the gate (sort_blend_has_output) and logs MATBLEND_PROGRAM fz=1.", "decision": "keep", "reason": "yyzo-bh-04 (p100a), bicycle 30 views 1024x1024, build 1197ea1e (iter 210 + #374 + #395). Same binary, 3 alternating rounds: zero-copy 10.660/10.705/10.675 mean 10.680 vs base 10.954 (10.951/10.965/10.945) and pinned copy 10.939 ms/view: -0.274 ms (-2.5%). Blend span 7.069 vs 7.067 (fused program on in every arm, fz=1 from frame 0), d2h 0.263 -> 0. md5 906e0435 30/30 in all 10 runs. Opt-in: the default stays off pending an A/B with the cross-view overlap default (xvpin, #388/#393). Outputs docs/zerocopy-out/out-t395.", "metrics": {"board": "yyzo-bh-04 (Blackhole p100a)", "frame_ms_view": 10.68, "frame_ms_view_rounds": [10.66, 10.705, 10.675], "frame_ms_view_off": 10.954, "frame_ms_view_off_rounds": [10.951, 10.965, 10.945], "frame_ms_view_pinned_copy": 10.939, "frame_delta_vs_off_ms": -0.274, "fps": 93.63, "blend_stage_ms": 7.069, "blend_stage_ms_off": 7.067, "d2h_ms": 0.0, "d2h_ms_off": 0.263, "hero_psnr_vs_ref": 42.51, "md5": "906e0435", "golden_match": true}, "timings": {"ms_view": 10.68, "sort": 0.519, "project": 3.038, "blend": 7.069, "d2h": 0.0}, "iter_dir": "ttw-211", "run_label": "docs/zerocopy-out/drive.sh 211 1197ea1e (O=docs/zerocopy-out/out-t395), rounds r1..r3 x base/pin/zc", "verdict": "KEEP (opt-in GSPLAT_TT_OUT_ZEROCOPY=1: 10.680 vs 10.954 ms/view on the p100a, same image; default off)", "ts": "2026-10-07T21:10:00-0400", "buildid": {"cpp": "gsplat_tt ttp/t395-zero-copy-pinned-output-double-buffered- 1197ea1e", "data": ""}, "device_screenshot": {"hero": "opt/metal-screenshots/t395-zerocopy-out/hero.png", "diff": "opt/metal-screenshots/t395-zerocopy-out/hero_diff10.png", "ref": "benchmarks/reference_v2/hero.png", "psnr_vs_ref": 42.51, "diff_ref": "benchmarks/reference_v2/hero.png", "golden": "tests/fixtures/hero/hero_golden_8bit.png", "golden_match": true, "md5": "906e0435", "commit": "1197ea1e", "config": "GSPLAT_TT_OUT_ZEROCOPY=1 (iter-210 defaults otherwise)", "device": "yyzo-bh-04 p100a", "visual_check": "t395 author looked at hero.png and hero_diff10.png: no tile or microblock seams, no grid lines, no blocky or empty tiles, no color shifts; diff only on thin edges (spokes, frame, bench slats, foliage). Golden match, max 0 LSB."}, "tracy_waiver": "Host output-path change (no device kernel change); the effect is the untraced TTW_TIMING d2h stage (0.263 -> 0 ms) with the blend span unchanged (7.067 vs 7.069 ms)."}
{"iter": 212, "idea": "Task #393: make the cross-view overlap with pinned output the default (#379/#388 'xvpin'): view N+1's pfwc projection is enqueued while view N's blend tail runs, and the output readback goes to a pinned host buffer. GSPLAT_TT_XVIEW_OVERLAP=0 / GSPLAT_TT_OUT_PINNED=0 opt out; run.py skips the next-view hint for backends without next_extrinsics.", "decision": "keep", "reason": "yyzo-bh-04 (Blackhole p100a, measurement reservation IRD job 244892), bicycle 30 views 1024x1024, merged head dd5e523c (t393 + opt tip 42f92a56 incl. t395 fused mat+blend zero-copy option and t374 OUT_PIN_HOLD). Same binary, 3 rotating rounds: new default 8.924/8.982/8.978 mean 8.961 vs opt-out (GSPLAT_TT_XVIEW_OVERLAP=0 GSPLAT_TT_OUT_PINNED=0) 10.906/10.867/10.865 mean 10.879 ms/view (-1.918, -17.6%). project stage 3.03 -> 1.09 ms (pfwc gather_wait 2.93 -> 1.08 ms, hidden under the previous view's tail); blend 7.10 -> 7.08, d2h 0.21 -> 0.25. Extra round with GSPLAT_TT_OUT_ZEROCOPY=1 on top of the new default (t395 path): 8.709 ms/view, md5 906e0435, XVIEW_HITS 29/30. md5 906e0435 on 30/30 views in all 8 runs (incl. warm-up and zero-copy round); XVIEW_HITS_OK hits=29 misses=0 in all 5 overlap runs. Pre-merge measurement (#393, head 56f75707): 9.016 vs 10.965. p150 bh-30 (#394, t388 tree 2138a42c with the flags set by env, viewer reservation): xvpin 9.176 vs base 11.027 ms/view (-16.8%), md5 906e0435 9x30/30. Hero PSNR vs reference_v2 42.51 dB. Published GPU reference 10.75 ms/view (published, not measured).", "metrics": {"board": "yyzo-bh-04 (Blackhole p100a, measurement box)", "frame_ms_view": 8.961, "frame_ms_view_rounds": [8.924, 8.982, 8.978], "frame_ms_view_off": 10.879, "frame_ms_view_off_rounds": [10.906, 10.867, 10.865], "frame_delta_vs_off_ms": -1.918, "fps": 111.59, "project_stage_ms": 1.09, "project_stage_ms_off": 3.03, "xview_hits": 29, "xview_misses": 0, "p150_board": "bh-30 (Blackhole p150, #394, tree 2138a42c, flags by env)", "p150_frame_ms_view": 9.176, "p150_frame_ms_view_rounds": [9.224, 9.156, 9.147], "p150_frame_ms_view_off": 11.027, "hero_psnr_vs_ref": 42.51, "md5": "906e0435", "golden_match": true, "zerocopy_frame_ms_view": 8.709, "zerocopy_md5": "906e0435"}, "timings": {"ms_view": 8.961, "project": 1.088, "sort": 0.447, "blend": 7.076, "d2h": 0.245, "xview": 0.056}, "iter_dir": "ttw-212", "run_label": "t404 rounds r0 (warm-up) r1..r3 + r4 zero-copy on yyzo-bh-04 at merged head dd5e523c (docs/xvpin-default-t393/drive.sh, out in docs/xvpin-default-t393/out-t404; pre-merge #393 run in .../out); p150 numbers from #394 (docs/xview-overlap-t379/p150 on ttp/t394-xview-p150)", "verdict": "KEEP (cross-view overlap + pinned output by default: 8.961 vs 10.879 ms/view on the p100a yyzo-bh-04 at merged head dd5e523c, same image)", "ts": "2026-10-07T21:25:00-0400", "buildid": {"cpp": "gsplat_tt ttp/t404-cross-view-overlap-xvpin-as-default-merg dd5e523c", "data": ""}, "device_screenshot": {"hero": "opt/metal-screenshots/ttw-212/hero.png", "diff": "opt/metal-screenshots/ttw-212/hero_diff10.png", "ref": "benchmarks/reference_v2/hero.png", "psnr_vs_ref": 42.51, "diff_ref": "benchmarks/reference_v2/hero.png", "golden": "tests/fixtures/hero/hero_golden_8bit.png", "golden_match": true, "md5": "906e0435", "commit": "dd5e523c", "config": "defaults at merged head dd5e523c (GSPLAT_TT_XVIEW_OVERLAP=1, GSPLAT_TT_OUT_PINNED=1 default; zero-copy off)", "device": "yyzo-bh-04 p100a", "visual_check": "author (#404) looked at hero and diff x10 captured at dd5e523c: no tile or microblock seams, no grid lines, no blocky or empty tiles, no color shifts; diff only on thin edges (spokes, frame, bench slats, foliage). Sweep md5 906e0435, max LSB vs golden 0."}, "tracy_waiver": "host-side scheduling change (enqueue order across views); the effect is in the untraced TTW_TIMING project stage (3.03 -> 1.09 ms, gather_wait 2.93 -> 1.08 ms) in docs/xvpin-default-t393/out-t404; no Tracy capture at this commit."}
{"iter": 213, "idea": "Task #399: make zero-copy output the default on top of the cross-view overlap (xv + GSPLAT_TT_OUT_ZEROCOPY, #374/#395): the blend writer writes the u8 image into a ring of pinned NoC-mapped host buffers and render_view returns a strided numpy view of the slot (holding its lease) instead of copying it out. GSPLAT_TT_OUT_ZEROCOPY=0 falls back to the pinned copy (old xvpin default); GSPLAT_TT_OUT_PINNED=0 turns off both. All render_view callers (run.py bench/md5/PNG dump, viewer letterbox + JPEG sender np.ascontiguousarray, viser fallback) take a strided view.", "decision": "keep", "reason": "yyzo-bh-04 (Blackhole p100a, measurement reservation IRD job 244892), bicycle 30 views 1024x1024. A/B on one build (7623475d, opt tip + #393 + #395 fused-gate fix d56cc59f), 3 alternating rounds: xv+zero-copy 8.759/8.717/8.730 mean 8.735 vs xvpin 9.273/9.091/9.073 mean 9.146 ms/view (-0.411, -4.5%); d2h 0.430 -> 0.004 ms, blend 7.083 -> 6.981. Confirmed at the iteration commit 32f91f6f (2 alternating rounds, same binary): new default 8.720/8.711 mean 8.716 vs GSPLAT_TT_OUT_ZEROCOPY=0 8.989/8.971 mean 8.980 (-2.9%). MATBLEND_PROGRAM fz=1 from frame 0 in all 12 runs (zerocopy=1 in the zero-copy arms); md5 906e0435 on 30/30 views in all 12 runs; XVIEW_HITS 29/30 in all. Hero PSNR vs reference_v2 42.51 dB, golden match. Published GPU reference 10.75 ms/view (published, not measured).", "metrics": {"board": "yyzo-bh-04 (Blackhole p100a, measurement box)", "frame_ms_view": 8.716, "frame_ms_view_rounds": [8.72, 8.711], "frame_ms_view_off": 8.98, "frame_ms_view_off_rounds": [8.989, 8.971], "frame_delta_vs_off_ms": -0.264, "ab_frame_ms_view": 8.735, "ab_frame_ms_view_rounds": [8.759, 8.717, 8.73], "ab_frame_ms_view_xvpin": 9.146, "ab_frame_ms_view_xvpin_rounds": [9.273, 9.091, 9.073], "fps": 114.73, "d2h_ms": 0.004, "d2h_ms_off": 0.247, "xview_hits": 29, "xview_misses": 0, "hero_psnr_vs_ref": 42.51, "md5": "906e0435", "golden_match": true}, "timings": {"ms_view": 8.716, "project": 1.082, "sort": 0.46, "blend": 7.07, "d2h": 0.004, "xview": 0.053}, "iter_dir": "ttw-213", "run_label": "t399 A/B r0 (smoke) r1..r3 xvpin vs xvzc at 7623475d (docs/xvzc-ab-t399/drive.sh, out in docs/xvzc-ab-t399/out); default confirm r1..r2 at 32f91f6f (docs/xvzc-ab-t399/drive_default.sh, out in docs/xvzc-ab-t399/out-default)", "verdict": "KEEP (zero-copy output by default with the cross-view overlap: 8.735 vs xvpin 9.146 ms/view on the p100a yyzo-bh-04, same image)", "ts": "2026-10-07T21:56:00-0400", "buildid": {"cpp": "gsplat_tt ttp/t399-a-b-xv-zero-copy-vs-xvpin-on-the-measure 32f91f6f", "data": ""}, "device_screenshot": {"hero": "opt/metal-screenshots/ttw-213/hero.png", "diff": "opt/metal-screenshots/ttw-213/hero_diff10.png", "ref": "benchmarks/reference_v2/hero.png", "psnr_vs_ref": 42.51, "diff_ref": "benchmarks/reference_v2/hero.png", "golden": "tests/fixtures/hero/hero_golden_8bit.png", "golden_match": true, "md5": "906e0435", "commit": "32f91f6f", "config": "defaults (GSPLAT_TT_OUT_ZEROCOPY=1 now default, with GSPLAT_TT_XVIEW_OVERLAP=1 and pinned output; iter-212 defaults otherwise)", "device": "yyzo-bh-04 p100a", "visual_check": "author (#399) looked at hero and diff x10: no tile or microblock seams, no grid lines, no blocky or empty tiles, no color shifts; diff only on thin edges (spokes, frame, bench slats, foliage). Sweep md5 906e0435, max LSB vs golden 0."}, "tracy_waiver": "host-side output path change (no host copy of the image); the effect is in the untraced TTW_TIMING d2h stage (0.430 -> 0.004 ms) in docs/xvzc-ab-t399/out; no Tracy capture at this commit."}
