{"iter": 62, "idea": "cleanup gate: restore 63.85 PSNR after render/ dead-path removal", "decision": "keep", "reason": "63.63 >= 63.6", "metrics": {"hero_vs_ref": 63.63}, "timings": {"ms_view": 295.792, "blend": 295.792}, "iter_dir": "ttw-062", "ts": "2026-06-04T04:14:42-0700", "buildid": {"cpp": "cpp#219 8833462 iter 62: cleanup gate: restore 63.85 PSNR after render/ dead-path removal bin=793507cbb5f51704", "data": "data#1 b703f70 sync tracy-041 capture script bin=d193d161f0d6fd76"}}
{"iter": 63, "idea": "verify L1 steps A+B: materialize + device subchunk dir", "decision": "keep", "reason": "63.63 >= 63.6", "metrics": {"hero_vs_ref": 63.63}, "timings": {"ms_view": 295.974, "blend": 295.974}, "iter_dir": "ttw-063", "ts": "2026-06-04T04:19:02-0700", "buildid": {"cpp": "cpp#221 47cb05d iter 63: verify L1 steps A+B: materialize + device subchunk dir bin=793507cbb5f51704", "data": "data#1 b703f70 sync tracy-041 capture script bin=d193d161f0d6fd76"}}
{"iter": 64, "idea": "Tracy: blend/cull hotspot baseline", "decision": "keep", "reason": "63.63 >= 63.6", "metrics": {"hero_vs_ref": 63.63}, "timings": {"ms_view": 296.345, "blend": 296.345}, "iter_dir": "ttw-064", "ts": "2026-06-04T04:31:05-0700", "buildid": {"cpp": "cpp#221 47cb05d iter 63: verify L1 steps A+B: materialize + device subchunk dir bin=793507cbb5f51704", "data": "data#1 b703f70 sync tracy-041 capture script bin=d193d161f0d6fd76"}}
{"iter": 65, "idea": "compute: skip zero-mask blend + thr-sentinel SFPU cull early-out", "decision": "keep", "reason": "63.63 >= 63.6", "metrics": {"hero_vs_ref": 63.63}, "timings": {"ms_view": 295.645, "blend": 295.645}, "iter_dir": "ttw-065", "ts": "2026-06-04T04:36:04-0700", "buildid": {"cpp": "cpp#223 3fd5635 iter 65: compute: skip zero-mask blend + thr-sentinel SFPU cull early-out bin=1a2a2641dbf7e117", "data": "data#1 b703f70 sync tracy-041 capture script bin=d193d161f0d6fd76"}}
{"iter": 67, "idea": "reader in-budget row suppress (mask0/op floor); two-pass emit_n+count-first", "decision": "keep", "reason": "63.63 >= 63.6", "metrics": {"hero_vs_ref": 63.63}, "timings": {"ms_view": 296.302, "blend": 296.302}, "iter_dir": "ttw-067", "ts": "2026-06-04T05:26:57-0700", "buildid": {"cpp": "cpp#226 1dd7287 iter 67: row suppress deadlock fix bin=aaf8d3ae5b088c68", "data": "data#1 b703f70 sync tracy-041 capture script bin=d193d161f0d6fd76"}}
{"iter": 68, "idea": "row-suppress: DPRINT hit rate + Tracy on iter67 bin", "decision": "keep", "reason": "63.63 >= 63.6", "metrics": {"hero_vs_ref": 63.63}, "timings": {"ms_view": 296.581, "blend": 296.581}, "iter_dir": "ttw-068", "ts": "2026-06-04T05:35:46-0700", "buildid": {"cpp": "cpp#227 c1bd8f9 iter 68: RDSUP DPRINT env hook (measurement only) bin=d3754d74d3a307b3", "data": "data#1 b703f70 sync tracy-041 capture script bin=d193d161f0d6fd76"}}
{"iter": 69, "idea": "Fuse tile_l1_cull into blend reader (MB_FUSE_TILE_L1_CULL)", "decision": "blocked", "reason": "TRISC0 LRA +0x768 > 0x720; blend compute at kernel-config ceiling (3 JIT tries, reverted to 53ac306)", "metrics": {}, "timings": {}, "iter_dir": "ttw-069", "ts": "2026-06-04T05:46:43-0700", "buildid": {"cpp": "iter69 blocked (revert 53ac306)", "data": "data#1 b703f70"}}
{"iter": 70, "idea": "tile_mb_mask: hoist box copy per tile + skip SFPU on all-pre-culled batch; writer branchless mask pack", "decision": "reject", "reason": "63.63>=63.6 but ms_view -0.06% (<2%); tile_mb_mask/tile_l1_cull_rd Tracy bar not met; try1 stale bin=d3754d74", "metrics": {"hero_vs_ref": 63.63}, "timings": {"ms_view": 296.414, "blend": 296.414}, "iter_dir": "ttw-070", "ts": "2026-06-04T05:54:00-0700", "buildid": {"cpp": "cpp#230 49452e2 iter 70: mask path opts (remote build+stamp) bin=f282b2575ac4d16d", "data": "data#1 b703f70 sync tracy-041 capture script bin=d193d161f0d6fd76"}}
{"iter": 71, "idea": "revert iter70 + trim blend (drop cp_inb/cp_l1 zones, l1_bulk fence); fuse hook gated OFF", "decision": "keep", "reason": "63.63 >= 63.6", "metrics": {"hero_vs_ref": 63.63}, "timings": {"ms_view": 296.868, "blend": 296.868}, "iter_dir": "ttw-071", "ts": "2026-06-04T06:04:40-0700", "buildid": {"cpp": "cpp#232 49452e2 iter 71: revert iter70 + trim cp_inb zones/l1_bulk fence (noinline conic reverted) bin=1c9522cbcc848062", "data": "data#1 b703f70 sync tracy-041 capture script bin=d193d161f0d6fd76"}}
{"iter": 72, "iter_dir": "ttw-072", "idea": "reader PRECONIC + wired MB_FUSE_TILE_L1_CULL", "decision": "reject", "reason": "hero_vs_ref 63.39 < 63.6; MB_FUSE=1 program config 109776>70656", "metrics": {"hero_vs_ref": 63.39, "ms_view": 328.72}, "timings": {}, "notes": "device yyzo-bh-07; bin=cab7c12a51d5ffd5; see opt/ttw/knowledge/iter-72-preconic-fuse-status.md", "ts": "2026-06-04T13:36:12Z", "buildid": {"cpp": "cab7c12a51d5ffd5", "data": ""}}
{"iter": 73, "idea": "revert iter-72 PRECONIC+fuse; restore iter-71 baseline", "decision": "keep", "reason": "63.63 >= 63.6", "metrics": {"hero_vs_ref": 63.63}, "timings": {"ms_view": 296.77, "blend": 296.77}, "iter_dir": "ttw-073", "screenshot": "opt/metal-screenshots/ttw-073/hero.png", "screenshot_diff": "opt/metal-screenshots/ttw-073/hero_diff10.png", "ts": "2026-06-04T06:37:32-0700", "buildid": {"cpp": "cpp#2 ed6443f iter 73: revert iter-72 restore iter-71 bin=bc902a49a43a8a11", "data": "data#   bin="}}
{"iter": 74, "idea": "mat: sc0 overflow tiles use l1 bulk not blendrec", "decision": "keep", "reason": "63.63 >= 63.6; ms_view -2.0%; materialize_ms ~21/view", "metrics": {"hero_vs_ref": 63.63}, "timings": {"ms_view": 290.75, "blend": 290.75}, "iter_dir": "ttw-074", "screenshot": "opt/metal-screenshots/ttw-074/hero.png", "screenshot_diff": "opt/metal-screenshots/ttw-074/hero_diff10.png", "ts": "2026-06-04T06:42:59-0700", "buildid": {"cpp": "cpp#5 b6397f7 iter 74: mat: sc0 overflow tiles use l1 bulk not blendrec bin=456c59edacf3f099", "data": "data#1 b703f70"}, "tracy": "opt/profiler/ttw-074-tracy/render.tracy"}
{"iter": 76, "idea": "mat: sc>=1 REC_BATCH=32 ring-pack batched writes cached sorted-id page", "decision": "keep", "reason": "63.63 >= 63.6", "metrics": {"hero_vs_ref": 63.63}, "timings": {"ms_view": 290.333, "blend": 290.333}, "iter_dir": "ttw-076", "screenshot": "opt/metal-screenshots/ttw-076/hero.png", "screenshot_diff": "opt/metal-screenshots/ttw-076/hero_diff10.png", "ts": "2026-06-04T06:54:56-0700", "buildid": {"cpp": "cpp#6 b6397f7 iter 76: mat: sc>=1 REC_BATCH=32 ring-pack batched writes cached sorted-id page bin=ab1ed9b14884cb7b", "data": "data#   bin="}}
{"iter": 77, "idea": "blend: skip in-budget cull_masks bulk when all splat op<=floor", "decision": "reject", "reason": "ms_view flat; cull_rd meta-cache hung \u2014 reverted 8b097ee", "metrics": {"hero_vs_ref": 63.63}, "timings": {"ms_view": 290.186, "blend": 290.186}, "iter_dir": "ttw-077", "ts": "2026-06-04T07:18:30-0700", "buildid": {"cpp": "reverted", "data": ""}}
{"iter": 79, "idea": "blend: CB_MB_COEFF depth 128 + single-pass rd_bk_emit", "decision": "reject", "reason": "ms_view -0.08% vs 290.15; reverted 474c29e", "metrics": {"hero_vs_ref": 63.63}, "timings": {"ms_view": 289.924, "blend": 289.924}, "iter_dir": "ttw-079", "ts": "2026-06-04T07:51:24-0700", "buildid": {"cpp": "reverted 051b284", "data": ""}}
{"iter": 80, "idea": "sort: materialize before cull+blend on shared CQ", "decision": "reject", "reason": "ms_view 290.08 flat vs 290.33; reverted on device", "metrics": {"hero_vs_ref": 63.63}, "timings": {"ms_view": 290.08, "blend": 290.08}, "iter_dir": "ttw-080", "ts": "2026-06-04T08:00:00-0700", "buildid": {"cpp": "ab1ed9b reverted", "data": ""}}
{"iter": 81, "idea": "C1 overflow payload DMA (gather fallback)", "decision": "reject", "reason": "payload path ~24dB corruption; gather 63.63 flat ms_view; use_payload=false", "metrics": {"hero_vs_ref": 63.63}, "timings": {"ms_view": 290.1, "blend": 290.1}, "iter_dir": "ttw-081", "ts": "2026-06-04T08:30:00-0700", "buildid": {"cpp": "cpp#13 bin=4dd8438d03ccd84e", "data": ""}, "notes": "meta [dir_base,num_sc] kept; C1b: fix materialize page index vs dir"}
{"iter": 82, "idea": "C1b revert: use_payload off, mat dir pages", "decision": "keep", "reason": "63.63 >= 63.6", "metrics": {"hero_vs_ref": 63.63}, "timings": {"ms_view": 290.635, "blend": 290.635}, "iter_dir": "ttw-082", "screenshot": "opt/metal-screenshots/ttw-082/hero.png", "screenshot_diff": "opt/metal-screenshots/ttw-082/hero_diff10.png", "ts": "2026-06-04T08:20:57-0700", "buildid": {"cpp": "cpp#17 474c29e iter 82: C1b revert: use_payload off, mat dir pages bin=9621391fd9d1e9af", "data": "data#   bin="}}
{"iter": 83, "idea": "C1b: mat sc0 sorted_ids, use_payload off gate check", "decision": "keep", "reason": "63.63 >= 63.6", "metrics": {"hero_vs_ref": 63.63}, "timings": {"ms_view": 295.516, "blend": 295.516}, "iter_dir": "ttw-083", "screenshot": "opt/metal-screenshots/ttw-083/hero.png", "screenshot_diff": "opt/metal-screenshots/ttw-083/hero_diff10.png", "ts": "2026-06-04T08:26:55-0700", "buildid": {"cpp": "cpp#20 e02aed9 iter 83: C1b: mat sc0 sorted_ids, use_payload off gate check bin=ff7e2433fe5af4f1", "data": "data#   bin="}}
{"iter": 84, "idea": "C1 DPRINT: payload vs gather PACK2 compare", "decision": "blocked", "reason": "pg_eq=1 but mism=4 at words 3,7; not page index; use_payload=false gate 63.63", "metrics": {"hero_vs_ref": 63.63}, "timings": {"ms_view": 297.0, "blend": 297.0}, "iter_dir": "ttw-084", "ts": "2026-06-04T10:00:00-0700", "buildid": {"cpp": "bin=497be364272dfde7 debug", "data": ""}, "notes": "see iter-84-c1-payload-dprint.md"}
{"iter": 85, "idea": "C1: mat PACK overlap fix + use_payload overflow", "decision": "keep", "reason": "63.63 >= 63.6", "metrics": {"hero_vs_ref": 63.63}, "timings": {"ms_view": 295.549, "blend": 295.549}, "iter_dir": "ttw-085", "screenshot": "opt/metal-screenshots/ttw-085/hero.png", "screenshot_diff": "opt/metal-screenshots/ttw-085/hero_diff10.png", "ts": "2026-06-04T08:39:26-0700", "buildid": {"cpp": "cpp#21 bb7a8c4 iter 85: C1: mat PACK overlap fix + use_payload overflow bin=497be364272dfde7", "data": "data#   bin="}}
{"iter": 86, "idea": "C1 perf Tracy A/B payload on vs gather", "decision": "blocked", "reason": "invalid device tree after bad rsync; gate 35-47dB; ledger: payload +1.6% slower vs iter74", "metrics": {}, "timings": {}, "iter_dir": "ttw-086", "ts": "2026-06-04T11:00:00-0700", "buildid": {"cpp": "n/a", "data": ""}, "notes": "re-checkout branch on bh-07 then re-verify"}
{"iter": 87, "idea": "device tree recovery + use_payload=false gate", "decision": "reject", "reason": "hero 46.65 < 63.6; flattened branch missing backends/; need full clone", "metrics": {"hero_vs_ref": 46.65}, "timings": {"ms_view": 101.99}, "iter_dir": "ttw-087", "ts": "2026-06-04T12:00:00-0700", "buildid": {"cpp": "cpp#27 bin=ddf5052ae8f6f02e", "data": ""}}
{"iter": 88, "idea": "recovery: full clone + gate green", "decision": "keep", "reason": "63.84 >= 63.6", "metrics": {"hero_vs_ref": 63.84}, "timings": {"ms_view": 296.937, "blend": 296.937}, "iter_dir": "ttw-088", "screenshot": "opt/metal-screenshots/ttw-088/hero.png", "screenshot_diff": "opt/metal-screenshots/ttw-088/hero_diff10.png", "ts": "2026-06-04T10:42:40-0700", "buildid": {"cpp": "cpp#33 05dc152 iter 88: recovery: full clone + gate green bin=793507cbb5f51704", "data": "data#   bin="}}
{"iter": 89, "idea": "branch tip: stage2 ref cmake + rebuild _gsplat_cpu at e28b5f9", "decision": "keep", "reason": "63.84 >= 63.6; hero view 299.3ms (30-view avg 104.9 includes fast orbits)", "metrics": {"hero_vs_ref": 63.84}, "timings": {"ms_view": 299.3, "blend": 299.3}, "iter_dir": "ttw-089", "ts": "2026-06-04T18:02:00-0700", "buildid": {"cpp": "e28b5f9 stage2 render/host ref cmake bin=793507cbb5f51704", "data": ""}, "notes": "see opt/ttw/knowledge/ref-cpu-cmake-stage2-20260604.md"}
{"iter": 90, "idea": "M1: blend loads PACK2 subchunk payload for all tiles; mask still from DRAM cull_masks", "decision": "reject", "reason": "10.18 >= 63.6", "metrics": {"hero_vs_ref": 10.18}, "timings": {"ms_view": 109.176, "blend": 109.176}, "iter_dir": "ttw-090", "screenshot": "opt/metal-screenshots/ttw-090/hero.png", "screenshot_diff": "opt/metal-screenshots/ttw-090/hero_diff10.png", "ts": "2026-06-04T13:50:00-0700", "buildid": {"cpp": "cpp#34 6edbaa1 iter 90: M1: blend loads PACK2 subchunk payload for all tiles; mask still from DRAM cull_masks bin=7e539c9959196156", "data": "data#   bin="}}
{"iter": 91, "idea": "DIAG: M1 force mask=0xFFFFFFFF (no cull) to isolate records vs mask alignment", "decision": "reject", "reason": "11.02 >= 63.6", "metrics": {"hero_vs_ref": 11.02}, "timings": {"ms_view": 132.792, "blend": 132.792}, "iter_dir": "ttw-091", "screenshot": "opt/metal-screenshots/ttw-091/hero.png", "screenshot_diff": "opt/metal-screenshots/ttw-091/hero_diff10.png", "ts": "2026-06-04T14:00:11-0700", "buildid": {"cpp": "cpp#35 6edbaa1 iter 91: DIAG: M1 force mask=0xFFFFFFFF (no cull) to isolate records vs mask alignment bin=4c4365a131064224", "data": "data#   bin="}}
{"iter": 92, "idea": "M1: blend loads PACK2 subchunk payload all tiles; mask from DRAM cull_masks; batch in-budget materialize writes", "decision": "reject", "reason": "10.18 >= 63.6", "metrics": {"hero_vs_ref": 10.18}, "timings": {"ms_view": 109.094, "blend": 109.094}, "iter_dir": "ttw-092", "screenshot": "opt/metal-screenshots/ttw-092/hero.png", "screenshot_diff": "opt/metal-screenshots/ttw-092/hero_diff10.png", "ts": "2026-06-04T14:11:47-0700", "buildid": {"cpp": "cpp#36 6edbaa1 iter 92: M1: blend loads PACK2 subchunk payload all tiles; mask from DRAM cull_masks; batch in-budget materialize writes bin=643b9d2e33812b43", "data": "data#   bin="}}
{"iter": 93, "idea": "M1: fix in-budget single-subchunk materialize payload (radix order); blend loads PACK2 payload for all tiles", "decision": "reject", "reason": "10.18 >= 63.6", "metrics": {"hero_vs_ref": 10.18}, "timings": {"ms_view": 109.438, "blend": 109.438}, "iter_dir": "ttw-093", "screenshot": "opt/metal-screenshots/ttw-093/hero.png", "screenshot_diff": "opt/metal-screenshots/ttw-093/hero_diff10.png", "ts": "2026-06-04T14:47:19-0700", "buildid": {"cpp": "cpp#39 6edbaa1 iter 93: M1: fix in-budget single-subchunk materialize payload (radix order); blend loads PACK2 payload for all tiles bin=9759bec234679bea", "data": "data#   bin="}}
{"iter": 94, "idea": "DIAG: force single-subchunk through proven gather path to isolate in-budget bug", "decision": "reject", "reason": "10.13 >= 63.6", "metrics": {"hero_vs_ref": 10.13}, "timings": {"ms_view": 112.297, "blend": 112.297}, "iter_dir": "ttw-094", "screenshot": "opt/metal-screenshots/ttw-094/hero.png", "screenshot_diff": "opt/metal-screenshots/ttw-094/hero_diff10.png", "ts": "2026-06-04T14:51:01-0700", "buildid": {"cpp": "cpp#40 6edbaa1 iter 94: DIAG: force single-subchunk through proven gather path to isolate in-budget bug bin=971e36e5a3457af7", "data": "data#   bin="}}
{"iter": 96, "idea": "M1: restore L1 invalidate fence in compute process_tile_l1_blend (dropped in M1 refactor); fixes single-subchunk stale-CB checkerboard", "decision": "reject", "reason": "10.18 >= 63.6", "metrics": {"hero_vs_ref": 10.18}, "timings": {"ms_view": 109.764, "blend": 109.764}, "iter_dir": "ttw-096", "screenshot": "opt/metal-screenshots/ttw-096/hero.png", "screenshot_diff": "opt/metal-screenshots/ttw-096/hero_diff10.png", "ts": "2026-06-04T15:08:17-0700", "buildid": {"cpp": "cpp#41 6edbaa1 iter 96: M1: restore L1 invalidate fence in compute process_tile_l1_blend (dropped in M1 refactor); fixes single-subchunk stale-CB checkerboard bin=047e9f5fa7566983", "data": "data#   bin="}}
{"iter": 97, "idea": "M1: restore MATH->UNPACK back-pressure ack in process_tile_l1_blend (+L1 invalidate fence) \u2014 fixes single-subchunk stale-bulk-CB black checkerboard", "decision": "reject", "reason": "10.23 >= 63.6", "metrics": {"hero_vs_ref": 10.23}, "timings": {"ms_view": 107.292, "blend": 107.292}, "iter_dir": "ttw-097", "screenshot": "opt/metal-screenshots/ttw-097/hero.png", "screenshot_diff": "opt/metal-screenshots/ttw-097/hero_diff10.png", "ts": "2026-06-04T15:22:59-0700", "buildid": {"cpp": "cpp#42 6edbaa1 iter 97: M1: restore MATH->UNPACK back-pressure ack in process_tile_l1_blend (+L1 invalidate fence) \u2014 fixes single-subchunk stale-bulk-CB black checkerboard bin=24b8be2a98cd0117", "data": "data#   bin="}}
{"iter": 97, "idea": "M1: invalidate MATH L1 before reading CB_MB_COUNTS (count read) \u2014 fixes single-subchunk black checkerboard (MATH read a stale recycled count -> wrong blend-loop length -> under-blended T~1 black tiles)", "decision": "reject", "reason": "10.23 >= 63.6", "metrics": {"hero_vs_ref": 10.23}, "timings": {"ms_view": 107.477, "blend": 107.477}, "iter_dir": "ttw-097", "screenshot": "opt/metal-screenshots/ttw-097/hero.png", "screenshot_diff": "opt/metal-screenshots/ttw-097/hero_diff10.png", "ts": "2026-06-04T15:58:40-0700", "buildid": {"cpp": "cpp#43 6edbaa1 iter 97: M1: invalidate MATH L1 before reading CB_MB_COUNTS (count read) \u2014 fixes single-subchunk black checkerboard (MATH read a stale recycled count -> wrong blend-loop length -> under-blended T~1 black tiles) bin=49cd5c29c92dd849", "data": "data#   bin="}}
{"iter": 98, "idea": "M1a: blend fat/overflow tiles consume materialized depth-sorted L1 PACK2 slab (process_tile_l1_blend) + MATH->UNPACK back-pressure ack fixes slot-recycle race; single-subchunk stays on coeff (separate bulk-compute defect, data byte-perfect)", "decision": "keep", "reason": "63.84 >= 63.6", "metrics": {"hero_vs_ref": 63.84}, "timings": {"ms_view": 104.279, "blend": 104.279}, "iter_dir": "ttw-098", "screenshot": "opt/metal-screenshots/ttw-098/hero.png", "screenshot_diff": "opt/metal-screenshots/ttw-098/hero_diff10.png", "ts": "2026-06-04T22:41:23-0700", "buildid": {"cpp": "cpp#53 6edbaa1 iter 98: M1a: blend fat/overflow tiles consume materialized depth-sorted L1 PACK2 slab (process_tile_l1_blend) + MATH->UNPACK back-pressure ack fixes slot-recycle race; single-subchunk stays on coeff (separate bulk-compute defect, data byte-perfect) bin=55aae59faf45ed26", "data": "data#   bin="}}
{"iter": 99, "idea": "M1b: route ALL tiles (single + fat) through process_tile_l1_blend consuming the L1 PACK2 slab; fix bulk-CB ring-straddle by slot-aligning CB_BUCKET_BULK/CB_BMASK_BULK reservations (fixed BULK_REC_SLOT/MASK_SLOT) so variable-size single tiles never wrap+corrupt the tail", "decision": "keep", "reason": "63.85 >= 63.6", "metrics": {"hero_vs_ref": 63.85}, "timings": {"ms_view": 104.157, "blend": 104.157}, "iter_dir": "ttw-099", "screenshot": "opt/metal-screenshots/ttw-099/hero.png", "screenshot_diff": "opt/metal-screenshots/ttw-099/hero_diff10.png", "ts": "2026-06-04T23:16:32-0700", "buildid": {"cpp": "cpp#54 f062b76 iter 99: M1b: route ALL tiles (single + fat) through process_tile_l1_blend consuming the L1 PACK2 slab; fix bulk-CB ring-straddle by slot-aligning CB_BUCKET_BULK/CB_BMASK_BULK reservations (fixed BULK_REC_SLOT/MASK_SLOT) so variable-size single tiles never wrap+corrupt the tail bin=c96b919665793ec2", "data": "data#   bin="}}
{"iter": 100, "idea": "M1c: delete dead in-budget blend path now that all tiles consume the L1 slab \u2014 remove the in-budget bucket+radix sort + rd_bk_emit coeff producer (reader), the !use_payload per-splat blendrec gather fallback (reader), and process_tile_gaussians + the CB_MB_COEFF consumer (compute); blend is now a single process_tile_l1_blend path", "decision": "keep", "reason": "63.85 >= 63.6", "metrics": {"hero_vs_ref": 63.85}, "timings": {"ms_view": 103.816, "blend": 103.816}, "iter_dir": "ttw-100", "screenshot": "opt/metal-screenshots/ttw-100/hero.png", "screenshot_diff": "opt/metal-screenshots/ttw-100/hero_diff10.png", "ts": "2026-06-04T23:23:58-0700", "buildid": {"cpp": "cpp#55 240d991 iter 100: M1c: delete dead in-budget blend path now that all tiles consume the L1 slab \u2014 remove the in-budget bucket+radix sort + rd_bk_emit coeff producer (reader), the !use_payload per-splat blendrec gather fallback (reader), and process_tile_gaussians + the CB_MB_COEFF consumer (compute); blend is now a single process_tile_l1_blend path bin=320484631e980b08", "data": "data#   bin="}}
{"iter": 101, "idea": "M2: cull bulk-loads depth-sorted PACK2 slab from L1 (dir_base+sc -> payload_page) and emits cull coeff rows in slab order; deletes l1_recs reload + L1 re-sort (in-budget) and blendrec gather (overflow). Writer still writes DRAM cull_masks; order stays cull_masks[base+k]==slab record k==depth-rank k.", "decision": "keep", "reason": "63.85 >= 63.6", "metrics": {"hero_vs_ref": 63.85}, "timings": {"ms_view": 98.534, "blend": 98.534}, "iter_dir": "ttw-101", "screenshot": "opt/metal-screenshots/ttw-101/hero.png", "screenshot_diff": "opt/metal-screenshots/ttw-101/hero_diff10.png", "ts": "2026-06-04T23:32:54-0700", "buildid": {"cpp": "cpp#57 2cd4f63 iter 101: M2: cull bulk-loads depth-sorted PACK2 slab from L1 (dir_base+sc -> payload_page) and emits cull coeff rows in slab order; deletes l1_recs reload + L1 re-sort (in-budget) and blendrec gather (overflow). Writer still writes DRAM cull_masks; order stays cull_masks[base+k]==slab record k==depth-rank k. bin=8b3be97f9dfaafb2", "data": "data#   bin="}}
