{"iter": 165, "idea": "Task #24 (R8 / candidate 5.3): atomic fixed-capacity bucket append. One sort_bin_atomic launch on both movers counts each core's pairs per tile, reserves each (core, tile) chunk with one NoC fetch-and-add on the tile's counter, and emits 32 B records into tile*32768+slot; the host reads 4 KB of totals instead of the histogram/layout round trip; no keys/ids, radix or publish. The materialize rebuilds canonical (core) order from a chunk table before the stable adaptive radix, so output should be byte-identical. Ported to a58c917 (branch ttp/t24, e1f86c5..d50703a, not landed).", "decision": "reject", "reason": "yyzo-bh-07 (Blackhole p100a, not a p150), bicycle 1024x1024. Speed where frames completed: sort stage 6.6-6.8 ms/view on the atomic path (emit 6.2-6.4, layout 0.13, publish host 0.2) vs 15.6 ms legacy tip, i.e. up to ~8 ms/view. Correctness fails: host check GSPLAT_TT_SORT_ATOMIC_CHECK=1 (chunk table read-back) finds 1-12 of 1024 tiles per frame with overlapping/gapped per-core chunks while chunk lengths still sum to the counter total, so some NoC fetch-and-adds (noc_fast_atomic_increment program_ret_addr=true, INCR_GET) return a wrong old value. Not fixed by: 16 B-spaced return slots, 16 B-spaced counters, staggered per-core tile order, one atomic in flight, L1 cache invalidate after the barrier. The frame after a bad layout hangs the device: every 30-view atomic run timed out (old base 548c58c+#35: 3/3 A/B rounds; tip port: hangs at view 3-10). Old-base legacy reference 94.8/95.1/94.9 ms/view. Next: same design with a device-side prefix sum over cores (two global semaphore barriers, no atomic return values), which also makes the chunk table unnecessary.", "metrics": {"board": "yyzo-bh-07 (Blackhole p100a)", "bit_identical": false, "atomic_sort_stage_ms": 6.7, "legacy_sort_stage_ms": 15.6, "bad_tiles_per_frame": "1-12 of 1024", "runs_completed_30_views": 0}, "timings": {"sort": 6.7}, "iter_dir": "ttw-165", "run_label": "t24p-c", "verdict": "REJECT (atomic bucket append: sort 15.6 -> ~6.7 ms/view where frames completed, but NoC fetch-and-add returns wrong bases in 1-12 tiles/frame and the next frame hangs; needs a device-side prefix sum instead of atomic returns)", "ts": "2026-09-30T10:30:00-0700", "buildid": {"cpp": "gsplat_tt ttp/t24 d50703a on a58c917", "data": ""}, "tracy": ""}
{"iter": 166, "idea": "Task #56 (port of task #35, lever L1 sort tail): split sort_radix_tile + sort_subchunk_materialize work over BRISC and NCRISC (dual mover). Each RISC gets a disjoint half of CB_BSORT (kA) and CB_SLAB (kB) plus its own local histogram; host builds per-RISC work lists (render/host/sort_mover_split.h), over-cap gather subchunks split into 2048-record materialize items, materialize gather cost weight 8 -> 1 (measured sweep). Unit test tests/unit/test_sort_tail_dual_mover.cpp (60 random scenes).", "decision": "keep", "reason": "A/B on yyzo-bh-07 (Blackhole p100a, not a p150), bicycle 30 views 1024x1024, 4 interleaved rounds in one session, base 469b812 (iter-164) vs 469b812 + this change: frame 62.85/61.65/61.65/61.88 -> 58.67/58.37/58.40/58.74 ms/view, mean 62.01 -> 58.55 (-3.46 ms/view, -5.6%), 16.13 -> 17.08 FPS. sort stage 15.63 -> 14.22 ms (publish_wait 4.99 -> 3.59), blend bucket (materialize + cull + blend) 22.23 -> 20.19 ms; other stages unchanged. Byte-identical: all 30 --dump-views md5-identical to the base with fresh kernel caches, hero_vs_ref 100.00 dB in all runs. Task #35 measured -7.3% on older base af239ef; the smaller gain here is expected since iter-163/164 already shrank the tail. Rebased onto 2ce7835 (iter-165 docs/ledger only, no code change).", "metrics": {"board": "yyzo-bh-07 (Blackhole p100a)", "bit_identical": true, "all_30_views_identical": true, "hero_vs_ref": 100.0, "frame_ms_view": 58.545, "frame_ms_view_baseline": 62.007, "frame_delta_ms": -3.462, "fps": 17.08, "fps_baseline": 16.13, "stage_sort_ms": 14.22, "stage_sort_ms_baseline": 15.625, "stage_blend_ms": 20.187, "stage_blend_ms_baseline": 22.231, "ab_rounds": 4, "gpu_ref_ms_view_published": 10.75}, "timings": {"ms_view": 58.545, "project": 10.932, "tile_assign": 8.789, "sort": 14.22, "blend": 20.187}, "iter_dir": "ttw-166", "run_label": "t56-ab4", "verdict": "KEEP (dual-mover sort tail: 62.01 -> 58.55 ms/view (-3.5, -5.6%), 30 views byte-identical; board yyzo-bh-07 p100a)", "ts": "2026-09-30T09:34:00-0700", "buildid": {"cpp": "gsplat_tt ttp/t56 0fa9a5a on 469b812", "data": ""}, "tracy": ""}
{"iter": 167, "idea": "Task #67 gate (deep tier): fuse the band cull into sort_subchunk_materialize. Run the coefficient transpose and the microblock_band_cull_compute SFPU test inside materialize, write word3 while the slab is still in L1, and delete the tile_l1_cull program (saves the slab DRAM read, the write-back and one launch). Rule: proceed only if the post-#59 Tracy zones show an upper-bound saving of at least 3 ms/view.", "decision": "diagnostic", "reason": "Not implemented: the gate failed. Post-#59 Tracy capture (tag t59-tracy-t59, build 469b812, yyzo-bh-07 Blackhole p100a, not a p150, bicycle 1024x1024, one 10-view chunk; 1210 zone instances = 110 cores x 11 frames): tile_mb_mask (TRISC, whole kernel_main) max-core 14.3 ms = 1.43 ms/view; tile_l1_cull_rd (NCRISC reader, whole kernel_main) 14.2 ms = 1.42 ms/view (1.30 / 1.29 if divided by the 11 captured frames). Both run at the same time in one program; the writer has no zone but only drains the last slab after the compute ends, and the launch gap between programs is ~0.007 ms (docs/inter-program-gaps-2026-09-30.md). Deleting the whole cull program therefore saves at most ~1.3-1.5 ms/view, about 2.5% of the 58.55 ms/view tip and half the 3 ms bar; Tracy overhead makes this an over-estimate. The real gain would be lower still: only the slab DRAM read and write-back (3.37 M pairs x 32 B, read + write, ~216 MB/frame) and the launch disappear, while the coefficient transpose (6 loads + 6 stores per record) and the SFPU band test move into materialize, whose two movers are the busy resource since #56. The cull program is unchanged since #59, so these numbers hold at tip f0a5cdf.", "metrics": {"board": "yyzo-bh-07 (Blackhole p100a)", "gate": "3.0 ms/view upper-bound saving required", "cull_program_upper_bound": "~1.3-1.5 ms/view", "tile_mb_mask_makespan": "1.43 ms/view (TRISC, Tracy)", "tile_l1_cull_rd_makespan": "1.42 ms/view (NCRISC, Tracy)", "inter_program_gap": "0.007 ms", "frame_at_tip": "58.545 ms/view (iter-166)", "gpu_ref_published": "10.75 ms/view (published, not measured)"}, "timings": {}, "iter_dir": "ttw-167", "verdict": "GATE NO-GO (fuse band cull into materialize: upper bound ~1.3-1.5 ms/view < 3 ms/view bar, from post-#59 Tracy; not implemented; board yyzo-bh-07 p100a)", "ts": "2026-09-30T11:01:00-0700", "buildid": {"cpp": "no new build; reads Tracy of gsplat_tt 469b812 (task #59)", "data": ""}, "tracy": "yyzo-bh-07:/localdev/smarton/gstt2-t59/opt/profiler/t59-t59/chunks/0-10/render.tracy (zone table in tt-project/state/runs/152/t59dev.log)"}
{"iter": 168, "idea": "Task #60 (lever L3, blend tail): dynamic tile claiming in the blend program. Every core claims the next tile from one shared counter (semaphore on the first core, NoC atomic increment-and-get into a reader L1 slot); claim order = sort LPT lists interleaved by rank (approx. descending cost). Reader passes claimed tile ids to the writer (CB 13); DONE flag / 0xFFFFFFFF ends both streams. Replaces the static LPT split by padded pair count. Re-weighting the static LPT by pairs x kept microblocks was not done (mask known only after the cull, misses the transmittance early-out); splitting the blend reader over BRISC+NCRISC was not done (blend is SFPU-bound: reader zones track the SFPU time via the 2-slot bulk CB wait).", "decision": "keep", "reason": "A/B on yyzo-bh-07 (Blackhole p100a, not a p150), bicycle 30 views 1024x1024, 3 interleaved rounds in one session, base 27348a1 vs 27348a1 + 0aaefad: frame 58.165/58.224/58.096 -> 57.259/57.204/57.230 ms/view, mean 58.16 -> 57.23 (-0.93 ms/view, -1.6%), 17.19 -> 17.47 FPS. Blend bucket 20.19 -> 19.09 ms; other stages unchanged. Tracy (10 views, per-view makespan): tile_blend_sfpu 16.02 -> 14.88 ms, tile_blend_load 15.48 -> 14.05 ms. Byte-identical: all 30 --dump-views md5-identical to the base, hero_vs_ref 100.00 dB in all runs; no hang over verify + 3 A/B rounds + Tracy (unlike task #24's fetch-and-add use, the single counter here is reliable). Rebased onto 92a19bc (task #19 stage timers, host-side only, no blend files touched).", "metrics": {"board": "yyzo-bh-07 (Blackhole p100a)", "bit_identical": true, "all_30_views_identical": true, "hero_vs_ref": 100.0, "frame_ms_view": 57.231, "frame_ms_view_baseline": 58.162, "frame_delta_ms": -0.931, "fps": 17.47, "fps_baseline": 17.19, "stage_blend_ms": 19.086, "stage_blend_ms_baseline": 20.192, "tracy_tile_blend_sfpu_makespan_ms": 14.876, "tracy_tile_blend_sfpu_makespan_ms_baseline": 16.021, "ab_rounds": 3, "gpu_ref_ms_view_published": 10.75}, "timings": {"ms_view": 57.231, "project": 10.93, "tile_assign": 8.78, "sort": 14.21, "blend": 19.086}, "iter_dir": "ttw-168", "verdict": "KEEP (blend dynamic tile claiming: 58.16 -> 57.23 ms/view (-0.93, -1.6%), blend 20.19 -> 19.09 ms, 30 views byte-identical; board yyzo-bh-07 p100a)", "ts": "2026-09-30T11:50:00-0700", "buildid": {"cpp": "gsplat_tt ttp/t60 0aaefad on 27348a1", "data": ""}, "tracy": "yyzo-bh-07:/localdev/smarton/gstt2-t60/opt/profiler/t60-t60/chunks/0-10/render.tracy (base: gstt2-t60base/.../t60-t60base; zone table in tt-project/state/runs/198/t60-abtr.log)"}
{"iter": 169, "idea": "Task #75 (gather_visible, project stage): profile, then cut the RISC compute in the gather. The count pass evaluates the soft-float visibility test once per Gaussian (lazy loads, fast path for the two subtractions), double-buffers its tile reads, and writes a 1024-bit visibility mask per tile. The scatter pass walks the mask bits instead of re-running the test and skips tiles with no visible element. Host test tests/unit/test_gather_visible_mask.cpp.", "decision": "keep", "reason": "Profile (Tracy, base 92a19bc, yyzo-bh-07 Blackhole p100a, not a p150): the gather is RISC-compute-bound, not NoC-bound. The count pass reads 146 MB in 3.2 ms (45 GB/s) and spends ~115 cycles/element in the soft-float test, which ran twice (count + scatter). It is not serialized (zone mean/max 0.85-0.86). Since the cost was the duplicated test and not data movement, this task removed the duplicate first. Fusing compaction into pfwc was not tried; it is a follow-up (6.46 ms of gather remains). A/B on yyzo-bh-07, bicycle 30 views 1024x1024, 3 interleaved rounds: base 92a19bc 58.650/58.438/58.220 -> new 56.607/56.291/56.092 ms/view (mean 58.44 -> 56.33, -2.10, -3.6%). gather_wait 8.69 -> 6.46 ms. Tracy makespans: proj_count 3.29 -> 2.75 ms, proj_scatter 5.52 -> 3.78 ms (scatter is now imbalanced: mean/max 0.69). All 30 views md5-identical, hero_vs_ref 100 dB. Rebased onto 834ac4e (task #60 blend change, a separate program); the combined tip was not re-measured because the p100 lock was busy.", "metrics": {"board": "yyzo-bh-07 (Blackhole p100a)", "bit_identical": true, "all_30_views_identical": true, "hero_vs_ref": 100.0, "frame_ms_view": 56.33, "frame_ms_view_baseline": 58.44, "frame_delta_ms": -2.1, "gather_wait_ms": 6.456, "gather_wait_ms_baseline": 8.689, "proj_count_makespan_ms": 2.75, "proj_scatter_makespan_ms": 3.78, "combined_tip_measured": false}, "timings": {"ms_view": 56.33, "project": 8.73, "tile_assign": 8.93, "sort": 14.29, "blend": 20.18}, "iter_dir": "ttw-169", "verdict": "KEEP (gather_visible mask: 58.44 -> 56.33 ms/view (-2.10, -3.6%) vs base 92a19bc, gather_wait 8.69 -> 6.46 ms, 30 views byte-identical; board yyzo-bh-07 p100a; combined tip with #60 not re-measured)", "ts": "2026-09-30T12:07:00-0700", "buildid": {"cpp": "gsplat_tt ttp/t75 2ed7584 on 92a19bc (rebased as 850c01e on 834ac4e)", "data": ""}, "tracy": "yyzo-bh-07:/localdev/smarton/gstt2-t75/opt/profiler/ttw-t75-new/chunks/0-10/render.tracy (base: gstt2-t75base/.../ttw-t75-base; log tt-project/state/runs/200/t75ab.log)"}
{"iter": 170, "idea": "Task #61 step 1 (L5): pack the final 8-bit RGB image on device. The blend writer converts each tile's bf16 RGB to u8 (img_pack_u8.h, same rounding as the old host assemble) and writes it straight into a row-major 1024x1024x3 u8 image buffer, inside #60's dynamic tile-claim loop. The host bf16->fp32 assemble is deleted and the D2H read shrinks to the packed u8 image. Model test tests/spec/test_img_pack_u8.py.", "decision": "keep", "reason": "iter-162 profile: host assemble 3.30 ms + D2H 0.67 ms ran after the device, on the critical path. A/B on yyzo-bh-07 (Blackhole p100a, not a p150), bicycle 30 views 1024x1024, 3 interleaved rounds: base 834ac4e 57.248/57.104/57.219 -> new 53.422/53.440/53.333, mean 57.19 -> 53.40 ms/view (-3.80, -6.6%). assemble 3.38 -> 0.00 ms, d2h 0.55 -> 0.21 ms, head 0.19 -> 0.00 ms; blend +0.14 ms (writer does the pack). All 30 views md5-identical, hero_vs_ref 100 dB. Measured on 834ac4e (#60); rebased onto b068069 (#75, gather_visible, a separate program) without conflicts, combined tip not re-measured. Step 2 (on-device bin layout) not attempted: bin_hist_d2h+bin_layout+upload now total ~0.56 ms/view, below the 3 ms gate.", "metrics": {"board": "yyzo-bh-07 (Blackhole p100a)", "bit_identical": true, "all_30_views_identical": true, "hero_vs_ref": 100.0, "frame_ms_view": 53.4, "frame_ms_view_baseline": 57.19, "frame_delta_ms": -3.8, "assemble_ms": 0.0, "assemble_ms_baseline": 3.38, "d2h_ms": 0.21, "d2h_ms_baseline": 0.55, "combined_tip_measured": false}, "timings": {"ms_view": 53.4, "project": 10.89, "tile_assign": 8.87, "sort": 14.17, "blend": 19.19}, "iter_dir": "ttw-170", "verdict": "KEEP (device u8 image pack: 57.19 -> 53.40 ms/view (-3.80, -6.6%) vs base 834ac4e, host assemble 3.38 -> 0 ms, 30 views byte-identical; board yyzo-bh-07 p100a; combined tip with #75 not re-measured)", "ts": "2026-09-30T12:15:27-0700", "buildid": {"cpp": "gsplat_tt ttp/t61 f11f306 on 834ac4e (rebased as 8678042 on b068069)", "data": ""}, "tracy_waiver": "no Tracy captured for this A/B; builds were in a deleted worktree", "tracy": "none (A/B log tt-project/state/runs/203/t61run3.log)"}
{"iter": 171, "idea": "Re-baseline (task #77): measure combined tips b068069 (#60+#75) and 9800d99 (#60+#75+#61).", "decision": "rebaseline", "reason": "yyzo-bh-07 (Blackhole p100a, not a p150), bicycle 30 views 1024x1024. b068069: 55.40/55.13 ms/view (mean 55.26). 9800d99: 3 rounds 51.258/51.208/51.105 ms/view (mean 51.19, stdev 0.08, 19.5 FPS), matches the ~51.3 expectation. All 30 views md5-identical to the #75 dump, hero_vs_ref 100 dB. Stages at 9800d99: project 8.67, tile_assign 8.86, sort 14.20, blend 19.14, d2h 0.26.", "metrics": {"board": "yyzo-bh-07 (Blackhole p100a)", "bit_identical": true, "all_30_views_identical": true, "hero_vs_ref": 100.0, "frame_ms_view": 51.19, "frame_ms_view_stdev": 0.08, "fps": 19.54, "b068069_ms_view": 55.26, "combined_tip_measured": true}, "timings": {"ms_view": 51.19, "project": 8.67, "tile_assign": 8.86, "sort": 14.2, "blend": 19.14}, "iter_dir": "ttw-171", "run_label": "t77-r1..r3", "verdict": "REBASELINE 9800d99 = 51.19 ms/view (19.5 FPS) on yyzo-bh-07 p100a, byte-identical", "ts": "2026-09-30T12:43:10-0700", "buildid": {"cpp": "gsplat_tt 9800d99", "data": ""}, "tracy": "none (log tt-project/state/runs/219/t77b.log)"}
{"iter": 172, "idea": "Task #68: stage the per-gaussian blend coefficients in DEST slot 6. The reader supplies each gaussian's ~10 scalars as a coefficient tile, copy_tile puts them in DEST, and the TRISC1 dispatch uses SFPLOAD instead of building each scalar with runtime SFPLOADI words (knob BLEND_COEF_DEST, env GSPLAT_TT_BLEND_COEF_DEST, default 1).", "decision": "keep", "reason": "Static objdump of the blend TRISC1 ELF: the pair dispatch body was 209 RISC + 140 Tensix insns, most of it assembling SFPLOADI words at runtime; with DEST staging it is 130 native SFPU insns (99 SFPU ops, 22 loads, 8 nops). A/B on yyzo-bh-07 (Blackhole p100a, not a p150), bicycle 30 views 1024x1024, 3 interleaved rounds on the rebased tip (base bb1a75e = 9800d99 + report fixes): knob off 51.128/51.220/51.206 -> on 48.949/48.902/49.000, mean 51.18 -> 48.95 ms/view (-2.23, -4.4%). blend 19.19 -> 16.97 ms. Tracy (10 views): tile_blend_sfpu makespan 14.96 -> 12.42 ms/view. All 30 views md5-identical, hero_vs_ref 100 dB. Earlier run on 27348a1: 58.39 -> 55.69 (-2.70).", "metrics": {"board": "yyzo-bh-07 (Blackhole p100a)", "bit_identical": true, "all_30_views_identical": true, "hero_vs_ref": 100.0, "frame_ms_view": 48.95, "frame_ms_view_baseline": 51.18, "frame_delta_ms": -2.23, "fps": 20.43, "blend_ms": 16.97, "blend_ms_baseline": 19.19, "tile_blend_sfpu_makespan_ms": 12.42, "tile_blend_sfpu_makespan_ms_baseline": 14.96, "trisc1_pair_body_insns": 130, "trisc1_pair_body_insns_baseline": 349, "combined_tip_measured": true}, "timings": {"ms_view": 48.95, "project": 8.65, "tile_assign": 8.84, "sort": 14.18, "blend": 16.97}, "iter_dir": "ttw-172", "run_label": "t68-ab-1..3", "verdict": "KEEP (blend coefficients staged in DEST: 51.18 -> 48.95 ms/view (-2.23, -4.4%), 20.4 FPS, 30 views byte-identical; board yyzo-bh-07 p100a)", "ts": "2026-09-30T13:10:00-0700", "buildid": {"cpp": "gsplat_tt ttp/t68 fb402c4 on bb1a75e", "data": ""}, "tracy": "yyzo-bh-07:/localdev/smarton/gstt2-t68/opt/profiler/t68-k1/chunks/0-10/render.tracy"}
{"iter": 173, "idea": "Task #80: cut the blend per-record TRISC1 floor. (1) branchless always-inline dm_fp32::unorm16_to_f; (2) jump-table mask walk over set pairs only (ctz + runtime-filled table of out-of-line bodies, env GSPLAT_TT_BLEND_JUMP_WALK, default 1); (3) UNORM16 op/colour decoded on the SFPU (USHORT SFPLOADI + cast + fp32 multiply by fl(1/65535), env GSPLAT_TT_BLEND_SFPU_UNORM, default 1, 2 = bit-check mode).", "decision": "keep", "reason": "Floor attribution with new ablation levels on the base (blend ms): a0 16.97, walk-only a5 13.44, no-bodies a1 10.84, no decode/staging a3 6.61, no record loop a4 5.61 -> TRISC1 per-record work was the floor (walk 2.6, decode+staging 4.2, loop 1.0), reader/handshake floor 5.6. A/B on yyzo-bh-07 (Blackhole p100a, not a p150), bicycle 30 views 1024x1024, 3 interleaved rounds, base 4780373 vs 0626a2c: 48.859/48.842/48.994 -> 44.321/44.457/44.389, mean 48.90 -> 44.39 ms/view (-4.51, -9.2%). blend 16.91 -> 12.36 ms. Tracy (10 views): tile_blend_sfpu makespan 12.39 -> 7.88 ms/view. Split: branchless decode -1.4, jump walk -1.7, SFPU decode -1.4 ms blend. All 30 views md5-identical, hero_vs_ref 100 dB; SFPU-decode bit-check mode also md5-identical; exhaustive host test of unorm16_to_f passes.", "metrics": {"board": "yyzo-bh-07 (Blackhole p100a)", "bit_identical": true, "all_30_views_identical": true, "hero_vs_ref": 100.0, "frame_ms_view": 44.39, "frame_ms_view_baseline": 48.9, "frame_delta_ms": -4.51, "fps": 22.53, "blend_ms": 12.36, "blend_ms_baseline": 16.91, "tile_blend_sfpu_makespan_ms": 7.88, "tile_blend_sfpu_makespan_ms_baseline": 12.39, "blend_floor_no_record_loop_ms": 5.62, "combined_tip_measured": true}, "timings": {"ms_view": 44.39, "project": 8.65, "tile_assign": 8.86, "sort": 14.17, "blend": 12.36}, "iter_dir": "ttw-173", "run_label": "t80-ba-3..5", "verdict": "KEEP (blend per-record TRISC1 floor: 48.90 -> 44.39 ms/view (-4.51, -9.2%), 22.5 FPS, 30 views byte-identical; board yyzo-bh-07 p100a)", "ts": "2026-09-30T14:25:00-0700", "buildid": {"cpp": "gsplat_tt ttp/t80 0626a2c on 4780373", "data": ""}, "tracy": "yyzo-bh-07:/localdev/smarton/gstt2-t80b/opt/profiler/t80-a0/chunks/0-10/render.tracy"}
{"iter": 174, "idea": "Task #85: re-check the inter-program idle untraced. The tile_assign 'publish' bucket (1.33 ms/view) was the all-ones keep-mask refill (~19 MB H2D + Finish, 9-12 ms) on the 4 views where P exceeded every earlier view and the grow-only pair buffers were reallocated. Fix: allocate gid/tid/keep at max(P_pad, pair_ceiling) so the fill happens once on warmup.", "decision": "keep", "reason": "Untraced gap attribution (ms/view): proj->TA 0.21 (host result build + TA launch; traced 1.39 is profiler-inflated), K2->count pass 1.40 -> 0.07 (keep refill fixed), hist->emit ~1.35 (hist D2H 0.25 + layout 0.24 + upload 0.07 + device pull of H2D tables ~0.8), sort publish_host 0.2, blend_setup 0.03. Total ~3.4 -> ~2.0. A/B on yyzo-bh-07 (Blackhole p100a, not a p150), bicycle 30 views 1024x1024, 3 interleaved rounds, base 9cced7e: 44.6/44.5/44.8 -> 43.4/43.1/43.3, mean 44.63 -> 43.27 ms/view (-1.37, -3.1%). Worst view 61-63 -> 50 ms. All 30 views md5-identical, hero_vs_ref 100 dB. Remaining ~2.0 ms idle is under the 3 ms gate; hist->emit device prefix sum (~1.3 ms) deferred. Tracy (views 0-9): all-core idle between programs 5.57 -> 2.46 ms/view; ta_bucket_scatter->sort_bin_hist 2.56 -> 0.06.", "metrics": {"board": "yyzo-bh-07 (Blackhole p100a)", "bit_identical": true, "all_30_views_identical": true, "hero_vs_ref": 100.0, "frame_ms_view": 43.27, "frame_ms_view_baseline": 44.63, "frame_delta_ms": -1.37, "fps": 23.11, "tile_assign_ms": 7.58, "tile_assign_ms_baseline": 8.91, "max_view_ms": 50.2, "max_view_ms_baseline": 61.5, "untraced_idle_ms_after": 2.0, "combined_tip_measured": true, "traced_all_core_idle_ms": 2.46, "traced_all_core_idle_ms_baseline": 5.57}, "timings": {"ms_view": 43.27, "project": 8.69, "tile_assign": 7.58, "sort": 14.23, "blend": 12.35}, "iter_dir": "ttw-174", "run_label": "t85-ab1..3", "verdict": "KEEP (TA pair buffers pre-sized to the pair ceiling: 44.63 -> 43.27 ms/view (-1.37, -3.1%), 23.1 FPS, 30 views byte-identical; board yyzo-bh-07 p100a)", "ts": "2026-09-30T16:30:00-0700", "buildid": {"cpp": "gsplat_tt ttp/t85 on 9cced7e", "data": ""}, "tracy": "yyzo-bh-07:/localdev/smarton/gstt2-t85/opt/profiler/t85-fix/chunks/0-10/render.tracy"}
