{"iter": 102, "idea": "M3: move 32-bit microblock mask into slab word3 (dead depth key); cull writer does aligned per-batch 64B page RMW of sort_subchunk_payload word3 (strided 4B misaligned both NoC ends -> 21.85dB, page RMW -> anchor); blend reads mask from rec[3]; deleted DRAM cull_masks buffer, ensure_resident_buffers, CB_BMASK_BULK + the blend reader's cull_masks/cull_mask_base args/accessors and bulk mask load", "decision": "keep", "reason": "63.85 >= 63.6", "metrics": {"hero_vs_ref": 63.85}, "timings": {"ms_view": 98.872, "blend": 98.872}, "iter_dir": "ttw-102", "screenshot": "opt/metal-screenshots/ttw-102/hero.png", "screenshot_diff": "opt/metal-screenshots/ttw-102/hero_diff10.png", "ts": "2026-06-04T23:52:58-0700", "buildid": {"cpp": "cpp#58 63249dc iter 102: M3: move 32-bit microblock mask into slab word3 (dead depth key); cull writer does aligned per-batch 64B page RMW of sort_subchunk_payload word3 (strided 4B misaligned both NoC ends -> 21.85dB, page RMW -> anchor); blend reads mask from rec[3]; deleted DRAM cull_masks buffer, ensure_resident_buffers, CB_BMASK_BULK + the blend reader's cull_masks/cull_mask_base args/accessors and bulk mask load bin=df835eea49ff1991", "data": "data#   bin="}}
{"iter": 103, "idea": "M4a: strip dead code from cull/blend (no ABI change) \u2014 remove unused blend-reader helpers (read_soa_u32/gather/load_ids/load_mask/pack_blendrec), dead per-tile bucket_meta read in blend reader, dead CB consts (CB_MB_COEFF/CB_BUCKET/CB_BSORT/CB_BMASK in readers+compute), dead host cb_cfg (CB_MB_COEFF, blend+cull CB_BSORT), and debug scaffolding (MB_CULL_SPIN/MB_C1_PAYLOAD_DEBUG/MB_RD_ROW_SUPPRESS_DPRINT defines + dprint include)", "decision": "keep", "reason": "63.85 >= 63.6", "metrics": {"hero_vs_ref": 63.85}, "timings": {"ms_view": 98.393, "blend": 98.393}, "iter_dir": "ttw-103", "screenshot": "opt/metal-screenshots/ttw-103/hero.png", "screenshot_diff": "opt/metal-screenshots/ttw-103/hero_diff10.png", "ts": "2026-06-05T00:08:44-0700", "buildid": {"cpp": "cpp#59 2ff081b iter 103: M4a: strip dead code from cull/blend (no ABI change) \u2014 remove unused blend-reader helpers (read_soa_u32/gather/load_ids/load_mask/pack_blendrec), dead per-tile bucket_meta read in blend reader, dead CB consts (CB_MB_COEFF/CB_BUCKET/CB_BSORT/CB_BMASK in readers+compute), dead host cb_cfg (CB_MB_COEFF, blend+cull CB_BSORT), and debug scaffolding (MB_CULL_SPIN/MB_C1_PAYLOAD_DEBUG/MB_RD_ROW_SUPPRESS_DPRINT defines + dprint include) bin=81e2917b5cb8f378", "data": "data#   bin="}}
{"iter": 104, "idea": "M5: double-buffer prefetch on CULL slab load (2-slot ping-pong, slab(N+1) reads interleaved into compute-throttled emit(N) via metadata pre-pass)", "decision": "keep", "reason": "63.85 >= 63.6", "metrics": {"hero_vs_ref": 63.85}, "timings": {"ms_view": 98.845, "blend": 98.845}, "iter_dir": "ttw-104", "screenshot": "opt/metal-screenshots/ttw-104/hero.png", "screenshot_diff": "opt/metal-screenshots/ttw-104/hero_diff10.png", "ts": "2026-06-05T00:45:46-0700", "buildid": {"cpp": "cpp#60 dbfae46 iter 104: M5: double-buffer prefetch on CULL slab load (2-slot ping-pong, slab(N+1) reads interleaved into compute-throttled emit(N) via metadata pre-pass) bin=d1b5e248b1e9dd4b", "data": "data#   bin="}}
{"iter": 105, "idea": "M5: cull double-buffer prefetch (slim: drop dead synchronous fallback so the larger kernel + profiler fits the Tensix config buffer; MAX_WORK=2048)", "decision": "keep", "reason": "63.85 >= 63.6", "metrics": {"hero_vs_ref": 63.85}, "timings": {"ms_view": 98.882, "blend": 98.882}, "iter_dir": "ttw-105", "screenshot": "opt/metal-screenshots/ttw-105/hero.png", "screenshot_diff": "opt/metal-screenshots/ttw-105/hero_diff10.png", "ts": "2026-06-05T00:55:46-0700", "buildid": {"cpp": "cpp#61 4b295b6 iter 105: M5: cull double-buffer prefetch (slim: drop dead synchronous fallback so the larger kernel + profiler fits the Tensix config buffer; MAX_WORK=2048) bin=9882b686d48b9e6e", "data": "data#   bin="}}
{"iter": 106, "idea": "M5: REVERT cull double-buffer prefetch (iters 104-105) to baseline. Tracy proof: tile_l1_cull_rd (NCRISC reader) 27.46ms == tile_mb_mask (TRISC SFPU) 27.47ms -> cull stage already ALU/SFPU-co-limited and fully overlapped; reader is busy-bound (issues every slab read + emits every coeff row + per-gaussian logf), not stall-bound, so double-buffer cannot lower it. Same for blend (reader 12.33 <= SFPU 13.08). Restores 98.4ms baseline.", "decision": "keep", "reason": "63.85 >= 63.6", "metrics": {"hero_vs_ref": 63.85}, "timings": {"ms_view": 98.242, "blend": 98.242}, "iter_dir": "ttw-106", "screenshot": "opt/metal-screenshots/ttw-106/hero.png", "screenshot_diff": "opt/metal-screenshots/ttw-106/hero_diff10.png", "ts": "2026-06-05T01:02:02-0700", "buildid": {"cpp": "cpp#62 a0e5989 iter 106: M5: REVERT cull double-buffer prefetch (iters 104-105) to baseline. Tracy proof: tile_l1_cull_rd (NCRISC reader) 27.46ms == tile_mb_mask (TRISC SFPU) 27.47ms -> cull stage already ALU/SFPU-co-limited and fully overlapped; reader is busy-bound (issues every slab read + emits every coeff row + per-gaussian logf), not stall-bound, so double-buffer cannot lower it. Same for blend (reader 12.33 <= SFPU 13.08). Restores 98.4ms baseline. bin=81e2917b5cb8f378", "data": "data#   bin="}}
{"iter": 107, "idea": "M5: blend transmittance saturation early-out (per-microblock T<eps skip via tile_regs_commit handshake + non-zeroing release; runtime knobs BLEND_T_EPS=1/256, BLEND_T_PERIOD=512 with 0=off). 244.7ms@63.95dB vs 246@63.85 baseline; blend SFPU -7%.", "decision": "keep", "reason": "63.95 >= 63.6", "metrics": {"hero_vs_ref": 63.95}, "timings": {"ms_view": 245.013, "blend": 245.013}, "iter_dir": "ttw-107", "screenshot": "opt/metal-screenshots/ttw-107/hero.png", "screenshot_diff": "opt/metal-screenshots/ttw-107/hero_diff10.png", "ts": "2026-06-05T10:12:20-0700", "buildid": {"cpp": "cpp#72 a7da175 iter 107: M5: blend transmittance saturation early-out (per-microblock T<eps skip via tile_regs_commit handshake + non-zeroing release; runtime knobs BLEND_T_EPS=1/256, BLEND_T_PERIOD=512 with 0=off). 244.7ms@63.95dB vs 246@63.85 baseline; blend SFPU -7%. bin=c51ef96074fdc8b4", "data": "data#   bin="}}
{"iter": 108, "idea": "cull thr on SFPU (hw log_no_init); drop NCRISC per-pair soft-float logf", "decision": "keep", "reason": "63.74 >= 40.0", "metrics": {"hero_vs_ref": 63.74}, "timings": {"ms_view": 244.371, "blend": 244.371}, "iter_dir": "ttw-108", "screenshot": "opt/metal-screenshots/ttw-108/hero.png", "screenshot_diff": "opt/metal-screenshots/ttw-108/hero_diff10.png", "ts": "2026-06-05T13:19:41-0700", "buildid": {"cpp": "cpp#73 b69639a iter 108: cull thr on SFPU (hw log_no_init); drop NCRISC per-pair soft-float logf bin=c869c429114d038d", "data": "data#   bin="}}
{"iter": 109, "idea": "cull bulk L1 slab hand-off (mirror blend reader): delete per-record CB_CULL_COEFF stream, compute reads records straight from bulk CB_BUCKET slab", "decision": "keep", "reason": "63.74 >= 63.6", "metrics": {"hero_vs_ref": 63.74}, "timings": {"ms_view": 196.861, "blend": 196.861}, "iter_dir": "ttw-109", "screenshot": "opt/metal-screenshots/ttw-109/hero.png", "screenshot_diff": "opt/metal-screenshots/ttw-109/hero_diff10.png", "ts": "2026-06-05T13:44:32-0700", "buildid": {"cpp": "cpp#75 5a290f8 iter 109: cull bulk L1 slab hand-off (mirror blend reader): delete per-record CB_CULL_COEFF stream, compute reads records straight from bulk CB_BUCKET slab bin=68350c1d541f9678", "data": "data#   bin="}}
{"iter": 110, "idea": "A2: coalesce per-subchunk slab load into ceil(L/64) large 2048B-page NoC transfers (was ~4096 64B interleaved reads/subchunk); slab now uses LARGE DRAM interleave page across host sizing + dir + materialize + both readers + mask writer (l1_splat_words unchanged). Root-caused the 16.09dB false-fail to a STALE reference _gsplat_cpu.so (old 64B host + new 2048B JIT kernels); rebuilt it -> hero_vs_ref=63.95dB.", "decision": "keep", "reason": "63.95 >= 60.0", "metrics": {"hero_vs_ref": 63.95}, "timings": {"ms_view": 194.749, "blend": 194.749}, "iter_dir": "ttw-110", "screenshot": "opt/metal-screenshots/ttw-110/hero.png", "screenshot_diff": "opt/metal-screenshots/ttw-110/hero_diff10.png", "ts": "2026-06-06T11:04:15-0700", "buildid": {"cpp": "cpp#78 708168f iter 110: A2: coalesce per-subchunk slab load into one large/contiguous NoC transfer (was ~4096 64B interleaved page reads/subchunk; transaction-issue-bound) bin=6286bdd97c80f8b9", "data": "data#   bin="}}
{"iter": 111, "idea": "A1: hoist conic (cov->A,B,C) into pfwc; delete per-microblock det/recip/A/B/C recompute in blend; rewrite cull in conic space; invert conic->cov at the cpu_cpp_mb device->host readback boundary so the reference's CPU cull/blend stay raw-cov. Attacks SFPU wall (tile_blend_sfpu ~291k ms).", "decision": "keep", "reason": "63.95 >= 60.0", "metrics": {"hero_vs_ref": 63.95}, "timings": {"ms_view": 192.303, "blend": 192.303}, "iter_dir": "ttw-111", "screenshot": "opt/metal-screenshots/ttw-111/hero.png", "screenshot_diff": "opt/metal-screenshots/ttw-111/hero_diff10.png", "ts": "2026-06-06T12:05:55-0700", "buildid": {"cpp": "cpp#80 04c8992 iter 111: A1: hoist conic (cov->A,B,C) into pfwc; delete per-microblock det/recip/A/B/C recompute in blend; rewrite cull in conic space; invert conic->cov at the cpu_cpp_mb device->host readback boundary so the reference's CPU cull/blend stay raw-cov. Attacks SFPU wall (tile_blend_sfpu ~291k ms). bin=665234a6034eca2b", "data": "data#   bin="}}
{"iter": 112, "idea": "Track 1: phase blend dispatch (power/exp/alpha/RGBT) in chunks of ~4 microblocks for SFPU ILP", "decision": "keep", "reason": "63.95 >= 60.0", "metrics": {"hero_vs_ref": 63.95}, "timings": {"ms_view": 206.809, "blend": 206.809}, "iter_dir": "ttw-112", "screenshot": "opt/metal-screenshots/ttw-112/hero.png", "screenshot_diff": "opt/metal-screenshots/ttw-112/hero_diff10.png", "ts": "2026-06-11T01:33:03-0700", "buildid": {"cpp": "cpp#81 b46ef22 iter 112: Track 1: phase blend dispatch (power/exp/alpha/RGBT) in chunks of ~4 microblocks for SFPU ILP bin=26899b1c1b9c1a84", "data": "data#   bin="}, "tracy": "opt/profiler/ttw-112/render.tracy"}
{"iter": 113, "idea": "Sort Stage 1: delete materialize DRAM scatter for in-budget tiles (in-place L1 permute + emit)", "decision": "keep", "reason": "63.95 >= 50.0", "metrics": {"hero_vs_ref": 63.95}, "timings": {"ms_view": 207.524, "blend": 207.524}, "iter_dir": "ttw-113", "screenshot": "opt/metal-screenshots/ttw-113/hero.png", "screenshot_diff": "opt/metal-screenshots/ttw-113/hero_diff10.png", "ts": "2026-06-11T01:46:56-0700", "buildid": {"cpp": "cpp#82 d33d3da iter 113: Sort Stage 1: delete materialize DRAM scatter for in-budget tiles (in-place L1 permute + emit) bin=25c03b1a2df09b00", "data": "data#   bin="}, "tracy": "opt/profiler/ttw-113/render.tracy"}
{"iter": 114, "idea": "Sort Stage 2: blendrec[g] read once per gaussian in the bucket fill (kills the random per-pair re-read); sort reads its tile bucket coalesced (materialize in-place L1 permute, iter 113)", "decision": "keep", "reason": "63.95 >= 50.0", "metrics": {"hero_vs_ref": 63.95}, "timings": {"ms_view": 211.775, "blend": 211.775}, "iter_dir": "ttw-114", "tracy": "opt/profiler/ttw-114/render.tracy", "screenshot": "opt/metal-screenshots/ttw-114/hero.png", "screenshot_diff": "opt/metal-screenshots/ttw-114/hero_diff10.png", "ts": "2026-06-11T02:03:12-0700", "buildid": {"cpp": "cpp#83 7f71e2c iter 114: Sort Stage 2: blendrec[g] read once per gaussian in the bucket fill (kills the random per-pair re-read); sort reads its tile bucket coalesced (materialize in-place L1 permute, iter 113) bin=51cd210056487289", "data": "data#   bin="}}
{"iter": 115, "idea": "Track 2 DIAGNOSTIC: ablate blend phasing (iter-112 Track 1) on yyzo-bh-07 \u2014 phased HEAD vs a bit-identical UNPHASED reconstruction, 30-view tile_blend_sfpu makespan", "decision": "blocked", "reason": "DIAGNOSTIC (no frame kept). Track 1 phasing REGRESSED blend +11.47 ms/view (+33.6%): phased=45.58 vs unphased=34.11 ms/view, BIT-IDENTICAL pixels (hero md5 e3fefb11 == for both). Fan-out K~=1 => no cross-microblock ILP to expose; phasing adds 4x mask-scan traversal + DR_SCR spill overhead with zero payoff. exp removal saves ~0 (noexp-on-phased 47.10 ~= phased 45.58) => blend still dependency-stall-bound, NOT throughput-bound; cheaper exp will not help. RECOMMEND: revert Track 1 (iter 112) to recover ~11.5 ms/view; run Track 3 per-gaussian microblock fan-out histogram next. Device kernel restored to pristine HEAD (md5 verified).", "metrics": {"blend_phased_ms_view": 45.58, "blend_unphased_ms_view": 34.11, "blend_noexp_phased_ms_view": 47.1, "blend_reader_floor_ms_view": 0.63, "blend_sfpu_floor_stale_ms_view": 61.01}, "notes": "tile_blend_sfpu ms/view: phased=45.58 | unphased=34.11 (bit-identical, +33.6% faster) | noexp_phased=47.10 | nomath(reader floor)=0.63 | noread(sfpu floor, stale)=61.01. 30-view avg_frame_ms: phased=231.5, unphased=220.1. Harness: opt/prof/prof_ablation_phasing.sh. Device yyzo-bh-07, HEAD aba575c.", "iter_dir": "ttw-115", "ts": "2026-06-11T02:20:15-0700", "buildid": {"cpp": "diagnostic#0 ablation-only (no build) on cpp#83 7f71e2c iter 114 (HEAD aba575c, phased kernel); device kernel restored to pristine bin=51cd210056487289", "data": "data#   bin="}}
{"iter": 116, "idea": "Revert Track 1 (iter-112) blend phasing \u2014 measured pure regression (+11.5 ms/view, bit-identical pixels per iter-115 ablation); restore the per-microblock full-chain (power->exp->alpha->RGBT) blend dispatch", "decision": "keep", "reason": "63.95 >= 50.0", "metrics": {"hero_vs_ref": 63.95}, "timings": {"ms_view": 195.538, "blend": 195.538}, "iter_dir": "ttw-116", "screenshot": "opt/metal-screenshots/ttw-116/hero.png", "screenshot_diff": "opt/metal-screenshots/ttw-116/hero_diff10.png", "ts": "2026-06-11T02:29:22-0700", "buildid": {"cpp": "cpp#84 97c3031 iter 116: Revert Track 1 (iter-112) blend phasing \u2014 measured pure regression (+11.5 ms/view, bit-identical pixels per iter-115 ablation); restore the per-microblock full-chain (power->exp->alpha->RGBT) blend dispatch bin=3a2363748913a4e2", "data": "data#   bin="}, "tracy": "opt/profiler/ttw-116/render.tracy"}
{"iter": 117, "idea": "Track 3 DIAGNOSTIC: per-gaussian microblock fan-out histogram (K = popcount of the cull microblock mask rec[3]) over the 30-view set, to test the iter-115 'K~=1' premise behind the blend-phasing regression", "decision": "blocked", "reason": "DIAGNOSTIC (no frame kept). REFUTES iter-115's 'fan-out K~=1' inference: measured over 95,400,748 gaussian-records (30 views, all blend cores, DPRINT of popcount(rec[3]) on the MATH thread), mean K>=3.27 (K5+ counted as exactly 5, true mean higher), median K=4; 85.4% of gaussians cover >=2 microblocks. So the per-microblock axis is NOT dead for ILP -- there ARE many independent microblock chains per gaussian. The iter-112 phasing still regressed (+11.5ms/view, correctly reverted in iter 116) but NOT because K~=1; the cause is the phasing IMPLEMENTATION overhead: each of the 4 phases recurses the full 32-microblock dispatch (4x mask-scan traversal/gaussian) AND spills each microblock intermediate to DR_SCR and reloads it between phases. Combined with the earlier ablation (noexp~=phased => blend is dependency-STALL/data-movement-bound, NOT SFPU-op-throughput-bound), exposing ILP did not help because the bottleneck is not op latency. Device kernel restored to pristine HEAD (md5 9d9c842680fbd883d1d7791be7ed6eab == Mac HEAD); instrumentation NOT committed.", "metrics": {"fanout_total_records": 95400748, "fanout_K0_pct": 4.8, "fanout_K1_pct": 9.7, "fanout_K2_pct": 23.7, "fanout_K3_pct": 11.6, "fanout_K4_pct": 16.2, "fanout_K5plus_pct": 34.1, "fanout_mean_K_lowerbound": 3.267, "fanout_median_K": 4}, "notes": "K-histogram (count | pct of 95,400,748): K=0 4,605,826 (4.8%) | K=1 9,281,584 (9.7%) | K=2 22,573,782 (23.7%) | K=3 11,034,449 (11.6%) | K=4 15,409,619 (16.2%) | K=5+ 32,495,488 (34.1%). per-view records ~3.18M matches SORT P_kept. Method: temporary DPRINT instrumentation in alpha_blend_compute_mb.cpp (TRISC_MATH counts popcount(rec[3]) per gaussian, prints per-core per-frame), TT_METAL_DPRINT_CORES=all, 30-view render_clean --no-ref on yyzo-bh-07 (HEAD b3238da). VERDICT: K is meaningfully >1 (median 4) -> microblock ILP is viable in principle; the blend-phasing loss was implementation overhead (4x mask traversal + DR_SCR spill), not absence of fan-out. RECOMMENDED next lever: (a) if pursuing microblock ILP, a SINGLE mask-scan that compacts covered microblocks into a list then phases across them WITHOUT DR_SCR spill (keep intermediates in distinct DEST slots); (b) batch-B independent gaussians' exp+quadratic then the short serial T/color recurrence -- still valid, but NO LONGER the only lever. Blend remains stall/data-movement-bound (cheaper exp won't help), so attack data movement / dependency stalls over raw SFPU throughput.", "iter_dir": "ttw-117", "ts": "2026-06-11T02:40:00-0700", "buildid": {"cpp": "diagnostic#0 instrumentation-only (DPRINT fan-out histogram, NOT committed) on cpp#84 b3238da iter 116 (reverted/unphased kernel); device kernel restored to pristine bin=3a2363748913a4e2", "data": "data#   bin="}}
{"iter": 118, "idea": "Blend Track 1b: CHEAP microblock ILP \u2014 single mask-scan compacts covered microblocks into adjacent pairs; C=2 stage-interleaved dependent chain (power/exp/alpha/RGBT issued across BOTH independent microblocks) hides SFPU op-latency stalls, with NO DR_SCR spill (every intermediate stays LREG-resident; per-pair fallback to the single-chain form when only one of the pair is covered, so no wasted SFPU work).", "decision": "keep", "reason": "63.95 >= 50.0 BIT-IDENTICAL (hero md5 e3fefb11); blend SFPU zone makespan 34.11 -> 29.65 ms/view (-4.46 / -13.1%); frame ms_view flat within noise (195.51 avg ~= 195.54 baseline).", "metrics": {"hero_vs_ref": 63.95, "blend_sfpu_ms_view": 29.65, "blend_sfpu_baseline_ms_view": 34.11, "blend_load_ms_view": 28.97}, "timings": {"ms_view": 195.506, "blend": 195.506}, "iter_dir": "ttw-118", "tracy": "opt/profiler/ttw-118/render.tracy", "screenshot": "opt/metal-screenshots/ttw-118/hero.png", "screenshot_diff": "opt/metal-screenshots/ttw-118/hero_diff10.png", "notes": "CHEAP microblock ILP, the iter-117-recommended lever. The blend was iter-115 dependency-STALL-bound (op latency on the per-microblock power->exp->alpha->at->RGBT recurrence), and iter-117 measured median fan-out K=4 (85.4% of gaussians cover >=2 microblocks), so the cross-microblock ILP axis is alive. We expose it CHEAPLY (the iter-112 phasing regressed +11.5 ms/view because it re-scanned the 32-bit mask 4x AND spilled every intermediate through DR_SCR between phases): (1) SINGLE mask-scan -- dispatch_blend_pairs walks the live mask ONCE, two bits per step; (2) for a covered PAIR, blend_pair_gaussian_math<A,B> issues the two INDEPENDENT microblock chains STAGE-INTERLEAVED (power for both, exp for both, alpha for both, at/RGB/T for both) so each microblock's SFPU latency bubble is filled by the other's ops; (3) NO spill -- all intermediates are vFloat LREGs, per-gaussian coeffs re-materialized per stage via as_float (cheap SFPLOADI immediate, no DEST traffic) to keep peak LREG pressure low; vec_min_max writes BOTH args so each chain uses its own zero/clamp const. C=2 chosen to fit the LREG budget with zero spill (the DEST-budget caveat). Pairs with only one covered microblock fall back to the single full-chain form (no wasted SFPU work, no penalty vs the old per-microblock dispatch). RESULT: tile_blend_sfpu makespan 34.11 -> 29.65 ms/view (-13.1%), measured by the iter-115 clustering method on the 30-view device profiler CSV (drop warmup view, FREQ=1350MHz). Output BIT-IDENTICAL: hero md5 e3fefb116d860f99d92bba1ef51d820c == the canonical e3fefb11 anchor, hero_vs_ref 63.95 == iter-116 baseline, across two independent 30-view runs (ms_view 196.02 and 194.99 -> mean 195.51, straddling the 195.54 frame baseline -> frame time statistically flat). Reordering ops across the two INDEPENDENT microblock accumulators (distinct DEST vectors) cannot change any per-microblock result, hence bit-exact -- confirms no DEST-slot collision / accumulator aliasing. Frame ms_view did not drop by the full 4.46 ms because blend SFPU (~30 ms) is not the frame critical path (the 196 ms frame is dominated by host/sort serialization -- SORT total alone ~55 ms), but the targeted blend-zone stall cost fell 13% with zero added overhead -- a real, design-advancing step (cheap microblock ILP validated; refutes that ILP needs phasing/spill). Device yyzo-bh-07, cpp#85 b6d1e03 bin=e447f26c64546156. NEXT LEVER: blend is no longer the only frame cost -- attack the host/SORT serialization (publish ~10.6 ms/view, bin ~44 ms/view) and the proj/gather scatter; on the blend itself, try widening to C=3 IF the LREG budget holds without spill (validate no DEST spill), and pair microblocks by spatial adjacency (current pairing is consecutive vector index) to raise the both-covered hit rate.", "ts": "2026-06-11T03:01:08-0700", "buildid": {"cpp": "cpp#85 b6d1e03 iter 118: cheap microblock ILP (C=2 pair-interleave, single mask-scan, no DR_SCR spill) bin=e447f26c64546156", "data": "data#   bin="}}
