{"iter": 175, "idea": "Task #90 (continues #86): 2 KB DRAM pages for the 32 B record buckets (materialize reads a bucket in 2 KB NoC reads, was one per 2 records), and the band-extent SFPU cull fused into the sort_subchunk_mat program: each mover transposes its depth-sorted L1 slab into coefficient tiles on its own CB stream, one compute kernel serves both streams in arrival order (UNPACK polls, mailbox to MATH/PACK), the mask is patched into word3 before the slab's single DRAM write. The separate tile_l1_cull program (slab read + write-back + launch) is gone. GSPLAT_TT_SPLIT_BLEND=1 splits the host blend timer into mat/cull/blend (absorbs #87).", "decision": "keep", "reason": "A/B on yyzo-bh-07 (Blackhole p100a, not a p150), bicycle 30 views 1024x1024, untraced, interleaved rounds: base a5f2bd6 43.27/43.20/43.20/43.02 (mean 43.17); + 2 KB pages (FUSE=0) 42.18/41.96/41.98/41.99 (42.03, -1.14); + fused mat+cull 41.31/41.39/41.34/41.57 (41.40, -1.77 total, -4.1%). Split timers: mat 2.51 + cull 1.34 ms -> fused 3.24-3.27 ms; blend alone 7.6 ms. All 30 views md5-identical in every run, hero_vs_ref 100 dB. The fused window is ~0.75 ms longer than mat alone because the movers wait for the SFPU during the permute; folding the coefficient fill into the permute and depth 4 did not change it.", "metrics": {"board": "yyzo-bh-07 (Blackhole p100a)", "bit_identical": true, "all_30_views_identical": true, "hero_vs_ref": 100.0, "frame_ms_view": 41.4, "frame_ms_view_baseline": 43.17, "frame_delta_ms": -1.77, "fps": 24.15, "frame_ms_view_2kb_pages_only": 42.03, "split_mat_ms_nofuse": 2.51, "split_cull_ms_nofuse": 1.34, "split_matcull_ms_fused": 3.25, "split_blend_ms": 7.58, "combined_tip_measured": true}, "timings": {"ms_view": 41.4, "project": 8.68, "tile_assign": 7.57, "sort": 14.2, "blend": 10.66}, "iter_dir": "ttw-175", "run_label": "t90r1..r7", "verdict": "KEEP (2 KB record pages + SFPU cull fused into sort_subchunk_mat: 43.17 -> 41.40 ms/view (-1.77, -4.1%), 24.2 FPS, 30 views byte-identical; board yyzo-bh-07 p100a)", "ts": "2026-10-01T01:35:00-0700", "buildid": {"cpp": "gsplat_tt ttp/t90 on d17df77 (fed6c28; measured as eac0ded pre-rebase)", "data": ""}}
{"iter": 176, "idea": "Task #102 (lever 2, prep #99): the visibility predicate and the tile_assign rectangle run on the SFPU inside pfwc (PFWC_VIS). pfwc emits the tpg/aabb word tiles, the visibility mask and per-tile counts. proj_count, ta_gauss_aabb, the three TA scan programs and their Finish are removed. gather_vis_scan + gather_vis_scatter compact with a balanced cut, and tile_assign runs K2 only (TA_K2_AABB). GSPLAT_TT_SFPU_VIS now defaults to 1; 0 is the kill switch.", "decision": "keep", "reason": "A/B on yyzo-bh-07 (Blackhole p100a, not a p150), bicycle 30 views 1024x1024, untraced, 3 interleaved rounds. Base 08f9200: 41.37/41.51/41.39 (mean 41.42). Vis: 32.58/32.63/32.62 (mean 32.61, -8.81, -21.3%). project 8.69 -> 6.02 and tile_assign 7.57 -> 1.44; sort and blend unchanged. VIS-CHECK (mode 2): 62 OK, 0 mismatches. All 90 candidate views and the variants are md5-identical, hero_vs_ref 100 dB. The variants nobal / w8 / w64 / notau all land at 32.56-32.72, so the balanced cut is worth <=0.1 ms and SFPMAD is RNE here. Tracy: proj_scatter balance is 0.67 (max 2.92 vs mean 1.96 ms), with the slow RISCs clustered by location (NoC/DRAM). Inter-program idle is 2.40 ms/view. Device build fixes: the PFWC_VIS program was 83 KB, over the 70.6 KB kernel config buffer, so the vis body is now instantiated for 16 vectors and run twice (66 KB now, ~4 KB headroom). The rebased tip 40c629d measured 32.62, md5-identical.", "metrics": {"board": "yyzo-bh-07 (Blackhole p100a)", "bit_identical": true, "all_30_views_identical": true, "hero_vs_ref": 100.0, "frame_ms_view": 32.61, "frame_ms_view_baseline": 41.42, "frame_delta_ms": -8.81, "fps": 30.67, "project_ms": 6.02, "project_ms_baseline": 8.69, "tile_assign_ms": 1.44, "tile_assign_ms_baseline": 7.57, "vis_check_mismatches": 0, "vis_nobal_ms": 32.72, "vis_w8_ms": 32.56, "vis_w64_ms": 32.57, "vis_notau_ms": 32.62, "traced_inter_program_idle_ms": 2.4, "proj_scatter_balance": 0.67, "combined_tip_measured": true, "gpu_ref_ms_view_published": 10.75}, "timings": {"ms_view": 32.61, "project": 6.02, "tile_assign": 1.44, "sort": 14.23, "blend": 10.67}, "iter_dir": "ttw-176", "run_label": "t99r1..r7", "verdict": "KEEP (lever 2: SFPU visibility + tile rectangle in pfwc, proj_count/ta_gauss_aabb/TA scans removed: 41.42 -> 32.61 ms/view (-8.81, -21.3%), 30.7 FPS, 30 views byte-identical; board yyzo-bh-07 p100a)", "ts": "2026-10-01T12:00:00-0700", "buildid": {"cpp": "gsplat_tt ttp/t102 on abc2840 (40c629d; A/B measured as ec1d90c pre-rebase)", "data": ""}, "tracy": "yyzo-bh-07:/localdev/smarton/gstt2-t99/opt/profiler/t102-vis/chunks/0-10/render.tracy"}
{"iter": 177, "idea": "Task #100: sort_bucket_emit rewrite. Pair pages and blendrec reads batched 8 per barrier and double-buffered (GSPLAT_TT_EMIT_PB), records staged in per-tile L1 runs and written coalesced (GSPLAT_TT_EMIT_RING), the gather publishes packed op/color words and the depth key so the emit drops the packoc writes, depth reads and most of pack_invariants (GSPLAT_TT_EMIT_PUBOC), slim pack_rec. Defaults PB=8, RING=8, PUBOC=1; PB=1 RING=0 PUBOC=0 is the legacy kill switch. Also review #103 hardening.", "decision": "keep", "reason": "Interleaved A/B on yyzo-bh-07 (Blackhole p100a, not a p150), bicycle 30 views 1024x1024, untraced, 3 rounds, order rotated. Base (knobs legacy) 32.84; pb 32.32 (-0.52); ring 32.18 (-0.66); puboc 31.07 (-1.77); pb+ring 31.50 (-1.34); all 29.59 (-3.25, -9.9%); all4 29.64. Steps compound: -2.95 summed alone, -3.25 together. bin_emit 8.94 -> 5.29 ms; PUBOC moves ~0.43 ms of packing into the gather. All 21 A/B runs md5-identical, hero_vs_ref 100 dB. Default-on confirm at 31838f2: 29.64 ms/view, md5-identical; legacy kill switch 32.80, md5-identical.", "metrics": {"board": "yyzo-bh-07 (Blackhole p100a)", "bit_identical": true, "all_30_views_identical": true, "hero_vs_ref": 100.0, "frame_ms_view": 29.59, "frame_ms_view_baseline": 32.84, "frame_delta_ms": -3.25, "fps": 33.8, "bin_emit_ms": 5.29, "bin_emit_ms_baseline": 8.94, "step_pb_ms": 32.32, "step_ring_ms": 32.18, "step_puboc_ms": 31.07, "step_pbring_ms": 31.5, "step_all4_ms": 29.64, "default_on_confirm_ms": 29.64, "combined_tip_measured": true, "gpu_ref_ms_view_published": 10.75}, "timings": {"ms_view": 29.59, "project": 6.46, "tile_assign": 1.44, "sort": 10.68, "blend": 10.7}, "iter_dir": "ttw-177", "run_label": "t100r1..r4", "verdict": "KEEP (emit rewrite: batched pair/blendrec reads, coalesced per-tile record runs, gather-published op/color/depth, slim pack_rec: 32.84 -> 29.59 ms/view (-3.25, -9.9%), 33.8 FPS, 30 views byte-identical; board yyzo-bh-07 p100a)", "ts": "2026-10-01T14:00:00-0700", "buildid": {"cpp": "gsplat_tt ttp/t100 31838f2 (A/B measured as c4dc7e2 with env knobs)", "data": ""}, "tracy": ""}
{"iter": 178, "idea": "Task #121 (lever A): one-launch sort v2 made the default. One program counts, prefixes (semaphore barriers) and emits records into per-tile DRAM buckets with #100's batched pair pages, per-tile record rings and gather-published op/color/depth (code from #124/#137/#138: 2e30c29, 3a3fa83, 68aa90b); the materialize sorts every tile. This replaces bin_hist + the host hist->emit bridge + emit + per-tile radix + publish. GSPLAT_TT_SORT_ONELAUNCH=0 is the kill switch back to the legacy sort. GSPLAT_TT_OL_MAT_SELECT (split big-tile items, select_ranks) now defaults to 0.", "decision": "keep", "reason": "Interleaved A/B on yyzo-bh-07 (Blackhole p100a, not a p150), bicycle 30 views 1024x1024, untraced, 3 rounds, order rotated: legacy 29.549, one-launch v2 24.597 (-4.95, -16.8%). Default confirm at 090fa37, 3 rotated rounds: default (select on) 24.693, select off 24.548 (faster in every round), legacy kill switch 29.637. Final default at 4e82912 (select off): 24.483 / 24.620 / 24.524 back-to-back, no hang. All 26 thirty-view runs md5-identical, hero_vs_ref 100 dB, ONELAUNCH_CHECK bad_tiles=0, watcher clean. CB total 1,032,192 B of 1,461,760 B usable L1. Tracy: sort span 10.51 -> 4.67 ms (emit busiest core 4.04 ms), materialize 3.17 -> 3.77 ms, device span 29.45 -> 24.82 ms; materialize now set by NCRISC whole-tile load imbalance (busiest 1.2-1.4x mean), not by big-tile items.", "metrics": {"board": "yyzo-bh-07 (Blackhole p100a)", "bit_identical": true, "all_30_views_identical": true, "hero_vs_ref": 100.0, "frame_ms_view": 24.54, "frame_ms_view_baseline": 29.55, "frame_delta_ms": -5.01, "fps": 40.7, "ab_onelaunch_ms": 24.6, "ab_legacy_ms": 29.55, "confirm_select_on_ms": 24.69, "confirm_select_off_ms": 24.55, "confirm_legacy_kill_switch_ms": 29.64, "default_on_confirm_ms": 24.54, "sort_stage_ms": 5.13, "sort_stage_ms_baseline": 10.68, "sort_ol_emit_makespan_ms": 4.04, "sort_ol_window_ms": 4.67, "mat_window_ms": 3.77, "mat_window_ms_baseline": 3.17, "device_span_traced_ms": 24.82, "device_span_traced_ms_baseline": 29.45, "cb_bytes_total": 1032192, "l1_usable_bytes": 1461760, "combined_tip_measured": true, "gpu_ref_ms_view_published": 10.75}, "timings": {"ms_view": 24.54, "project": 6.45, "tile_assign": 1.44, "sort": 5.14, "blend": 11.27}, "iter_dir": "ttw-178", "run_label": "t124r1..r3, t124rd1..d3, t124rf", "verdict": "KEEP (one-launch sort v2 default: 29.55 -> 24.54 ms/view (-5.01, -17.0%), 40.7 FPS, 30 views byte-identical; board yyzo-bh-07 p100a)", "ts": "2026-10-04T11:22:00-0700", "buildid": {"cpp": "gsplat_tt ttp/t121 4e82912 (A/B measured as 0f0c365 with GSPLAT_TT_SORT_ONELAUNCH=1; confirm at 090fa37)", "data": ""}, "tracy": ""}
{"iter": 179, "idea": "Task #122 (lever B, code prep #125: ba1d0f6, ebd084c, af3cffc): the pfwc writer also compacts the visible gaussians into per-core segments (proj_m_depth, the 64 B blend record, offs, aabb) and the tile_assign segment K2 builds the pairs from them, so gather_vis_scan, gather_vis_scatter and the TA vis K2 no longer run. Tuning in #122: the UNORM16 opacity/color packs (record words 10/11) are built once per scene on the host (GSPLAT_TT_PUBOC_PRE, default 1, 0 = kill switch) and copied by the fused writer and the legacy scatter; the fused copy loop loads ahead of its stores; records are staged bank-major and written as one NoC write per DRAM bank per 16 records. GSPLAT_TT_PFWC_FUSE now defaults to 1 with GSPLAT_TT_SFPU_VIS=1; 0 is the kill switch.", "decision": "keep", "reason": "A/B on yyzo-bh-07 (Blackhole p100a, not a p150), bicycle 30 views 1024x1024, untraced. The #125 code as written was slower than its base: 30.9 vs 29.65 ms/view (Tracy: fused pfwc 7.45 ms, writer-bound). Compile-time ablations (GSPLAT_TT_FUSE_ABL) put ~3.7 ms on the per-gaussian UNORM16 packs and ~0.7 ms on per-record NoC writes; with all record work skipped pfwc+K2 is 4.07 ms. Fixes, pfwc+K2 (gather_wait): 9.71 -> 5.77 (host packs) -> 4.91 (loads ahead) -> 4.44 (bank-grouped writes). On the lever-2 base before lever A, 3 paired rounds: 29.47 -> 26.35 (-3.12). After rebasing onto lever A (2b406a0), 2 interleaved rounds: lever A alone (GSPLAT_TT_PFWC_FUSE=0) 24.36 / 24.62, A+B default 21.22 / 21.27 (24.49 -> 21.25, -3.24, -13.2%); paired gains 3.02-3.34, median 3.14. project 6.32 -> 4.58 ms, tile_assign 1.44 -> 0.01 ms; sort and blend unchanged. Every 30-view run md5-identical to md5-r82new.txt, hero_vs_ref 100 dB, no TT_THROW/TT_FATAL. The host packs also speed the legacy path by ~0.3 ms (gather_wait 3.89 -> 3.64).", "metrics": {"board": "yyzo-bh-07 (Blackhole p100a)", "bit_identical": true, "all_30_views_identical": true, "hero_vs_ref": 100.0, "frame_ms_view": 21.25, "frame_ms_view_baseline": 24.49, "frame_delta_ms": -3.24, "fps": 47.1, "ab_fused_default_ms": 21.25, "ab_kill_switch_ms": 24.49, "pre_lever_a_fused_ms": 26.35, "pre_lever_a_base_ms": 29.47, "t125_code_as_written_ms": 30.9, "paired_gain_median_ms": 3.14, "pfwc_k2_ms": 4.41, "pfwc_k2_ms_t125_code": 9.71, "pfwc_k2_floor_no_record_work_ms": 4.07, "kill_pfwc_plus_gather_ms": 6.12, "kill_ta_k2_ms": 1.4, "unorm16_pack_cost_ms": 3.7, "project_ms": 4.58, "project_ms_baseline": 6.32, "tile_assign_ms": 0.01, "tile_assign_ms_baseline": 1.44, "combined_tip_measured": true, "gpu_ref_ms_view_published": 10.75}, "timings": {"ms_view": 21.25, "project": 4.58, "tile_assign": 0.01, "sort": 5.17, "blend": 11.24}, "iter_dir": "ttw-179", "run_label": "t122r1..r14", "verdict": "KEEP (lever B: visible-gaussian compaction fused into the pfwc writer, host UNORM16 packs, bank-grouped record writes: 24.49 -> 21.25 ms/view (-3.24, -13.2%), 47.1 FPS, 30 views byte-identical; board yyzo-bh-07 p100a)", "ts": "2026-10-04T12:15:00-0700", "buildid": {"cpp": "gsplat_tt ttp/t122 2b406a0 on 5178c67 (lever A); pre-lever-A rounds on the same code before the rebase", "data": ""}, "tracy": "yyzo-bh-07:/localdev/smarton/gstt2-t122/opt/profiler/t122-fuse (the #125 code as written)"}
{"iter": 180, "idea": "Task #146 (blend lever 2, bit-identical TRISC1 instruction diet in alpha_blend_compute_mb.cpp): (h) GSPLAT_TT_BLEND_CONST_HOIST: the pair bodies' exp/clamp constants are staged once per subchunk (L12-L14, DEST slot 6 idx 11-12) instead of ~22 SFPLOADIs per pair body, dead 255 clamp dropped; (t) GSPLAT_TT_BLEND_FAST_TRED: range-compare T-saturation reduce with a per-row-pair early exit (period 512 kept); (r) GSPLAT_TT_BLEND_RAW_STAGE: raw-instruction coefficient staging (lite form, record format unchanged). h and t default 1, r default 0; 0 = kill switches.", "decision": "keep", "reason": "Interleaved A/B on yyzo-bh-07 (Blackhole p100a, not a p150), bicycle 30 views 1024x1024, untraced, every arm md5-identical to md5-r82new.txt (hero 100 dB). On the lever A base, 3 rounds, blend ms: off 11.27, h 10.64 (-0.62), r 11.07 (-0.20), t 10.32 (-0.95), all 9.44 (-1.83). Tracy BLEND_PROF: blend program 7.69 -> 5.76 ms/view, tile_blend_sfpu makespan 8.03 -> 5.89. Rebased on lever B (b7a04a4), 3 rounds, ms/view: off 21.23, h+t 19.65 (-1.58, -7.4%), all 19.39; r on top of h+t is -0.23 ms blend (paired view 0.29/0.30/0.18), under the 0.3 ms bar, so it stays default off. A shorter T period (256) gave 22.83 vs 22.69 ms/view on the lever A base but changed all 30 views (76.3 dB): dropped.", "metrics": {"board": "yyzo-bh-07 (Blackhole p100a)", "bit_identical": true, "all_30_views_identical": true, "hero_vs_ref": 100.0, "frame_ms_view": 19.65, "frame_ms_view_baseline": 21.23, "frame_delta_ms": -1.58, "fps": 50.9, "blend_ms": 9.68, "blend_ms_baseline": 11.27, "step_h_const_hoist_blend_delta_ms": -0.62, "step_t_fast_tred_blend_delta_ms": -0.95, "step_r_raw_stage_blend_delta_ms": -0.2, "step_r_marginal_on_ht_blend_delta_ms": -0.23, "all_three_ms_view": 19.39, "tracy_blend_program_ms": 5.76, "tracy_blend_program_ms_baseline": 7.69, "p256_period_bit_identical": false, "combined_tip_measured": true, "gpu_ref_ms_view_published": 10.75}, "timings": {"ms_view": 19.65, "project": 4.6, "tile_assign": 0.005, "sort": 5.2, "blend": 9.68}, "iter_dir": "ttw-180", "run_label": "t146r1..r3 (lever A base), t146r11..r13 (tip)", "verdict": "KEEP (blend TRISC1 diet: constant hoist + fast T reduce: 21.23 -> 19.65 ms/view (-1.58, -7.4%), 50.9 FPS, 30 views byte-identical; board yyzo-bh-07 p100a)", "ts": "2026-10-04T12:50:00-0700", "buildid": {"cpp": "gsplat_tt ttp/t146 8c423e3 on b7a04a4 (lever B); lever-A-base rounds on 0b44916", "data": ""}, "tracy": "yyzo-bh-07:/localdev/smarton/gstt2-t146/opt/profiler/t146-{off,all}; docs/blend-diet-t146/out"}
{"iter": 181, "idea": "Task #142 (lever C, prepared by #140): dead-record pre-cull. pfwc (PFWC_PRECULL, GSPLAT_TT_PRECULL=1) shrinks each gaussian's tile rectangle to the opacity-aware extent the microblock band cull can keep, so dead (gaussian, tile) records are not emitted, sorted or materialized. Fitted under the 70656 B kernel config buffer (log2 bound from opacity bits, nested v_ifs, inline loads, one radius-limit test).", "decision": "keep-optin", "reason": "Interleaved A/B on yyzo-bh-07 (Blackhole p100a, not a p150), bicycle 30 views 1024x1024, 4 rotated rounds, untraced: base 19.83+-0.05, precull 19.33+-0.02 ms/view, paired delta -0.50+-0.04 ms (-2.5%). Stages: blend(mat+cull+blend) -0.40, sort -0.17, project +0.07. Not byte-identical: max 1 LSB on 2.7k-5.5k px/view, PSNR 74.9-78.2 dB vs base; bit-identical with BLEND_T_PERIOD=0 (5 views, psnr inf), so the diff is the T-saturation checkpoint shift. Records 3.37M -> 3.24M/30 views; dead share 19.7% -> 16.5% (only ~20% of dead records removed). Kept opt-in (default 0) pending independent review of the non-identical default.", "metrics": {"board": "yyzo-bh-07 (Blackhole p100a)", "bit_identical": false, "all_30_views_identical": false, "max_lsb_diff": 1, "psnr_min_db": 74.89, "psnr_max_db": 78.24, "bit_identical_t_period0": true, "frame_ms_view": 19.33, "frame_ms_view_stdev": 0.02, "frame_ms_view_baseline": 19.83, "frame_ms_view_baseline_stdev": 0.05, "frame_delta_ms": -0.5, "frame_delta_pct": -2.5, "fps": 51.7, "blend_stage_delta_ms": -0.4, "sort_stage_delta_ms": -0.17, "project_stage_delta_ms": 0.07, "tracy_pfwc_ms": [2.685, 2.985], "tracy_sort_ol_emit_ms": [4.03, 3.91], "tracy_sort_ol_count_ms": [1.02, 0.98], "tracy_mat_cull_ms": [3.95, 3.34], "tracy_blend_sfpu_ms": [7.82, 7.75], "records_30v": [3369033, 3236947], "dead_share": [0.1973, 0.1646], "pfwc_kernel_bytes": "under 70656 B"}, "timings": {"ms_view": 19.33, "project": 4.69, "tile_assign": 0.007, "sort": 5.04, "blend": 9.29}, "iter_dir": "ttw-181", "run_label": "t124r1..r4-{base,pc}, t124rt0-{b0,p0}, r5/r6-dc, tracy t142-{base,pc}", "verdict": "KEEP-OPTIN (lever C pre-cull: 19.83 -> 19.33 ms/view (-0.50, -2.5%), <=1 LSB diff; opt-in GSPLAT_TT_PRECULL=1; board yyzo-bh-07 p100a)", "ts": "2026-10-04T13:20:00-0700", "buildid": {"cpp": "gsplat_tt ttp/t142 8f3dd12 on iter-180", "data": ""}, "tracy": "yyzo-bh-07:/localdev/smarton/gstt2-t142/opt/profiler/t142-{base,pc}; docs/precull-t142/out"}
{"iter": 182, "idea": "Task #156 (independent review of lever C, iter-181): GSPLAT_TT_PRECULL now defaults to 1 (dead-record pre-cull in pfwc shrinks each gaussian's tile rectangle to the opacity-aware extent the band cull keeps); GSPLAT_TT_PRECULL=0 is the kill switch. Goldens refreshed: tests/fixtures/hero/hero_golden_8bit.png (old one in tests/fixtures/hero/archive/hero_golden_8bit_pre-t156-precull.png) and the remote md5 list md5-r82new.txt (old one kept as md5-r82new.pre-t156.txt).", "decision": "keep", "reason": "Review: no blocking problems in 4b6c092. The shrunk radii only feed the tile rectangle (blend keeps the 3-sigma radii), the max_radius test is unchanged, shrunk r >= 2 so no lane changes visibility, the log2 bound only over-estimates t, non-finite lanes and cull-disabled views are left alone, and the dropped copy_tile inits are safe because every CB in that step is Float32; test_precull.cpp passes. Interleaved A/B on yyzo-bh-07 (Blackhole p100a, not a p150), bicycle 30 views 1024x1024, 3 rounds, untraced: off (old default) 19.71+-0.04, on (new default) 19.21+-0.12 ms/view, paired delta -0.40/-0.54/-0.56, mean -0.50 ms (-2.5%). Stages: blend 9.68 -> 9.29, sort 5.14 -> 5.02, project 4.59 -> 4.67. Off arm md5-identical to the old golden in all 3 rounds; the new default is deterministic (same md5 list in all 3 rounds) and differs by at most 1 LSB from the old default: PSNR 74.89-78.24 dB over 90 view comparisons (gate >= 70 dB).", "metrics": {"board": "yyzo-bh-07 (Blackhole p100a)", "bit_identical": false, "all_30_views_identical": false, "max_lsb_diff": 1, "psnr_min_db": 74.89, "psnr_max_db": 78.24, "deterministic_3_rounds": true, "hero_vs_ref": 100.0, "hero_vs_old_golden": 76.12, "frame_ms_view": 19.21, "frame_ms_view_stdev": 0.12, "frame_ms_view_baseline": 19.71, "frame_ms_view_baseline_stdev": 0.04, "frame_delta_ms": -0.5, "frame_delta_pct": -2.5, "fps": 52.1}, "timings": {"ms_view": 19.21, "project": 4.67, "tile_assign": 0.005, "sort": 5.02, "blend": 9.29}, "iter_dir": "ttw-182", "run_label": "t156r1..r3-{off,base}", "verdict": "KEEP (lever C pre-cull default on after review: 19.71 -> 19.21 ms/view (-0.50, -2.5%), <=1 LSB diff, goldens refreshed; board yyzo-bh-07 p100a)", "ts": "2026-10-04T13:45:00-0700", "buildid": {"cpp": "gsplat_tt ttp/t156 b831ecb on iter-181", "data": ""}, "tracy": "yyzo-bh-07:/localdev/smarton/gstt2-t161/opt/profiler/t161-m1/chunks/0-10/render.tracy", "tracy_note": "t161 capture with default config (PRECULL=1, same as iter-182 tip); zones in docs/precull-pc-t161/out/t161-m1-zones.txt"}
