{"iter": 214, "idea": "Task #409: Ethernet dispatch (GSPLAT_TT_DISPATCH=eth, 12x10 = 120 compute cores) is the p150 default. render/eth_default.py detects the card before the device opens; on a p150 it makes or reuses the opt/eth overlay (TT_METAL_RUNTIME_ROOT with 12-core dispatch lists and a 32 KB idle-ERISC .ld bound, own JIT cache) and runs eth; on a p100a, on overlay failure, or with GSPLAT_TT_DISPATCH=worker it runs worker (11x10) with a log line. C++ unset/auto picks eth only when the overlay marker is present. The md5 check is per grid (opt/md5_golden.py: 11x10 906e0435, 12x10 39d84b28).", "decision": "keep", "reason": "bh-30 (Blackhole p150b, viewer reservation IRD job 135630; no free non-viewer p150), bicycle 30 views 1024x1024, one build 50900f21 (opt tip edc90a94 + t397 + #409), zero-copy output on in both arms. 3 alternating rounds: eth default 8.427/8.450/8.360 mean 8.412 ms/view (118.9 FPS) vs GSPLAT_TT_DISPATCH=worker 8.839/8.857/8.906 mean 8.867 (112.8 FPS): -0.455 ms/view, -5.1%. Blend 6.448 -> 5.895 ms, project 1.136 -> 1.085, sort 1.060 -> 1.173 (bin_emit noise). md5 per grid: worker 906e0435 (11x10 golden) 30/30 in 3/3 rounds, eth 39d84b28 (12x10 golden) 30/30 in 3/3 rounds. MATBLEND_PROGRAM fz=1 zerocopy=1 in all runs, XVIEW_HITS 29/30. Hero PSNR vs reference_v2 42.51 dB. Published GPU reference 10.75 ms/view (published, not measured): eth is 1.28x faster. Pending independent review before landing/tagging.", "metrics": {"board": "bh-30 (Blackhole p150b, viewer reservation IRD job 135630)", "frame_ms_view": 8.412, "frame_ms_view_rounds": [8.427, 8.45, 8.36], "frame_ms_view_worker": 8.867, "frame_ms_view_worker_rounds": [8.839, 8.857, 8.906], "frame_delta_vs_worker_ms": -0.455, "fps": 118.9, "fps_worker": 112.8, "grid": "12x10", "grid_worker": "11x10", "xview_hits": 29, "hero_psnr_vs_ref": 42.51, "md5": "39d84b28", "md5_worker": "906e0435", "golden_match": true, "gpu_published_ms_view": 10.75}, "timings": {"ms_view": 8.412, "project": 1.085, "sort": 1.173, "blend": 5.895, "d2h": 0.01, "xview": 0.146}, "iter_dir": "ttw-214", "run_label": "t409 A/B s0 smoke + r1 (W,D) r2 (D,W) r3 (W,D) at 50900f21 on bh-30 (docs/eth-default-t409/drive409.sh + bench409.sh, out in docs/eth-default-t409/out)", "verdict": "KEEP pending review (ETH dispatch 12x10 by default on p150: 8.412 vs worker 8.867 ms/view on bh-30, per-grid md5 golden)", "ts": "2026-10-07T22:40:00-0400", "buildid": {"cpp": "gsplat_tt ttp/t409-make-eth-dispatch-12x10-the-p150-default 50900f21", "data": ""}, "device_screenshot": {"hero": "opt/metal-screenshots/ttw-214/hero.png", "diff": "opt/metal-screenshots/ttw-214/hero_diff10.png", "ref": "benchmarks/reference_v2/hero.png", "psnr_vs_ref": 42.51, "diff_ref": "benchmarks/reference_v2/hero.png", "golden": "tests/fixtures/hero/hero_golden_8bit_12x10.png", "golden_match": true, "md5": "39d84b28", "commit": "50900f21", "config": "defaults on p150 (eth dispatch via render/eth_default.py overlay, 12x10 grid; zero-copy pinned output and cross-view overlap on; iter-213 defaults otherwise)", "device": "bh-30 p150b", "visual_check": "author (#409) looked at hero and diff x10: no tile or microblock seams, no band or step along the 12th core column or any tile boundary, no blocky or empty tiles, no color shifts; diff only on thin edges (spokes, frame, bench slats, foliage). Tile-boundary pixel columns mean |err| 0.873 vs interior 0.875. Hero is pixel-identical to the t397 eth hero; vs the worker hero 242 pixels differ (max 13 LSB, PSNR 82.2 dB). New 12x10 golden fixture = this hero."}, "tracy_waiver": "dispatch-mode change; Tracy device profiling under the ETH overlay is blocked by the idle-ERISC prefetch overflow found in t397, so stage evidence is TTW_TIMING (docs/eth-default-t409/out/r*-*.log)."}
{"iter": 215, "idea": "Task #418: packed key|id LSD radix in the mat movers' per-tile sort (sort_radix_tile_algo.h sort_record_ids, GSPLAT_TT_SORT_PACKED, default on; =0 restores the key/id pair radix). Same stable plan and permutation; the key gather also finds kmin/kmax, pass 0 packs ((key>>d)<<ib)|id into one word when the remaining key bits fit beside the id, middle passes move one word, the last pass writes ids straight into the output. ~9 instead of ~18 L1 accesses per element. #413 had shown mat is mover-bound and the sort is 78% of mover sort+perm time.", "decision": "keep", "reason": "yyzo-bh-04 (Blackhole p100a, measurement reservation IRD job 244892, 11x10), bicycle 30 views 1024x1024, one build bb1c9bdd, 3 alternating untraced rounds: packed 8.263/8.259/8.297 mean 8.273 vs pair (GSPLAT_TT_SORT_PACKED=0) 8.711/8.712/8.756 mean 8.726 ms/view (-0.453, -5.2%); the gain is in the fused mat+blend stage (blend 7.019 -> 6.553). md5 906e0435 on 30/30 views in all 6 runs. Tracy (GSPLAT_TT_MATCULL_PROF=1, same build): mover sort 152 -> 95 cyc/rec (BRISC), 141 -> 88 (NCRISC); TRISC1 mat start gap 0.596 -> 0.425 ms and between-job gaps 0.477 -> 0.335 ms per core-view (views 0-9, same-capture pair control); mat length 2.284 -> 1.831 ms. Measured on p100a on the pre-ETH-default tree (merge base edc90a94); not yet measured on p150 with the iter-214 ETH default. Hero PSNR vs reference_v2 42.51 dB, golden match. Published GPU reference 10.75 ms/view (published, not measured).", "metrics": {"board": "yyzo-bh-04 (Blackhole p100a, measurement box)", "frame_ms_view": 8.273, "frame_ms_view_rounds": [8.263, 8.259, 8.297], "frame_ms_view_off": 8.726, "frame_ms_view_off_rounds": [8.711, 8.712, 8.756], "frame_delta_vs_off_ms": -0.453, "fps": 120.88, "mover_sort_cyc_per_rec_brisc": 95.2, "mover_sort_cyc_per_rec_brisc_off": 152.2, "mover_sort_cyc_per_rec_ncrisc": 88.2, "mover_sort_cyc_per_rec_ncrisc_off": 140.9, "mat_between_job_gaps_ms": 0.335, "mat_between_job_gaps_ms_off": 0.477, "mat_start_gap_ms": 0.425, "mat_start_gap_ms_off": 0.596, "xview_hits": 29, "xview_misses": 0, "hero_psnr_vs_ref": 42.51, "md5": "906e0435", "golden_match": true, "gpu_published_ms_view": 10.75}, "timings": {"ms_view": 8.273, "project": 1.096, "sort": 0.507, "blend": 6.553, "d2h": 0.003, "xview": 0.058}, "iter_dir": "ttw-215", "run_label": "t418 A/B r1..r3 xvpk vs xvpair at bb1c9bdd (docs/mover-sortperm/drive.sh MODE=rounds + drive_rest.sh, out in docs/mover-sortperm/out)", "verdict": "KEEP pending review (packed mover sort: 8.273 vs 8.726 ms/view on p100a, bit-exact)", "ts": "2026-10-07T23:30:00-0400", "buildid": {"cpp": "gsplat_tt ttp/t418-size-and-speed-up-mover-sort-perm-in-sor bb1c9bdd (build #125)", "data": ""}, "device_screenshot": {"hero": "opt/metal-screenshots/ttw-215/hero.png", "diff": "opt/metal-screenshots/ttw-215/hero_diff10.png", "ref": "benchmarks/reference_v2/hero.png", "psnr_vs_ref": 42.51, "diff_ref": "benchmarks/reference_v2/hero.png", "golden": "tests/fixtures/hero/hero_golden_8bit.png", "golden_match": true, "md5": "906e0435", "commit": "bb1c9bdd", "config": "defaults on p100a 11x10 (packed mover sort on; zero-copy pinned output and cross-view overlap on; iter-213 defaults otherwise)", "device": "yyzo-bh-04 p100a", "visual_check": "author (#418) looked at hero and diff x10: no tile seams, blocky or empty tiles, no color shifts; diff only on thin edges (spokes, frame, bench slats, foliage). Tile-boundary pixel columns mean |err| 0.873 vs interior 0.875 (rows 0.862 vs 0.876). Hero is pixel-identical to the iter-213 hero (png md5 86524912)."}, "tracy": "docs/mover-sortperm/out/dev-pk-c0.csv.gz", "tracy_note": "device profiler CSVs (GSPLAT_TT_MATCULL_PROF=1) for 30 views: docs/mover-sortperm/out/dev-pk-c{0,10,20}.csv.gz, pair control dev-pair-c0.csv.gz, host tracy -u in tracy-u-*.csv.gz; analysis out/ana418-*.txt"}
{"iter": 216, "idea": "Task #425: loopback NoC record copy for the mat movers' perm and big-tile gather (GSPLAT_TT_PERM_NOC bits 0/1) plus a packed key|id sort for big-tile items (sort_ids_gathered, bit 2); default 7, =0 restores the RISC word copy and pair sort. #418 had left perm at ~40 cyc/rec (an 8-word RISC copy) and the NCRISC big-tile sort at ~22 cyc/rec as the main TRISC1 between-job gap causes.", "decision": "keep", "reason": "yyzo-bh-04 (Blackhole p100a, measurement reservation IRD job 244892, 11x10), bicycle 30 views 1024x1024, one build d4b7abd9 (#125), 3 alternating untraced rounds: n7 (default) 8.023/8.050/8.055 mean 8.043 vs RISC copy (GSPLAT_TT_PERM_NOC=0, = iter-215 path) 8.223/8.215/8.272 mean 8.237 ms/view (-0.194, -2.4%); NoC perm only (=3) 8.110. Frame avg 8.086 vs 8.280. Gain is in the fused mat+blend stage (blend 6.558 -> 6.367). md5 906e0435 on 30/30 views in all 9 runs. Tracy (GSPLAT_TT_MATCULL_PROF=1): mover perm 38.7 -> 23.0 cyc/rec (BRISC), 42.5 -> 22.6 (NCRISC); NCRISC big-tile 21.9 -> 18.2 cyc/rec; sort unchanged (~96/88). Unit test sort_ids_gathered 3229 cases, 0 fails. Hero PSNR vs reference_v2 42.51 dB, golden match. Measured on p100a; not yet on p150 with the iter-214 ETH default. Published GPU reference 10.75 ms/view (published, not measured). p150 confirmation (#435, bh-30 Blackhole p150, ETH dispatch 12x10, tree at best-iter-216 e13e9f6b, one build, 3 alternating untraced rounds N/Z, Z/N, N/Z): default PERM_NOC=7 7.693/7.697/7.724 mean 7.705 ms/view (129.8 FPS) vs GSPLAT_TT_PERM_NOC=0 7.892/7.979/8.122 mean 7.998 (-0.293, -3.7%); frame avg 7.781 vs 8.073; gain again in blend (5.21 vs 5.41 mean). iter 215 ran about 7.846 on bh-30. md5 39d84b28 = 12x10 golden on 30/30 views in all 8 runs (incl. warm-ups); p150 hero (opt/metal-screenshots/ttw-216/p150) PSNR vs reference_v2 42.51 dB, bit-exact vs hero_golden_8bit_12x10, identical across arms; looked at hero and diff x10: no tile seams.", "metrics": {"board": "yyzo-bh-04 (Blackhole p100a, measurement box)", "frame_ms_view": 8.043, "frame_ms_view_rounds": [8.023, 8.05, 8.055], "frame_ms_view_off": 8.237, "frame_ms_view_off_rounds": [8.223, 8.215, 8.272], "frame_ms_view_perm_only": 8.11, "frame_ms_view_perm_only_rounds": [8.075, 8.085, 8.171], "frame_delta_vs_off_ms": -0.194, "fps": 124.33, "mover_perm_cyc_per_rec_brisc": 23.0, "mover_perm_cyc_per_rec_brisc_off": 38.7, "mover_perm_cyc_per_rec_ncrisc": 22.6, "mover_perm_cyc_per_rec_ncrisc_off": 42.5, "mover_big_cyc_per_rec_ncrisc": 18.2, "mover_big_cyc_per_rec_ncrisc_off": 21.9, "xview_hits": 29, "xview_misses": 0, "hero_psnr_vs_ref": 42.51, "md5": "906e0435", "golden_match": true, "gpu_published_ms_view": 10.75, "p150_board": "bh-30 (Blackhole p150, #435, ETH dispatch 12x10, viewer reservation IRD job 135630; viewer stopped for the bench only)", "p150_frame_ms_view": 7.705, "p150_frame_ms_view_rounds": [7.693, 7.697, 7.724], "p150_frame_ms_view_off": 7.998, "p150_frame_ms_view_off_rounds": [7.892, 7.979, 8.122], "p150_frame_delta_vs_off_ms": -0.293, "p150_fps": 129.79, "p150_md5": "39d84b28", "p150_golden_12x10_match": true, "p150_hero_psnr_vs_ref": 42.51}, "timings": {"ms_view": 8.043, "project": 1.101, "sort": 0.5, "blend": 6.367, "d2h": 0.004, "xview": 0.058}, "iter_dir": "ttw-216", "run_label": "t425 A/B r1..r3 xvn7/xvn3/xvcpu at d4b7abd9 (docs/perm-noc-t425/drive.sh, out in docs/perm-noc-t425/out; run 1 at 8353878c in out/run1-8353878c)", "verdict": "KEEP pending review (NoC perm + packed big-tile sort: 8.043 vs 8.237 ms/view on p100a, bit-exact)", "ts": "2026-10-08T00:00:00-0400", "buildid": {"cpp": "gsplat_tt ttp/t425-cut-mover-perm-and-ncrisc-big-tile-sort- d4b7abd9 (build #125)", "data": ""}, "device_screenshot": {"hero": "opt/metal-screenshots/ttw-216/hero.png", "diff": "opt/metal-screenshots/ttw-216/hero_diff10.png", "ref": "benchmarks/reference_v2/hero.png", "psnr_vs_ref": 42.51, "diff_ref": "benchmarks/reference_v2/hero.png", "golden": "tests/fixtures/hero/hero_golden_8bit.png", "golden_match": true, "md5": "906e0435", "commit": "d4b7abd9", "config": "defaults on p100a 11x10 (GSPLAT_TT_PERM_NOC=7 default; packed mover sort, zero-copy pinned output and cross-view overlap on; iter-215 defaults otherwise)", "device": "yyzo-bh-04 p100a", "visual_check": "author (#425) looked at hero and diff x10: no tile seams, blocky or empty tiles, no color shifts; diff only on thin edges (spokes, frame, bench slats, foliage). 16-px tile-boundary columns mean |err| 0.864 vs interior 0.877 (rows 0.877 vs 0.875). Hero is pixel-identical to the iter-215 hero (png md5 86524912)."}, "tracy": "docs/perm-noc-t425/out/dev-xvn7-c0.csv.gz", "tracy_note": "device profiler CSV (GSPLAT_TT_MATCULL_PROF=1) views 0-9: dev-xvn7-c0.csv.gz, NoC-perm-only run-1 control out/run1-8353878c/dev-n3-c0.csv.gz, RISC-copy control docs/mover-sortperm/out/dev-pk-c0.csv.gz; cyc/rec via docs/mover-sortperm/cyc_per_rec.py"}
{"iter": 217, "ts": "2026-10-10T13:39:00Z", "decision": "rebaseline", "verdict": "REBASELINE", "run_label": "t465 b2b re-baseline p150 best-iter-216", "iter_dir": "ttw-217", "buildid": "e13e9f6b", "idea": "Task #465: re-baseline best-iter-216 (e13e9f6b) under the new headline metric, back-to-back ms/view (render/run.py --back-to-back --b2b-passes 3), on p150. Not a lever: no code change is kept here.", "reason": "bh-30 (Blackhole p150, ETH dispatch 12x10, viewer reservation; viewer stopped for the bench only), bicycle 30 views 1024x1024, one build per tree, 3 alternating rounds (rounds A/B, B/A, A/B; each round b2b A/B then latency A/B; docs/b2b-rebaseline-t465/bench465.sh). b2b median of 9 measured passes 9.574 ms/view (104.4 FPS), passes 10.036, 10.071, 9.310, 9.334, 9.661, 9.306, 9.904, 9.574, 9.347. Latency without --dump-views (secondary) 9.156, 9.139, 9.147, median 9.147. Sweep md5 39d84b28 on 30/30 views in every b2b run, identical across passes. Hero rendered on device (b2b dump, pass 0): PSNR vs benchmarks/reference_v2/hero.png 42.51 dB; bit-exact vs hero_golden_8bit_12x10.png (golden badge). Published GPU reference 10.75 ms/view (published, not measured).", "metrics": {"board": "bh-30 (Blackhole p150, ETH dispatch 12x10, viewer reservation; viewer stopped for the bench only)", "commit": "e13e9f6b", "build": "best-iter-216", "ms_view_b2b": 9.574, "ms_view_b2b_passes": [10.036, 10.071, 9.31, 9.334, 9.661, 9.306, 9.904, 9.574, 9.347], "ms_view_latency": 9.147, "ms_view_latency_runs": [9.156, 9.139, 9.147], "md5": "39d84b28", "fps": 104.45, "gpu_published_ms_view": 10.75}, "timings": {"ms_view_b2b": 9.574, "ms_view_latency": 9.147}, "device_screenshot": {"hero": "opt/metal-screenshots/ttw-217/hero.png", "diff": "opt/metal-screenshots/ttw-217/hero_diff10.png", "ref": "benchmarks/reference_v2/hero.png", "psnr_vs_ref": 42.51, "diff_ref": "benchmarks/reference_v2/hero.png", "golden": "tests/fixtures/hero/hero_golden_8bit_12x10.png", "golden_match": true, "md5": "39d84b28", "commit": "e13e9f6b", "config": "defaults (best-iter-216)", "device": "bh-30 p150", "visual_check": "t465 worker looked at the hero and the diff x10: no tile seams, blocky or empty tiles, no color shifts; diff only on thin edges (spokes, frame, bench slats, foliage). Hero is bit-exact vs the board golden and identical across both builds."}}
{"iter": 218, "ts": "2026-10-10T13:39:00Z", "decision": "rebaseline", "verdict": "REBASELINE", "run_label": "t465 b2b re-baseline p150 opt tip c7232e14 + #465 run.py b2b print", "iter_dir": "ttw-218", "buildid": "13ce253e", "idea": "Task #465: re-baseline opt tip c7232e14 + #465 run.py b2b print (13ce253e) under the new headline metric, back-to-back ms/view (render/run.py --back-to-back --b2b-passes 3), on p150. Not a lever: no code change is kept here.", "reason": "bh-30 (Blackhole p150, ETH dispatch 12x10, viewer reservation; viewer stopped for the bench only), bicycle 30 views 1024x1024, one build per tree, 3 alternating rounds (rounds A/B, B/A, A/B; each round b2b A/B then latency A/B; docs/b2b-rebaseline-t465/bench465.sh). b2b median of 9 measured passes 9.397 ms/view (106.4 FPS), passes 10.054, 9.500, 9.300, 9.929, 9.397, 9.422, 9.297, 9.385, 9.261. Latency without --dump-views (secondary) 9.124, 9.181, 9.134, median 9.134. Sweep md5 39d84b28 on 30/30 views in every b2b run, identical across passes. Hero rendered on device (b2b dump, pass 0): PSNR vs benchmarks/reference_v2/hero.png 42.51 dB; bit-exact vs hero_golden_8bit_12x10.png (golden badge). Published GPU reference 10.75 ms/view (published, not measured).", "metrics": {"board": "bh-30 (Blackhole p150, ETH dispatch 12x10, viewer reservation; viewer stopped for the bench only)", "commit": "13ce253e", "build": "opt tip c7232e14 + #465 run.py b2b print", "ms_view_b2b": 9.397, "ms_view_b2b_passes": [10.054, 9.5, 9.3, 9.929, 9.397, 9.422, 9.297, 9.385, 9.261], "ms_view_latency": 9.134, "ms_view_latency_runs": [9.124, 9.181, 9.134], "md5": "39d84b28", "fps": 106.42, "gpu_published_ms_view": 10.75}, "timings": {"ms_view_b2b": 9.397, "ms_view_latency": 9.134}, "device_screenshot": {"hero": "opt/metal-screenshots/ttw-218/hero.png", "diff": "opt/metal-screenshots/ttw-218/hero_diff10.png", "ref": "benchmarks/reference_v2/hero.png", "psnr_vs_ref": 42.51, "diff_ref": "benchmarks/reference_v2/hero.png", "golden": "tests/fixtures/hero/hero_golden_8bit_12x10.png", "golden_match": true, "md5": "39d84b28", "commit": "13ce253e", "config": "defaults (opt tip c7232e14 + #465 run.py b2b print)", "device": "bh-30 p150", "visual_check": "t465 worker looked at the hero and the diff x10: no tile seams, blocky or empty tiles, no color shifts; diff only on thin edges (spokes, frame, bench slats, foliage). Hero is bit-exact vs the board golden and identical across both builds."}}
{"iter": 219, "ts": "2026-10-10T13:39:00Z", "decision": "rebaseline", "verdict": "REBASELINE", "run_label": "t465 b2b re-baseline p100 best-iter-216", "iter_dir": "ttw-219", "buildid": "e13e9f6b", "idea": "Task #465: re-baseline best-iter-216 (e13e9f6b) under the new headline metric, back-to-back ms/view (render/run.py --back-to-back --b2b-passes 3), on p100. Not a lever: no code change is kept here.", "reason": "yyzo-bh-04 (Blackhole p100a, measurement box), bicycle 30 views 1024x1024, one build per tree, 3 alternating rounds (rounds A/B, B/A, A/B; each round b2b A/B then latency A/B; docs/b2b-rebaseline-t465/bench465.sh). b2b median of 9 measured passes 9.821 ms/view (101.8 FPS), passes 9.841, 9.821, 9.818, 9.848, 9.818, 9.825, 9.822, 9.820, 9.818. Latency without --dump-views (secondary) 9.783, 9.796, 9.797, median 9.796. Sweep md5 906e0435 on 30/30 views in every b2b run, identical across passes. Hero rendered on device (b2b dump, pass 0): PSNR vs benchmarks/reference_v2/hero.png 42.51 dB; bit-exact vs hero_golden_8bit.png (golden badge). Published GPU reference 10.75 ms/view (published, not measured).", "metrics": {"board": "yyzo-bh-04 (Blackhole p100a, measurement box)", "commit": "e13e9f6b", "build": "best-iter-216", "ms_view_b2b": 9.821, "ms_view_b2b_passes": [9.841, 9.821, 9.818, 9.848, 9.818, 9.825, 9.822, 9.82, 9.818], "ms_view_latency": 9.796, "ms_view_latency_runs": [9.783, 9.796, 9.797], "md5": "906e0435", "fps": 101.82, "gpu_published_ms_view": 10.75}, "timings": {"ms_view_b2b": 9.821, "ms_view_latency": 9.796}, "device_screenshot": {"hero": "opt/metal-screenshots/ttw-219/hero.png", "diff": "opt/metal-screenshots/ttw-219/hero_diff10.png", "ref": "benchmarks/reference_v2/hero.png", "psnr_vs_ref": 42.51, "diff_ref": "benchmarks/reference_v2/hero.png", "golden": "tests/fixtures/hero/hero_golden_8bit.png", "golden_match": true, "md5": "906e0435", "commit": "e13e9f6b", "config": "defaults (best-iter-216)", "device": "yyzo-bh-04 p100a", "visual_check": "t465 worker looked at the hero and the diff x10: no tile seams, blocky or empty tiles, no color shifts; diff only on thin edges (spokes, frame, bench slats, foliage). Hero is bit-exact vs the board golden and identical across both builds."}}
{"iter": 220, "ts": "2026-10-10T13:39:00Z", "decision": "rebaseline", "verdict": "REBASELINE", "run_label": "t465 b2b re-baseline p100 opt tip c7232e14 + #465 run.py b2b print", "iter_dir": "ttw-220", "buildid": "13ce253e", "idea": "Task #465: re-baseline opt tip c7232e14 + #465 run.py b2b print (13ce253e) under the new headline metric, back-to-back ms/view (render/run.py --back-to-back --b2b-passes 3), on p100. Not a lever: no code change is kept here.", "reason": "yyzo-bh-04 (Blackhole p100a, measurement box), bicycle 30 views 1024x1024, one build per tree, 3 alternating rounds (rounds A/B, B/A, A/B; each round b2b A/B then latency A/B; docs/b2b-rebaseline-t465/bench465.sh). b2b median of 9 measured passes 9.818 ms/view (101.9 FPS), passes 9.840, 9.812, 9.818, 9.813, 9.818, 9.813, 9.828, 9.835, 9.841. Latency without --dump-views (secondary) 9.804, 9.798, 9.793, median 9.798. Sweep md5 906e0435 on 30/30 views in every b2b run, identical across passes. Hero rendered on device (b2b dump, pass 0): PSNR vs benchmarks/reference_v2/hero.png 42.51 dB; bit-exact vs hero_golden_8bit.png (golden badge). Published GPU reference 10.75 ms/view (published, not measured).", "metrics": {"board": "yyzo-bh-04 (Blackhole p100a, measurement box)", "commit": "13ce253e", "build": "opt tip c7232e14 + #465 run.py b2b print", "ms_view_b2b": 9.818, "ms_view_b2b_passes": [9.84, 9.812, 9.818, 9.813, 9.818, 9.813, 9.828, 9.835, 9.841], "ms_view_latency": 9.798, "ms_view_latency_runs": [9.804, 9.798, 9.793], "md5": "906e0435", "fps": 101.85, "gpu_published_ms_view": 10.75}, "timings": {"ms_view_b2b": 9.818, "ms_view_latency": 9.798}, "device_screenshot": {"hero": "opt/metal-screenshots/ttw-220/hero.png", "diff": "opt/metal-screenshots/ttw-220/hero_diff10.png", "ref": "benchmarks/reference_v2/hero.png", "psnr_vs_ref": 42.51, "diff_ref": "benchmarks/reference_v2/hero.png", "golden": "tests/fixtures/hero/hero_golden_8bit.png", "golden_match": true, "md5": "906e0435", "commit": "13ce253e", "config": "defaults (opt tip c7232e14 + #465 run.py b2b print)", "device": "yyzo-bh-04 p100a", "visual_check": "t465 worker looked at the hero and the diff x10: no tile seams, blocky or empty tiles, no color shifts; diff only on thin edges (spokes, frame, bench slats, foliage). Hero is bit-exact vs the board golden and identical across both builds."}}
