{"iter": 0, "idea": "baseline", "decision": "keep", "reason": "63.85 >= 63.6", "metrics": {"hero_vs_ref": 63.85}, "timings": {"proj": 60.7, "ta": 97.7, "sort": 44.6, "blend": 429.4}, "ts": "2026-05-31T04:30:10-0700", "buildid": {"cpp": "cpp#1 7eed227 iter 0: baseline", "data": "data#"}, "iter_dir": "ttw-000"}
{"iter": 1, "idea": "fix SFPU cull fast path via DRAM settle spin fence after mask read barrier", "decision": "keep", "reason": "63.85 >= 63.6", "metrics": {"hero_vs_ref": 63.85}, "timings": {"proj": 60.6, "ta": 98.1, "sort": 44.8, "blend": 259.4}, "ts": "2026-05-31T17:55:09-0700", "buildid": {"cpp": "cpp#2 b3b6231 iter 1: fix SFPU cull fast path via DRAM settle spin fence after mask read barrier", "data": "data#"}, "iter_dir": "ttw-001"}
{"iter": 4, "idea": "Fix segfault P_kept cull gate", "decision": "reject", "reason": "metric hero_vs_ref missing", "metrics": {}, "timings": {}, "ts": "2026-05-31T20:48:41-0700", "buildid": {"cpp": "cpp#4 7e5bced iter 4: Fix segfault P_kept cull gate", "data": "data#"}, "iter_dir": "ttw-004"}
{"iter": 5, "idea": "Fix segfault: D2H sorted ids when blend_mode=0 ref path", "decision": "keep", "reason": "63.85 >= 63.6", "metrics": {"hero_vs_ref": 63.85}, "timings": {"proj": 56.7, "ta": 129.8, "sort": 17.6, "blend": 269.5}, "ts": "2026-05-31T20:51:40-0700", "buildid": {"cpp": "cpp#5 7e5bced iter 5: Fix segfault: D2H sorted ids when blend_mode=0 ref path", "data": "data#"}, "iter_dir": "ttw-005"}
{"iter": 6, "idea": "baseline at HEAD e18423e (fused_tile)", "decision": "keep", "reason": "63.85 >= 63.6", "metrics": {"hero_vs_ref": 63.85}, "timings": {"proj": 56.7, "ta": 129.3, "sort": 17.6, "blend": 202.0}, "ts": "2026-05-31T23:19:29-0700", "buildid": {"cpp": "cpp#6 e18423e iter 6: baseline at HEAD e18423e (fused_tile)", "data": "data#"}, "iter_dir": "ttw-006"}
{"iter": 7, "idea": "on-device scan_bases: drop D2H core_total + host prefix", "decision": "keep", "reason": "63.85 >= 63.6", "metrics": {"hero_vs_ref": 63.85}, "timings": {"proj": 56.5, "ta": 129.4, "sort": 17.5, "blend": 200.7}, "ts": "2026-05-31T23:23:23-0700", "buildid": {"cpp": "cpp#7 9b784b4 iter 7: on-device scan_bases: drop D2H core_total + host prefix", "data": "data#"}, "iter_dir": "ttw-007"}
{"iter": 8, "idea": "sort\u2192blend pipe: defer publish Finish, skip pkept D2H", "decision": "keep", "reason": "63.85 >= 63.6", "metrics": {"hero_vs_ref": 63.85}, "timings": {"proj": 56.6, "ta": 129.3, "sort": 16.4, "blend": 201.0}, "ts": "2026-05-31T23:31:23-0700", "buildid": {"cpp": "cpp#8 da09320 iter 8: sort\u2192blend pipe: defer publish Finish, skip pkept D2H", "data": "data#"}, "iter_dir": "ttw-008"}
{"iter": 9, "idea": "blend reader: hoist constant ramps once/core + coalesce tile-range SoA read", "decision": "keep", "reason": "63.85 >= 63.6", "metrics": {"hero_vs_ref": 63.85}, "timings": {"proj": 56.3, "ta": 129.2, "sort": 15.7, "blend": 202.2}, "ts": "2026-05-31T23:38:46-0700", "buildid": {"cpp": "cpp#9 3010291 iter 9: blend reader: hoist constant ramps once/core + coalesce tile-range SoA read", "data": "data#"}, "iter_dir": "ttw-009"}
{"iter": 10, "idea": "blend reader: mask-first filter skips zero-mask attr gathers", "decision": "reject", "reason": "verify rc=137", "metrics": {}, "timings": {}, "ts": "2026-06-01T00:26:07-0700", "buildid": {"cpp": "cpp#10 ffdd218 iter 10: blend reader: mask-first filter skips zero-mask attr gathers", "data": "data#"}, "iter_dir": "ttw-010"}
{"iter": 11, "idea": "fused blend: drop redundant res_out zero H2D upload", "decision": "keep", "reason": "63.85 >= 63.6", "metrics": {"hero_vs_ref": 63.85}, "timings": {"proj": 56.0, "ta": 129.4, "sort": 16.1, "blend": 196.2}, "ts": "2026-06-01T00:57:08-0700", "buildid": {"cpp": "cpp#15 ffdd218 iter 11: fused blend: drop redundant res_out zero H2D upload bin=8e9d81daf27b65a9", "data": "data#   bin="}, "iter_dir": "ttw-011"}
{"iter": 12, "idea": "Stage C2: contiguous per-tile blend payload (coalesced blend reader reads)", "decision": "keep", "reason": "63.85 >= 63.6", "metrics": {"hero_vs_ref": 63.85}, "timings": {"proj": 54.5, "ta": 128.6, "sort": 16.0, "blend": 191.3}, "ts": "2026-06-01T05:23:27-0700", "buildid": {"cpp": "cpp#17 eed0abc yyzo-bh-03 failover baseline (prebuilt .so from /proj_sw; C2 is kernel-JIT) bin=8e9d81daf27b65a9", "data": "data#   bin="}, "iter_dir": "ttw-012"}
{"iter": 13, "idea": "blend reader: skip redundant 2nd cull-mask page read on non-straddling chunks", "decision": "keep", "reason": "63.85 >= 63.6", "metrics": {"hero_vs_ref": 63.85}, "timings": {"proj": 54.4, "ta": 128.6, "sort": 15.7, "blend": 191.3}, "ts": "2026-06-01T05:36:43-0700", "buildid": {"cpp": "cpp#17 eed0abc yyzo-bh-03 failover baseline (prebuilt .so from /proj_sw; C2 is kernel-JIT) bin=8e9d81daf27b65a9", "data": "data#   bin="}, "iter_dir": "ttw-013"}
{"iter": 14, "idea": "fuse cull+blend L1 handoff: blocked by 70656B kernel-config ceiling; land gated scaffold, default off (baseline restored)", "decision": "keep", "reason": "63.85 >= 63.6", "metrics": {"hero_vs_ref": 63.85}, "timings": {"proj": 54.4, "ta": 128.6, "sort": 15.3, "blend": 191.4}, "ts": "2026-06-01T06:32:33-0700", "buildid": {"cpp": "cpp#20 47257af iter 14: fuse cull+blend L1 handoff: blocked by 70656B kernel-config ceiling; land gated scaffold, default off (baseline restored) bin=891b04a11040e361", "data": "data#   bin="}, "iter_dir": "ttw-014"}
{"iter": 15, "idea": "two-program L1 mask handoff: cull_masks resident-L1 + Finish between cull/blend (GSPLAT_TT_L1_MASKS=1, default off); falsified spin-as-DRAM-settle, gate off, baseline held", "decision": "keep", "reason": "63.85 >= 63.6", "metrics": {"hero_vs_ref": 63.85}, "timings": {"proj": 54.5, "ta": 128.7, "sort": 15.7, "blend": 190.9}, "ts": "2026-06-01T06:57:23-0700", "buildid": {"cpp": "cpp#22 e204f63 iter 15: two-program L1 mask handoff: cull_masks resident-L1 + Finish between cull/blend (GSPLAT_TT_L1_MASKS=1, default off); falsified spin-as-DRAM-settle, gate off, baseline held bin=9daa4bc077dc8fe5", "data": "data#   bin="}, "iter_dir": "ttw-015"}
{"iter": 16, "idea": "Stage C2 contiguous per-tile blend payload: on-device pack pass (payload_pack) writes 64B/candidate rows (attrs+conic-raw+microblock mask) into blend_payload indexed by global candidate idx; sequential streaming blend reader (reader_alpha_blend_mb_payload) replaces the ~1.9GB random gather. Blend exec drops 191->26ms with byte-correct data proven end-to-end (pack->DRAM->reader L1->CB->compute all verified identical to baseline via readback+DPRINT) but final image regresses to 11.23dB via an as-yet-unexplained path; gated OFF (GSPLAT_TT_BLEND_PAYLOAD default off) to hold the 63.85dB baseline.", "decision": "keep", "reason": "63.85 >= 63.6", "metrics": {"hero_vs_ref": 63.85}, "timings": {"proj": 54.4, "ta": 128.6, "sort": 15.7, "blend": 190.6}, "ts": "2026-06-01T08:17:19-0700", "buildid": {"cpp": "cpp#24 67c7e31 iter 16: Stage C2 contiguous per-tile blend payload: on-device pack pass (payload_pack) writes 64B/candidate rows (attrs+conic-raw+microblock mask) into blend_payload indexed by global candidate idx; sequential streaming blend reader (reader_alpha_blend_mb_payload) replaces the ~1.9GB random gather. Blend exec drops 191->26ms with byte-correct data proven end-to-end (pack->DRAM->reader L1->CB->compute all verified identical to baseline via readback+DPRINT) but final image regresses to 11.23dB via an as-yet-unexplained path; gated OFF (GSPLAT_TT_BLEND_PAYLOAD default off) to hold the 63.85dB baseline. bin=76c1343b5166443f", "data": "data#   bin="}, "iter_dir": "ttw-016"}
{"iter": 17, "idea": "payload partial desync fix (11->43dB), gated off, residual documented", "decision": "keep", "reason": "63.85 >= 63.6", "metrics": {"hero_vs_ref": 63.85}, "timings": {"proj": 54.4, "ta": 128.7, "sort": 16.1, "blend": 191.0}, "ts": "2026-06-01T09:42:59-0700", "buildid": {"cpp": "cpp#50 87cd402 iter 17: payload partial desync fix (11->43dB), gated off, residual documented bin=ffc6d81de0e973ce", "data": "data#   bin="}, "iter_dir": "ttw-017"}
{"iter": 18, "idea": "diag: re-upload ramps every frame under payload", "decision": "reject", "reason": "26.73 >= 63.6", "metrics": {"hero_vs_ref": 26.73}, "timings": {"proj": 54.3, "ta": 128.6, "sort": 16.3, "blend": 456.4}, "ts": "2026-06-01T08:55:36-0700", "buildid": {"cpp": "cpp#32 7b6a768 iter 18: diag: re-upload ramps every frame under payload bin=2e21e5fba5b15a49", "data": "data#   bin="}, "iter_dir": "ttw-018"}
{"iter": 19, "idea": "size payload to sort_sorted_ids (padded index space) - fix pack OOB", "decision": "reject", "reason": "42.09 >= 63.6", "metrics": {"hero_vs_ref": 42.09}, "timings": {"proj": 54.3, "ta": 128.6, "sort": 15.6, "blend": 457.3}, "ts": "2026-06-01T09:01:39-0700", "buildid": {"cpp": "cpp#33 7b6a768 iter 19: size payload to sort_sorted_ids (padded index space) - fix pack OOB bin=3125ba6dbc7f380f", "data": "data#   bin="}, "iter_dir": "ttw-019"}
{"iter": 20, "idea": "R1: drop ta-stage cull (K3+K4), blend microblock cull rejects corners; ta 129->37ms, ms/view 391->306, PSNR 63.85 unchanged, default ON (GSPLAT_TT_TA_NO_CULL)", "decision": "keep", "reason": "63.85 >= 63.6", "metrics": {"hero_vs_ref": 63.85}, "timings": {"proj": 54.5, "ta": 36.8, "sort": 16.0, "blend": 198.6}, "ts": "2026-06-01T10:57:36-0700", "buildid": {"cpp": "cpp#56 e6e29a8 iter 20: R1: drop ta-stage cull (K3+K4), blend microblock cull rejects corners; ta 129->37ms, ms/view 391->306, PSNR 63.85 unchanged, default ON (GSPLAT_TT_TA_NO_CULL) bin=674080232d03df04", "data": "data#   bin="}, "iter_dir": "ttw-020"}
{"iter": 21, "idea": "S1: AoS proj_m_blendrec \u2014 blend reader gathers 1 contiguous 64B record/candidate instead of 7-9 random SoA pages; blend 198.5->192.7ms (-6), proj +4 (gather emits 120MB AoS buf), ms/view 306->304, PSNR 63.85 bit-identical. Modest win confirms blend is spin/latency-bound not txn-bound (next lever B4 multi-mover/kill-spin or B2 L1-resident). default ON (GSPLAT_TT_BLEND_AOS=0 reverts)", "decision": "keep", "reason": "63.85 >= 63.6", "metrics": {"hero_vs_ref": 63.85}, "timings": {"proj": 58.6, "ta": 36.9, "sort": 16.0, "blend": 192.7}, "ts": "2026-06-01T11:27:03-0700", "buildid": {"cpp": "cpp#61 365eb15 iter21: S1 AoS proj_m_blendrec default-ON bin=f19990afeefb461f", "data": "data#   bin="}, "iter_dir": "ttw-021"}
{"iter": 22, "idea": "T1 scatter-before-sort (GSPLAT_TT_TILE_BUCKET, default OFF): bin (sort_bin.cpp mode 1) scatters the FULL record {a,b,c,px,py,op,r,g,b,depth} into per-tile contiguous DRAM buckets in ARBITRARY (bin/gaussian) order, reusing the existing atomic-free per-core coalesce (record page e <-> keys/ids elem e, write to tile_recs[rowp[t]+curp[t]]). Sequential blendrec[g] reads (gaussian-major) + scatter WRITES; ZERO random DRAM reads to build the bucket (vs abandoned TILE_REC which read blendrec[sorted_id]=random). Bucket write-only here (radix+blend gather unchanged) so PSNR identical. Foundation for T2 (per-tile L1 load + L1 depth sort) + T3 (L1 cull+blend, kills gather+MB_CULL_SPIN). bin 8->27ms (unoptimized per-record barriered scatter; T1b ring-buffers).", "decision": "gate-off-infra", "reason": "63.85 >= 63.6 holds; infra, does not beat baseline alone (payoff lands with T2/T3)", "metrics": {"hero_vs_ref": 63.85}, "timings": {"proj": 58.5, "ta": 36.8, "sort": 35.4, "blend": 193.1}, "ts": "2026-06-01T12:52:00-0700", "buildid": {"cpp": "cpp#70 05dcb80 T1 scatter-before-sort bin emits per-tile full-record bucket bin=500c7a0f1f528d7e", "data": "data#   bin="}, "iter_dir": "ttw-022"}
{"iter": 23, "idea": "T2/T3 bucket-fed L1 blend (GSPLAT_TT_TILE_BUCKET, default OFF): blend reader bulk-loads each tile's dense record bucket DRAM->L1, STABLE LSD-radix depth-sorts in L1 (reproduces DRAM-radix order so cull_masks[cull_base+k] aligns), emits coeff rows from L1 records -> per-candidate ATTRIBUTE GATHER ELIMINATED. Correctness recovered to 63.85 (was 3.6dB) by iterating on Lb (dense bucket count) not L (sort_tile_ranges). T3 blend-time win BLOCKED: per-tile cull_masks->L1 bulk read needs a fixed ~512-iter busy-wait spin (=84ms, 109->192); falsified noc_async_read_barrier (spin0=37dB), inter-program Finish (BUCKET_FINISH=1 spin0=37dB; masks settled in DRAM still need spin), prefetch-before-sort (PREFETCH_MASK identical numbers; compute doesnt drain the read). Spin is a busy-wait on the sole reader core + each tile emit needs its own masks -> cant overlap. Clean removal (cull writes masks to core-local L1, same program) is FUSE_BLEND which overflows kernel-config ceiling (92688>70656). Unlock: bake mask into bucket record during cull (rides the spin-free settled-tile_recs load). Full path is net +20ms today (T1 scatter sort 16->36, blend flat) -> stays gated.", "decision": "gate-off-blocker", "reason": "gate holds 63.85 but does not beat baseline; documented platform spin blocker (opt/blend-data-movement-plan.md S6)", "metrics": {"hero_vs_ref": 63.85}, "timings": {"proj": 58.6, "ta": 36.8, "sort": 36.4, "blend": 192.4}, "ts": "2026-06-01T13:30:00-0700", "buildid": {"cpp": "cpp#71 T2T3 bucket L1 load+sort+blend gather-eliminated spin-blocked", "data": "data#   bin="}, "iter_dir": "ttw-023"}
{"iter": 24, "idea": "UNLOCK1 (mask-in-record) premise FALSIFIED + UNLOCK2 (scatter pipeline) is bandwidth-bound; bucket path stays gated. UNLOCK1: a fully SEPARATE cull program with its OWN distributed::Finish before blend STILL needs the 512-spin (FUSED_TILE=0 spin0=37.6dB/110ms, spin512=63.85/194) -> cull-stage writes are NOT made visible to a later blend read by any Finish; records read spin-free ONLY because written in the genuinely-separate sort-stage dispatch. So mask-in-record only works if the mask is computed DURING the sort stage, but the sort program is dataflow-only (no SFPU) -> needs the whole cull SFPU subsystem added to sort (major, code-ceiling risk). FUSE_BLEND re-measured: still 92688>70656 (22KB over, dominated by merged cull+blend SFPU compute; reader-shrink doesn't help; cull must not be retuned). UNLOCK2: replaced sort_bin synchronous per-record scatter with a REC_BATCH=16 ring (1 barrier/16) -> sort UNCHANGED at 36.3ms (was 35-36) because the +20ms is intrinsic BANDWIDTH (~1.28GB blendrec->tile_recs copy), not latency. Next: (a) SFPU cull moved into sort program (spin-free mask baked in record), (b) T5 quantize record 64->32B to halve scatter, (c) born-in-bucket-order records. Default production unchanged 63.85dB blend 192.8.", "decision": "gate-off-blocker", "reason": "gate holds 63.85 but bucket path cannot beat baseline; precise documented blocker after real effort on both unlock1 and FUSE_BLEND-resize (opt/blend-data-movement-plan.md S7)", "metrics": {"hero_vs_ref": 63.85}, "timings": {"proj": 58.5, "ta": 36.7, "sort": 36.3, "blend": 192.8}, "ts": "2026-06-01T14:45:00-0700", "buildid": {"cpp": "cpp#72 T1b ring scatter (bandwidth-bound) + unlock1/fuseblend falsified", "data": "data#   bin="}, "iter_dir": "ttw-024"}
{"iter": 25, "idea": "ROUTE A \u2014 the 70656B kernel-config ceiling IS RAISEABLE (load-bearing). Source: tt_metal/llrt/hal/tt-1xx/blackhole/bh_hal_tensix.cpp:43 `default_l1_kernel_config_size = 69*1024` (=70656). max_size = get_ringbuffer_size(TENSIX) = l1_unreserved_base - KERNEL_CONFIG_base, and l1_unreserved_base = L1_top - get_dev_size(DEFAULT_UNRESERVED); DEFAULT_UNRESERVED base/size both derive from that constant (base up, size down 1:1), so bumping it grows the ring 1:1 at the cost of per-core worker L1. No env override (grepped rtoptions). Bumped 69->128KB (ring 70656->131072, reserves +59KB/core of ~1.5MB; bucket uses ~210KB). Rebuilt prebuilt libtt_metal manually (cmake regen unsafe: tree configured with /usr/bin/cmake v4.3.2, host has /usr/local/bin/cmake v4.0.2): recompile bh_hal_tensix.cpp.o, RE-ARCHIVE libhal_1xx.a (gotcha: the .o is archived; relinking alone keeps stale obj), relink libtt_metal.so. gsplat RUNPATHs build/tt_metal/libtt_metal.so so no gsplat rebuild. RESULT: ceiling GONE, GSPLAT_TT_FUSE_BLEND=1 builds+binds+EXECUTES, blend 193->116ms (FUSED_TILE upload+exec+readback=112.9ms), ms/view 304->228. Production path unregressed (FUSE_BLEND off = 63.85dB/192.4ms). BUT FUSE_BLEND path = 30.07dB (first-ever execution of the fused scaffold). Image looks visually clean; diff heatmap concentrates on EDGES/overlap/detail (sky+road flat=no error) -> per-microblock blend or compositing-order class, NOT structural/color. Static audit PASSES: ids=sort_sorted_ids (sorted order), cull+blend read same order, mask packed via perm(g,m) (microblock-geometry correct), blend math bit-matches alpha_blend_compute_mb, DR_T=1/RGB=0/ramps init correct, output via tiles_to_image_mb_into same as production. Residual suspect: SFPU state/precision shared across cull-then-blend phases in one compute kernel, or a runtime CB-pipelining subtlety -> needs on-device DPRINT A/B vs the two-program blend. Bounded effort: banked the ceiling unlock, correctness debug is the next route.", "decision": "ceiling-cracked-correctness-blocked", "reason": "ROUTE A core deliverable achieved: ceiling raiseable + FUSE_BLEND builds/runs/measured (blend 116ms). Fused-path correctness 30.07dB localized to per-microblock blend (edge heatmap); all static checks pass; needs device DPRINT debug. tt-metal HAL change persists, correctness-neutral for production. See opt/blend-data-movement-plan.md S8.", "metrics": {"hero_vs_ref_fuseblend": 30.07, "hero_vs_ref_production": 63.85}, "timings": {"proj": 58.6, "ta": 37.0, "sort": 16.1, "blend_fuseblend": 116.1, "blend_production": 192.4}, "ts": "2026-06-01T14:35:00-0700", "buildid": {"cpp": "cpp#77 31fcec6 (unchanged) + tt-metal HAL ring 69->128KB", "data": "data#   bin="}, "iter_dir": "ttw-025"}
{"iter": 26, "idea": "FUSE_BLEND correctness debug: ROOT CAUSE = the cull SFPU phase non-deterministically corrupts the subsequent blend phase WITHIN the single fused program (datapath/DEST-bank hazard the two-program design avoids via fresh per-program config). Device DPRINT A/B: (1) per-gaussian inputs incl. microblock mask are bit-DETERMINISTIC & correct (sort -u collapses every (tile,p,gid) to one line) -> mask handoff cull->writer->CB_TILE_MASKS->reader->CB_MB_COEFF is NOT the bug; (2) CB_COLOR_OUT bf16 outputs are NON-deterministic in fused (two values/tile across passes) but deterministic in production, delta scales with depth L -> runtime hazard not static; (3) per-gaussian SFPU start_/done_ drain does NOT fix (not the cross-gaussian DR_R/G/B/T accumulation pipeline); (4) MATH-only hw_configure+pack_sync_init reinit does NOT fix (not a MATH config leak); (5) CULL_LEVEL sweep PINS it: level0 keep-all (no copy_tile, no cull SFPU)=DETERMINISTIC 44.13dB, level1 bbox (copy_tile(BOX)+v_if SFPU, no exp/recip)=NON-det 29.09dB, level3 full=NON-det ~30dB -> even the lightest cull SFPU+copy_tile datapath activity in the same program as blend triggers it. Unpack+pack formats ARE already reconfigured at cull->blend boundary yet bug persists -> residual hazard is below format-reconfig (SrcA/DEST bank reuse / DEST full-sync / SFPU LREG). Clean fix init_sfpu()/unary_op_init_common mid-kernel DEADLOCKS (re-runs UNPACK/PACK hw_configure with pending CBs; wedged device x2). BANKED, FUSE_BLEND gated OFF; needs LLK-level inter-phase pipeline reset OR ROUTE C (cull moved into sort program = separate programs, no shared config, also kills spin). Production re-verified 63.85dB/blend193.2ms/304.7 ms-view unregressed.", "shipped": false, "gated": "FUSE_BLEND default OFF", "hero_vs_ref_prod": 63.85, "blend_ms_prod": 193.2, "ms_view_prod": 304.7, "fused_blend_ms": 116.1, "fused_hero_vs_ref": 30.0, "next": "ROUTE C: SFPU microblock cull into SORT program (spin-free mask baked into record, separate programs avoid the fused datapath hazard); or isolate the non-deadlocking LLK cull->blend reset; then T5 quantize + born-in-bucket records.", "ts": "2026-06-01T18:20:00-0700", "metrics": {"hero_vs_ref": 63.85, "fused_hero_vs_ref": 30.0}, "timings": {"blend": 193.2, "ms_view": 304.7}, "reason": "ROUTE C: SFPU microblock cull into SORT program (spin-free mask baked into record, separate programs avoid the fused datapath hazard); or isolate the non-deadlocking LLK cull->blend reset; then T5 quantize + born-in-bucket records.", "iter_dir": "ttw-026"}
{"iter": 27, "idea": "FIX L1-bucket Lb>64 fast-producer race: MATH->UNPACK back-pressure ack + MATH cache-invalidate (gated GSPLAT_TT_BUCKET_CB_FENCE); HYPOTHESIS A proven via AB probe", "decision": "keep", "reason": "bucket fast path now 63.85 dB / 178.9 ms blend with no EMIT_SPIN; gated default OFF; production (FUSED_TILE) re-verified unregressed; next lever = fold the ~80ms cull pass", "metrics": {"hero_vs_ref": 63.85, "hero_vs_ref_bucket_fix": 63.85, "hero_vs_ref_bucket_before": 42.87}, "timings": {"proj": 58.5, "ta": 36.5, "sort": 15.7, "blend": 192.9, "blend_bucket_fix": 178.9, "ms_view_prod": 303.9, "ms_view_bucket": 372.9}, "ts": "2026-06-01T19:05:03-0700", "buildid": {"cpp": "cpp#91 ed9ba50 iter29 probe+CB fence bin=151d79e9ef8fcec4", "data": "data#   bin="}, "iter_dir": "ttw-027"}
{"iter": 28, "idea": "rowck split devcull", "decision": "keep", "reason": "63.85 >= 63.6", "metrics": {"hero_vs_ref": 63.85}, "timings": {"proj": 54.9, "ta": 128.6, "sort": 15.7, "blend": 421.1}, "ts": "2026-06-01T09:29:07-0700", "buildid": {"cpp": "cpp#44 b432e84 iter 28: rowck split devcull bin=ffc6d81de0e973ce", "data": "data#   bin="}, "iter_dir": "ttw-028"}
{"iter": 29, "idea": "rowck commutative devcull", "decision": "keep", "reason": "63.85 >= 63.6", "metrics": {"hero_vs_ref": 63.85}, "timings": {"proj": 54.4, "ta": 128.6, "sort": 15.7, "blend": 421.4}, "ts": "2026-06-01T09:31:47-0700", "buildid": {"cpp": "cpp#45 8d45aad iter 29: rowck commutative devcull bin=ffc6d81de0e973ce", "data": "data#   bin="}, "iter_dir": "ttw-029"}
