{"iter": 140, "idea": "DECISIVE GATE EXPERIMENT (Stage-0 falsification of the persistent-kernel rewrite's load-bearing assumption): can a single in-order per-core program OVERLAP an NCRISC-dataflow stage with an SFPU-compute stage so fused makespan drops toward max(NCRISC,SFPU) instead of sum? Smallest decisive hang-safe probe: a GATED (GSPLAT_TT_OVERLAP_PROBE, default-OFF, reversible) store-stress injected into the cull NCRISC reader (reader_tile_l1_cull.cpp). After each cb_push_back of a bucket slot (now draining on the SFPU/TRISC cull compute, microblock_cull_compute.cpp tile_mb_mask), the reader issues store_reps 32B noc_async_writes (sort-emit store-bound proxy) into a throwaway DRAM scratch ring, barrier every 64 -> single in-order CQ, NO 2nd CQ, NO intermediate Finish, CB-fence handshake only (respects the iter-52/55-59 hang class). Host (blend_device.cpp) forces a clean Finish after cull when the probe is on so cull_ms is the TRUE program makespan, and prints TTW_OVERLAP. Stores hit throwaway scratch -> output stays byte-identical (hero_vs_ref=100.00). Measure fused makespan (reps=R) vs barrier-separated sum = baseline SFPU-cull (reps=0) + the added NCRISC store stage, busiest-core device zones via Tracy (tile_l1_cull_rd reader wall, ovlp_store NCRISC store busy, tile_mb_mask SFPU), plus a same-core wall-clock concurrency check.", "decision": "diagnostic", "reason": "VERDICT = PROCEED. The load-bearing assumption HOLDS: NCRISC dataflow and SFPU compute run CONCURRENTLY on the same cores under one in-order program with CB handshaking; the fused makespan collapses to max(NCRISC,SFPU), hiding the ENTIRE SFPU stage. Device busiest-core per-view zones (cpp#123 bin=b4836c7dfcff6ca2, 30-view Tracy on yyzo-bh-07): BASELINE reps=0 (SFPU-cull alone) reader wall tile_l1_cull_rd = 21.99 ms == SFPU tile_mb_mask 22.39 ms (M0 ~= 22 ms; cull is internally balanced). FUSED reps=100000: reader wall (busiest core 14,2) = 73.66 ms (M1) of which ovlp_store NCRISC store-busy = 58.77 ms; SFPU compute UNCHANGED at 22.39 ms. Barrier-separated SUM = M1_ncrisc_stage(73.66) + M0_sfpu(21.99) = 95.65 ms; measured FUSED = 73.66 ms = max(73.66,22) -> the full ~22 ms SFPU stage is HIDDEN = 21.99 ms overlap = 23.0% reduction vs sum. Same-core wall-clock concurrency: NCRISC store window overlaps the SFPU zone 93.1% (vs 0% at reps=0). Host cull_ms scaling corroborates (reps 0->8k->100k->400k = 34->35->78->313 ms; adding 8k stores cost ~+1 ms because the SFPU absorbed it). ALL runs bit-identical (hero_vs_ref=100.00) and HANG-FREE (4 timed runs + 2 Tracy captures; the forced-Finish-after-cull ordering held with no wedge -- corroborates that the iter-55-59 hangs were the 2nd-CQ / intermediate-Finish-while-publish-pending class, NOT same-program NCRISC<->SFPU overlap). HONEST CAVEATS: (1) the store-stress is a SYNTHETIC sort-emit proxy (pure 32B writes, no divmod/pack) -> proves the MECHANISM and that piling a large NCRISC stage on top still hides the SFPU; the REAL sort-emit overlap efficiency is quantified in Stage 1. (2) The frame plateau is UNCHANGED at 173.1 ms (this iter is a microbench, no production path change; probe is committed default-OFF). The implied win: fusing the barrier-separated sort-emit (NCRISC ~32 ms, sort_bucket_emit) + cull (SFPU ~22 ms) pair should hide ~min(stage) -> proceed to staged L1-handoff (Stages 1-3 in tmp/hostfree-rewrite-scope-notes.md).", "metrics": {"hero_vs_ref": 100.0, "bit_identical": true, "baseline_cull_makespan_ms_M0": 21.99, "sfpu_compute_ms": 22.39, "fused_makespan_ms_M1": 73.66, "ncrisc_store_busy_ms_S": 58.77, "barrier_separated_sum_ms": 95.65, "overlap_hidden_ms": 21.99, "overlap_reduction_pct": 23.0, "store_window_sfpu_overlap_pct": 93.1, "store_window_sfpu_overlap_pct_baseline": 0.0, "host_cull_ms_reps0": 34.0, "host_cull_ms_reps8k": 35.0, "host_cull_ms_reps100k": 78.0, "host_cull_ms_reps400k": 313.0, "frame_ms_view": 173.1}, "timings": {"ms_view": 173.1, "blend": 173.1}, "iter_dir": "ttw-140", "verdict": "PROCEED", "ts": "2026-06-11T21:40:00-0700", "buildid": {"cpp": "cpp#123 3f4759e iter-140 Stage-0 NCRISC<->SFPU overlap probe (gated store-stress in cull reader) bin=b4836c7dfcff6ca2", "data": "data#   bin="}, "tracy": "opt/profiler/ttw-140/render.tracy"}
{"iter": 141, "idea": "Stage 1 of the staged persistent-kernel rewrite: L1-resident sort->cull handoff for the IN-BUDGET tile subset. Plan was to emit the depth-sorted PACK2 slab from the in-budget materialize permute directly into L1 in cull's vector layout, delete the tile_l1_cull_rd DRAM read for in-budget tiles, and fuse emit+cull under one in-order CQ (double-buffered per tile) so the SFPU cull hides under the NCRISC emit -- realizing the iter-140 NCRISC<->SFPU overlap mechanism on the REAL stages. MEASURE-FIRST disposition before attempting the hang-prone 3-program restructure (iter-55-59 class).", "decision": "blocked", "reason": "VERDICT = SPLIT/REVERT (no kernel change landed; 0 of 3 implementation tries consumed -- stopped on decisive measured/structural grounds BEFORE risking the hang-prone restructure, per MEASURE-FIRST + don't-wedge guardrails). The iter-140 mechanism is REAL and the cull SFPU does expose a large idle-NCRISC shadow (cull reader NOMATH floor 0.63 ms vs 21.99 ms wall => ~21.4 ms of idle NCRISC under the 22.39 ms SFPU cull). BUT the SCOPED Stage 1 (in-budget tiles only) is a SUB-NOISE frame lever for three compounding structural reasons, all from committed read-only scopes + a fresh ttw-141-base baseline: (1) The cull stage is ALREADY internally NCRISC<->SFPU-overlapped in shipping code -- reader_tile_l1_cull + microblock_cull_compute are ONE program (blend_device.cpp tile_l1_cull, single CreateProgram); iter-140 measured M0 = max(reader 21.99, SFPU 22.39) = 22.4 ms, i.e. the cull program is already at the fused optimum. There is no separate materialize->cull 'sum' inside the cull program to collapse. (2) The IN-BUDGET materialize work that Stage 1 can move into that shadow is only ~1.7 ms (iter-130 MEASURED: in-budget permute 1.7 ms vs overflow gather 24.6 ms busiest; sort_subchunk_materialize.cpp header). The dominant 12.5 ms materialize makespan (ttw-138) is the OVERFLOW GATHER, which Stage 1's scope explicitly leaves on the existing path. Moving the 1.7 ms in-budget permite off does NOT shrink the materialize makespan (12.5 ms busiest core is overflow-bound, a different core), so the materialize->cull barrier does not shrink. (3) The deleted in-budget slab DRAM round-trip is only ~0.57 ms and is ~98% SFPU-backpressured (iter-137 read-only scope) => deleting it nets ~0 ms wall. Net: fused-vs-sum frame delta for the SCOPED in-budget Stage 1 ~= 0-1.7 ms, far below the 23% (~20 ms) iter-140 microbench signal and well within frame view-to-view noise (ttw-141-base: avg 173.3, p50 175.2, min 142.1, max 210.9 ms). WHY THE MICROBENCH DOESN'T TRANSFER TO THE SCOPED STAGE: iter-140 piled a SYNTHETIC 73.66 ms NCRISC store-stress on top of the 22 ms SFPU (NCRISC >> SFPU regime, empty shadow) and the SFPU hid under it; the REAL in-budget emit is ~1.7 ms (NCRISC << SFPU), so there is essentially nothing to hide and the cull SFPU pole (22.4 ms) is unchanged. WHERE THE REAL LEVER ACTUALLY IS (recommendation, NOT this scope): the iter-140 row's own implied win is hiding the LARGE NCRISC stages -- sort_bucket_emit (32.1 ms) + materialize overflow (~12.5 ms) ~= 44 ms NCRISC -- under the cull+blend SFPU shadow (22.4 + 28.8 ~= 51 ms). That requires the FULL cross-stage per-tile pipeline (Stages 2-3, the high-risk 3-program -> persistent restructure), NOT the in-budget materialize->cull residency change. RECOMMENDATION: rescope Stage 1 to fuse the FULL sort-emit/materialize NCRISC (incl. overflow) under the cull SFPU shadow, OR skip the sub-noise in-budget step and design Stage 2 (blend) directly -- the L1-residency 'delete the DRAM read' framing saves ~0 because the readers are backpressure shadows; the only paying lever is filling the idle-NCRISC shadow with the BIG emit/scatter stages. SIDE FIX (KEEP, independent): repaired the CPU reference build broken since iter-133 -- backends/cpu_cpp/pybind_module.cpp + src/gsplat_tt/pfwc.h still called/declared the pre-iter-133 3-ptr pfwc_tt while render/host defines the 4-ptr (means-fused) version, so any _gsplat_cpu rebuild produced an undefined-symbol ImportError. Added the missing `means` arg / aligned the stale src header; hero_vs_cpu diagnostic restored to 63.95 dB. NO hangs (only the pristine baseline ran on device); reservation intact.", "metrics": {"hero_vs_ref": 100.0, "bit_identical": true, "hero_vs_cpu": 63.95, "frame_ms_view": 173.313, "frame_p50_ms": 175.2, "frame_min_ms": 142.1, "frame_max_ms": 210.9, "cull_program_makespan_ms_M0": 22.4, "cull_reader_ncrisc_ms": 21.99, "cull_sfpu_mask_ms": 22.39, "cull_reader_nomath_floor_ms": 0.63, "cull_idle_ncrisc_shadow_ms": 21.36, "in_budget_permute_ms": 1.7, "overflow_gather_ms_busiest": 24.6, "materialize_makespan_ms": 12.529, "in_budget_slab_round_trip_ms": 0.57, "scoped_stage1_frame_lever_ms_est": "0-1.7 (sub-noise)", "iter140_microbench_reduction_pct": 23.0, "implementation_tries_used": 0}, "timings": {"ms_view": 173.313, "blend": 173.313}, "iter_dir": "ttw-141", "verdict": "SPLIT/REVERT (scoped in-budget lever sub-noise; mechanism real; real lever = full emit+overflow under cull/blend SFPU shadow = Stage 2-3)", "ts": "2026-06-11T22:10:00-0700", "buildid": {"cpp": "cpp#123 3f4759e (pristine baseline; iter-141 made NO kernel/render_clean change) bin=b4836c7dfcff6ca2 + cpu-ref fix (pybind_module.cpp/pfwc.h, not in bin_artifact)", "data": "data#   bin="}}
{"iter": 142, "idea": "Task #18: split the 46.5 ms sort stage (SortCallTimings wired into stage_timers as stage_sort_* leaves) and cut what the device actually waits on inside it. Measured split refuted the '~36 ms host binning' premise: Pass A count and Pass B emit were already device kernels; host-serial time was ~2.4 ms. Four bit-identical cuts: (1) host_bin_layout_into: row-major passes, persistent tables, heap LPT, no build/upload of the dead dense recbase table; (2) subchunk directory uploaded from the host's build_subchunk_layout instead of the serial single-core sort_subchunk_directory kernel (deleted); (3) emit reads its own count-pass histogram row (new buf_bin_hist, arg 17) instead of re-scanning its tid/keep pages; (4) count pass batches 32 pages of NoC reads per barrier.", "decision": "keep", "reason": "A/B, 3 interleaved rounds per build inside one reservation on yyzo-bh-07 (Blackhole p100a), bicycle 30 views 1024x1024: avg_frame_ms 173.53 +/- 0.56 -> 166.63 +/- 0.05 (-6.90 ms, 5.76 -> 6.00 FPS); stage_sort 46.49 -> 40.00 (-6.50 ms). Leaves: bin_layout 1.98 -> 0.25, publish_wait 10.31 -> 8.02 (directory kernel gone), bin_emit 32.17 -> 30.26, bin_count 1.40 -> 0.90; project/tile_assign/blend unchanged within 0.02 ms. hero_vs_ref 100.00 dB in all six runs and all 30 dumped views byte-identical to the baseline build. Host bridge now ~0.65 ms (at its floor); sort is 99% device: emit 30.3, radix+publish 8.0, count 0.9. Next lever: de-stall sort_bucket_emit (R3), -5 to -10 ms expected. Detail: docs/sort-stage-split-2026-09-30.md.", "metrics": {"hero_vs_ref": 100.0, "bit_identical": true, "all_30_views_identical": true, "board": "yyzo-bh-07 (Blackhole p100a)", "frame_ms_view": 166.633, "frame_ms_view_baseline": 173.533, "frame_delta_ms": -6.9, "stage_sort_ms": 39.998, "stage_sort_ms_baseline": 46.493, "stage_sort_bin_count_ms": 0.897, "stage_sort_bin_hist_d2h_ms": 0.251, "stage_sort_bin_layout_ms": 0.249, "stage_sort_upload_ms": 0.07, "stage_sort_bin_emit_ms": 30.262, "stage_sort_publish_wait_ms": 8.016, "stage_project_ms": 36.961, "stage_tile_assign_ms": 21.792, "stage_blend_ms": 63.597, "ab_rounds": 3, "tracy_pv_makespan_ms": {"sort_bucket_emit": 30.863, "sort_subchunk_mat": 12.375, "sort_tile_depth": 7.157, "sort_bin_hist": 0.894, "sort_subchunk_dir": "absent (kernel removed)", "NCRISC-KERNEL": 123.133, "BRISC-FW": 157.783, "TRISC-KERNEL": 51.842, "note": "busiest-core per-view makespan, 30-view capture with device profiler on (perturbs timing)"}}, "timings": {"ms_view": 166.633, "blend": 166.633}, "iter_dir": "ttw-142", "verdict": "WIN (-6.9 ms/view, bit-identical; board yyzo-bh-07 p100a)", "ts": "2026-09-30T02:45:00-0700", "buildid": {"cpp": "gsplat_tt dede928 (smarton/tt-project-opt lineage; A/B baseline ab018fd)", "data": ""}, "screenshot": "opt/metal-screenshots/ttw-142/hero.png", "screenshot_diff": "opt/metal-screenshots/ttw-142/hero_diff10.png", "tracy": "opt/profiler/ttw-142/render.tracy"}
{"iter": 143, "idea": "Task #20 T-B(1): pack_rec builds the 32B record in a register array and stores it with one __builtin_memcpy instead of 8 volatile uint32 stores.", "decision": "revert", "reason": "yyzo-bh-07 p100a, bicycle 30 views: bin_emit 30.26 -> 30.43 ms, avg_frame_ms 166.9 vs base 166.6-168.2: flat. First try called library memcpy (unknown alignment); with __builtin_assume_aligned it inlines, still flat. The 8 L1 stores are not a stall source. Bit-identical. Not kept.", "metrics": {"hero_vs_ref": 100.0, "bit_identical": true, "all_30_views_identical": true, "board": "yyzo-bh-07 (Blackhole p100a)", "frame_ms_view": 166.85, "frame_ms_view_baseline": 167.08, "frame_delta_ms": -0.23, "stage_sort_bin_emit_ms": 30.43, "stage_sort_bin_emit_ms_baseline": 30.26, "hero_md5": "e3fefb116d860f99d92bba1ef51d820c"}, "timings": {"ms_view": 166.85, "blend": 166.85}, "iter_dir": "ttw-143", "verdict": "REVERT", "ts": "2026-09-30T03:30:00-0700", "buildid": {"cpp": "gsplat_tt uncommitted (variant) (smarton/tt-project-opt, task #20 T-B)", "data": ""}}
{"iter": 144, "idea": "Task #20 T-B(2): prefetch every distinct blendrec page named by a pair page (<=16) into the existing 16-page CB_REC ring under one barrier, instead of one read+barrier per gaussian.", "decision": "keep", "reason": "yyzo-bh-07 p100a, bicycle 30 views, interleaved with base: bin_emit 30.26 -> 27.01 ms (-3.25), avg_frame_ms 167.08 -> 163.53 (4 runs each, clean separation). All 30 views byte-identical, hero md5 e3fefb11.", "metrics": {"hero_vs_ref": 100.0, "bit_identical": true, "all_30_views_identical": true, "board": "yyzo-bh-07 (Blackhole p100a)", "frame_ms_view": 163.53, "frame_ms_view_baseline": 167.08, "frame_delta_ms": -3.55, "stage_sort_bin_emit_ms": 27.01, "stage_sort_bin_emit_ms_baseline": 30.26, "hero_md5": "e3fefb116d860f99d92bba1ef51d820c"}, "timings": {"ms_view": 163.53, "blend": 163.53}, "iter_dir": "ttw-144", "verdict": "KEEP", "ts": "2026-09-30T03:30:00-0700", "buildid": {"cpp": "gsplat_tt 2d287b7 (smarton/tt-project-opt, task #20 T-B)", "data": ""}}
{"iter": 145, "idea": "Task #20 T-B(3a): fold the first kept pair's depth-page read into the page's blendrec prefetch barrier.", "decision": "revert", "reason": "yyzo-bh-07 p100a: bin_emit 27.01 -> 26.82 ms, avg_frame_ms 163.5 (flat vs 163.4-163.7). Bit-identical. Below the 1% bar; not kept.", "metrics": {"hero_vs_ref": 100.0, "bit_identical": true, "all_30_views_identical": true, "board": "yyzo-bh-07 (Blackhole p100a)", "frame_ms_view": 163.5, "frame_ms_view_baseline": 163.53, "frame_delta_ms": -0.03, "stage_sort_bin_emit_ms": 26.82, "stage_sort_bin_emit_ms_baseline": 27.01, "hero_md5": "e3fefb116d860f99d92bba1ef51d820c"}, "timings": {"ms_view": 163.5, "blend": 163.5}, "iter_dir": "ttw-145", "verdict": "REVERT", "ts": "2026-09-30T03:30:00-0700", "buildid": {"cpp": "gsplat_tt uncommitted (variant) (smarton/tt-project-opt, task #20 T-B)", "data": ""}}
{"iter": 146, "idea": "Task #20 T-B(3): NCRISC has no FPU, so the emit loop's fp32 math (per-gaussian UNORM16 pack: 4x compare/mul/add/convert; per-pair tile-local mean subtract) was ~24 libgcc soft-float calls per gaussian. Replaced with integer, bit-exact RNE code (render/kernels/dataflow/sort_bin_fp32.h), float path kept only for NaN / out-of-range operands. Found by ablation: stubbing the float math cut bin_emit 27.0 -> 11.5 ms.", "decision": "keep", "reason": "yyzo-bh-07 p100a, bicycle 30 views: bin_emit 27.01 -> 17.03 ms (-9.98), avg_frame_ms 163.53 -> 153.38 (4 runs + dump run, clean separation). All 30 views byte-identical, hero md5 e3fefb11. Helper checked exhaustively on x86 (tests/unit/test_sort_bin_fp32.cpp: all 2^32 pack inputs, all 2^32 means x 4 tile origins + 2e9 random pairs, 0 mismatches; a rounding mutation is caught). Other NCRISC/BRISC kernels likely carry the same soft-float cost.", "metrics": {"hero_vs_ref": 100.0, "bit_identical": true, "all_30_views_identical": true, "board": "yyzo-bh-07 (Blackhole p100a)", "frame_ms_view": 153.38, "frame_ms_view_baseline": 163.53, "frame_delta_ms": -10.15, "stage_sort_bin_emit_ms": 17.03, "stage_sort_bin_emit_ms_baseline": 27.01, "hero_md5": "e3fefb116d860f99d92bba1ef51d820c", "ablation_nofloat_bin_emit_ms": 11.53, "ablation_nowrite_bin_emit_ms": 24.34}, "timings": {"ms_view": 153.38, "blend": 153.38}, "iter_dir": "ttw-146", "verdict": "KEEP", "ts": "2026-09-30T03:30:00-0700", "buildid": {"cpp": "gsplat_tt b13b2cc (smarton/tt-project-opt, task #20 T-B)", "data": ""}}
{"iter": 147, "idea": "Task #20 T-B(4): flush_recs/flush_packoc wait on noc_async_writes_flushed() (staging reuse) instead of a full write-ack barrier; the per-tile write-out barrier becomes one barrier at kernel end.", "decision": "keep", "reason": "yyzo-bh-07 p100a, bicycle 30 views: bin_emit 17.03 -> 16.15 ms (-0.88), avg_frame_ms 153.38 -> 152.6 (3 runs each, candidate max 152.6 < baseline min 153.3). All 30 views byte-identical. Cumulative task #20: bin_emit 30.26 -> 16.15 ms (-47%), avg_frame_ms 167.08 -> 152.6 (-14.5 ms, 5.99 -> 6.55 FPS).", "metrics": {"hero_vs_ref": 100.0, "bit_identical": true, "all_30_views_identical": true, "board": "yyzo-bh-07 (Blackhole p100a)", "frame_ms_view": 152.6, "frame_ms_view_baseline": 153.38, "frame_delta_ms": -0.78, "stage_sort_bin_emit_ms": 16.15, "stage_sort_bin_emit_ms_baseline": 17.03, "hero_md5": "e3fefb116d860f99d92bba1ef51d820c", "emit_cycles_per_pair_derived": {"base": 1434, "after_T-B": 765, "note": "derived: host-timed bin_emit x 1.35 GHz / (mean P 3.13M / 110 cores); Tracy capture pending (device lock busy)"}}, "timings": {"ms_view": 152.6, "blend": 152.6}, "iter_dir": "ttw-147", "verdict": "KEEP", "ts": "2026-09-30T03:30:00-0700", "buildid": {"cpp": "gsplat_tt 9fb8769 (smarton/tt-project-opt, task #20 T-B)", "data": ""}, "screenshot": "opt/metal-screenshots/ttw-147/hero.png", "screenshot_diff": "opt/metal-screenshots/ttw-147/hero_diff10.png"}
{"iter": 148, "idea": "Task #20 T-B(5): double-buffer the gid/tid/keep pair pages (second set in the host-allocated but unused CB 10) so page pg+1's reads ride page pg's blendrec barrier.", "decision": "revert", "reason": "yyzo-bh-07 p100a: bin_emit 16.15 -> 15.82 ms, avg_frame_ms 152.4/153.5/152.2 vs 152.6 x3: no frame gain, fails clean separation. Bit-identical. Not kept.", "metrics": {"hero_vs_ref": 100.0, "bit_identical": true, "all_30_views_identical": true, "board": "yyzo-bh-07 (Blackhole p100a)", "frame_ms_view": 152.7, "frame_ms_view_baseline": 152.6, "frame_delta_ms": 0.1, "stage_sort_bin_emit_ms": 15.82, "stage_sort_bin_emit_ms_baseline": 16.15, "hero_md5": "e3fefb116d860f99d92bba1ef51d820c"}, "timings": {"ms_view": 152.7, "blend": 152.7}, "iter_dir": "ttw-148", "verdict": "REVERT", "ts": "2026-09-30T03:30:00-0700", "buildid": {"cpp": "gsplat_tt uncommitted (variant) (smarton/tt-project-opt, task #20 T-B)", "data": ""}}
