{"iter": 30, "idea": "rowck commutative payload", "decision": "reject", "reason": "43.74 >= 63.6", "metrics": {"hero_vs_ref": 43.74}, "timings": {"proj": 54.5, "ta": 128.7, "sort": 15.6, "blend": 458.1}, "ts": "2026-06-01T09:32:49-0700", "buildid": {"cpp": "cpp#46 304a279 iter 30: rowck commutative payload bin=ffc6d81de0e973ce", "data": "data#   bin="}, "iter_dir": "ttw-030"}
{"iter": 31, "idea": "prove CULL_SPLIT is irreducible device SFPU; bank gated GSPLAT_TT_CULL_PIPELINE (~1ms); production unregressed", "decision": "keep", "reason": "63.85 >= 63.6", "metrics": {"hero_vs_ref": 63.85}, "timings": {"proj": 58.5, "ta": 36.9, "sort": 15.8, "blend": 192.9}, "ts": "2026-06-01T20:32:34-0700", "buildid": {"cpp": "cpp#94 2d1f93f iter31: gated cull->blend Finish pipeline (GSPLAT_TT_CULL_PIPELINE) bin=44b056d2c23003c2", "data": "data#   bin="}, "iter_dir": "ttw-031"}
{"iter": 32, "idea": "tile->core LOAD BALANCE diagnosis: cull+blend already LPT, within 1.3% optimal (heaviest tile 0.68x mean); no LPT win to ship \u2014 bank candidate-shrink as next lever; gated GSPLAT_TT_LPT_STATS; production unregressed", "decision": "keep", "reason": "63.85 >= 63.6", "metrics": {"hero_vs_ref": 63.85}, "timings": {"proj": 58.5, "ta": 36.7, "sort": 15.9, "blend": 192.4}, "ts": "2026-06-01T20:51:47-0700", "buildid": {"cpp": "cpp#95 fca7e14 iter32 GSPLAT_TT_LPT_STATS diagnostic bin=d808876bf643c7c7", "data": "data#   bin="}, "iter_dir": "ttw-032"}
{"iter": 33, "idea": "project gather load-rebalance: strided tile->core scatter (DEFAULT-ON), skew 2.12x->1.21x, proj 37->32.4ms @8v, 63.85dB held", "decision": "keep", "reason": "63.85 >= 63.6", "metrics": {"hero_vs_ref": 63.85}, "timings": {"proj": 43.6, "ta": 35.8, "sort": 16.1, "blend": 193.3}, "ts": "2026-06-01T21:15:33-0700", "buildid": {"cpp": "cpp#98 113519a iter33: PROJ_BALANCE strided gather default-ON (final) bin=ef5321c93ad08a69", "data": "data#   bin="}, "iter_dir": "ttw-033"}
{"iter": 34, "idea": "tile_assign K2 scatter rebalance: MEASURED non-win (gated GSPLAT_TT_TA_STATS proves write 1.0004x / set_g 1.037x \u2014 already balanced); bank diagnosis, no striding shipped; real lever = all-ones keep-mask H2D", "decision": "keep", "reason": "63.85 >= 63.6", "metrics": {"hero_vs_ref": 63.85}, "timings": {"proj": 43.5, "ta": 35.7, "sort": 15.9, "blend": 193.0}, "ts": "2026-06-01T21:32:30-0700", "buildid": {"cpp": "cpp#102 bfdd743 iter 34: tile_assign K2 scatter rebalance: MEASURED non-win (gated GSPLAT_TT_TA_STATS proves write 1.0004x / set_g 1.037x \u2014 already balanced); bank diagnosis, no striding shipped; real lever = all-ones keep-mask H2D bin=311cebf12b26152c", "data": "data#   bin="}, "iter_dir": "ttw-034"}
{"iter": 35, "idea": "tile_assign: eliminate per-frame all-ones keep-mask H2D (fill buf_keep once on grow, cache buf_keep_all_ones) \u2014 ta 21.2->10.2ms, ms/view 183.4->173.5 @8v, 63.85dB bit-identical", "decision": "keep", "reason": "63.85 >= 63.6", "metrics": {"hero_vs_ref": 63.85}, "timings": {"proj": 43.6, "ta": 25.0, "sort": 16.5, "blend": 192.5}, "ts": "2026-06-01T21:36:29-0700", "buildid": {"cpp": "cpp#104 65728fa iter 35: tile_assign: eliminate per-frame all-ones keep-mask H2D (fill buf_keep once on grow, cache buf_keep_all_ones) \u2014 ta 21.2->10.2ms, ms/view 183.4->173.5 @8v, 63.85dB bit-identical bin=99fbd2daee94602b", "data": "data#   bin="}, "iter_dir": "ttw-035"}
{"iter": 37, "idea": "project count->scan->scatter fusion (GSPLAT_TT_PROJ_DEVICE_SCAN default-ON): no inter-kernel Finish, pre-size to padded_n ceiling so scatter needs no host M, count-only readback drops depth D2H \u2014 proj 32.4->28.3, ms/view 173.2->169.6 @8v, 63.85dB bit-identical; per-frame project Finish 3->0", "decision": "keep", "reason": "63.85 >= 63.6", "metrics": {"hero_vs_ref": 63.85}, "timings": {"proj": 39.3, "ta": 25.0, "sort": 16.0, "blend": 194.0}, "ts": "2026-06-01T22:38:32-0700", "buildid": {"cpp": "cpp#107 944ba1a iter 37: project count->scan->scatter fusion DEFAULT-ON (proj 32.4->28.3, ms/view 173.2->169.6 @8v, 63.85dB) bin=19804835fbfaf16b", "data": "data#   bin="}, "iter_dir": "ttw-037"}
{"iter": 38, "idea": "sort bin host-bridge measurement (GSPLAT_TT_SORT_TIMING gated diag, default-off): split bin into count-kernel ~1ms / hist-D2H 0.26 / host-build 1.6 / H2D 0.29 \u2014 sort host bridge = ~2.0-2.35ms/frame, host_build dominant; banked as STEP-4 sort on-device-LPT target (plan 9.4)", "decision": "keep", "reason": "63.85 >= 63.6", "metrics": {"hero_vs_ref": 63.85}, "timings": {"proj": 39.3, "ta": 25.0, "sort": 15.9, "blend": 194.2}, "ts": "2026-06-01T22:43:59-0700", "buildid": {"cpp": "cpp#108 8eb62c8 iter 38 diag: GSPLAT_TT_SORT_TIMING split of bin into count-kernel/D2H/host-build (gated, default off) bin=90f66c610cac25a2", "data": "data#   bin="}, "iter_dir": "ttw-038"}
{"iter": 39, "idea": "Phase A endgame verify (cpp#121 0c72479): JIT warmup A1/A2 + sort->blend pipe + Tracy renames on ideal TILE_BUCKET path; 63.85dB held. Fixed per-iter screenshot logging over SSH (devrun forwards TTW_ITER_DIR; verify_cmd iter-dir unquoted; iterate parses shot= from SUMMARY not devrun banner). bicycle.ply re-synced full on device (was truncated to 53MB)", "decision": "keep", "reason": "63.85 >= 63.6", "metrics": {"hero_vs_ref": 63.85}, "timings": {"proj": 39.3, "ta": 24.9, "sort": 204.2, "blend": 0.0}, "iter_dir": "ttw-039", "ts": "2026-06-02T10:31:46-0700", "buildid": {"cpp": "cpp#121 0c72479 rebuild Tracy zone kernels bin=d193d161f0d6fd76", "data": "data#   bin="}}
{"iter": 40, "idea": "M0: 32B L1 record + pre-sized per-tile bucket scatter w/ atomic cursors (GSPLAT_TT_L1_RECORD), reads back into existing sort+blend; ideal path 63.85dB held", "decision": "keep", "reason": "63.85 >= 63.6", "metrics": {"hero_vs_ref": 63.85}, "timings": {"proj": 39.3, "ta": 25.0, "sort": 203.9, "blend": 0.0}, "iter_dir": "ttw-040", "ts": "2026-06-02T11:56:52-0700", "buildid": {"cpp": "cpp#122 e2a6ee4 iter 40: M0: 32B L1 record + pre-sized per-tile bucket scatter w/ atomic cursors (GSPLAT_TT_L1_RECORD), reads back into existing sort+blend; ideal path 63.85dB held bin=d193d161f0d6fd76", "data": "data#   bin="}}
{"iter": 41, "idea": "M0 (genuine): 32B L1 record + per-tile bucket scatter; consume-side fixed \u2014 64B-paged DRAM record (low 32B), fp32 cov + tile-local mean, UNORM16 opacity/color ([0,1] fields => ~30x tighter than fp16); 63.85dB", "decision": "keep", "reason": "63.85 >= 63.6", "metrics": {"hero_vs_ref": 63.85}, "timings": {"proj": 39.4, "ta": 24.9, "sort": 232.2, "blend": 0.0}, "iter_dir": "ttw-041", "ts": "2026-06-02T15:40:44-0700", "buildid": {"cpp": "cpp#138 138e943 iter 41: M0 (genuine): 32B L1 record + per-tile bucket scatter; consume-side fixed \u2014 64B-paged DRAM record (low 32B), fp32 cov + tile-local mean, UNORM16 opacity/color ([0,1] fields => ~30x tighter than fp16); 63.85dB bin=6f97ac90352414ed", "data": "data#1 b703f70 sync tracy-041 capture script bin=d193d161f0d6fd76"}}
{"iter": 42, "idea": "M1: L1-resident LSD radix sort over 32B records; bit-order proven == DRAM reference (on-device: mono=0 + key-multiset perm=0 across 1100 bucket tiles/all cores, cull-mask alignment intact => 42dB failure mode absent); 63.85dB", "decision": "keep", "reason": "63.85 >= 63.6", "metrics": {"hero_vs_ref": 63.85}, "timings": {"proj": 39.3, "ta": 24.8, "sort": 232.8, "blend": 0.0}, "iter_dir": "ttw-042", "ts": "2026-06-02T16:18:32-0700", "buildid": {"cpp": "cpp#142 7b7966a iter 42: M1: L1-resident LSD radix sort over 32B records; bit-order proven == DRAM reference (on-device: mono=0 + key-multiset perm=0 across 1100 bucket tiles/all cores, cull-mask alignment intact => 42dB failure mode absent); 63.85dB bin=58ca522fd5ed289c", "data": "data#1 b703f70 sync tracy-041 capture script bin=d193d161f0d6fd76"}}
{"iter": 43, "idea": "M2(bin): drop dead 64B tile_recs dense scatter on L1_RECORD path (~216MB/frame dead DRAM writes removed; blend reads only 32B buf_l1_recs, fallback gathers proj_m_*); bin 43->41ms, sort 52.8->50.8, ms/view 304.9->297.3; 63.85dB bit-identical", "decision": "keep", "reason": "63.85 >= 63.6", "metrics": {"hero_vs_ref": 63.85}, "timings": {"proj": 39.3, "ta": 24.8, "sort": 229.9, "blend": 0.0}, "iter_dir": "ttw-043", "ts": "2026-06-02T16:41:36-0700", "buildid": {"cpp": "cpp#144 fc12738 iter 43: M2(bin): drop dead 64B tile_recs dense scatter on L1_RECORD path (~216MB/frame dead DRAM writes removed; blend reads only 32B buf_l1_recs, fallback gathers proj_m_*); bin 43->41ms, sort 52.8->50.8, ms/view 304.9->297.3; 63.85dB bit-identical bin=3ccfa6b62ec6ce68", "data": "data#1 b703f70 sync tracy-041 capture script bin=d193d161f0d6fd76"}}
{"iter": 44, "idea": "M2 \u00a76 transmittance early-out: gated dense-tile block spill/reload (T->fp32 L1 CBs, uniform max-T break). Correct (EO-probe PSNR 63.85=baseline, bit-stable); default-off (GSPLAT_TT_BLEND_EARLYOUT). Foundation for microblock-major early-out.", "decision": "keep", "reason": "63.85 >= 63.6", "metrics": {"hero_vs_ref": 63.85}, "timings": {"proj": 39.3, "ta": 24.8, "sort": 230.2, "blend": 0.0}, "iter_dir": "ttw-044", "ts": "2026-06-02T18:36:30-0700", "buildid": {"cpp": "cpp#148 b85fbf9 iter 44: M2 \u00a76 transmittance early-out: gated dense-tile block spill/reload (T->fp32 L1 CBs, uniform max-T break). Correct (EO-probe PSNR 63.85=baseline, bit-stable); default-off (GSPLAT_TT_BLEND_EARLYOUT). Foundation for microblock-major early-out. bin=7532b9d694030cc4", "data": "data#1 b703f70 sync tracy-041 capture script bin=d193d161f0d6fd76"}}
{"iter": 45, "idea": "Part B: de-lump device timers \u2014 report SORT/CULL/BLEND ms separately (cull+blend were lumped under the sort host-timer). Continuation now plumbs cull_ms/blend_ms out; measurement-only, PSNR bit-identical.", "decision": "keep", "reason": "63.85 >= 63.6", "metrics": {"hero_vs_ref": 63.85}, "timings": {"proj": 39.3, "ta": 24.9, "sort": 46.8, "cull": 0.0, "blend": 182.5}, "iter_dir": "ttw-045", "ts": "2026-06-02T18:51:05-0700", "buildid": {"cpp": "cpp#150 099fe42 iter 45: Part B: de-lump device timers \u2014 report SORT/CULL/BLEND ms separately (cull+blend were lumped under the sort host-timer). Continuation now plumbs cull_ms/blend_ms out; measurement-only, PSNR bit-identical. bin=bbefdeeada99b0a4", "data": "data#1 b703f70 sync tracy-041 capture script bin=d193d161f0d6fd76"}}
{"iter": 46, "idea": "Part A: M2 \u00a76 per-microblock transmittance early-out \u2014 replace iter-44's tile-level break with a true per-microblock done-mask (spilled-T scan groups px by SFPU vector V=(r&~1)|(c&1); clear keep-bit M when all 32 px of mb M have T<eps; subsequent gaussians AND ~done into their coverage mask). PROVEN CORRECT: 63.85-63.86 dB across EO_BLK 64..768. Gated-off (GSPLAT_TT_BLEND_EARLYOUT): perf-neutral because the resident blend is READER-GATHER-bound, not SFPU-compute-bound (smaller blocks monotonically worse: 768->184.6 256->186.8 128->188.7 64->193.5ms) \u2014 the compute early-out skips SFPU math but the reader still gathers every candidate. Next lever: reader-side tile-saturation tail-skip.", "decision": "keep", "reason": "63.85 >= 63.6", "metrics": {"hero_vs_ref": 63.85}, "timings": {"proj": 39.3, "ta": 25.0, "sort": 46.2, "cull": 0.0, "blend": 184.3}, "iter_dir": "ttw-046", "ts": "2026-06-02T19:05:17-0700", "buildid": {"cpp": "cpp#152 bb52a1d iter 46: Part A: M2 \u00a76 per-microblock transmittance early-out \u2014 replace iter-44's tile-level break with a true per-microblock done-mask (spilled-T scan groups px by SFPU vector V=(r&~1)|(c&1); clear keep-bit M when all 32 px of mb M have T<eps; subsequent gaussians AND ~done into their coverage mask). PROVEN CORRECT: 63.85-63.86 dB across EO_BLK 64..768. Gated-off (GSPLAT_TT_BLEND_EARLYOUT): perf-neutral because the resident blend is READER-GATHER-bound, not SFPU-compute-bound (smaller blocks monotonically worse: 768->184.6 256->186.8 128->188.7 64->193.5ms) \u2014 the compute early-out skips SFPU math but the reader still gathers every candidate. Next lever: reader-side tile-saturation tail-skip. bin=12bb207ef9ce5a5e", "data": "data#1 b703f70 sync tracy-041 capture script bin=d193d161f0d6fd76"}}
{"iter": 47, "idea": "MEASURE-FIRST blend breakdown (device per-tile-class zones rd_bk_emit/rd_overflow/cp_inb/cp_ovf + host TILE_HISTO). Hero: in-budget 914 tiles/2.01M cand (59.8%), overflow 110 tiles/1.36M cand (40.2%), max_tile_n=25699>FIT. Blend makespan ~93ms (reader~=compute co-equal) + separate cull ~80ms = lumped host blend 182.5. In-budget CO-LIMITED: reader-emit 824 ~= compute-SFPU 844 (load+sort only ~286). Busiest cores are OVERFLOW-gather-dominated (top core overflow 449 vs emit 181, 30v totals). Tailskip scaffold gated-off (deadlock-free 63.85 but blend 185.8>182.5, not a win). Measurement-only, PSNR 63.85 bit-identical.", "decision": "keep", "reason": "63.85 >= 63.6", "metrics": {"hero_vs_ref": 63.85}, "timings": {"proj": 39.3, "ta": 24.9, "sort": 45.7, "cull": 0.0, "blend": 184.0}, "iter_dir": "ttw-047", "ts": "2026-06-02T20:04:01-0700", "buildid": {"cpp": "cpp#156 f18c3c3 iter 47: MEASURE-FIRST blend breakdown (device per-tile-class zones rd_bk_emit/rd_overflow/cp_inb/cp_ovf + host TILE_HISTO). Hero: in-budget 914 tiles/2.01M cand (59.8%), overflow 110 tiles/1.36M cand (40.2%), max_tile_n=25699>FIT. Blend makespan ~93ms (reader~=compute co-equal) + separate cull ~80ms = lumped host blend 182.5. In-budget CO-LIMITED: reader-emit 824 ~= compute-SFPU 844 (load+sort only ~286). Busiest cores are OVERFLOW-gather-dominated (top core overflow 449 vs emit 181, 30v totals). Tailskip scaffold gated-off (deadlock-free 63.85 but blend 185.8>182.5, not a win). Measurement-only, PSNR 63.85 bit-identical. bin=325ef2bf2c6a5942", "data": "data#1 b703f70 sync tracy-041 capture script bin=d193d161f0d6fd76"}}
{"iter": 48, "idea": "iter48: post-sort subchunk table + per-subchunk cull/blend dispatch (sort unchanged)", "decision": "keep", "reason": "63.85 >= 63.6", "metrics": {"hero_vs_ref": 63.85}, "timings": {"ms_view": 288.378, "blend": 288.378}, "iter_dir": "ttw-048", "ts": "2026-06-03T02:24:21-0700", "buildid": {"cpp": "cpp#157 9f1d618 iter 48: iter48: post-sort subchunk table + per-subchunk cull/blend dispatch (sort unchanged) bin=69df429df7353d46", "data": "data#1 b703f70 sync tracy-041 capture script bin=d193d161f0d6fd76"}}
{"iter": 49, "idea": "iter49: split bulk L1 CB rings (CB_BUCKET_BULK/BMASK_BULK); in-budget bucket scratch-only (no push); bulk L1 load + coeff emit for overflow", "decision": "keep", "reason": "63.85 >= 63.6", "metrics": {"hero_vs_ref": 63.85}, "timings": {"ms_view": 289.781, "blend": 289.781}, "iter_dir": "ttw-049", "ts": "2026-06-03T08:47:00-0700", "buildid": {"cpp": "cpp#176 db9dcd0 iter49: bulk L1 load + coeff emit; CB_BUCKET scratch-only deadlock fix bin=fd5e7e03a5c64c53", "data": "data#1 b703f70 sync tracy-041 capture script bin=d193d161f0d6fd76"}}
{"iter": 50, "idea": "PACK2: two 32B splats per 64B page in sort scatter + in-budget reader unpack; [PACK2] host stats; overflow still gid-gather", "decision": "keep", "reason": "63.85 >= 63.6", "metrics": {"hero_vs_ref": 63.85}, "timings": {"ms_view": 290.247, "blend": 290.247}, "iter_dir": "ttw-050", "ts": "2026-06-03T09:35:26-0700", "buildid": {"cpp": "cpp#179 840a23f iter50: overflow subchunk gather by gid (PACK2 in-budget only) bin=97fa69bd3600dd42", "data": "data#1 b703f70 sync tracy-041 capture script bin=d193d161f0d6fd76"}}
{"iter": 51, "idea": "Double-buffer overflow subchunks; PACK2 bulk + MB_FLAG_L1_BULK (cp_l1_blend), 2x CB_BMASK depth", "decision": "keep", "reason": "63.84 >= 63.6", "metrics": {"hero_vs_ref": 63.84}, "timings": {"ms_view": 242.075, "blend": 242.075}, "iter_dir": "ttw-051", "ts": "2026-06-03T09:40:59-0700", "buildid": {"cpp": "cpp#178 e6d43d4 iter51: double-buffer overflow PACK2 l1_bulk bin=0a5e2d9edd16b821", "data": "data#1 b703f70 sync tracy-041 capture script bin=d193d161f0d6fd76"}}
{"iter": 52, "idea": "MB saturation EO: iter-46 per-mb keep-mask from resident T (subchunk-end T spill+scan, AND into dispatch mask). Blocked: tile_regs_commit+pack inside active blend wedges device (~10min hang at warmup); in-blend v_if/step-mask either SFPI ICE or 7.98dB; reverted to iter-51.", "decision": "blocked", "reason": "device hang on mb_sat_refresh_keep; no gate run", "metrics": {}, "timings": {}, "iter_dir": "ttw-052", "ts": "2026-06-03T10:45:00-0700", "buildid": {"cpp": "cpp#186 3076bac iter52 blocked (reverted to e6d43d4)", "data": "data#1 b703f70"}}
{"iter": 53, "idea": "Monolith A+B+C: sort_subchunk_materialize + device dir + unified rd_l1_bulk only (D not done). Subagent stalled; verify hung after publish=601ms (payload_pages=1684771); 3 device attempts.", "decision": "blocked", "reason": "device hang/timeout post-sort materialize; split per 3-try rule \u2014 next: step A only on e6d43d4 blend path", "metrics": {}, "timings": {}, "iter_dir": "ttw-053", "ts": "2026-06-03T18:30:00-0700", "buildid": {"cpp": "cpp#180 c168a45 iter53 WIP monolith (not kept)", "data": "data#1 b703f70"}}
{"iter": 54, "idea": "Step A only: sort_subchunk_materialize + host dir/prefix (blend iter-51). Mat after blend Finish; page-align subchunk_dir; payload_pages~1.68M.", "decision": "keep", "reason": "63.84 >= 63.6", "metrics": {"hero_vs_ref": 63.84}, "timings": {"ms_view": 268.623, "blend": 268.623, "materialize_ms_per_view": 26}, "iter_dir": "ttw-054", "ts": "2026-06-03T19:24:30-0700", "buildid": {"cpp": "cpp#184 067ba8e iter54: step A PACK2 subchunk materialize (mat after pipe) bin=ec39eb0b29e17646", "data": "data#1 b703f70 sync tracy-041 capture script bin=d193d161f0d6fd76"}}
{"iter": 55, "idea": "Step B: sort_subchunk_directory at publish writes blend_subchunk_meta+dir+prefix; remove host build_subchunk_plan from blend (iter-51 reader path unchanged).", "decision": "keep", "reason": "63.84 >= 63.6", "metrics": {"hero_vs_ref": 63.84}, "timings": {"ms_view": 270.74, "blend": 270.74, "materialize_ms_per_view": 27}, "iter_dir": "ttw-055", "ts": "2026-06-03T19:30:15-0700", "buildid": {"cpp": "cpp#186 bin=f370771f8dc12f19 iter55: step B device subchunk directory at publish", "data": "data#1 b703f70 sync tracy-041 capture script bin=d193d161f0d6fd76"}}
{"iter": 56, "idea": "Step C blocked (3-try): unified payload reader (bulk DMA sort_subchunk_payload+dir, cp_l1_blend only; drop rd_bk_emit/cp_inb/gid gather). Required mat-before-blend + host dir H2D; 4 device attempts: hero_vs_ref=10.18dB tile-grid corruption (black/misaligned tiles); mat-before-blend+iter55 reader hung >25min on device. Materialize never gate-tested at blend until C. Split: C1 overflow-only payload reader; C2 in-budget; fix device-dir meta [dir_base,num_sc] vs [num_sc,count]; DPRINT dir/payload spot-check.", "decision": "blocked", "reason": "hero_vs_ref=10.18 << 63.6 after 3+ tries; revert render/ to 5624b96", "metrics": {"hero_vs_ref": 10.18}, "timings": {"ms_view": 316.8, "blend": 316.8, "materialize_ms_per_view": 38}, "iter_dir": "ttw-056", "ts": "2026-06-03T19:40:00-0700", "buildid": {"cpp": "cpp#191 blocked step C (reverted to 5624b96)", "data": "data#1 b703f70"}}
{"iter": 57, "idea": "Step C1 blocked (3-try): overflow-only payload reader + dir meta [dir_base,num_sc] + mat-before-blend. Tries: build-ID fail; hang post-JIT (no SUBCHUNK); 600s timeout hang same. Anchor 5624b96.", "decision": "blocked", "reason": "device hang at first view after JIT warmup; no gate", "metrics": {}, "timings": {}, "iter_dir": "ttw-057", "ts": "2026-06-03T20:15:00-0700", "buildid": {"cpp": "cpp#192 blocked C1 (revert to 5624b96)", "data": "data#1 b703f70"}}
{"iter": 58, "idea": "Narrow debug: mat-before-blend ONLY (iter-55 reader). Try1: mat+Finish before blend \u2192 hang post-JIT no SUBCHUNK (repro). Try2: mat enqueue deferred Finish \u2192 exit 255 ~12s post-JIT. Try3: 5624b96 baseline also hung (device wedged after SIGKILL). Bisect: early Finish breaks sort_blend_pipe single-CQ drain.", "decision": "blocked", "reason": "hang reproduced; root cause documented; device needs recover before C1", "metrics": {}, "timings": {}, "iter_dir": "ttw-058", "ts": "2026-06-03T21:45:00-0700", "buildid": {"cpp": "cpp#195 iter58 blocked (revert 5624b96)", "data": "data#1 b703f70"}}
{"iter": 59, "idea": "Mat-before-blend in sort_blend_pipe. Try1: mat enqueue-only on shared CQ \u2192 hang blend Finish. Try2: 2 HW CQs \u2014 Finish(CQ0) after publish+dir, mat+Finish(CQ1), then cull+blend on CQ0; materialize_ms=712 then hang (no SUMMARY). Iter-55 reader unchanged.", "decision": "blocked", "reason": "mat-before-blend hangs post-mat at blend Finish (try1+try2); revert 5624b96", "metrics": {}, "timings": {"materialize_ms_smoke": 712.22}, "iter_dir": "ttw-059", "ts": "2026-06-03T22:46:00-0700", "buildid": {"cpp": "cpp#202 iter59 try2 blocked (revert 5624b96)", "data": "data#1 b703f70"}}
{"iter": 60, "idea": "Step D (ttw-060): tile-local L1 cull on loaded subchunk \u2014 reader_tile_l1_cull + microblock_cull_compute (TILE_L1_CULL) + writer_tile_l1_mask; drop global cull_global_mb; iter-55 reader unchanged; no mat-before-blend. Try1: L1 mesh cull_masks clashed with cull CBs. Try2: DRAM masks + MB_TILE_L1_MASKS (no spin).", "decision": "keep", "reason": "63.84 >= 63.6", "metrics": {"hero_vs_ref": 63.84}, "timings": {"ms_view": 295.6, "blend": 295.6}, "iter_dir": "ttw-060", "ts": "2026-06-03T22:56:00-0700", "buildid": {"cpp": "cpp#205 5624b96 iter60 step D tile-local L1 cull bin=9b194864dbec80ed", "data": "data#1 b703f70"}}
{"iter": 61, "idea": "Fuse tile_l1_cull into blend reader (MB_FUSE_TILE_L1_CULL). Try3: blend hang >30min; Try4-5: ARC timeout. WIP local, no gate.", "decision": "blocked", "reason": "no SUMMARY; device ARC/SSH after hang", "metrics": {}, "timings": {}, "iter_dir": "ttw-061", "ts": "2026-06-04T00:10:00-0700", "buildid": {"cpp": "iter61 WIP fuse (not kept)", "data": "data#1 b703f70"}}
