{"iter": 156, "idea": "Task #41: verify the microblock keep test for thin Gaussians (suspected cause of the task-#28 spoke seams at contrib_floor 1/255), fix, and re-try adopting 1/255.", "decision": "keep", "reason": "Mask check (hero, floor 1/255, yyzo-bh-07 Blackhole p100a): device keep mask vs exact fp64 box-min over 3.37M (gaussian,tile) pairs x 32 microblocks: 1657 device culls the fp64 test would keep, all borderline (SFPU log, m2 within 1e-3 of thr) with peak pixel alpha <= 0.0039 < 1/255; 0 harmful false culls. The keep test is correct. Real cause: the mask keeps a whole 8x4 block when any pixel reaches the floor, so sub-floor tails of faint haze (hero pixel 459,600: 4988 of 5168 pairs below 1/255, together +52 levels) were kept in some blocks and dropped in the next. Fix: per-pixel floor in the blend (alpha < floor -> 0, the GPU 3DGS rule), BLEND_PIXEL_FLOOR, on by default. Device output matches an fp64 CPU per-pixel render of the same records within 1 level. Visual check, 30 views vs old floor: diff seam ratios 1.00-1.07 (mask-only 1/255 was 1.11-1.19), no grid structure in full-res side-by-side or x16 heatmaps; diff follows scene edges (haze in front of spokes, pillars). PSNR vs old golden 42.2-43.2 dB. Adopted: contrib_floor 1/16384 -> 1/255, old golden archived, new golden = this render. Speed (2 interleaved rounds, base 93aa708): 107.75 -> 103.23 ms/view (-4.52, -4.2%), stage_blend 49.62 -> 44.80. The pixel-floor compare costs ~0.5 ms/view (measured before rebase: 115.2 mask-only vs 115.7).", "metrics": {"board": "yyzo-bh-07 (Blackhole p100a)", "hero_vs_ref": 100.0, "hero_vs_old_golden": 42.49, "bit_identical": false, "frame_ms_view": 103.234, "frame_ms_view_baseline": 107.752, "frame_delta_ms": -4.518, "fps": 9.69, "fps_baseline": 9.28, "stage_blend_ms": 44.805, "stage_blend_ms_baseline": 49.625, "ab_rounds": 2, "mask_pairs": 3369033, "mask_false_cull": 1657, "mask_false_cull_peak_alpha_max": 0.00388, "mask_false_cull_harmful": 0, "seam_diff_max_f255pf": 1.067, "seam_diff_max_f255_maskonly": 1.192, "psnr_vs_old_min": 42.24, "psnr_vs_old_max": 43.2}, "timings": {"ms_view": 103.234, "blend": 44.805}, "iter_dir": "ttw-156", "verdict": "KEEP (contrib_floor 1/255 + per-pixel blend floor: seam-free, 107.75 -> 103.23 ms/view; board yyzo-bh-07 p100a)", "ts": "2026-09-30T06:05:00-0700", "buildid": {"cpp": "gsplat_tt ttp/t41 on 93aa708 (BLEND_PIXEL_FLOOR default on, cameras_v2 floor 1/255)", "data": ""}, "screenshot": "opt/metal-screenshots/ttw-156/hero.png", "screenshot_diff": "opt/metal-screenshots/ttw-156/hero_diff10.png"}
{"iter": 157, "idea": "Task #34: split tile_assign K1 bbox (ta_gauss_aabb) and K2 scatter (ta_bucket_scatter) over BRISC + NCRISC (dual data mover): contiguous range split, private CBs, byte-identical outputs.", "decision": "keep", "reason": "A/B on yyzo-bh-07 (Blackhole p100a), bicycle 30 views, 3 rounds each, HEAD 685f77b vs split: 103.37 -> 96.97 ms/view (-6.39), stage tile_assign 14.72 -> 8.90 ms (-5.81). All 30 views byte-identical (md5 of dumped npy/png). Host model test: 1353 split cases, 0 mismatches. Tracy (pre-rebase base c259cfa, same board, tile_assign kernels unchanged since): ta_gauss_aabb 9.20 -> 4.61 ms, ta_bucket_scatter 10.49 -> 5.39 ms (both now on BRISC,NCRISC). Pre-rebase A/B on c259cfa was 145.56 -> 136.08 ms/view (-9.49); the smaller delta now is because other tasks already cut tile_assign 21.8 -> 14.7 ms.", "metrics": {"board": "yyzo-bh-07 (Blackhole p100a)", "bit_identical": true, "frame_ms_view": 96.972, "frame_ms_view_baseline": 103.365, "frame_delta_ms": -6.393, "fps": 10.31, "fps_baseline": 9.67, "stage_tile_assign_ms": 8.904, "stage_tile_assign_ms_baseline": 14.718, "tracy_ta_gauss_aabb_ms": 4.613, "tracy_ta_gauss_aabb_ms_baseline": 9.202, "tracy_ta_bucket_scatter_ms": 5.393, "tracy_ta_bucket_scatter_ms_baseline": 10.494}, "timings": {"ms_view": 96.972, "tile_assign": 8.904}, "iter_dir": "ttw-157", "verdict": "KEEP (tile_assign dual-mover split: 103.37 -> 96.97 ms/view, byte-identical; board yyzo-bh-07 p100a)", "ts": "2026-09-30T06:25:00-0700", "buildid": {"cpp": "gsplat_tt ttp/t34 on 685f77b (tile_assign K1/K2 BRISC+NCRISC split)", "data": ""}}
{"iter": 158, "idea": "Task #31: close the ~5.8 ms/view inter-program device idle from docs/tracy-chunked-2026-09-30.md. New opt/profiler/program_gaps.py measures all-core idle from firmware zones (union of *-FW intervals); on the ttw-149 capture real idle is 2.99 ms/view, not 5.8: ta_gauss_aabb->ta_bucket_scatter 0.05 (scan programs without zones fill it), ta_bucket_scatter->sort_bin_hist 1.29 (after tile_assign's Finish on K2), sort_bin_hist->sort_bucket_emit 1.35 (host bridge: 1.8 MB hist D2H 0.24 + layout ~0.3 + ~5.4 MB table H2D), sort_tile_depth->sort_subchunk_mat 0.07 (unnamed 1.15 ms program fills it). Tried: drop the Finish after K2 and chain the sort count pass behind it on the CQ (count pass reads P from the ctrl page on device).", "decision": "reject", "reason": "A/B, 3 interleaved rounds per build in one device session on yyzo-bh-07 (Blackhole p100a, not a p150), bicycle 30 views 1024x1024, base 7df44de: tile_assign+sort 40.63 -> 40.52 ms/view (-0.11, smaller in all 3 rounds); avg_frame_ms base 145.8/145.4/147.1 vs new 145.3/145.3/145.2. All 30 views byte-identical, hero_vs_ref 100.00 dB. Only ~0.1 of the 1.29 ms gap closed, so the idle is not mainly the host round trip; far below the 1% bar. Patch kept at docs/inter-program-gaps/k2-count-chain.patch. Next: Tracy the patched build to see what the device does in that gap; device-side layout for the hist->emit gap is worth at most ~1.3 ms/view.", "metrics": {"hero_vs_ref": 100.0, "bit_identical": true, "all_30_views_identical": true, "board": "yyzo-bh-07 (Blackhole p100a)", "all_core_idle_ms_view": 2.99, "gap_k2_count_ms": 1.29, "gap_hist_emit_ms": 1.35, "ta_sort_ms_view": 40.52, "ta_sort_ms_view_baseline": 40.63, "ta_sort_delta_ms": -0.11, "frame_ms_view": 145.27, "frame_ms_view_baseline": 146.1, "ab_rounds": 3}, "timings": {"ms_view": 145.27, "blend": 145.27}, "iter_dir": "ttw-158", "verdict": "REJECT (-0.11 ms/view, bit-identical; gap is not the host Finish; board yyzo-bh-07 p100a)", "ts": "2026-09-30T06:20:00-0700", "buildid": {"cpp": "gsplat_tt ttp/t31 on 7df44de (K2 no-Finish + device-side count-pass split)", "data": ""}, "screenshot": "opt/metal-screenshots/ttw-158/hero.png", "screenshot_diff": "opt/metal-screenshots/ttw-158/hero_diff10.png"}
{"iter": 159, "idea": "Task #26 (R11): adaptive stable radix in sort_tile_depth (sort_radix_tile.cpp). Per tile: one min/max scan, radix on key-kmin with 1..4 passes whose digit width is chosen from n and the key range, all histograms filled in one scan, last pass writes ids only; histograms as u16 in the RISC's 8 KB local memory (3 KB); 4-wide load-ahead in the histogram/scatter loops. Still a stable sort by key, so the permutation is unchanged.", "decision": "keep", "reason": "A/B on yyzo-bh-07 (Blackhole p100a), bicycle 30 views, 3 interleaved rounds, base 3d59718: frame 96.95 -> 94.10 ms/view (-2.85), stage sort 18.63 -> 15.64 ms, stage_sort_publish_wait 8.02 -> 5.02 ms (-3.00, -37%). hero_vs_ref 100.00 dB in all runs; 30-view --dump-views byte-identical (md5). Host test vs std::stable_sort: 1825 cases, 0 fails. Steps: first version kept histograms in an L1 CB and only saved 0.40 ms (L1 read-after-write on bucket counters); an ablation with the sort skipped put DMA+publish at 2.19 ms, so the sort math was ~5.8 ms; moving histograms to local memory gave 6.33 ms, the 4-wide load-ahead 5.02 ms. Sort math left ~2.8 ms, so further tuning here is < 1% of the frame. Tracy (30 views, 3 stitched chunks, same board): sort_tile_depth busiest core 6.97 -> 3.98 ms/view (mean 6.75 -> 3.80); baseline from the task #16 capture (kernel unchanged since). Zones: opt/profiler/ttw-159/zones.txt.", "metrics": {"board": "yyzo-bh-07 (Blackhole p100a)", "bit_identical": true, "frame_ms_view": 94.099, "frame_ms_view_baseline": 96.953, "frame_delta_ms": -2.854, "fps": 10.63, "fps_baseline": 10.31, "stage_sort_ms": 15.635, "stage_sort_ms_baseline": 18.629, "stage_sort_publish_wait_ms": 5.018, "stage_sort_publish_wait_ms_baseline": 8.018, "ablation_publish_wait_no_sort_ms": 2.194, "variant_l1_hist_publish_wait_ms": 7.603, "variant_local_hist_no_unroll_publish_wait_ms": 6.329, "tracy_sort_tile_depth_max_ms": 3.979, "tracy_sort_tile_depth_max_ms_baseline": 6.97, "tracy_sort_tile_depth_mean_ms": 3.798, "tracy_sort_tile_depth_mean_ms_baseline": 6.75}, "timings": {"ms_view": 94.099, "sort": 15.635}, "iter_dir": "ttw-159", "verdict": "KEEP (adaptive radix in sort_tile_depth: 96.95 -> 94.10 ms/view, publish_wait 8.02 -> 5.02 ms, byte-identical; board yyzo-bh-07 p100a)", "ts": "2026-09-30T06:45:00-0700", "buildid": {"cpp": "gsplat_tt ttp/t26 on 3d59718 (adaptive radix sort_radix_tile)", "data": ""}, "tracy": "opt/profiler/ttw-159/render.tracy"}
{"iter": 160, "idea": "Task #44: with the per-pixel blend floor (iter-156) the microblock mask only has to be a superset of blocks where a PIXEL CENTRE reaches the floor. The cull box goes from the continuous [x0,x0+8]x[y0,y0+4] to the pixel-centre box [x0+0.5,x0+7.5]x[y0+0.5,y0+3.5] (box ramps +0.5 in sort_device/blend_device make_box_ramp; extent 7x3 in microblock_cull_compute). With no slack left at the centres, the cull thr (SFPU log) and the blend alpha (bf16-rounded approx exp) disagreed on ~115 edge pixels/view by 1 LSB, so thr is widened by a 0.05 m2 margin (extra keeps are zeroed by the per-pixel floor).", "decision": "keep", "reason": "A/B on yyzo-bh-07 (Blackhole p100a), bicycle 30 views 1024x1024, 3 interleaved rounds, base e49d388: stage blend 44.81 -> 43.20 ms/view (-1.61, -3.6%), frame 94.10 -> 92.51 ms/view (-1.59, -1.7%). 30-view --dump-views md5 byte-identical to base, hero_vs_ref 100.00 dB. Box alone (no margin) was 43.05 ms but NOT identical (hero 91.90 dB; 3465 pixels over 30 views off by 1 LSB, all at x%8 in {0,7} / y%4 in {0,3}). Margin 0.02 was also byte-identical (blend 43.16); 0.05 kept for ~2.5x headroom over the bf16 alpha rounding (~0.008 m2). Tracy (30 views, 3 stitched chunks, same board): device blend window 17.07 -> 15.36 ms/view (-10%), tile_blend_sfpu mean 14.58 -> 13.09 ms; cull window unchanged (15.93 -> 15.99). Zones: opt/profiler/ttw-160/zones.txt.", "metrics": {"board": "yyzo-bh-07 (Blackhole p100a)", "bit_identical": true, "all_30_views_identical": true, "hero_vs_ref": 100.0, "stage_blend_ms": 43.197, "stage_blend_ms_baseline": 44.806, "stage_blend_delta_ms": -1.609, "frame_ms_view": 92.509, "frame_ms_view_baseline": 94.104, "frame_delta_ms": -1.595, "fps": 10.81, "fps_baseline": 10.63, "variant_no_margin_blend_ms": 43.049, "variant_no_margin_hero_vs_ref_db": 91.9, "variant_no_margin_diff_pixels_30v": 3465, "variant_margin_002_blend_ms": 43.159, "thr_margin_m2": 0.05, "ab_rounds": 3, "tracy_blend_window_ms": 15.36, "tracy_blend_window_ms_baseline": 17.07, "tracy_tile_blend_sfpu_mean_ms": 13.087, "tracy_tile_blend_sfpu_mean_ms_baseline": 14.576, "tracy_cull_window_ms": 15.99, "tracy_cull_window_ms_baseline": 15.93}, "timings": {"ms_view": 92.509, "blend": 43.197}, "iter_dir": "ttw-160", "verdict": "KEEP (pixel-centre microblock box + 0.05 thr margin: blend 44.81 -> 43.20 ms/view, frame 94.10 -> 92.51, byte-identical; board yyzo-bh-07 p100a)", "ts": "2026-09-30T07:30:00-0700", "buildid": {"cpp": "gsplat_tt ttp/t44 on e49d388 (pixel-centre cull box + thr margin)", "data": ""}, "tracy": "opt/profiler/ttw-160/render.tracy"}
{"iter": 161, "idea": "Task #33: dual data mover for gather_visible (proj_count + proj_scatter). gather_visible_scatter.cpp and the count pass now run on BRISC and NCRISC of the same cores; each core's range is split into two contiguous halves (BRISC first half, NCRISC second), each mover has its own base from gather_scan_bases, so output order equals the single-mover order. GSPLAT_TT_PROJ_GATHER_MOVERS=1 restores the single-mover path.", "decision": "keep", "reason": "A/B on yyzo-bh-07 (Blackhole p100a), bicycle 30 views 1024x1024, 3 interleaved rounds, base e49d388 (iter-159) vs e49d388+this change: frame 93.89 -> 85.51 ms/view (-8.38, -8.9%), stage project 20.41 -> 11.98 ms (-8.43). MOVERS=1 path 93.66 ms (matches base). hero_vs_ref 100.00 dB in all runs; 30-view --dump-views md5 identical for new and MOVERS=1 vs base. Tracy (same board, 30 views): proj_scatter per-view makespan 12.36 -> 6.79 ms, proj_count 6.32 -> 3.26 ms, both now on BRISC+NCRISC. Saving is below the spec's -12..-17 ms because the stages already partly overlapped other work; the halving of both kernels is as expected for a latency-bound mover. A/B was taken before iter-160 (blend) landed; the change touches only the project stage, so the gain should add on top. Host model tests/unit/test_gather_dual_mover.cpp: 2400 cases, 0 mismatches (an interleaved split fails 1048).", "metrics": {"board": "yyzo-bh-07 (Blackhole p100a)", "bit_identical": true, "frame_ms_view": 85.51, "frame_ms_view_baseline": 93.89, "frame_delta_ms": -8.38, "fps": 11.69, "fps_baseline": 10.65, "stage_project_ms": 11.98, "stage_project_ms_baseline": 20.41, "frame_ms_view_movers1": 93.66, "tracy_proj_scatter_makespan_ms": 6.794, "tracy_proj_scatter_makespan_ms_baseline": 12.356, "tracy_proj_count_makespan_ms": 3.259, "tracy_proj_count_makespan_ms_baseline": 6.322}, "timings": {"ms_view": 85.51, "project": 11.98}, "iter_dir": "ttw-161", "verdict": "KEEP (dual-mover gather: 93.89 -> 85.51 ms/view, project 20.41 -> 11.98 ms, byte-identical; board yyzo-bh-07 p100a)", "ts": "2026-09-30T14:40:00-0700", "buildid": {"cpp": "gsplat_tt ttp/t33 3b26b52 on e49d388 (dual-mover gather_visible)", "data": ""}, "tracy": "remote yyzo-bh-07:/localdev/smarton/gstt2-t33/opt/profiler/ttw-157-t33/render.tracy (base: gstt2-t33base/opt/profiler/ttw-157-t33base)"}
{"iter": 162, "idea": "Task #50: re-profile at origin/smarton/tt-project-opt 7533fd8 (iter-161). 3 untraced timing rounds + chunked 30-view Tracy capture (3x10 views, stitched) with zone_occupancy, program_gaps and analyze_zones. Per-stage, per-RISC critical-path table and re-ranked top-5 levers in docs/OPTIMIZATION-PLAN.md section 0.5; raw outputs in docs/reprofile-t50/.", "decision": "diagnostic", "reason": "yyzo-bh-07 (Blackhole p100a, not a p150), bicycle 30 views 1024x1024, 3 rounds: 82.5 / 82.6 / 82.7 ms/view (~12.1 FPS). Device span 78.39 ms: project 10.80, tile_assign 7.53, sort 14.28 (bin_hist 0.88 + emit 8.04 + tile_depth 3.98, NCRISC-only), subchunk_mat 5.62 (NCRISC-only), cull 15.99 (tile_mb_mask TRISC 15.0 + NCRISC re-read 14.7), blend 21.48 (SFPU balance 0.84); all-core inter-program idle 3.00; host after device ~4.1 (assemble 3.30). Top levers [D]: L1 merge #35 dual-mover tile_depth+mat 4.8-7, L2 cheaper/fused cull 6-12, L3 blend tail+mover balance 2-4, L4 pre-project cull 4-8, L5 device-side image pack + on-device bin layout 4-6. Even with all five at upper bound ~45 ms/view vs published GPU 10.75 ms/view [published, not measured]. Timing only; hero_vs_ref 67.20 dB here is against the remote base tree's fixture, not this SHA's.", "metrics": {"board": "yyzo-bh-07 (Blackhole p100a)", "frame_ms_view": 82.5, "device_span_ms": 78.39, "inter_program_idle_ms": 3.0, "gpu_ref_ms_view_published": 10.75}, "timings": {"ms_view": 82.5, "project": 10.94, "tile_assign": 8.79, "sort": 15.58, "blend": 42.93}, "iter_dir": "ttw-162", "verdict": "DIAGNOSTIC (re-profile at 7533fd8: 82.5 ms/view, device 78.4 ms; last program mat+cull+blend = 43.1 ms; board yyzo-bh-07 p100a)", "ts": "2026-09-30T08:10:00-0700", "buildid": {"cpp": "gsplat_tt origin/smarton/tt-project-opt 7533fd8 (profiling build)", "data": ""}, "tracy": "opt/profiler/ttw-162/chunks/0-10/render.tracy (+ chunks/10-20, chunks/20-30)"}
{"iter": 163, "idea": "Task #47: audit of hot dataflow loops for L1 read-after-write counters/cursors and dependent load-after-store chains. Offenders fixed: (1) sort_subchunk_materialize depth sort used a fixed 4x8-bit radix with bucket counters in an L1 CB (cnt[b]++ read right after write) and re-read each key through the index every pass -> adaptive radix from task #26 (u16 histograms in RISC local memory, load-ahead); (2) gather_visible_scatter copied each visible gaussian with alternating volatile load/store (each input read twice, each store waiting on its load) plus 7 redundant zero stores -> all loads first, then stores; (3) sort_bucket_emit reloaded curp[t] from L1 three times per pair -> load once. tile_assign_scatter has no L1 counters (cursors are registers).", "decision": "keep", "reason": "A/B on yyzo-bh-07 (Blackhole p100a, not a p150), bicycle 30 views 1024x1024, 3 interleaved rounds, base 3192ba6: frame 93.88 -> 85.54 ms/view (-8.34, -8.9%); rounds base 93.97/93.82/93.86 vs new 85.72/85.41/85.49. Stage timers: project 20.42 -> 18.32, blend 44.81 -> 38.50, sort unchanged (15.6). 30-view --dump-views md5 byte-identical; hero_vs_ref 100.00 dB in all runs. Host test of the new materialize sort vs the old one: 1945 cases, 0 fails. Re-measured stacked on task #44 (base af239ef vs ca71400, same board, 3 interleaved rounds): 92.38 -> 84.09 ms/view (-8.29, -9.0%); project 20.42 -> 18.34, blend 43.20 -> 36.88; 30 views byte-identical, hero_vs_ref 100.00 dB. Combined branch tip (114a882 = this + task #33 dual-mover gather + cull cleanup) vs af239ef, same board, 3 interleaved rounds: 92.49 -> 76.56 ms/view (-15.93), 13.06 FPS; project 20.43 -> 10.95, blend 43.20 -> 36.88; 30 views byte-identical, hero_vs_ref 100.00 dB. The blend-stage saving (-6.3 ms) is this task's materialize change; the two gather changes overlap in the project stage.", "metrics": {"board": "yyzo-bh-07 (Blackhole p100a)", "bit_identical": true, "frame_ms_view": 84.092, "frame_ms_view_baseline": 92.381, "frame_delta_ms": -8.288, "fps": 11.89, "fps_baseline": 10.82, "stage_project_ms": 18.335, "stage_project_ms_baseline": 20.421, "stage_blend_ms": 36.878, "stage_blend_ms_baseline": 43.195, "stage_sort_ms": 15.641, "stage_sort_ms_baseline": 15.644, "frame_ms_view_pre44": 85.538, "frame_ms_view_pre44_baseline": 93.882, "tip_114a882_frame_ms_view": 76.56, "tip_114a882_frame_ms_view_baseline": 92.49, "tip_114a882_fps": 13.06}, "timings": {"ms_view": 84.092, "project": 18.335, "blend": 36.878, "sort": 15.641}, "iter_dir": "ttw-163", "run_label": "t47-ab", "verdict": "KEEP (L1 RAW audit: materialize adaptive radix + gather loads-first + emit cursor load-once: 92.38 -> 84.09 ms/view, byte-identical; board yyzo-bh-07 p100a)", "ts": "2026-09-30T07:40:00-0700", "buildid": {"cpp": "gsplat_tt ca71400 on af239ef (L1 RAW audit)", "data": ""}}
{"iter": 164, "idea": "Task #59 (lever L2): band-extent SFPU microblock cull. The tile-local cull (tile_mb_mask) put one gaussian per SFPU vector (lanes = 32 microblocks) and ran a box-constrained Mahalanobis minimum per lane: ~140 SFPU + ~100 scalar TRISC instructions per (gaussian, tile) pair (runtime-immediate coefficient loads, 128 noinline calls per batch, per-record decode), ~15 ms/core. New kernel microblock_band_cull_compute.cpp puts one gaussian per SFPU LANE (32 per vector, 128 per coefficient tile; the idle NCRISC reader transposes slab records into an fp32 coefficient tile) and walks the 8 microblock rows: per row the ellipse's exact x-extent comes from clamping its right/left-most point into the row (edges are concave/convex in v), and each 8-px column block is kept iff that extent meets its pixel-centre span, tested on squares (no sqrt). Same 'ellipse meets the pixel-centre box' test and the same 0.05 m2 thr margin as before, so the mask is a superset of the per-pixel 1/255 floor. Keep bits accumulate as fp32 2^23+mask16 so the writer is integer-only; the writer patches word3 in the reader's L1 slab slot and writes the slab back in 2 KB pages (no per-batch 64 B DRAM read-modify-write). Model: opt/golden-check/cull_mask_check.py band_keep_f32, tests/spec/test_band_cull.py.", "decision": "keep", "reason": "A/B on yyzo-bh-07 (Blackhole p100a, not a p150), bicycle 30 views 1024x1024, 3 interleaved rounds in one session, base fdef315 vs fdef315 + this change: frame 76.23/76.54/76.53 -> 61.90/61.67/61.83 ms/view, mean 76.43 -> 61.80 (-14.63 ms/view, -19.1%), 13.08 -> 16.18 FPS; stage blend bucket (materialize + cull + blend) 36.88 -> 22.24 ms (-14.64); other stages unchanged. Byte-identical: all 30 --dump-views md5-identical to the base, hero_vs_ref 100.00 dB in all 6 runs. Mask check on the first frame (GSPLAT_TT_DUMP_CULL, 3,369,033 pairs): box-min kernel kept 8,033,113 microblocks, band kernel 8,033,112; 1 bit only in the band mask and 2 only in the box-min mask, each with its nearest pixel centre >= 0.047 m2 beyond the live threshold (peak alpha*255 < 1); all non-mask slab words byte-identical. Committed on top of 7b9358d (gather review nits, no default-path change).", "metrics": {"board": "yyzo-bh-07 (Blackhole p100a)", "bit_identical": true, "all_30_views_identical": true, "hero_vs_ref": 100.0, "frame_ms_view": 61.798, "frame_ms_view_baseline": 76.43, "frame_delta_ms": -14.632, "fps": 16.18, "fps_baseline": 13.08, "stage_blend_ms": 22.235, "stage_blend_ms_baseline": 36.879, "stage_blend_delta_ms": -14.644, "ab_rounds": 3, "pairs_first_frame": 3369033, "mask_bits_box_min": 8033113, "mask_bits_band": 8033112, "mask_bits_band_only": 1, "mask_bits_box_min_only": 2, "thr_margin_m2": 0.05, "gpu_ref_ms_view_published": 10.75}, "timings": {"ms_view": 61.798, "project": 10.935, "tile_assign": 8.779, "sort": 15.582, "blend": 22.235}, "iter_dir": "ttw-164", "verdict": "KEEP (band-extent microblock cull: 76.43 -> 61.80 ms/view (-14.6, -19%), blend bucket 36.88 -> 22.24 ms, byte-identical 30 views; board yyzo-bh-07 p100a)", "ts": "2026-09-30T09:10:00-0700", "buildid": {"cpp": "gsplat_tt ttp/t59 4a7df4e on 7b9358d (A/B measured on fdef315)", "data": ""}, "tracy": ""}
