{"iter": 127, "idea": "recover frame to baseline: disable on-device sort bin-layout (sort_device_layout_enabled=false) AND the S5.3 host-free M/P over-provisioning (host_free_mp_enabled=false) now that iter-126 MEASURED the Metal Trace endgame as a no-go (replay removes <0.5ms; the ~92ms BRISC-FW is on-device firmware+NCRISC dataflow trace replays unchanged). Restores the host host_bin_layout_from_hist+build_lpt path and the real-M/P-read tile_assign (pre-iter-121 working path); on-device layout (S5.1-S5.5 sort_bin_layout/sort_bin_emit) + static-ceiling over-provision code KEPT gated-off for a future fusion lever. Bit-identical: hero md5 e3fefb116d860f99d92bba1ef51d820c, 63.95dB. ms_view 236.7(iter-125 ledger)/~205-211(steady) -> 195.6 avg, min 163.7; BRISC-FW 224.7->179.1, NCRISC-KERNEL 189.9->144.4 == iter-116 best-known baseline (full regression recovery).", "decision": "keep", "reason": "63.95 >= 50.0", "metrics": {"hero_vs_ref": 63.95}, "timings": {"ms_view": 195.277, "blend": 195.277}, "iter_dir": "ttw-127", "screenshot": "opt/metal-screenshots/ttw-127/hero.png", "screenshot_diff": "opt/metal-screenshots/ttw-127/hero_diff10.png", "ts": "2026-06-11T09:20:51-0700", "buildid": {"cpp": "cpp#94 ecba17b iter 127: recover frame to baseline: disable on-device sort bin-layout (sort_device_layout_enabled=false) AND the S5.3 host-free M/P over-provisioning (host_free_mp_enabled=false) now that iter-126 MEASURED the Metal Trace endgame as a no-go (replay removes <0.5ms; the ~92ms BRISC-FW is on-device firmware+NCRISC dataflow trace replays unchanged). Restores the host host_bin_layout_from_hist+build_lpt path and the real-M/P-read tile_assign (pre-iter-121 working path); on-device layout (S5.1-S5.5 sort_bin_layout/sort_bin_emit) + static-ceiling over-provision code KEPT gated-off for a future fusion lever. Bit-identical: hero md5 e3fefb116d860f99d92bba1ef51d820c, 63.95dB. ms_view 236.7(iter-125 ledger)/~205-211(steady) -> 195.6 avg, min 163.7; BRISC-FW 224.7->179.1, NCRISC-KERNEL 189.9->144.4 == iter-116 best-known baseline (full regression recovery). bin=3a2c4a729a3b7f56", "data": "data#   bin="}, "tracy": "opt/profiler/ttw-127/render.tracy"}
{"iter": 128, "idea": "sort_bucket_emit: hoist per-gaussian-invariant 32B record packing (cov/depth_key/UNORM16 op+color) out of the per-pair scatter loop. iter-128 ablation MEASURED pack_rec=27ms=71% of the 40.9ms scatter (the scattered-DRAM-write premise was REFUTED: 32B writes only 1.6ms); only the tile-local mean varies per pair, so the invariant words are computed once per gaussian (pack_invariants in the blendrec-read branch). Bit-identical hero md5 e3fefb11, 63.95dB. sort_bucket_emit 40.9->30.6, NCRISC-KERNEL 144.6->134.2, BRISC-FW ~179->169; ms_view 195.6->187.4 avg / 163.7->157.6 min.", "decision": "keep", "reason": "63.95 >= 50.0", "metrics": {"hero_vs_ref": 63.95}, "timings": {"ms_view": 186.918, "blend": 186.918}, "iter_dir": "ttw-128", "screenshot": "opt/metal-screenshots/ttw-128/hero.png", "screenshot_diff": "opt/metal-screenshots/ttw-128/hero_diff10.png", "ts": "2026-06-11T09:49:44-0700", "buildid": {"cpp": "cpp#95 b744d2a iter 128: sort_bucket_emit: hoist per-gaussian-invariant 32B record packing (cov/depth_key/UNORM16 op+color) out of the per-pair scatter loop. iter-128 ablation MEASURED pack_rec=27ms=71% of the 40.9ms scatter (the scattered-DRAM-write premise was REFUTED: 32B writes only 1.6ms); only the tile-local mean varies per pair, so the invariant words are computed once per gaussian (pack_invariants in the blendrec-read branch). Bit-identical hero md5 e3fefb11, 63.95dB. sort_bucket_emit 40.9->30.6, NCRISC-KERNEL 144.6->134.2, BRISC-FW ~179->169; ms_view 195.6->187.4 avg / 163.7->157.6 min. bin=2737d8866f393d17", "data": "data#   bin="}, "tracy": "opt/profiler/ttw-128/render.tracy"}
{"iter": 129, "idea": "sort_bin be_main: kill the per-pair tile-coord integer div/mod (tile_x=tt%grid_w, tile_y=tt/grid_w) with a power-of-two shift/mask (grid_w=l1_tiles_x=32 for the 1024x1024 / 32px-tile bench, so tt&31==tt%32 and tt>>5==tt/32 bit-identically; div/mod fallback kept for non-pow2 grids; zero extra storage). MEASURE-FIRST REFUTED the premise: bit-identical (hero md5 e3fefb116d860f99d92bba1ef51d820c, 63.95dB) but FRAME-NEUTRAL -- sort_bucket_emit 30.57->30.58 (noise), NCRISC-KERNEL 134.23->134.28, BRISC-FW 168.96->169.02, ms_view 187.4->187.0 avg / 156.6->157.1 min. The NCRISC software divide is NOT the be_main residual hotspot (it is overlapped by the dominant per-pair L1 store traffic). CONFIRMING ABLATION (null the 8 per-pair 32B-record L1 stores, not bit-identical): sort_bucket_emit 30.58->13.03 (-17.5ms, -57%), NCRISC-KERNEL -16.7, BRISC-FW -15.7 => the residual be_main cost IS the per-pair 32B record L1 store traffic (8 u32 stores x ~21.7k pairs/core), NOT the tile-coord decode. REVERTED to HEAD (frame-neutral dead complexity). Next lever: cut the per-pair record store traffic (record born once-per-gaussian / Stage-2b TA-side fill), not the div/mod.", "decision": "blocked", "reason": "bit-identical (hero md5 e3fefb11, 63.95dB) but frame-neutral: per-pair div/mod refuted as the be_main hotspot (sort_bucket_emit 30.57->30.58); reverted per the bit-identical-but-neutral gate. Ablation localizes the real cost to the per-pair 32B-record L1 stores (-17.5ms when nulled).", "metrics": {"hero_vs_ref": 63.95}, "timings": {"ms_view": 187.033, "blend": 187.033}, "iter_dir": "ttw-129", "screenshot": "opt/metal-screenshots/ttw-129/hero.png", "screenshot_diff": "opt/metal-screenshots/ttw-129/hero_diff10.png", "ts": "2026-06-11T10:05:44-0700", "buildid": {"cpp": "cpp#96 d333c34 iter 129 (measured then reverted): sort_bin be_main per-pair div/mod -> pow2 shift/mask; bit-identical, frame-neutral; div/mod refuted as be_main hotspot -> reverted to HEAD bin=2737d8866f393d17. measure build bin=efe043ec617d66f8"}, "tracy": "opt/profiler/ttw-129/render.tracy"}
{"iter": 130, "idea": "sort_subchunk_mat subchunk-balanced (load balance). Phase-1 DIAGNOSED via 30-view Tracy phase sub-zones (analyze_zones): the dominant materialize cost is NOT the iter-113 in-place L1 permute (mat_perm 1.7ms/mat_read 0.55/mat_sort 6.3/mat_write 0.02 busiest-core) but the OVERFLOW gather (mat_gather 24.6ms) - random blendrec re-read + scalar UNORM pack + 32B scatter for overflow tiles, untouched by Stage 1. The shared per-tile count-LPT overloads cores owning big overflow tiles (mat_total max 27.1 vs 17.0ms balanced floor; busiest core 91% gather). FIX bit-identical: each (tile,sc) is an independent work item with core-independent output, so balance ALL items across cores via gather-cost-weighted greedy-LPT (kernel now iterates a work-item list; host build_mat_worklist). hero md5 e3fefb11 bit-identical, 63.95dB; ms_view min 156.6->147.1.", "decision": "keep", "reason": "63.95 >= 50.0", "metrics": {"hero_vs_ref": 63.95}, "timings": {"ms_view": 181.597, "blend": 181.597}, "iter_dir": "ttw-130", "screenshot": "opt/metal-screenshots/ttw-130/hero.png", "screenshot_diff": "opt/metal-screenshots/ttw-130/hero_diff10.png", "ts": "2026-06-11T10:38:14-0700", "buildid": {"cpp": "cpp#101 0b49e4b iter 130: subchunk-balanced materialize (clean, zones stripped) bin=10ab15799beab950", "data": "data#   bin="}, "tracy": "opt/profiler/ttw-130/render.tracy"}
{"iter": 131, "idea": "Stage-2b: pre-pack op/color UNORM16 into the 32B blend record at BIRTH (gather_visible_scatter) so sort_bin pack_invariants and the depth-sorted materialize overflow gather COPY the two packed words instead of re-deriving 4 fp32->UNORM16 conversions (per-gaussian / per-overflow-record). Phase-1 fresh 30-view ranking (ttw-131): BRISC-FW 165.86, NCRISC-KERNEL 131.42; top reducible NCRISC zones sort_bucket_emit 30.58, sort_subchunk_mat 19.62 (overflow re-read/re-pack), readers ~98% backpressure. Ablation MEASURED the gather re-pack at frame -7.1 (skip-pack) vs read -4.5 (skip-read). Bit-identical hero md5 e3fefb116d860f99d92bba1ef51d820c, 63.95dB. NCRISC-KERNEL 131.42->113.80 (-17.6), BRISC-FW 165.86->162.12 (-3.74); sort_bucket_emit 30.58->18.83, sort_subchunk_mat 19.62->13.74; tradeoff proj_scatter 20.83->35.40 (+14.6, pack relocated to BRISC producer). ms_view 181.6->178.9 avg / 147.0->143.8 min.", "decision": "keep", "reason": "63.95 >= 50.0", "metrics": {"hero_vs_ref": 63.95}, "timings": {"ms_view": 178.575, "blend": 178.575}, "iter_dir": "ttw-131", "screenshot": "opt/metal-screenshots/ttw-131/hero.png", "screenshot_diff": "opt/metal-screenshots/ttw-131/hero_diff10.png", "ts": "2026-06-11T11:18:32-0700", "buildid": {"cpp": "cpp#102 faebfa0 iter 131: Stage-2b: pre-pack op/color UNORM16 into the 32B blend record at BIRTH (gather_visible_scatter) so sort_bin pack_invariants and the depth-sorted materialize overflow gather COPY the two packed words instead of re-deriving 4 fp32->UNORM16 conversions (per-gaussian / per-overflow-record). Phase-1 fresh 30-view ranking (ttw-131): BRISC-FW 165.86, NCRISC-KERNEL 131.42; top reducible NCRISC zones sort_bucket_emit 30.58, sort_subchunk_mat 19.62 (overflow re-read/re-pack), readers ~98% backpressure. Ablation MEASURED the gather re-pack at frame -7.1 (skip-pack) vs read -4.5 (skip-read). Bit-identical hero md5 e3fefb116d860f99d92bba1ef51d820c, 63.95dB. NCRISC-KERNEL 131.42->113.80 (-17.6), BRISC-FW 165.86->162.12 (-3.74); sort_bucket_emit 30.58->18.83, sort_subchunk_mat 19.62->13.74; tradeoff proj_scatter 20.83->35.40 (+14.6, pack relocated to BRISC producer). ms_view 181.6->178.9 avg / 147.0->143.8 min. bin=de6db8435d93defa", "data": "data#   bin="}, "tracy": "opt/profiler/ttw-131/render.tracy"}
{"iter": 132, "idea": "relocate op/color UNORM16 pack off BRISC proj_scatter onto NCRISC sort_bin pack_invariants; publish 2 packed words via 16B-aligned blendrec offset-32 write-back for materialize copy (bit-identical, frame 178.8->177.1 avg / 143.9->142.3 min same-thermal)", "decision": "keep", "reason": "63.95 >= 50.0", "metrics": {"hero_vs_ref": 63.95}, "timings": {"ms_view": 177.592, "blend": 177.592}, "iter_dir": "ttw-132", "screenshot": "opt/metal-screenshots/ttw-132/hero.png", "screenshot_diff": "opt/metal-screenshots/ttw-132/hero_diff10.png", "ts": "2026-06-11T16:03:43-0700", "buildid": {"cpp": "cpp#110 f8e63c1 iter 132: relocate op/color UNORM16 pack off BRISC proj_scatter onto NCRISC sort_bin pack_invariants; publish 2 packed words via 16B-aligned blendrec offset-32 write-back for materialize copy (bit-identical, frame 178.8->177.1 avg / 143.9->142.3 min same-thermal) bin=ae4373403d20ecbd", "data": "data#   bin="}, "tracy": "opt/profiler/ttw-132/render.tracy"}
{"iter": null, "iter_dir": "newref-132", "ts": "2026-06-11T16:12:07-0700", "decision": "blocked", "idea": "\u2550\u2550\u2550\u2550\u2550\u2550\u2550\u2550\u2550\u2550\u2550\u2550\u2550\u2550\u2550\u2550\u2550\u2550 NEW REF \u2550\u2550\u2550\u2550\u2550\u2550\u2550\u2550\u2550\u2550\u2550\u2550\u2550\u2550\u2550\u2550\u2550\u2550  golden = iter-132 hero (md5 e3fefb116d860f99d92bba1ef51d820c). Gate metric is now 8-bit PSNR vs this committed golden (tests/fixtures/hero/hero_golden_8bit.png); bit-identical output = 100.00 dB. Prior metric was float-vs-CPU (63.95 dB; max float diff ~1.4/255, 8-bit output effectively identical). hero_vs_cpu retained as a secondary float ground-truth diagnostic.", "reason": "User-directed rebaseline: freeze the current bit-identical TT hero as the 8-bit golden reference and measure drift-from-golden going forward. Re-test CPU float ground truth periodically (premises can go stale).", "metrics": {}, "timings": {}}
{"iter": 133, "idea": "PROGRAM FUSION #1 (roadmap lever #1): merge project(transform_means_cam) + pfwc into ONE device program (single CreateProgram/EnqueueMeshWorkload). The fp32 means_cam DRAM store+reload between the two programs is replaced by a CORE-LOCAL L1 pass: the fused compute kernel runs the world->camera transform (R*means) and folds the pfwc translation (+t) directly into the same fp32 DEST, emitting tx/ty/tz to L1 scratch CBs consumed in-place by the pfwc body (no NoC/DRAM round-trip). reader_pfwc/writer_pfwc reused verbatim (means SoA replaces means_cam SoA in input slots 0-2). BIT-IDENTICAL: means_cam was stored fp32 (lossless), so the in-DEST handoff produces identical bits -> hero_vs_ref=100.00dB (8bit-vs-golden, hero_diff10 ~all-black), hero_vs_cpu=63.95dB. MEASURED (30-view Tracy, analyze_zones): program dispatch/view 15.53->14.49 (-1.03, exactly one program removed; BRISC-FW pairs 51243->47833). BUT BRISC-FW busiest-core makespan 161.71->161.60 (-0.1, flat) because means_cam was the CHEAPEST program (mcam compute makespan was only 0.671ms); the 4.8ms/program AVERAGE is dominated by the heavy multi-launch sort/blend programs, not this light element-wise pair. No NCRISC penalty (NCRISC-FW 127.37->127.29; the means_cam DRAM write + project reader are gone, L1 handoff is free). Frame 177.1->176.8 avg / 142.3->141.8 min (30 views, same thermal) -- flat-to-slightly-better.", "decision": "keep", "reason": "100.00 >= 50.0 (bit-identical) AND no regression (frame avg -0.3 / min -0.5) AND real architectural gain: one fewer program dispatch/view (15.53->14.49) + means_cam DRAM round-trip eliminated (cleaner L1-resident handoff toward the host-free design). BRISC-FW makespan win small because means_cam is the cheapest program; the launch-firmware prize lives in fusing the heavy sort/blend programs (future levers).", "metrics": {"hero_vs_ref": 100.0}, "timings": {"ms_view": 176.821, "blend": 176.821}, "iter_dir": "ttw-133", "screenshot": "opt/metal-screenshots/ttw-133/hero.png", "screenshot_diff": "opt/metal-screenshots/ttw-133/hero_diff10.png", "ts": "2026-06-11T17:01:13-0700", "buildid": {"cpp": "cpp#111 c067ff1 iter 133: fuse project(means_cam)+pfwc into ONE program; means_cam handoff via core-local L1 CB (no DRAM round-trip), translation folded into transform; bit-identical bin=1fe38deb098213d3", "data": "data#   bin="}, "tracy": "opt/profiler/ttw-133/render.tracy"}
{"iter": 134, "idea": "tile_assign NCRISC reciprocal-multiply: replace the per-Gaussian soft-float DIVIDE by tile_size (tsf) with a hoisted MULTIPLY by 1/tsf in BOTH data-mover kernels K1 ta_gauss_aabb (tile_assign_bbox.cpp) and K2 ta_bucket_scatter (tile_assign_scatter.cpp). tile_size=32 is a power of two so 1/32=0.03125 is EXACTLY representable in fp32 and dividing by 2^5 only decrements the exponent (no mantissa rounding, no underflow for tile coords) => x*(1/tsf) is BIT-IDENTICAL to x/tsf, so min_x/min_y/max_x/max_y truncations are unchanged. The FPU-less data-mover RISC emits an expensive __divsf3 soft-float call per coord; the multiply (__mulsf3) is much cheaper. DIAGNOSIS (analyze_zones, 30-view): K2 was COMPUTE-EXPOSED (the AABB recompute's 3 divides/Gaussian sat on its critical path) so ta_bucket_scatter dropped 12.24->10.49 ms/view (-1.74); K1 is NoC-READ-bound (4 input pages read per 16 Gaussians, divides hidden under read-barrier latency) so ta_gauss_aabb stayed flat 9.70->9.70. NCRISC-FW 127.37->125.55 (-1.82); BRISC idle-waits on NCRISC so the BRISC-FW frame long pole dropped 161.71->159.91 (-1.80). hero md5 == committed golden (byte-identical). Frame 177.0->175.0 avg / 142.1->140.5 min (30-view, same-thermal, 4 runs each, clean cluster separation).", "decision": "keep", "reason": "100.00 >= 50.0 (bit-identical: hero PNG md5 == golden e3fefb11) AND frame avg improves 177.0->175.0 ms (-2.0) with clean cluster separation (baseline 176.9-177.1 vs candidate 174.7-175.2, no overlap; 4 runs each, same thermal). ta_bucket_scatter -1.74 ms/view, NCRISC-FW -1.82, BRISC-FW long pole -1.80. ta_gauss_aabb flat (NoC-read floor, not divide-bound).", "metrics": {"hero_vs_ref": 100.0, "hero_vs_cpu": 63.95}, "timings": {"ms_view": 174.95, "blend": 174.95}, "iter_dir": "ttw-134", "screenshot": "opt/metal-screenshots/ttw-134/hero.png", "screenshot_diff": "opt/metal-screenshots/ttw-134/hero_diff10.png", "ts": "2026-06-11T17:29:39-0700", "buildid": {"cpp": "cpp#113 80df833 iter 134: tile_assign K1/K2 reciprocal-multiply (replace per-Gaussian soft-float /tsf with *(1/tsf); tile_size=32 power-of-two => bit-identical); cut NCRISC __divsf3 in ta_gauss_aabb + ta_bucket_scatter bin=6d633cdbff5f8be9", "data": "data#   bin="}, "tracy": "opt/profiler/ttw-134/render.tracy"}
{"iter": 135, "idea": "NCRISC bit-identical strength reduction (iter-134 lever, integer variant): in sort_bin.cpp pack_rec the per-kept-pair tile-local-mean recompute needs tt/l1_tiles_x and tt%l1_tiles_x. l1_tiles_x is a RUNTIME arg so the compiler cannot strength-reduce it and emits a soft __udivmodsi4 PER PAIR on the divider-less NCRISC, inside sort_bucket_emit (the biggest NCRISC zone, 32.45 ms/view); the divmod is compute-exposed for the dominant blendrec-cache-hit pairs (no NoC read). For the 1024px hero tiles_x=32 (power of two), so tt/32 == tt>>5 and tt%32 == tt&31 EXACTLY (unsigned) -> BIT-IDENTICAL. Replaced the per-pair divmod with a power-of-two-guarded shift/mask (detect pow2 once, hoisted; non-pow2 grids fall back to exact / and % so output is unchanged for any tiles_x). DIAGNOSIS (analyze_zones, 30-view): the NAMED candidate sort_tile_depth (7.15 ms/view) has NO soft-divide -- its only /,% are by the COMPILE-TIME const ELEMS_PER_PAGE=16, already strength-reduced by the compiler to shift/mask -- so it is not a lever. The float /tsf lever is fully exhausted (both tile_assign kernels, iter-134). RESULT (30-view Tracy, candidate vs iter-134 baseline, deterministic device-cycle makespans): the ONLY changed zone sort_bucket_emit 32.449->32.022 ms/view (-0.43); it propagated ~1:1 through the idle-waiting BRISC long pole: NCRISC-FW 125.554->125.246 (-0.31), BRISC-FW 159.911->159.588 (-0.32). hero PNG md5 == committed golden (byte-identical). Frame 175.00->174.68 avg / 140.58->140.45 min (30-view, same-thermal, 4 runs each). A smaller-but-real instance of the iter-134 lever: the divmod is partly hidden under sort_bucket_emit's per-pair 32B L1-store floor (iter-129), so the win is ~4x smaller than ta_bucket_scatter's -1.74.", "decision": "keep", "reason": "KEEP: 100.00 >= 50.0 (bit-identical: hero PNG md5 == golden e3fefb11, byte-identical) AND a real improvement. Frame avg -0.3 ms (175.00->174.68); 3/4 candidate runs (174.5/174.6/174.7) sit below ALL 4 baseline runs (174.8/174.9/175.1/175.2) with a single boundary tie at 174.9 -- near-clean separation. The decisive evidence is deterministic device-cycle Tracy: the ONLY edited zone (sort_bucket_emit) dropped -0.43 ms and flowed 1:1 into the BRISC-FW frame long pole (-0.32), which is causal mechanism-level proof, not wall-clock noise. Zero risk (pow2-guarded, exact divmod fallback). NOTE: the cheap strength-reduction lever is now nearly exhausted on the NCRISC movers -- next big lever is the inter-frame host gap (Part B: steady-state ~32 ms/view, REAL not warmup) or the sort_bucket_emit record-layout change.", "metrics": {"hero_vs_ref": 100.0, "hero_vs_cpu": 63.95}, "timings": {"ms_view": 174.675, "blend": 174.675}, "iter_dir": "ttw-135", "screenshot": "opt/metal-screenshots/ttw-135/hero.png", "screenshot_diff": "opt/metal-screenshots/ttw-135/hero_diff10.png", "ts": "2026-06-11T17:52:00-0700", "buildid": {"cpp": "cpp#114 2be8ba5 iter 135: sort_bin pack_rec per-pair divmod -> power-of-two shift/mask (tt/tiles_x, tt%tiles_x; tiles_x=32 => bit-identical); cut NCRISC __udivmodsi4 in sort_bucket_emit bin=6aa86d7c13007f44", "data": "data#   bin="}, "tracy": "opt/profiler/ttw-135/render.tracy"}
