{"iter": 149, "idea": "Task #22 T-C (R2 pilot): split sort_bucket_emit over both data movers. Each core's pair-page range is split at mid: BRISC (new kernel instance on RISCV_0/NOC0) scatters [lo, mid), NCRISC [mid, hi). Both fill the core's one shared counting-sort region and the same per-(core,tile) record/overflow slots as before; NCRISC's cursors start at mover 0's per-tile kept count, which the NCRISC count pass snapshots at mid into buf_bin_h0. Gaussian-major pairs => byte-identical output with NO host layout change (instead of the plan's per-(core,mover,tile) widening, which would have doubled per-tile radix padding). Fill-done semaphores order the shared write-out, split by tile between movers; other staging CBs private per mover (BRISC at CB id+16, +42 KB L1). Kill switch GSPLAT_TT_SORT_EMIT_MOVERS=1; GSPLAT_TT_SORT_EMIT_SPLIT=<permille>.", "decision": "keep", "reason": "A/B, 3 interleaved rounds per build in one session on yyzo-bh-07 (Blackhole p100a), bicycle 30 views 1024x1024, baseline T-B head 967e973: avg_frame_ms 152.99 +/- 0.54 -> 145.42 +/- 0.18 (-7.57 ms, 6.54 -> 6.88 FPS; slowest new 145.7 < fastest base 152.4); stage_sort 25.97 -> 18.76; bin_emit 16.15 -> 9.00 (56% of base); bin_count 0.906 -> 0.920; project/tile_assign/blend unchanged. hero_vs_ref 100.00 dB, hero md5 e3fefb11..., all 30 dumped views byte-identical to the base build. Tracy (30 views, per-view busiest core): sort_bucket_emit 15.92 -> 8.43 ms on both movers (1.89x, matches T-A p6 latency-bound 1.83x), NCRISC-KERNEL 108.33 -> 100.91 (-7.42), BRISC-KERNEL 86.23 -> 94.61 (+8.38), BRISC-FW 143.08 -> 135.67 (-7.41): moved work, not a cost shuffle. Split 450/550 permille measured slower (9.69/9.76 ms). Model test tests/unit/test_sort_bin_dual_mover.cpp: 21447 split cases byte-identical. Detail + follow-ups (proj_scatter/proj_count on BRISC 35.8 ms, tile_assign 19.7, sort_subchunk_mat 12.4): docs/sort-emit-dual-mover-2026-09-30.md.", "metrics": {"hero_vs_ref": 100.0, "bit_identical": true, "all_30_views_identical": true, "hero_md5": "e3fefb116d860f99d92bba1ef51d820c", "board": "yyzo-bh-07 (Blackhole p100a)", "frame_ms_view": 145.418, "frame_ms_view_baseline": 152.99, "frame_delta_ms": -7.57, "stage_sort_ms": 18.76, "stage_sort_ms_baseline": 25.966, "stage_sort_bin_emit_ms": 9.0, "stage_sort_bin_emit_ms_baseline": 16.146, "stage_sort_bin_count_ms": 0.92, "stage_sort_bin_count_ms_baseline": 0.906, "stage_project_ms": 36.97, "stage_tile_assign_ms": 21.766, "stage_blend_ms": 63.579, "ab_rounds": 3, "split_permille": 500, "split_sweep_bin_emit_ms": {"450": 9.692, "500": 9.075, "550": 9.764}, "tracy_pv_makespan_ms": {"sort_bucket_emit": 8.432, "sort_bucket_emit_baseline": 15.921, "sort_bucket_emit_brisc": 8.432, "sort_bucket_emit_ncrisc": 8.429, "NCRISC-KERNEL": 100.909, "NCRISC-KERNEL_baseline": 108.325, "BRISC-KERNEL": 94.606, "BRISC-KERNEL_baseline": 86.227, "BRISC-FW": 135.665, "BRISC-FW_baseline": 143.077, "sort_bin_hist": 0.906, "sort_bin_hist_baseline": 0.895, "note": "busiest-core per-view makespan, 30-view captures of both builds with device profiler on (perturbs timing); opt/profiler/ttw-149/zones.txt"}}, "timings": {"ms_view": 145.418, "blend": 145.418}, "iter_dir": "ttw-149", "verdict": "WIN (-7.57 ms/view, bit-identical; board yyzo-bh-07 p100a)", "ts": "2026-09-30T04:05:00-0700", "buildid": {"cpp": "gsplat_tt 9b49b58 (smarton/tt-project-opt, task #22 T-C; A/B baseline 967e973)", "data": ""}, "screenshot": "opt/metal-screenshots/ttw-149/hero.png", "screenshot_diff": "opt/metal-screenshots/ttw-149/hero_diff10.png", "tracy": "opt/profiler/ttw-149/render.tracy"}
{"iter": 150, "idea": "Task #23 (candidate 5.1 / lever R4): shrink the per-(gaussian,tile) bucket record 32 B -> 16 B. Emit packs [half A|half B][half C|half mx][half my|unorm16 op][unorm r11|g11|b10] (conic x2^10 = tile^2 units; mean tile-local; PACK4 = four records per 64 B page); the depth key leaves the record and materialize reads it from the emit's page-aligned keys layout, then expands each record to the unchanged 32 B slab (cull/blend untouched). Measured v1 (soft-float pack + half conversions) and v2 (integer-only pack), plus a 32 B control with the same integer pack to isolate the record-size effect.", "decision": "reject", "reason": "VERDICT = REJECT (record size is not the emit's cost). yyzo-bh-07 (Blackhole p100a), bicycle 30 views, interleaved A/B, 3 rounds per variant, base 76ffb66 (pre T-B/T-C). baseline 167.13 +/- 0.69 ms/view (emit 30.27); R16 v1 (soft-float pack) 168.73 vs 167.17 same session (+1.57; emit +2.09); R16 v2 (integer pack) 157.23 +/- 0.13 (emit 20.96); 32 B control with the SAME integer pack 154.87 +/- 0.09 (emit 18.33, hero_vs_ref 68.68). So at equal packing the 16 B record costs +2.37 ms/view and 9.3 dB: halving record bytes/L1 stores buys nothing (T-A: volatile store ~2.5 cyc, one 32 B NoC write ~78 cyc per record either way) while the half conversions cost more. Quality R16 v2: hero_vs_ref 59.40 dB, hero_vs_cpu 60.44 dB; 99.4% of hero pixels identical to golden, 56 px >= 8 LSB (max 15) along ONE thin splat: independent half rounding of A,B,C perturbs det by ~eps*r^2 (host analysis: 6 hero gaussians go non-PD; half Cholesky factors would give 0). Traffic (hero, 3.13 M bucket records): emit record writes 100 -> 50 MB, materialize bucket reads 100 -> 50 MB (+12.5 MB separately fetched keys), NoC write count unchanged, materialize bucket L1 512 -> 256 KB (stage_blend, which absorbs materialize, -0.05 ms). The experiment located the real emit cost -- soft-float pack (~10 ms) -- which T-B(3) (iter-146) landed independently; a bit-exact integer pack built here reproduced it (emit 30.26 -> 20.00 ms, 156.37 ms/view, 30/30 views byte-identical) and was dropped as a duplicate. Code archived as docs/r16-record/r16-record-experiment.patch (against 76ffb66); write-up docs/r16-record-2026-09-30.md. No Tracy capture (stage spans isolate the two affected kernels; A/B spread <= 0.01 ms on them).", "metrics": {"hero_vs_ref": 59.4, "hero_vs_cpu": 60.44, "bit_identical": false, "board": "yyzo-bh-07 (Blackhole p100a)", "frame_ms_view": 157.233, "frame_ms_view_baseline": 167.133, "frame_ms_view_32B_same_packing": 154.867, "frame_delta_vs_32B_same_packing_ms": 2.367, "frame_ms_view_v1_softfloat": 168.733, "frame_ms_view_v1_session_baseline": 167.167, "stage_sort_bin_emit_ms": 20.958, "stage_sort_bin_emit_ms_baseline": 30.267, "stage_sort_bin_emit_ms_32B_same_packing": 18.329, "stage_sort_bin_emit_ms_v1_softfloat": 32.348, "stage_blend_ms": 63.528, "stage_blend_ms_baseline": 63.583, "stage_blend_ms_32B_same_packing": 63.596, "stage_sort_ms": 30.693, "stage_sort_ms_baseline": 40.083, "hero_vs_ref_32B_same_packing": 68.68, "bitexact_int_pack_32B_frame_ms_view": 156.367, "bitexact_int_pack_32B_emit_ms": 20.002, "bitexact_int_pack_32B_all_30_views_identical": true, "hero_pixels_identical_pct": 99.41, "hero_px_ge_8lsb": 56, "hero_max_err_lsb": 15, "bucket_record_bytes": 16, "bucket_record_bytes_baseline": 32, "hero_bucket_write_mb": 50.0, "hero_bucket_write_mb_baseline": 100.0, "materialize_bucket_l1_kb_cap_tile": 256, "materialize_bucket_l1_kb_cap_tile_baseline": 512, "ab_rounds": 3}, "timings": {"ms_view": 157.233, "blend": 157.233}, "iter_dir": "ttw-150", "verdict": "REJECT (16 B record +2.37 ms/view and -9.3 dB vs 32 B at equal packing; board yyzo-bh-07 p100a)", "ts": "2026-09-30T04:30:00-0700", "buildid": {"cpp": "gsplat_tt 0e27429 (R16 v2 experiment on 76ffb66; archived as docs/r16-record/r16-record-experiment.patch)", "data": ""}, "screenshot": "opt/metal-screenshots/ttw-150/hero.png", "screenshot_diff": "opt/metal-screenshots/ttw-150/hero_diff10.png", "tracy": ""}
{"iter": 151, "idea": "Task #30: audit the critical-path BRISC/NCRISC dataflow kernels for libgcc soft-float (data movers have no FPU; __addsf3/__subsf3/__mulsf3 ~85-90 cycles, compares ~20-30). objdump of the JIT ELFs found soft-float in the per-gaussian hot loops of gather_visible_scatter (count + scatter passes: 4 __addsf3, 4 __subsf3, 16 __gesf2, 4 __lesf2 call sites), tile_assign_bbox and tile_assign_scatter (AABB tile coords: add/sub + __mulsf3 + __fixsfsi per gaussian) and sort_subchunk_materialize (tile-local mean, 2 __subsf3 per overflow record). Replaced with integer, bit-exact fp32 helpers (new render/kernels/dataflow/dm_fp32.h: IEEE compares on bits, RNE add with 6 guard bits + sticky, trunc of x*2^-s; float expression kept as fallback outside the fast range) and sort_bin_fp32::sub_int. The gather's `mx + rx > 0` becomes the exact identity `-rx < mx`. Readers of pfwc/project, tile_l1_cull, blend and sort_radix_tile have no soft-float (checked in the ELFs). sort_bin skipped (task #27).", "decision": "keep", "reason": "A/B, 3 interleaved rounds per build in one device session on yyzo-bh-07 (Blackhole p100a, not a p150), bicycle 30 views 1024x1024, base = smarton/tt-project-opt 7df44de: avg_frame_ms 145.47 (145.5/145.6/145.3) -> 121.73 (121.7/121.8/121.7), -23.73 ms/view (-16.3%), 6.87 -> 8.21 FPS. stage_project 36.97 -> 20.41 (-16.56), stage_tile_assign 21.77 -> 14.75 (-7.02), sort 18.77 / blend 63.58-63.60 unchanged (materialize's overflow-path subtract is below noise). hero_vs_ref 100.00 dB, hero md5 e3fefb11..., all 30 dumped views byte-identical to the base build. Host check tests/unit/test_dm_fp32.cpp: 11.8e9 comparisons against native fp32 (every fp32 pattern for trunc, full sweeps against fixed operands, 1e9 random pairs), 0 mismatches. Tracy 30 views (per-view busiest-core makespan, base = ttw-149 which has the same kernels for these zones): proj_count 14.96 -> 6.32, proj_scatter 20.81 -> 12.36, ta_gauss_aabb 9.20 -> 5.25, ta_bucket_scatter 10.49 -> 7.18, BRISC-FW 135.67 -> 112.29 ms.", "metrics": {"hero_vs_ref": 100.0, "bit_identical": true, "all_30_views_identical": true, "board": "yyzo-bh-07 (Blackhole p100a)", "frame_ms_view": 121.733, "frame_ms_view_baseline": 145.467, "frame_delta_ms": -23.733, "fps": 8.21, "fps_baseline": 6.87, "stage_project_ms": 20.414, "stage_project_ms_baseline": 36.967, "stage_tile_assign_ms": 14.748, "stage_tile_assign_ms_baseline": 21.769, "stage_sort_ms": 18.764, "stage_blend_ms": 63.598, "stage_blend_ms_baseline": 63.58, "ab_rounds": 3, "softfloat_call_sites_gather_before": 28, "softfloat_call_sites_gather_after_cold_fallback": 4, "host_check_comparisons": 11768772384, "host_check_mismatches": 0, "tracy_pv_makespan_ms": {"proj_count": [14.96, 6.32], "proj_scatter": [20.81, 12.36], "ta_gauss_aabb": [9.2, 5.25], "ta_bucket_scatter": [10.49, 7.18], "BRISC-FW": [135.67, 112.29], "NCRISC-FW": [100.92, 93.69]}, "tracy_pv_makespan_note": "[base ttw-149, ttw-151] busiest core per view, profiler on"}, "timings": {"ms_view": 121.733, "blend": 121.733}, "iter_dir": "ttw-151", "verdict": "KEEP (-23.73 ms/view, 145.47 -> 121.73, bit-identical 30/30; board yyzo-bh-07 p100a)", "ts": "2026-09-30T04:55:00-0700", "buildid": {"cpp": "gsplat_tt ttp/t30 on 7df44de (dm_fp32 integer fp32 in gather/tile_assign/materialize)", "data": ""}, "screenshot": "opt/metal-screenshots/ttw-151/hero.png", "screenshot_diff": "opt/metal-screenshots/ttw-151/hero_diff10.png", "tracy": "opt/profiler/ttw-151/render.tracy"}
{"iter": 152, "idea": "Task #28: adopt contrib_floor 1/255 (GPU 3DGS skip threshold) instead of 1/16384, gated on a full-res visual check (side-by-side, x16 diff heatmap, per-32x32-tile max diff, grid seam ratios) over all 30 bicycle views.", "decision": "reject", "reason": "VERDICT = REJECT (visible microblock artifact on thin spokes). yyzo-bh-07 (Blackhole p100a), bicycle 30 views 1024x1024, base 7df44de. Speed: 145.3 -> 138.7 ms/view (1 run each, with view dumps), stage_blend 63.6 -> 57.0 ms; hero 51.97 dB vs current golden, all views 51.8-52.6 dB. But thin wheel-spoke Gaussians drop out in short segments (up to 36 levels darker over ~7 px, hero y=459 x=600) whose ends sit on 8x4 microblock lines: 33% of sharp dip edges (1092/3325, all views) fall on microblock lines vs 19% by chance. Per-pixel 1/255 skipping cannot remove 36 levels, so the per-microblock keep test likely overestimates Mahalanobis distance for very thin anisotropic Gaussians (margin hidden at 1/16384) -- unverified. Background diff is +-1 level (grid-aligned rectangles visible only in the amplified heatmap). Golden and default unchanged. Evidence: opt/golden-check/ (NOTE.md, sbs/hero.png, heat/, tilemax/, crops/hero_spoke_zoom8x.png, stats.json).", "metrics": {"board": "yyzo-bh-07 (Blackhole p100a)", "hero_vs_ref": 51.97, "bit_identical": false, "frame_ms_view": 138.685, "frame_ms_view_baseline": 145.344, "stage_blend_ms": 57.019, "stage_blend_ms_baseline": 63.578, "views_psnr_min": 51.83, "views_psnr_max": 52.64, "max_abs_diff_levels": 40, "spoke_dip_max_levels": 36, "dip_edges_on_mb_lines_pct": 32.8, "dip_edges_on_mb_lines_chance_pct": 19.0, "ab_rounds": 1}, "timings": {"ms_view": 138.685, "blend": 57.019}, "iter_dir": "ttw-152", "verdict": "REJECT (contrib_floor 1/255: spoke segments drop out on 8x4 microblock lines, up to 36 levels; board yyzo-bh-07 p100a)", "ts": "2026-09-30T05:15:00-0700", "buildid": {"cpp": "gsplat_tt 7df44de (floor set via cameras json copy only)", "data": ""}, "screenshot": "opt/metal-screenshots/ttw-152/hero.png", "screenshot_diff": "opt/metal-screenshots/ttw-152/hero_diff10.png"}
{"iter": 153, "idea": "Task #9: instrument sub-tile (4x8 microblock) culling waste in the blend. GSPLAT_TT_MB_STATS=1 compiles scalar MATH-thread counters into alpha_blend_compute_mb.cpp (one DPRINT MBSTATS line per core per launch; compiled out by default); GSPLAT_TT_MB_STATS_INV_FLOOR=N sets the live-pixel floor to 1/N; profiler/mb_stats_summary.py aggregates. Non-perf-changing tooling.", "decision": "instrument", "reason": "Measurement only, no perf change (stats compiled out by default: 166.6 ms/view, blend 63.59 ms, bit-identical at base 76ffb66; yyzo-bh-07 Blackhole p100a, bicycle 30 views). Per frame: 3.08 M pairs reach blend, 4.8% with a zero microblock mask; only 11.5% of the 32-per-pair microblock slots are blended (the 32x whole-tile waste is ~88% recovered). At the pipeline floor 1/16384, 12.6% of blended microblocks (1.42 M/frame) have no live pixel; at the GPU floor 1/255, 47% do. Estimated bit-identical recoverable <= ~4 ms/view (~2.5%): do not pursue finer-grain culling. contrib_floor 1/16384 -> 1/255 measured 166.6 -> 160.0 ms/view (-4.0%) at 51.97 dB vs golden (needs a golden re-baseline decision). Details: docs/subtile-waste-2026-09-30.md.", "metrics": {"board": "yyzo-bh-07 (Blackhole p100a)", "bit_identical": true, "hero_vs_ref": 100.0, "pairs_to_blend_per_frame": 3077443, "blended_microblock_fraction": 0.115, "useless_blended_mb_frac_floor_16384": 0.126, "useless_blended_mb_frac_floor_255": 0.469, "frame_ms_view_default_76ffb66": 166.6, "frame_ms_view_floor_255": 160.0, "hero_vs_ref_floor_255": 51.97}, "timings": {}, "iter_dir": "ttw-153", "verdict": "INSTRUMENT (no perf change; recoverable <= ~4 ms/view bit-identical; board yyzo-bh-07 p100a)", "ts": "2026-09-30T03:14:19-0700", "buildid": {"cpp": "gsplat_tt 6d8e872 (task #9, on 76ffb66)", "data": ""}, "tracy": ""}
{"iter": 154, "idea": "Task #27: remove soft-float from sort_bucket_emit (pack_invariants / pack_rec). Audit found T-B(3) (iter-146) had already replaced both float expressions with integer bit-exact helpers (sort_bin_fp32.h); disassembly of the sort_bin ELFs shows the only soft-float calls are the NaN / out-of-range fallbacks. This task: (1) 32-bit fast paths in sort_bin_fp32 unorm16 (only the product stays 64-bit) and sub_int (k==0 shortcut; |a|>=4 and tile origin k<=1016 round on 32 bits), exhaustively re-verified; (2) accumulating Tracy sub-zones emit_pack_invariants / emit_pack_rec (DeviceZoneScopedSumN1/N2, active only with TT_METAL_PROFILER_SUM=1) + opt/profiler/emit_sumzones.py.", "decision": "keep", "reason": "yyzo-bh-07 (Blackhole p100a), bicycle 30 views 1024x1024, 3 interleaved A/B rounds vs cc9399c (after task #30): stage_sort_bin_emit 8.997 -> 8.85 ms (-0.147, -1.6%; ranges 8.993-8.999 vs 8.848-8.852, disjoint); stage_sort 18.781 -> 18.602; ms_view 121.984 -> 121.568 (-0.42 ms, -0.3%; base spread 0.48 ms, so only the emit/sort share is attributable). All 30 dumped views byte-identical, hero md5 e3fefb11..., hero_vs_ref 100.00 dB. Exhaustive host test (on bh-07): unorm16 4,278,190,082 and sub_int 4,447,490,326 fast-path inputs, 0 mismatches. Sum zones (10 views, per RISC per launch, measured on 7df44de): pack_invariants 1.81 ms = 22.7% and pack_rec 1.59 ms = 19.8% of the ~8 ms emit zone; empty-zone calibration 0.7% / 0.3%. Float math share is ~0 (the ~40% estimate in docs/hw-ceilings.md was made on pre-T-B code; T-B(3) iter-146 already made both expressions integer). Remaining pack cost is integer work plus L1 loads/stores. Kept: bit-identical, zero risk, tooling useful; gain is sub-1% of the frame. Details: docs/sort-emit-softfloat-2026-09-30.md.", "metrics": {"hero_vs_ref": 100.0, "bit_identical": true, "all_30_views_identical": true, "hero_md5": "e3fefb116d860f99d92bba1ef51d820c", "board": "yyzo-bh-07 (Blackhole p100a)", "frame_ms_view": 121.568, "frame_ms_view_baseline": 121.984, "frame_delta_ms": -0.416, "stage_sort_bin_emit_ms": 8.85, "stage_sort_bin_emit_ms_baseline": 8.997, "stage_sort_ms": 18.602, "stage_sort_ms_baseline": 18.781, "emit_zone_ms_per_risc": 7.99, "pack_invariants_share_of_emit": 0.227, "pack_rec_share_of_emit": 0.198, "sumzone_timer_overhead_share": 0.01, "softfloat_calls_on_hot_path": 0, "fps": 8.23, "fps_baseline": 8.2, "ab_rounds": 3}, "timings": {"ms_view": 121.568, "blend": 121.568}, "iter_dir": "ttw-154", "verdict": "KEEP (bit-identical; emit -0.15 ms, frame -0.42 ms within noise; board yyzo-bh-07 p100a)", "ts": "2026-09-30T05:20:00-0700", "buildid": {"cpp": "gsplat_tt 5eae3a0 (task 27: sort_bin_fp32 32-bit paths + emit sum zones, on c259cfa)", "data": ""}, "screenshot": "opt/metal-screenshots/ttw-154/hero.png", "screenshot_diff": "opt/metal-screenshots/ttw-154/hero_diff10.png", "tracy": ""}
{"iter": 155, "idea": "Task #39 (covers queued #36): remove libgcc soft-float from the cull/blend TRISC compute kernels' scalar record decode (TRISCs have no scalar FPU). objdump of the JIT ELFs: microblock_cull_compute TRISC1 had 129 __subsf3 (mx-txf / my-tyf in each of 32 unrolled cull_face_x/cull_face_y), plus per-record mean+origin adds and UNORM16 op convert+mul = 8 soft-float calls per record; alpha_blend_compute_mb TRISC1 had 4x UNORM16 convert+mul per record and float compares in the T-readback. Replaced with integer bit-exact helpers in dm_fp32.h (unorm16_to_f: exact product q*65537*2^-32 rounded RNE; add_sub_roundtrip: fl(fl(a+k)-k) via two dm_fp32::add, float fallback outside the fast range). Cull computes mlx/mly once per record on the MATH thread; blend decodes UNORM only for records with a live mask; T max/threshold compares on bits.", "decision": "keep", "reason": "A/B, 3 interleaved rounds per build in one device session on yyzo-bh-07 (Blackhole p100a, not a p150), bicycle 30 views 1024x1024, base = smarton/tt-project-opt cc9399c: avg_frame_ms 121.78 (121.70/121.94/121.69) -> 107.83 (107.83/107.80/107.86), -13.95 ms/view (-11.5%), 8.21 -> 9.27 FPS. stage_blend 63.60 -> 49.63 (-13.97); other stages unchanged. hero_vs_ref 100.00 dB, hero md5 e3fefb11..., all 30 dumped views byte-identical to base. After: blend TRISC0/1/2 ELFs have no soft-float calls; cull TRISC1 keeps only cold-fallback and per-tile/per-core sites. Host check tests/unit/test_trisc_fp32.cpp: 26.8e9 comparisons vs native fp32, 0 mismatches. No Tracy in this task (cull vs blend split of the 14 ms not measured).", "metrics": {"hero_vs_ref": 100.0, "bit_identical": true, "all_30_views_identical": true, "board": "yyzo-bh-07 (Blackhole p100a)", "frame_ms_view": 107.827, "frame_ms_view_baseline": 121.776, "frame_delta_ms": -13.949, "fps": 9.27, "fps_baseline": 8.21, "stage_blend_ms": 49.628, "stage_blend_ms_baseline": 63.597, "ab_rounds": 3, "softfloat_call_sites_cull_trisc1_before": 142, "softfloat_call_sites_blend_trisc1_before": 14, "softfloat_call_sites_blend_after": 0, "host_check_comparisons": 26836897484, "host_check_mismatches": 0}, "timings": {"ms_view": 107.827, "blend": 107.827}, "iter_dir": "ttw-155", "verdict": "KEEP (-13.95 ms/view, 121.78 -> 107.83, bit-identical 30/30; board yyzo-bh-07 p100a)", "ts": "2026-09-30T05:35:00-0700", "buildid": {"cpp": "gsplat_tt ttp/t39 on cc9399c (integer record decode in cull/blend TRISC kernels)", "data": ""}, "screenshot": "opt/metal-screenshots/ttw-155/hero.png", "screenshot_diff": "opt/metal-screenshots/ttw-155/hero_diff10.png"}
