{"iter": 119, "idea": "Sort Stage 2b DIAGNOSTIC: fuse projection into the bucket fill by killing the gaussian-major blendrec AoS DRAM array (gather stops writing proj_m_blendrec; sort_bin in-budget fill + sort_subchunk_materialize overflow re-gather assemble each 32B PACK2 record from the compacted SoA proj_m_* instead). Goal was to eliminate proj_scatter's 20.8 ms/view gaussian-major write.", "decision": "blocked", "reason": "DIAGNOSTIC (no frame kept) \u2014 REFUTES the premise that proj_scatter's 20.8 ms/view is the blendrec write. Measured: killing blendrec drops proj_scatter only 20.83->18.79 ms/view (-2.0); the other ~18.8 ms is the REQUIRED SoA proj_m_* writes (px,py,rx,ry,a,b,c,depth,opacity,colors), which blend/cull/tile_assign still read. blendrec's real value was making the DEPTH-SORTED overflow re-gather cheap (1 contiguous 64B AoS read/record); without it sort_subchunk_mat must read ~8 SoA pages/record (gids depth-sorted, non-monotonic, uncacheable) -> sort_subchunk_mat 26.15->35.79 ms/view (+9.6) even after batching the reads (per-record-barrier naive form was +18.2 -> 44.33). In-budget bucket fill IMPROVED (sort_bucket_emit 39.68->36.02, -3.7, via gaussian-major SoA page caching). NET: ms_view 195.51 (iter-118 anchor) -> 206.56 naive / 198.07 batched (+2.56 ms, +1.3%), BIT-IDENTICAL pixels (hero md5 e3fefb116d860f99d92bba1ef51d820c == anchor). BRISC-FW long pole 179.72->183.64 (+3.9), NCRISC-KERNEL 144.53->150.53 (+6.0). Clear structural regression on a refuted premise -> REVERTED. Device kernel+host restored to pristine HEAD (md5 e3fefb11 re-verified, ms_view 195.24, bin=e447f26c64546156).", "metrics": {"ms_view_anchor_iter118": 195.506, "ms_view_stage2b_naive": 206.556, "ms_view_stage2b_batched": 198.07, "ms_view_revert_verify": 195.242, "hero_vs_ref": 63.95, "bit_identical": true, "proj_scatter_pvmk_base": 20.826, "proj_scatter_pvmk_2b": 18.789, "proj_count_pvmk_base": 14.966, "proj_count_pvmk_2b": 14.966, "sort_bucket_emit_pvmk_base": 39.677, "sort_bucket_emit_pvmk_2b": 36.023, "sort_subchunk_mat_pvmk_base": 26.148, "sort_subchunk_mat_pvmk_2b_naive": 44.331, "sort_subchunk_mat_pvmk_2b_batched": 35.788, "brisc_fw_pvmk_base": 179.721, "brisc_fw_pvmk_2b": 183.641, "ncrisc_kernel_pvmk_base": 144.525, "ncrisc_kernel_pvmk_2b": 150.534}, "notes": "Per-view MAKESPAN (busiest-core), 30-view device CSV, iter-116 baseline (opt/profiler/ttw-116) vs iter-119b batched (opt/profiler/ttw-119): proj_scatter 20.83->18.79 (-2.0) | proj_count 14.97->14.97 (0) | sort_bucket_emit 39.68->36.02 (-3.7) | sort_subchunk_mat 26.15->35.79 (+9.6; naive per-record-barrier form was 44.33) | BRISC-FW 179.72->183.64 (+3.9) | NCRISC-KERNEL 144.53->150.53 (+6.0). The kept tradeoff math: -2.0 (proj_scatter) -3.7 (sort_bucket_emit) +9.6 (sort_subchunk_mat) = net +3.9 on the NCRISC/BRISC long pole => +2.5 ms/view wall. ROOT CAUSE: blendrec is NOT the proj_scatter cost; it is a read-amortization cache for the depth-sorted overflow gather. RECOMMENDED next lever: (a) the only way to truly fuse and win is to make the bucket scatter the SINGLE record write AND keep ALL records (incl. overflow) in the buckets so sort_subchunk_materialize reads them coalesced from buf_l1_recs (no depth-sorted SoA re-gather) \u2014 i.e. grow/segment the per-(core,tile) bucket so overflow subchunks live in L1/DRAM buckets too, not re-fetched by gid. (b) Alternatively leave blendrec and attack the actual long pole: BRISC-FW 179.7 is ~92 ms host-dispatch overhead (BRISC-KERNEL 87.1) \u2014 the host-free glue (Stage 5) is the real frame win, not blendrec. Harness: rsync render/ -> cmake build-tt -> render/run.py --no-ref + capture_tracy.sh -> analyze_zones.py. Device yyzo-bh-07, HEAD 9ab6e23. Kernel+host NOT committed (reverted).", "iter_dir": "ttw-119", "ts": "2026-06-11T03:58:00-0700", "buildid": {"cpp": "diagnostic on cpp#86/#87 9ab6e23 iter-119 Stage 2b (kill blendrec, SoA record assembly); device restored to pristine cpp#88 bin=e447f26c64546156 (md5 e3fefb11 == Mac HEAD)", "data": "data#   bin="}}
{"iter": 120, "idea": "Characterize the ~92ms BRISC host-dispatch overhead; test redundant-Finish removal", "decision": "blocked", "reason": "DIAGNOSTIC (no frame kept). Phase-1 host-wall breakdown localizes the frame: sort+cull+blend=133.8ms/view (69%), project=37.5 (gather 34.9; mc+pfwc Finish bubbles only 0.72+1.91), tile_assign=23.8, post~0; ~18 EnqueueMeshWorkload + ~13 CQ drains/view; total 195.1 == 195.5 baseline. Phase-2: removed 5 provably-redundant Finish barriers (means_cam/pfwc resident, ta-scan redundant w/ P-read, ta-K2 bubble, sort-bin-cnt redundant w/ hist-read) -> FRAME-NEUTRAL 195.1->196.1 (work just shifts: ta 23.8->13.3, sort 133.8->145.3, gather 34.9->37.3). Root cause: single in-order CQ + negligible host compute => a removed Finish is re-imposed by the next blocking read; the 92ms is on-device BRISC-FW per-program launch overhead (only fusion or Metal Trace reduces it). REVERTED to pristine (md5 e3fefb11, 63.95dB, 195.0). Added concrete ordered Stage-5 plan (S5.1 = flip sort_device_layout_enabled()).", "metrics": {"ms_view_baseline": 195.13, "ms_view_drains_removed": 196.07, "ms_view_revert_verify": 195.0, "hero_vs_ref": 63.95, "bit_identical": true, "hostwall_project_ms": 37.53, "hostwall_means_cam_ms": 0.72, "hostwall_pfwc_ms": 1.91, "hostwall_gather_ms": 34.9, "hostwall_tile_assign_ms": 23.81, "hostwall_sort_cull_blend_ms": 133.79, "hostwall_post_ms": 0.002, "enqueue_meshworkload_per_view": 18, "cq_drains_per_view": 13, "drains_removed_count": 5, "hostwall_ta_after": 13.29, "hostwall_sort_after": 145.33, "hostwall_gather_after": 37.33}, "notes": "Phase-1 CHARACTERIZE: GSPLAT_TT_HOST_PROFILE=1 chrono in render_view (env-gated, reverted) split the 195ms host wall per stage on device (yyzo-bh-07, 30 views). The Python ms_view IS the host wall (every stage drains the one shared device_state::command_queue() in-order CQ). Per-stage program/Finish audit (production constants resident_in/pairs/device_scan=true, ta_no_cull=true, tile_bucket/l1_record/dev_publish=true, device_layout=false): project=5 enq/3 syncs (means_cam Finish, pfwc Finish, gather count+scan+scatter + M-read); tile_assign=5 enq/3 syncs (K1; scan1+scan_bases Finish; P-read; scan2+K2 Finish); sort+cull+blend=~10 enq/~7 syncs (P-read, bin-cnt Finish, hist-read+hostLPT+6 H2D + upload, bin-scat Finish, routeC-cull Finish, radix Finish, publish+subchunk-dir Finish, materialize piped, blend drain+image D2H). Phase-2 EXPERIMENT: gated/removed 5 redundant Finishes; measured frame-neutral and REVERTED. Honest finding: host Finish removal cannot move this frame because (a) negligible host compute to overlap, (b) the next blocking read re-imposes the device-makespan wait, (c) the 92ms BRISC non-kernel is on-device per-program launch firmware overhead (proportional to ~18 programs). The real levers are fusion (fewer programs) and Metal Trace (pre-record dispatch) -> Stage 5. Appended concrete ordered Stage-5 plan to opt/sort-l1-resident-plan.md: S5.1 flip sort_device_layout_enabled() (device bin-layout path EXISTS, removes the biggest mid-frame host blocker: hist-read+host-LPT+6 H2D), then device/static LPT, padded_n over-provision to delete M/P-read drains, static subchunk alloc, persistent kernels, BeginTraceCapture. Device restored pristine cpp#88 bin=e447f26c64546156.", "iter_dir": "ttw-120", "ts": "2026-06-11T04:25:00-0700", "buildid": {"cpp": "diagnostic on cpp#88 9ab6e23 (iter-118 HEAD pristine); HOSTPROF chrono instrumentation + 5-Finish-removal experiment, both REVERTED; device restored to pristine bin=e447f26c64546156 (md5 e3fefb11 == Mac HEAD b7ac3db)", "data": "data#   bin="}}
{"iter": 121, "idea": "S5.1: enable on-device sort bin-layout (sort_device_layout_enabled=true). Recovered the missing sort_bin_layout.cpp kernel (host referenced it but it was absent from render/kernels/ \u2014 the real reason the flag was off), rewrote it as an efficient single-core bulk-row pass, and extended it to populate l1_rec_base (the L1_RECORD scatter's per-(core,tile) bucket base) which the legacy kernel lacked. Removes host hist-read + host-LPT + 6 H2D re-uploads; host now reads only resident result buffers + a tiny ctrl page.", "decision": "keep", "reason": "63.95 >= 50.0", "metrics": {"hero_vs_ref": 63.95}, "timings": {"ms_view": 214.999, "blend": 214.999}, "iter_dir": "ttw-121", "screenshot": "opt/metal-screenshots/ttw-121/hero.png", "screenshot_diff": "opt/metal-screenshots/ttw-121/hero_diff10.png", "ts": "2026-06-11T04:57:40-0700", "buildid": {"cpp": "cpp#89 56d8f42 iter 121: S5.1: enable on-device sort bin-layout (sort_device_layout_enabled=true). Recovered the missing sort_bin_layout.cpp kernel (host referenced it but it was absent from render/kernels/ \u2014 the real reason the flag was off), rewrote it as an efficient single-core bulk-row pass, and extended it to populate l1_rec_base (the L1_RECORD scatter's per-(core,tile) bucket base) which the legacy kernel lacked. Removes host hist-read + host-LPT + 6 H2D re-uploads; host now reads only resident result buffers + a tiny ctrl page. bin=241ea500aa9bdc9d", "data": "data#   bin="}, "tracy": "opt/profiler/ttw-121/render.tracy", "notes": "S5.1 device sort bin-layout \u2014 KEEP (bit-identical, architectural gain; +10% standalone). VERIFY (layout_verify=true, 30 views): device layout == host_bin_layout_from_hist BIT-EXACT, dev_status==0, zero mismatch prints across hist/counts/tids/lpt_meta/tmeta incl. heavy/overflow + l1_record tiles. Root cause the flag was off: render/kernels/dataflow/sort_bin_layout.cpp was MISSING (host referenced it; JIT could not compile) and the legacy version never wrote l1_rec_base (live L1_RECORD scatter base). Recovered from git (61f61ad), rewrote as efficient single-core bulk-row (read_pages/write_pages, 2 streaming passes over core rows) + on-device LPT, wired bucket_fit(arg12)+l1_base_addr(arg13). REMOVES host-side: hist D2H read, host-LPT compute, all 6 H2D re-uploads (bin2d/tmeta/tile_ids/bucket_meta/l1_rec_base/...); host-LPT now runs ON-DEVICE (NOT deferred to S5.2). Host reads only a tiny ctrl page + already-resident result buffers. PERF (layout_verify=false): hero md5 e3fefb116d860f99d92bba1ef51d820c (bit-identical), PSNR 63.95dB. ms_view 195.5->215.0 (+19.5, +10%). Per-view busiest-core makespan (30-view Tracy): BRISC-FW 179.72->202.53 (+22.8); NCRISC-KERNEL 144.53->167.59 (+23.1); TRISC-KERNEL 52.43->51.89 (-0.5); named sort zones unchanged (bucket_emit 39.7, subchunk_mat 26.2, bin_hist 1.41; proj_scatter/count 20.83/14.97). The entire +23ms is the NEW single-core sort_bin_layout kernel (no named zone -> shows as NCRISC-KERNEL on core(0,0), inflating the BRISC-FW long pole): serial single-core layout is slower than fast host CPU IN ISOLATION; the H2D/host-dispatch win is only realized once Metal Trace hides the per-program launch overhead. KEEP rationale: bit-identical + removes the load-bearing host blocker (host-LPT + 6 H2D) that blocks capturing the sort stage into a Metal Trace; this is the documented S5.1 trace prerequisite. NEXT (S5.2): either parallelize the device layout across cores (kill the single-core +23ms) or land Metal Trace so the removed host-dispatch overhead becomes a net win."}
{"iter": 122, "idea": "S5.2: cheap on-device sort bin-layout \u2014 L1-cache the per-core histogram (one DRAM read pass instead of two) + LSD radix LPT sort replacing O(n^2) selection (bit-exact, identical (cost,tile_id) order); recovers ~half the iter-121 +23ms single-core regression (215.0->205 ms/view), pixels bit-identical (hero md5 e3fefb11, 63.95dB)", "decision": "keep", "reason": "63.95 >= 50.0", "metrics": {"hero_vs_ref": 63.95}, "timings": {"ms_view": 205.029, "blend": 205.029}, "iter_dir": "ttw-122", "screenshot": "opt/metal-screenshots/ttw-122/hero.png", "screenshot_diff": "opt/metal-screenshots/ttw-122/hero_diff10.png", "ts": "2026-06-11T05:20:16-0700", "buildid": {"cpp": "cpp#90 1d99fbd iter 122: S5.2: cheap on-device sort bin-layout \u2014 L1-cache the per-core histogram (one DRAM read pass instead of two) + LSD radix LPT sort replacing O(n^2) selection (bit-exact, identical (cost,tile_id) order); recovers ~half the iter-121 +23ms single-core regression (215.0->205 ms/view), pixels bit-identical (hero md5 e3fefb11, 63.95dB) bin=283a78dc20c153d6", "data": "data#   bin="}, "tracy": "opt/profiler/ttw-122/render.tracy"}
{"iter": 123, "idea": "S5.3 M-domain GROUNDWORK (gated prerequisite, behind host_free_mp_enabled): tile_assign now reads the visible-count M from the resident proj_M control page via a runtime InterleavedAddrGen<true> (bbox K1 + scan_reduce + scan_add) and over-provisions the M-domain offsets/scan buffers + K1 page-split to a static page-aligned ceiling n_ceil (= proj_m_px capacity) instead of the host-read M. Reversible (host_free_mp_enabled() default true). Frame-neutral at the steady-state floor (~204-205 ms/view; the higher verify avg is thermal from back-to-back runs). Bit-identical (hero md5 e3fefb11, 63.95 dB across 30 views). NOTE: the three mid-frame host blocking read-deletions (tile_assign P-read, sort P-read, gather M-read) are NOT removed yet \u2014 this lands only the resident-read + static-ceiling pattern they depend on.", "decision": "keep", "reason": "63.95 >= 50.0", "metrics": {"hero_vs_ref": 63.95}, "timings": {"ms_view": 232.882, "blend": 232.882}, "iter_dir": "ttw-123", "screenshot": "opt/metal-screenshots/ttw-123/hero.png", "screenshot_diff": "opt/metal-screenshots/ttw-123/hero_diff10.png", "ts": "2026-06-11T06:31:13-0700", "buildid": {"cpp": "cpp#91 f1a8eab iter 123: S5.3 M-domain GROUNDWORK (gated prerequisite, behind host_free_mp_enabled): tile_assign now reads the visible-count M from the resident proj_M control page via a runtime InterleavedAddrGen<true> (bbox K1 + scan_reduce + scan_add) and over-provisions the M-domain offsets/scan buffers + K1 page-split to a static page-aligned ceiling n_ceil (= proj_m_px capacity) instead of the host-read M. Reversible (host_free_mp_enabled() default true). Frame-neutral at the steady-state floor (~204-205 ms/view; the higher verify avg is thermal from back-to-back runs). Bit-identical (hero md5 e3fefb11, 63.95 dB across 30 views). NOTE: the three mid-frame host blocking read-deletions (tile_assign P-read, sort P-read, gather M-read) are NOT removed yet \u2014 this lands only the resident-read + static-ceiling pattern they depend on. bin=67660b4ac6a5febd", "data": "data#   bin="}, "tracy": "opt/profiler/ttw-123/render.tracy"}
{"iter": 124, "idea": "S5.3 tile_assign P-read deletion \u2014 pair buffers + K2 scatter work-split sized to static pair_ceiling() (4,718,592); K2 reads clamped P from resident ta_pairs_P ctrl page (InterleavedAddrGen<true>); scan_bases clamps published P + publishes overflow/true-P; sort_device hard-fails on overflow. Behind host_free_mp_enabled (reversible). Frame-neutral trace-prerequisite (removes one of three mid-frame host blocking-read drains).", "decision": "keep", "reason": "63.95 >= 50.0", "metrics": {"hero_vs_ref": 63.95}, "timings": {"ms_view": 238.355, "blend": 238.355}, "iter_dir": "ttw-124", "screenshot": "opt/metal-screenshots/ttw-124/hero.png", "screenshot_diff": "opt/metal-screenshots/ttw-124/hero_diff10.png", "ts": "2026-06-11T07:38:13-0700", "buildid": {"cpp": "cpp#92 d754416 iter 124: S5.3 tile_assign P-read deletion \u2014 pair buffers + K2 scatter work-split sized to static pair_ceiling() (4,718,592); K2 reads clamped P from resident ta_pairs_P ctrl page (InterleavedAddrGen<true>); scan_bases clamps published P + publishes overflow/true-P; sort_device hard-fails on overflow. Behind host_free_mp_enabled (reversible). Frame-neutral trace-prerequisite (removes one of three mid-frame host blocking-read drains). bin=ba1fecf45513c2a7", "data": "data#   bin="}, "tracy": "opt/profiler/ttw-124/render.tracy"}
{"iter": 125, "idea": "S5.4: parallelize on-device sort bin-layout Pass-2 base emit across 16 cores (new sort_bin_emit.cpp). Coordinator (sort_bin_layout.cpp) publishes per-worker running-prefix checkpoints (page_acc pages + rec_acc counts at each worker first source-core) to a small DRAM ckpt buffer; emit workers replay the exact Pass-2 accumulation over disjoint source-core ranges (contention-free) -> bit-identical bin2d/l1_rec_base bases. CQ-ordered after the coordinator (no semaphores; follows the proven program-ordering pattern). Recovers part of the iter-121 +13ms single-core layout regression: A/B (matched thermal) min_ms 213.0 -> 211.5 (-1.5), BRISC-FW 226.2 -> 224.7, NCRISC-KERNEL 191.4 -> 189.9, TRISC unchanged. Bit-exact (layout_verify=true: 33/33 IDENTICAL across 30 views) + hero 63.95dB. Launch overhead caps the 2-program win now; folds away under Metal Trace.", "decision": "keep", "reason": "63.95 >= 50.0", "metrics": {"hero_vs_ref": 63.95}, "timings": {"ms_view": 236.721, "blend": 236.721}, "iter_dir": "ttw-125", "screenshot": "opt/metal-screenshots/ttw-125/hero.png", "screenshot_diff": "opt/metal-screenshots/ttw-125/hero_diff10.png", "ts": "2026-06-11T08:20:19-0700", "buildid": {"cpp": "cpp#93 de6d1db iter 125: S5.4: parallelize on-device sort bin-layout Pass-2 base emit across 16 cores (new sort_bin_emit.cpp). Coordinator (sort_bin_layout.cpp) publishes per-worker running-prefix checkpoints (page_acc pages + rec_acc counts at each worker first source-core) to a small DRAM ckpt buffer; emit workers replay the exact Pass-2 accumulation over disjoint source-core ranges (contention-free) -> bit-identical bin2d/l1_rec_base bases. CQ-ordered after the coordinator (no semaphores; follows the proven program-ordering pattern). Recovers part of the iter-121 +13ms single-core layout regression: A/B (matched thermal) min_ms 213.0 -> 211.5 (-1.5), BRISC-FW 226.2 -> 224.7, NCRISC-KERNEL 191.4 -> 189.9, TRISC unchanged. Bit-exact (layout_verify=true: 33/33 IDENTICAL across 30 views) + hero 63.95dB. Launch overhead caps the 2-program win now; folds away under Metal Trace. bin=c70695503e7573cf", "data": "data#   bin="}, "tracy": "opt/profiler/ttw-125/render.tracy"}
{"iter": 126, "idea": "MEASURE Metal Trace payoff: gated GSPLAT_TT_TRACE_PROTO captures the real hero-view program stream into a 256MB trace region (+program cache) and times ReplayTrace vs host dispatch on yyzo-bh-07 (N=50). REFUTES the trace endgame: trace replays bit-identically but removes <0.5ms (frame is on-device-execution bound, not host-dispatch bound).", "decision": "blocked", "reason": "DIAGNOSTIC (no frame kept; proto reverted, device pristine). Trace replay == host dispatch to within noise on BOTH a heavy 5-program tile_assign sub-chain (trace 57.102 vs host-pipelined 57.106 vs host-drained 57.169 ms/iter) AND a light 2-program project head means_cam+pfwc (trace 2.5125 vs 2.5132 vs 2.5333). Per-drain dispatch bubble is program-weight-independent ~16-20us (light probe proves heavy compute was NOT masking a per-launch cost). Implied full-frame trace-removable host dispatch ~13 drains*18us + ~20 programs*1-4us = <0.5ms, three orders of magnitude below the hypothesized ~92ms / ~45-60ms. The ~145-160ms post-trace floor is REFUTED: Metal Trace replays the on-device BRISC-FW launch/barrier firmware UNCHANGED (bit-identical 5-program replay takes the same wall time as host dispatch); the 92ms BRISC-FW-non-kernel is on-device firmware+dataflow, not host dispatch. Bit-identical confirmed (ta_pairs_gid FNV-1a 4587123369709330712 across host-reenqueue==trace-replay==after-frame, != zeroed). Gotchas: DEFAULT_TRACE_REGION_SIZE=0 (must pass explicit trace_region_size); enable_program_cache() required; per-program double-enqueue (gather mode0/1, sort wl_bin) uncapturable as one replay unit (had to restrict to all-distinct sub-chain); no host ops inside Begin/EndTraceCapture; buffer addresses baked into trace (needs static alloc, no realloc). NO-GO on the host-free single trace as a perf lever; redirect the 4-6 cycles to fusion (fewer programs) + NCRISC dataflow kernels. Reverted to pristine: hero md5 e3fefb116d860f99d92bba1ef51d820c, 63.95dB, device bin c70695503e7573cf == stamped iter-125.", "metrics": {"hero_vs_ref": 63.95, "hero_md5_ok": true, "bit_identical_replay": true, "chain_distinct": true, "n_replays": 50, "heavy_chain_programs": 5, "heavy_host_pipelined_ms": 57.106, "heavy_host_drained_ms": 57.169, "heavy_trace_replay_ms": 57.102, "heavy_per_drain_bubble_us": 15.6, "heavy_delta_drained_vs_trace_ms": 0.067, "cheap_chain_programs": 2, "cheap_host_pipelined_ms": 2.5132, "cheap_host_drained_ms": 2.5333, "cheap_trace_replay_ms": 2.5125, "cheap_per_drain_bubble_us": 20.0, "trace_removable_host_dispatch_ms_est_upper": 0.5}, "iter_dir": "ttw-126", "ts": "2026-06-11T09:06:18-0700", "buildid": {"cpp": "diagnostic on cpp#93 de6d1db bin=c70695503e7573cf (iter-125 HEAD pristine); GSPLAT_TT_TRACE_PROTO trace-capture/replay measurement prototype, REVERTED; device restored to pristine bin=c70695503e7573cf (hero md5 e3fefb116d860f99d92bba1ef51d820c == Mac HEAD)", "data": "data#   bin="}}
