{"iter": 199, "idea": "Task #232 (write-up docs/pfwc-noc1-balance-t232): balance the pfwc writer NoCs, then re-gate P2. writer_pfwc_split.cpp (PFWC_RD_COLS) lets either RISC read any subset of the 10 pfwc input tiles per chunk (runtime args 39-41: NoC0 column mask, BRISC tile set on those columns, BRISC tile set elsewhere); NCRISC reads the complement. New defaults: GSPLAT_TT_PFWC_COV2D_SFPU=1 (P2, t228) and GSPLAT_TT_PFWC_RD_REST=0x0F (BRISC/NoC0 reads input tiles 0-3 on every core, NCRISC/NoC1 reads tiles 4-9); =0 turns each off. Kernel config auto-opens +32 KB (program 96288 B).", "decision": "keep", "reason": "yyzo-bh-07 (Blackhole p100a, not a p150), bicycle 30 views 1024x1024. STEPCYC writer field fl (time in flush_rec/flush_pg) showed the slow cores stall in NoC write issue: input reads on a NoC slow that NoC's record and page writes (NoC1 reads hurt columns 13-15, NoC0 reads hurt rows 2-4), so a 4/6 read split balances both. Tracy STEPCYC=1 views 0-4 (KCFG_EXTRA_KB=32): mean pfwc span old default 2.323, P2 alone 2.565, P2 + RD_REST=0x0F 1.935 ms; core wall max 2.552 (P2 alone) -> 1.903; NCRISC record loop at x=14 1.402 -> 0.866 ms; column means within 0.07 ms. Gate, 4 rotated untraced rounds on c074fae (before iter 198 merged): old default 12.607/12.609/12.626/12.579 mean 12.605 ms/view, fix 12.261/12.257/12.281/12.301 mean 12.275 (paired -0.330, gate -0.3), alt (P2 + tiles 0-5 on x>=13, 0-2 elsewhere) 12.336 (-0.269). Verify on the merged tip 3ec6008 (with BLEND_DECODE_AHEAD=2), 2 swapped rounds: default 11.600/11.651 mean 11.625 ms/view (86.0 FPS), off (COV2D_SFPU=0, RD_REST=0) 11.918/11.984 mean 11.951, paired -0.326; project 3.343 -> 3.021. Tracy 30 views (KCFG_EXTRA_KB=32): device span 11.334 ms/view (iter 198: 11.663), pfwc window 2.004. md5 46a725ab on all 16 arms (30/30 views). Not built: 2:1 chunk deal and NoC0 for NCRISC record writes (the read split alone passed the gate).", "metrics": {"board": "yyzo-bh-07 (Blackhole p100a)", "bit_identical": true, "all_30_views_identical": true, "max_lsb": 0, "hero_vs_ref": 100.0, "frame_ms_view": 11.625, "frame_ms_view_baseline": 11.951, "frame_delta_ms": -0.326, "frame_delta_pct": -2.7, "fps": 86.02, "gate_ms_view_base": 12.605, "gate_ms_view_fix": 12.275, "gate_ms_view_alt": 12.336, "gate_delta_fix": -0.33, "gate_delta_alt": -0.269, "project_ms_default": 3.021, "project_ms_off": 3.343, "tracy_pfwc_span_ms_old_default": 2.323, "tracy_pfwc_span_ms_p2_alone": 2.565, "tracy_pfwc_span_ms_new_default": 1.935, "tracy_pfwc_core_wall_max_ms_p2_alone": 2.552, "tracy_pfwc_core_wall_max_ms_new_default": 1.903, "tracy_ncrisc_rec_x14_ms_p2_alone": 1.402, "tracy_ncrisc_rec_x14_ms_new_default": 0.866, "tracy_device_span_ms": 11.334, "tracy_pfwc_window_ms": 2.004}, "timings": {"ms_view": 11.625, "project": 3.021, "blend": 7.491}, "iter_dir": "ttw-199", "run_label": "t232 Tracy sweep pb/p0/pf/pr*/ph* + r1..r4 {base,fix,alt} + verify rv1..rv2 {default,off} + Tracy t232-def", "verdict": "KEEP (P2 cov2d SFPU + BRISC/NoC0 reads pfwc input tiles 0-3 on by default: 11.951 -> 11.625 ms/view (-0.326), 86.0 FPS, md5-identical; board yyzo-bh-07 p100a)", "tracy": "opt/profiler/ttw-199/render.tracy", "ts": "2026-10-05T12:45:00-0400", "buildid": {"cpp": "gsplat_tt 3ec6008 (defaults COV2D_SFPU=1, RD_REST=0x0F)", "data": ""}, "device_screenshot": {"hero": "opt/metal-screenshots/ttw-199/hero.png", "diff": "opt/metal-screenshots/ttw-199/hero_diff10.png", "ref": "benchmarks/reference_v2/hero.png", "psnr_vs_ref": 41.16, "diff_ref": "benchmarks/reference_v2/hero.png", "golden": "tests/fixtures/hero/archive/hero_golden_8bit_pre-t290-newton.png", "golden_match": true, "md5": "46a725ab", "commit": "3ec6008", "config": "defaults (GSPLAT_TT_PFWC_COV2D_SFPU=1, GSPLAT_TT_PFWC_RD_REST=0x0F, GSPLAT_TT_BLEND_DECODE_AHEAD=2, GSPLAT_TT_BLEND_SCHED=2, ...), verify round rv1 (same ttp lock as the A/B run)", "device": "yyzo-bh-07 p100a", "visual_check": "Looked at hero.png full frame, a 512 px full-resolution crop of the bike, and the 10x diff. No seams on 16/32 px tile edges (mean gradient across 32 px column/row boundaries 6.93/7.51 vs 6.76/7.71 elsewhere; 16 px 6.73/7.75 vs 6.76/7.70), no blocky, empty or black tiles (darkest 32x32 tile mean 14.5/255), no stripes or color shifts; spokes and fence slats are crisp. PSNR 41.16 dB vs benchmarks/reference_v2/hero.png, the same as the golden. The 10x diff vs that reference shows only edge detail (spokes, frame, fence slats, foliage) and faint soft blobs at upper left from culled low-contribution Gaussians; no tile grid (per 32 px tile diff mean p50 0.82, max 6.20)."}}
{"iter": 200, "idea": "Task #260 floor A/B arm A: contrib_floor 1/255 on the iter-199 tip (runtime knobs only, cameras_v2 copy with only contrib_floor changed). Measures the speed cost and the accuracy gain vs benchmarks/reference_v2/hero.png of a lower floor (t251 split the 41.16 dB golden vs reference gap to the iter-156 1/255 floor).", "decision": "diagnostic", "reason": "yyzo-bh-07 (Blackhole p100a, not a p150), bicycle 30 views 1024x1024, commit 9427a47 (46e9e17 + a default-off projection dump). 3 rotated untraced rounds A-E: 11.647/11.643/11.660, mean 11.650 ms/view (85.8 FPS), +0.000 vs arm A (default). Hero PSNR vs reference_v2 41.16 dB (A 41.16, B 45.83, C 46.71, D 46.79, E 46.78). Sweep md5 46a725ab; hero identical in rounds 1 and 3. Not a code change; the default is unchanged and no golden was saved.", "metrics": {"board": "yyzo-bh-07 (Blackhole p100a)", "contrib_floor": "1/255", "pixel_floor": true, "frame_ms_view": 11.65, "frame_ms_view_rounds": [11.647, 11.643, 11.66], "frame_delta_vs_default_ms": 0.0, "fps": 85.84, "hero_psnr_vs_ref": 41.16, "golden_match": true}, "timings": {"ms_view": 11.65}, "iter_dir": "ttw-200", "run_label": "t260 rounds r1..r3 arm A (docs/floor-ab-t260/remote_time.sh)", "verdict": "DIAGNOSTIC (floor 1/255: 11.650 ms/view, 41.16 dB vs reference_v2)", "ts": "2026-10-05T14:00:00-0700", "buildid": {"cpp": "gsplat_tt ttp/t260-floor-ab 9427a47 on 46e9e17", "data": ""}, "device_screenshot": {"hero": "opt/metal-screenshots/ttw-200/hero.png", "diff": "opt/metal-screenshots/ttw-200/hero_diff10.png", "ref": "benchmarks/reference_v2/hero.png", "psnr_vs_ref": 41.16, "diff_ref": "benchmarks/reference_v2/hero.png", "golden": "tests/fixtures/hero/archive/hero_golden_8bit_pre-t290-newton.png", "golden_match": true, "md5": "46a725ab", "commit": "9427a47", "config": "defaults (contrib_floor 1/255, GSPLAT_TT_BLEND_PIXEL_FLOOR=1, BLEND_SCHED=2)", "device": "yyzo-bh-07 p100a", "visual_check": "no tile or microblock seams (step ratio at 32px edges x1.02/y0.97, at 8x4 edges x1.005/y1.012, same as golden); diff shows broad faint curved haze where large low-alpha gaussians are culled, plus bright errors on spokes and frame edges"}}
{"iter": 201, "idea": "Task #260 floor A/B arm B: contrib_floor 1/1024 on the iter-199 tip (runtime knobs only, cameras_v2 copy with only contrib_floor changed). Measures the speed cost and the accuracy gain vs benchmarks/reference_v2/hero.png of a lower floor (t251 split the 41.16 dB golden vs reference gap to the iter-156 1/255 floor).", "decision": "diagnostic", "reason": "yyzo-bh-07 (Blackhole p100a, not a p150), bicycle 30 views 1024x1024, commit 9427a47 (46e9e17 + a default-off projection dump). 3 rotated untraced rounds A-E: 12.650/12.667/12.573, mean 12.630 ms/view (79.2 FPS), +0.980 vs arm A (default). Hero PSNR vs reference_v2 45.83 dB (A 41.16, B 45.83, C 46.71, D 46.79, E 46.78). Sweep md5 07efa52a; hero identical in rounds 1 and 3. Not a code change; the default is unchanged and no golden was saved.", "metrics": {"board": "yyzo-bh-07 (Blackhole p100a)", "contrib_floor": "1/1024", "pixel_floor": true, "frame_ms_view": 12.63, "frame_ms_view_rounds": [12.65, 12.667, 12.573], "frame_delta_vs_default_ms": 0.98, "fps": 79.18, "hero_psnr_vs_ref": 45.83, "golden_match": false}, "timings": {"ms_view": 12.63}, "iter_dir": "ttw-201", "run_label": "t260 rounds r1..r3 arm B (docs/floor-ab-t260/remote_time.sh)", "verdict": "DIAGNOSTIC (floor 1/1024: 12.630 ms/view, 45.83 dB vs reference_v2)", "ts": "2026-10-05T14:00:00-0700", "buildid": {"cpp": "gsplat_tt ttp/t260-floor-ab 9427a47 on 46e9e17", "data": ""}, "device_screenshot": {"hero": "opt/metal-screenshots/ttw-201/hero.png", "diff": "opt/metal-screenshots/ttw-201/hero_diff10.png", "ref": "benchmarks/reference_v2/hero.png", "psnr_vs_ref": 45.83, "diff_ref": "benchmarks/reference_v2/hero.png", "golden": "tests/fixtures/hero/archive/hero_golden_8bit_pre-t290-newton.png", "golden_match": false, "md5": "07efa52a", "commit": "9427a47", "config": "cameras copy with contrib_floor 1/1024 (tile cull and pixel floor 1/1024), other defaults", "device": "yyzo-bh-07 p100a", "visual_check": "no tile or microblock seams (edge step ratios within 1.03 of non-edge, same as A); most of the broad haze in the diff is gone; remaining errors on thin high-contrast edges (spokes, frame, foliage)"}}
{"iter": 202, "idea": "Task #260 floor A/B arm C: contrib_floor 1/4096 on the iter-199 tip (runtime knobs only, cameras_v2 copy with only contrib_floor changed). Measures the speed cost and the accuracy gain vs benchmarks/reference_v2/hero.png of a lower floor (t251 split the 41.16 dB golden vs reference gap to the iter-156 1/255 floor).", "decision": "diagnostic", "reason": "yyzo-bh-07 (Blackhole p100a, not a p150), bicycle 30 views 1024x1024, commit 9427a47 (46e9e17 + a default-off projection dump). 3 rotated untraced rounds A-E: 13.467/13.503/13.597, mean 13.522 ms/view (74.0 FPS), +1.872 vs arm A (default). Hero PSNR vs reference_v2 46.71 dB (A 41.16, B 45.83, C 46.71, D 46.79, E 46.78). Sweep md5 27ae3e6d; hero identical in rounds 1 and 3. Not a code change; the default is unchanged and no golden was saved.", "metrics": {"board": "yyzo-bh-07 (Blackhole p100a)", "contrib_floor": "1/4096", "pixel_floor": true, "frame_ms_view": 13.522, "frame_ms_view_rounds": [13.467, 13.503, 13.597], "frame_delta_vs_default_ms": 1.872, "fps": 73.95, "hero_psnr_vs_ref": 46.71, "golden_match": false}, "timings": {"ms_view": 13.522}, "iter_dir": "ttw-202", "run_label": "t260 rounds r1..r3 arm C (docs/floor-ab-t260/remote_time.sh)", "verdict": "DIAGNOSTIC (floor 1/4096: 13.522 ms/view, 46.71 dB vs reference_v2)", "ts": "2026-10-05T14:00:00-0700", "buildid": {"cpp": "gsplat_tt ttp/t260-floor-ab 9427a47 on 46e9e17", "data": ""}, "device_screenshot": {"hero": "opt/metal-screenshots/ttw-202/hero.png", "diff": "opt/metal-screenshots/ttw-202/hero_diff10.png", "ref": "benchmarks/reference_v2/hero.png", "psnr_vs_ref": 46.71, "diff_ref": "benchmarks/reference_v2/hero.png", "golden": "tests/fixtures/hero/archive/hero_golden_8bit_pre-t290-newton.png", "golden_match": false, "md5": "27ae3e6d", "commit": "9427a47", "config": "cameras copy with contrib_floor 1/4096 (tile cull and pixel floor 1/4096), other defaults", "device": "yyzo-bh-07 p100a", "visual_check": "no tile or microblock seams; haze gone; diff only on thin high-gradient edges (spokes, frame, foliage)"}}
{"iter": 203, "idea": "Task #260 floor A/B arm D: contrib_floor 1/16384 with the per-pixel floor off on the iter-199 tip (runtime knobs only, cameras_v2 copy with only contrib_floor changed). Measures the speed cost and the accuracy gain vs benchmarks/reference_v2/hero.png of a lower floor (t251 split the 41.16 dB golden vs reference gap to the iter-156 1/255 floor).", "decision": "diagnostic", "reason": "yyzo-bh-07 (Blackhole p100a, not a p150), bicycle 30 views 1024x1024, commit 9427a47 (46e9e17 + a default-off projection dump). 3 rotated untraced rounds A-E: 15.337/15.207/15.217, mean 15.253 ms/view (65.6 FPS), +3.603 vs arm A (default). Hero PSNR vs reference_v2 46.79 dB (A 41.16, B 45.83, C 46.71, D 46.79, E 46.78). Sweep md5 7beae7a2; hero identical in rounds 1 and 3. Not a code change; the default is unchanged and no golden was saved.", "metrics": {"board": "yyzo-bh-07 (Blackhole p100a)", "contrib_floor": "1/16384", "pixel_floor": false, "frame_ms_view": 15.253, "frame_ms_view_rounds": [15.337, 15.207, 15.217], "frame_delta_vs_default_ms": 3.603, "fps": 65.56, "hero_psnr_vs_ref": 46.79, "golden_match": false}, "timings": {"ms_view": 15.253}, "iter_dir": "ttw-203", "run_label": "t260 rounds r1..r3 arm D (docs/floor-ab-t260/remote_time.sh)", "verdict": "DIAGNOSTIC (floor 1/16384: 15.253 ms/view, 46.79 dB vs reference_v2)", "ts": "2026-10-05T14:00:00-0700", "buildid": {"cpp": "gsplat_tt ttp/t260-floor-ab 9427a47 on 46e9e17", "data": ""}, "device_screenshot": {"hero": "opt/metal-screenshots/ttw-203/hero.png", "diff": "opt/metal-screenshots/ttw-203/hero_diff10.png", "ref": "benchmarks/reference_v2/hero.png", "psnr_vs_ref": 46.79, "diff_ref": "benchmarks/reference_v2/hero.png", "golden": "tests/fixtures/hero/archive/hero_golden_8bit_pre-t290-newton.png", "golden_match": false, "md5": "7beae7a2", "commit": "9427a47", "config": "cameras copy with contrib_floor 1/16384, GSPLAT_TT_BLEND_PIXEL_FLOOR=0, GSPLAT_TT_BLEND_SCHED=0 (SCHED=2 requires the pixel floor)", "device": "yyzo-bh-07 p100a", "visual_check": "no tile or microblock seams; diff only on thin high-gradient edges, visually the same as C"}}
{"iter": 204, "idea": "Task #260 floor A/B arm E: contrib_floor 1/16384 on the iter-199 tip (runtime knobs only, cameras_v2 copy with only contrib_floor changed). Measures the speed cost and the accuracy gain vs benchmarks/reference_v2/hero.png of a lower floor (t251 split the 41.16 dB golden vs reference gap to the iter-156 1/255 floor).", "decision": "diagnostic", "reason": "yyzo-bh-07 (Blackhole p100a, not a p150), bicycle 30 views 1024x1024, commit 9427a47 (46e9e17 + a default-off projection dump). 3 rotated untraced rounds A-E: 14.377/14.363/14.383, mean 14.374 ms/view (69.6 FPS), +2.724 vs arm A (default). Hero PSNR vs reference_v2 46.78 dB (A 41.16, B 45.83, C 46.71, D 46.79, E 46.78). Sweep md5 1b5426ce; hero identical in rounds 1 and 3. Not a code change; the default is unchanged and no golden was saved.", "metrics": {"board": "yyzo-bh-07 (Blackhole p100a)", "contrib_floor": "1/16384", "pixel_floor": true, "frame_ms_view": 14.374, "frame_ms_view_rounds": [14.377, 14.363, 14.383], "frame_delta_vs_default_ms": 2.724, "fps": 69.57, "hero_psnr_vs_ref": 46.78, "golden_match": false}, "timings": {"ms_view": 14.374}, "iter_dir": "ttw-204", "run_label": "t260 rounds r1..r3 arm E (docs/floor-ab-t260/remote_time.sh)", "verdict": "DIAGNOSTIC (floor 1/16384: 14.374 ms/view, 46.78 dB vs reference_v2)", "ts": "2026-10-05T14:00:00-0700", "buildid": {"cpp": "gsplat_tt ttp/t260-floor-ab 9427a47 on 46e9e17", "data": ""}, "device_screenshot": {"hero": "opt/metal-screenshots/ttw-204/hero.png", "diff": "opt/metal-screenshots/ttw-204/hero_diff10.png", "ref": "benchmarks/reference_v2/hero.png", "psnr_vs_ref": 46.78, "diff_ref": "benchmarks/reference_v2/hero.png", "golden": "tests/fixtures/hero/archive/hero_golden_8bit_pre-t290-newton.png", "golden_match": false, "md5": "1b5426ce", "commit": "9427a47", "config": "cameras copy with contrib_floor 1/16384, pixel floor on (1/16384), other defaults", "device": "yyzo-bh-07 p100a", "visual_check": "no tile or microblock seams; diff only on thin high-gradient edges, visually the same as C/D"}}
{"iter": 205, "idea": "Task #266/#290: GSPLAT_TT_PFWC_RECIP_NEWTON default on. pfwc 1/tz becomes an SFPARECIP seed plus 2 Newton steps (same pattern as the existing conic path), so projected means are accurate to ~1e-4 px instead of up to 0.41 px.", "decision": "keep", "reason": "yyzo-bh-07 (Blackhole p100a, not a p150), bicycle 30 views 1024x1024, commit 7bcba92 (t266 7c6c7b8 + default flip). 3 rotated untraced rounds default vs GSPLAT_TT_PFWC_RECIP_NEWTON=0: on 11.657/11.64/11.673 mean 11.657 ms/view, off 11.629/11.64/11.715 mean 11.661 (delta -0.005, noise). Hero PSNR vs benchmarks/reference_v2/hero.png 41.16 -> 42.51 dB at the same speed. New sweep md5 906e0435 (hero 86524912) in all 3 rounds; off arm still 46a725ab. Hero golden refreshed to this image; old golden archived as tests/fixtures/hero/archive/hero_golden_8bit_pre-t290-newton.png.", "metrics": {"board": "yyzo-bh-07 (Blackhole p100a)", "frame_ms_view": 11.657, "frame_ms_view_rounds": [11.657, 11.64, 11.673], "frame_ms_view_off": 11.661, "frame_ms_view_off_rounds": [11.629, 11.64, 11.715], "frame_delta_vs_off_ms": -0.005, "fps": 85.79, "hero_psnr_vs_ref": 42.51, "hero_psnr_vs_ref_off": 41.16, "md5": "906e0435", "golden_match": true}, "timings": {"ms_view": 11.657}, "iter_dir": "ttw-205", "run_label": "t290 rounds r1..r3 (docs/land-t290/remote_time.sh), screenshot opt/ttw/screenshot.sh", "verdict": "KEEP (PFWC_RECIP_NEWTON on: 11.657 ms/view, 42.51 dB vs reference_v2, +1.35 dB at no cost)", "ts": "2026-10-05T16:30:00-0400", "buildid": {"cpp": "gsplat_tt ttp/t290-land-t266 7bcba92", "data": ""}, "device_screenshot": {"hero": "opt/metal-screenshots/ttw-205/hero.png", "diff": "opt/metal-screenshots/ttw-205/hero_diff10.png", "ref": "benchmarks/reference_v2/hero.png", "psnr_vs_ref": 42.51, "diff_ref": "benchmarks/reference_v2/hero.png", "golden": "tests/fixtures/hero/hero_golden_8bit.png", "golden_match": true, "md5": "906e0435", "commit": "7bcba92", "config": "defaults (GSPLAT_TT_PFWC_RECIP_NEWTON=1 now default)", "device": "yyzo-bh-07 p100a", "visual_check": "looked at hero and diff: no tile or microblock seams, no blocky tiles; diff only on thin high-gradient edges (spokes, frame, foliage), same character as iter 199"}}
{"iter": 206, "idea": "Task #273/#289/#293: fused mat+blend program (GSPLAT_TT_MATBLEND_FUSE) on by default. Mat and blend run in one program with per-tile ready flags, so each core starts blending as soon as its own mat work ends instead of waiting at the program barrier for the slowest core.", "decision": "keep", "reason": "yyzo-bh-07 (Blackhole p100a, not a p150), bicycle 30 views 1024x1024, commit 2f2ff54 (iter 205 + fused mat+blend + default flip). Untraced paired round r6: fuse on 11.129 vs GSPLAT_TT_MATBLEND_FUSE=0 11.653 ms/view (-0.52); #289 rounds r3/r4 before Newton: 11.13 vs 11.75 (-0.62). Tracy: mat->blend barrier wait 0.000 ms (0.489 in #267), blend_end_max 6.261 vs 6.815 ms traced. md5 906e0435 on 30/30 views in both arms; hero bit-identical to iter 205 (PSNR vs reference_v2 42.51 dB).", "metrics": {"board": "yyzo-bh-07 (Blackhole p100a)", "frame_ms_view": 11.129, "frame_ms_view_rounds": [11.129, 11.105], "frame_ms_view_off": 11.653, "frame_ms_view_off_rounds": [11.653], "frame_delta_vs_off_ms": -0.524, "fps": 89.86, "hero_psnr_vs_ref": 42.51, "md5": "906e0435", "golden_match": true, "tracy_blend_end_max_ms": 6.261, "tracy_mat_to_blend_wait_ms": 0.0}, "timings": {"ms_view": 11.129}, "iter_dir": "ttw-206", "run_label": "t293 round r6 (docs/matblend-ready-t273/t289/remote_time.sh), Tracy t293-ns, screenshot opt/ttw/screenshot.sh", "verdict": "KEEP (fused mat+blend on: 11.129 ms/view, -0.52 vs off, same image as iter 205)", "ts": "2026-10-05T16:45:00-0400", "buildid": {"cpp": "gsplat_tt ttp/t293-t289-fused-mat-blend-tracy-check-default 2f2ff54", "data": ""}, "device_screenshot": {"hero": "opt/metal-screenshots/ttw-206/hero.png", "diff": "opt/metal-screenshots/ttw-206/hero_diff10.png", "ref": "benchmarks/reference_v2/hero.png", "psnr_vs_ref": 42.51, "diff_ref": "benchmarks/reference_v2/hero.png", "golden": "tests/fixtures/hero/hero_golden_8bit.png", "golden_match": true, "md5": "906e0435", "commit": "2f2ff54", "config": "defaults (GSPLAT_TT_MATBLEND_FUSE=1 and GSPLAT_TT_PFWC_RECIP_NEWTON=1 now default)", "device": "yyzo-bh-07 p100a", "visual_check": "looked at hero and diff: no tile or microblock seams, no blocky tiles; diff only on thin high-gradient edges (spokes, frame, foliage); hero is bit-identical to iter 205"}, "tracy": "opt/profiler/ttw-206/render.tracy", "tracy_note": "captured with GSPLAT_TT_PFWC_WRITER_SPLIT=0 (fused CBs overflow L1 under the profiler kcfg bump at defaults); mat/blend code is the default"}
